created_at,text
2017-10-16,Hearing for dentist begins one year after Edmonton girl suffers brain damage https://t.co/0FHRFUqaup https://t.co/I2kjCqg1QC
2017-10-16,Alberta RCMP find cube van involved in fatal gas-and-dash in Thorsby https://t.co/m3aIFSvWH7 https://t.co/pIcvrkNoQ4
2017-10-16,323 people potentially exposed to TB at Edmonton continuing-care facility  https://t.co/ea2XH3Okca https://t.co/wka2oKv61n
2017-10-16,Edmonton's Somali community reeling after Mogadishu bombing https://t.co/A3yiTyGf7U https://t.co/4fS7CYJNMX
2017-10-16,"Low fuel led to fatal helicopter crash near Whitecourt, Alta., investigation finds https://t.co/XDGZ7xrj5n https://t.co/lXKpZxhXqr"
2017-10-16,"'It's Stupid 101': Think twice before snapping a wildlife selfie, says Edmonton photographer https://t.co/VwQsQhC2ca https://t.co/UZxsuPexfx"
2017-10-16,She spent $124K to get her home back: Legislation leaves Alberta common-law couples without recourse https://t.co/XJ6mFH30Aw https://t.co/5zfsrr75DK
2017-10-16,Alberta RCMP on lookout for liquor thieves in dirty stolen Suburu  https://t.co/2n58KV7uwh https://t.co/GKXfjPFYBG
2017-10-16,"Alberta voters electing mayors, councillors and trustees https://t.co/31ybcI2aJM https://t.co/3VaALvf72s"
2017-10-16,Hearing starts for dentist in case of girl who suffered brain damage after procedure  https://t.co/sRBgYGF0GZ https://t.co/HvgsAqb5g9
2017-10-16,Edmonton swim club parts ways with controversial British coach https://t.co/lFRPkqpJXY https://t.co/VuDYjJBXwt
2017-10-16,McCann family unveils sculpture for slain seniors https://t.co/j4BrixXpn2 https://t.co/ixLoQ7yeDj
2017-10-16,Homeless Connect event helps those in need access basic services https://t.co/RDilShnGWF https://t.co/aL8raLR9Dq
2017-10-15,Canadian oil producers alter strategies in face of oil supply certainty https://t.co/NKEnqlDohZ https://t.co/1329MLwwul
2017-10-15,Alberta Imam warns youth that Islamic State is 'still recruiting' https://t.co/NBe2TcZQM6 https://t.co/heVRehXBZq
2017-10-15,Pedestrian seriously injured after being struck by vehicle in Grande Prairie https://t.co/zwf4m5DgIX https://t.co/9e7wKXIOkX
2017-10-15,"Liberals prepare to reveal 2018 immigration plan they say will boost economy, help refugees https://t.co/vQI8XJpzgZ https://t.co/qmg7j2jMqE"
2017-10-15,Dark days for Edmonton Oilers as team drops third straight game https://t.co/KPDfuBI0sk https://t.co/gAePeJKzra
2017-10-15,"Corrections Canada responds to concerns about Edmonton women's prison raised by guards, advocates  https://t.co/rJ2EFEnMAO https://t.co/6y3Ab2ZuWi"
2017-10-15,Through economic boom and wildfire: Fort McMurray region's longest serving mayor leaves office https://t.co/QPsacq3e8W https://t.co/REONMQgSKK
2017-10-15,100 kittens whiskered away to furever homes in Edmonton https://t.co/2iiCzVqlmd https://t.co/HdTEeD60qq
2017-10-15,"Ed O'Loughlin reignites love affair with Canada, snow and maps for new novel https://t.co/TdP6cszY6m https://t.co/8XjY54oqRR"
2017-10-14,Police shoot at suspects involved in car chase in central Alberta https://t.co/4N9FSMB3qL https://t.co/ZseNWZJZtu
2017-10-14,Pie to die for: Vegan pizzeria schools  Twyla Campbell https://t.co/ZfH2OobRVT https://t.co/iL2Z62CIs0
2017-10-14,"'Dynamite's ready, Butch': Oilers without top-gun Draisaitl face Senators on Saturday https://t.co/f86F0XlsTe https://t.co/vljkkwdqyC"
2017-10-14,Marijuana is not an all-purpose medical cure https://t.co/pW8EuXYffU https://t.co/z66rElCsGw
2017-10-14,"Canada urgently needs to diversify in science, tech, engineering and math: report https://t.co/ICEu3TruAN https://t.co/dNlU3YjgPr"
2017-10-14,60th birthday bash in the works for Northern Alberta Jubilee Auditorium https://t.co/3uBwNJIJ2Q https://t.co/t0Ec5B0C16
2017-10-14,Cash for couches: Class-action foam settlement may net you $20 https://t.co/QgoE7iKxKt https://t.co/ZfJdtYQCKn
2017-10-14,"Vibrant, hard-fought councillor races make up for lacklustre mayoral campaign https://t.co/Z1HGFouQIp https://t.co/M4wEo6fi5J"
2017-10-14,"Even in Alberta, political connections are inevitable in municipal politics https://t.co/wi3VqxGphJ https://t.co/ehtnnNGXHH"
2017-10-14,Ground search underway for missing First Nation's woman south of Fort McMurray  https://t.co/iPUZwrdpt1 https://t.co/QP7OTDjsP4
2017-10-14,Man charged with 2nd-degree murder in Edmonton homicide https://t.co/45Oei50cuM https://t.co/4GzyBOAGsp
2017-10-14,Voter turnout up 13 per cent at Edmonton advance polls https://t.co/8mXLrosa0P https://t.co/BVVyRh8Ecj
2017-10-14,"ASIRT investigating officer-involved shooting near Sylvan Lake, Alta. https://t.co/4gAoi7ky4P https://t.co/j0jTb6P9iD"
2017-10-14,"Your neighbours, your issues in the Edmonton election https://t.co/kcZRjLZh2G https://t.co/DZrFFFs4dj"
2017-10-14,"Accused Lindhout kidnapper admits in sting video receiving $10,000 of ransom https://t.co/6QHBBWZhhe https://t.co/MHMF9iDWfB"
2017-10-14,Red Deer photographer's experience with spirit bears 'pretty overwhelming' https://t.co/qdJdjxuaRp https://t.co/MWOKmkSFhB
2017-10-13,"'I thought I was going to die,' says victim of Edmonton machete attack, carjacking https://t.co/ifavZEgPiL https://t.co/FJy4JnTSmz"
2017-10-13,Edmonton police seek suspects wanted in string of store robberies https://t.co/fPg8LzBtmF https://t.co/nsjhyxgPN1
2017-10-13,Notley says unfair to assess Energy East on downstream environmental impact https://t.co/1tAthF4KcA https://t.co/dG1nw8RSlm
2017-10-13,"Edmonton lawyer suspended for abusing his wife, legal partner for 17 years https://t.co/Ybskq3Kd6t https://t.co/BeYfhtT7Hv"
2017-10-13,Driver dies in highway crash near Sherwood Park https://t.co/3JeKu6VDbk https://t.co/p5ZqQKHY4s
2017-10-13,Political veterans jockey for room in crowded Strathcona County mayoral race https://t.co/UscEO8TPIh https://t.co/WeLkdYi52F
2017-10-13,Alberta man nabbed in Winnipeg hotel with stash of identity theft materials  https://t.co/dFc5k1jiqi https://t.co/8HPMc7lGhh
2017-10-13,Edmonton criminal lawyer suspended after domestic assault conviction https://t.co/9rDbYFfz9I https://t.co/azR3q9zIpw
2017-10-13,Man killed when pickup collides with semi-trailer near Rocky Mountain House https://t.co/H9WTIfwO5o https://t.co/ELScfJzgc6
2017-10-13,"ALERT seizes gun, cocaine, cash from 4 Edmonton homes https://t.co/gRhj9tqvuQ https://t.co/r43SPVZFOM"
2017-10-13,Gun scare involving masked student prompts Halloween warning https://t.co/agce5xNSDC https://t.co/PaCzpMqYQO
2017-10-13,"Court OKs Sears Canada liquidation, all stores to close https://t.co/uyZDG28W9B https://t.co/Jv5DUrx7cn"
2017-10-13,"One day, 100 kittens: Edmonton Humane Society hosts adoption challenge  https://t.co/fGIZ0mP2ul https://t.co/E48oMp47NF"
2017-10-13,"Manhunt continues in Saskatchewan after shooting, armed carjackings in Alberta https://t.co/ANvph5B7Rp https://t.co/S4WgaiV7fp"
2017-10-13,"RCMP says free trial scams are fraudulent, but credit card companies make victims pay https://t.co/xgj1jzjKhb https://t.co/LGuf8HYYMa"
2017-10-13,"Beaumont voters fear becoming 'suburb of Edmonton', candidate says https://t.co/gDrz6cV1k5 https://t.co/hyKNaJu9nz"
2017-10-13,UCP's Brian Jean accuses Jason Kenney campaign of spreading lies  https://t.co/hgvX9bbieY https://t.co/yFjmm8zyjZ
2017-10-13,Ward 9 candidates get schooled by students in province-wide Student Vote campaign https://t.co/mfMuiQCNIk https://t.co/u0oGiuZS9J
2017-10-13,"An underwater bubble show, dark sky festival and comedy: What's on around Edmonton this weekend https://t.co/KfqRn2Qbyo https://t.co/MmEwrGPgB8"
2017-10-13,"Alberta to roll out new rules to better protect condo owners, buyers in 2018 https://t.co/UlEzfXBhGd https://t.co/97RIMdbRGb"
2017-10-12,Miss the 3rd #MayorForum in #YEG? Introductions were still underway when one candidate walked off stage: https://t.co/x6maOB2SPt #yegvotes https://t.co/kuXXeWgvmz
2017-10-12,Calf shot in the neck by arrow in northern Alberta https://t.co/FFCGBz7ZVs https://t.co/w0qAdNBpBw
2017-10-12,"Oct. 18, 2004: Stephen Mandel's come-from-behind Edmonton mayoral victory https://t.co/n38EOm4UMW https://t.co/nPP0onhHme"
2017-10-12,No review of how university handled anti-abortion group's demonstration https://t.co/U3t6MvJnMa https://t.co/XDHNCGP7qM
2017-10-12,University of Alberta engineering students launch all-natural lipstick line https://t.co/UkYj1yD8DT https://t.co/G29MEqeT7x
2017-10-12,"Alberta film grant program lost $1.2M due to vague guidelines, auditor general says https://t.co/sOdbjOzqUu https://t.co/4UPe4lVfCE"
2017-10-12,"Grab a shake at Pop's Chock'lit Shoppe, Riverdale is coming to Edmonton  https://t.co/oJ7GM7LQrj https://t.co/8twNB03Hoz"
2017-10-12,"First Nations boy, 8, cuts long hair after bullying in Cold Lake, Alta. school: mother https://t.co/u002P0HzsL https://t.co/cPE0aKoqYv"
2017-10-12,Senior struck in west-Edmonton crosswalk in critical condition  https://t.co/NCzVYLu19i https://t.co/Omf1rUxtIQ
2017-10-12,ASIRT investigating after man shot in Edmonton traffic stop  https://t.co/LrGbo7pm9X https://t.co/lJV2qEwDSs
2017-10-12,"Job vacancies soar in Alberta, led by surge in energy sector  https://t.co/drq7v8gCUw https://t.co/xjp9jma0nN"
2017-10-12,We are currently experiencing a technical issue with our links that may result in some people seeing the wrong story. We are working on it!
2017-10-12,"Crime spree ends with shooting, carjackings in Sherwood Park, Edmonton  https://t.co/DzeWqy6JYV https://t.co/SjdhRW8uqm"
2017-10-12,"'It's so unfair': Thorsby mourns victim of gas and dash, province promises action https://t.co/D5oqNfYTxU https://t.co/bqGGDWJaPx"
2017-10-12,107th Ave. business owners band together to support out-of-work Edmonton immigrants https://t.co/dAblzY3IOh https://t.co/8fqSliwMfp
2017-10-12,Jury trial underway for violent sexual assault on stranger  https://t.co/559EQc3R0C https://t.co/kBBAjcRd1B
2017-10-12,Guards speak out on Edmonton women's prison allegations https://t.co/fwgZhpurAE https://t.co/K4qGeNk5yZ
2017-10-12,"Overheard at the #mayorforum: ""For anybody smirking out there, I don't want your vote."" Check it out here: https://t.co/6L8wB7m5kP #yegvotes"
2017-10-12,LIVE: We've made it to the 2nd half of the #mayorforum and it sure hasn't been boring! Join us &amp; watch here: https://t.co/6L8wB7m5kP #yeg https://t.co/Wih9sEYMCY
2017-10-12,WATCH LIVE: https://t.co/6L8wB7m5kP #yeg #yegcc #yegvotes https://t.co/ivXIycAFBa
2017-10-12,ICYMI: Here's some of the highlights from last week's mayoral forum. Watch the final forum live here: https://t.co/6L8wB7m5kP #yegvotes #yeg https://t.co/bkByaLIE31
2017-10-12,WATCH LIVE: https://t.co/6L8wB7m5kP #yegcc #yegvotes #yeg https://t.co/yMt5BbABpS
2017-10-12,LIVE: Dramatic start to the mayoral candidate debate - one candidate walked off stage during intros: https://t.co/6L8wB7m5kP #yegvotes #YEG
2017-10-12,Edmonton Votes 2017: Third and final mayoral forum https://t.co/XOIV7tcEyY https://t.co/omIwqmKYAQ
2017-10-12,LIVE: We are broadcasting from the final mayor debate. Watch here: https://t.co/6L8wB7m5kP #YEG #yegcc #yegvotes https://t.co/WNClo84YpM
2017-10-12,15 minutes until we go live from the final #yeg mayoral debate before the election. Watch LIVE on CBC Edmonton or on https://t.co/HAnqQ9qN2Y
2017-10-11,First Nation traditional hunters harvest 6 animals in Jasper National Park https://t.co/IONtLjwtGC https://t.co/NEFqza5c54
2017-10-11,Alberta Justice officials say people have wrong idea about legal-aid fee https://t.co/1WKrYfRiGG https://t.co/OowkYl2Qt8
2017-10-11,Architects propose park to connect downtown with Whyte Avenue https://t.co/uZrJrmO5lR https://t.co/oqReugtI5p
2017-10-11,Mikisew Cree First Nation members launch petition to remove chief and council https://t.co/k7Ot97yshp https://t.co/W4aXBcMAaP
2017-10-11,"No tanning salons for minors after Jan. 1, says Alberta Health https://t.co/xXfT2Ri1vm https://t.co/SPu2nyC5QZ"
2017-10-11,"Young but not restless, Edmonton Oilers regroup after two straight losses https://t.co/vP0rGadPMG https://t.co/p2aBicqKaB"
2017-10-11,Edmonton dentist fights tooth decay with candy bounty https://t.co/ibZjkcFiIC https://t.co/2vi2yTAcgG
2017-10-11,Farmers look above drones as space satellite updates on crop health expand https://t.co/s2s1FAfU8t https://t.co/HTQwKWhxo3
2017-10-11,"Supreme Court hears appeal over sentence in death of Geo Mounsef, 2 https://t.co/rr71yHL0eA https://t.co/dvAIYe0rEh"
2017-10-11,'Darling': Sculpture in memory of Lyle and Marie McCann to be unveiled in St. Albert https://t.co/iimyxqSfXH https://t.co/ZHj9QVIZ1s
2017-10-11,Driver dies in two-vehicle crash near Slave Lake https://t.co/6mhVkRWaGW https://t.co/alTB8zVm3e
2017-10-11,California wildfire gives Oilers great Grant Fuhr a scare https://t.co/aNqcRlPI23 https://t.co/YP3ryviBwE
2017-10-11,'Large blob': Gargantuan gourd crowned Alberta's prince of pumpkins https://t.co/c2pmG2zfVZ https://t.co/s7Cg2XZb5J
2017-10-11,"Bad pet owners, not pit bulls to blame for Edmonton dog-on-dog attacks, expert says https://t.co/gRSlyRbbLU https://t.co/60hcuuQy6V"
2017-10-11,'My dad was everything:' family urges driver of fatal gas-and-dash to surrender https://t.co/SiAKvTQRR9 https://t.co/Qa2OGwb8cp
2017-10-11,Newcomers and rural voters call for more representation as Wood Buffalo goes to the polls https://t.co/afsyyEPdAy https://t.co/GaTVx8waYe
2017-10-11,Snowfall warning issued for central Alberta https://t.co/hOZxkPnRil https://t.co/JFR7sC7c4c
2017-10-11,Politicians criticize Trudeau's reaction to critics of Energy East demise https://t.co/HC8j53ZXoB https://t.co/IRcqnA19OX
2017-10-11,Delayed start of triple-murder trial could jeopardize case https://t.co/6JWf3kmw0e https://t.co/BIDIlP9Ldz
2017-10-11,Transgender youth health study reveals 'alarming' statistics on mental health https://t.co/5yiGafWthi https://t.co/QVv5WaWO33
2017-10-11,50 headstones vandalized at Edmonton's Mount Pleasant Cemetery https://t.co/LBu7zliLT1 https://t.co/dB6S8Yezs3
2017-10-11,"Thorsby, Alta. to honour gas station owner killed in gas-and-dash incident https://t.co/V2fY62odoy https://t.co/a0RcyENoE7"
2017-10-10,Edmonton school tries to protect students after overdose hits close to home https://t.co/2vPHS8AfjY https://t.co/UfTDS7mxwy
2017-10-10,"Central Alberta man's murder trial in deaths of parents, sister delayed 2 weeks https://t.co/g6Q0XIknrE https://t.co/oUZmyeOlJT"
2017-10-10,Edmonton man killed in Prince Albert vehicle crash https://t.co/dnNgQeu96K https://t.co/Tq7LhWBs7R
2017-10-10,"Pit bulls are worst offenders in fatal dog-on-dog attacks, Edmonton stats show https://t.co/h9z0JYCpkd https://t.co/OH34A9Vmqi"
2017-10-10,"Online dating scams not for the faint of heart, RCMP say  https://t.co/uf4ElSlml7 https://t.co/8TEz5tHTQ7"
2017-10-10,Canadian women's hockey team to host U.S. in Edmonton https://t.co/tyoAudi6Uk https://t.co/HFZ8TcoUGI
2017-10-10,Advanced voting numbers hold steady for 2017 election https://t.co/ISub1AZAq4 https://t.co/fDleVEqAFq
2017-10-10,Sears Canada to ask court for permission to liquidate all remaining stores https://t.co/E6c6PHjlv2 https://t.co/qmxjY3DUN3
2017-10-10,"Edmonton Oilers needed Rocky Marciano, but got Rocky Balboa instead https://t.co/H60nMMKZtE https://t.co/6YJQzzefP9"
2017-10-10,Acclaimed Alberta actor steps out of spotlight to tell Indigenous stories as filmmaker https://t.co/EoaoOWLk4J https://t.co/AuvaFGIHhQ
2017-10-10,Snowfall warning in effect for western Alberta https://t.co/yfcQZ6wPJ6 https://t.co/xpW5miqRKV
2017-10-10,"Triple-murder trial begins in Red Deer for man accused of killing parents, sister https://t.co/IlYevrvr7h https://t.co/4FCNI1MGGD"
2017-10-10,"Edmonton women's prison failing Indigenous women, inmates with mental illness, advocates say https://t.co/bTfeAggyRh https://t.co/m8BAOF3SJg"
2017-10-10,"Nikolaj Ehlers scores hat trick, adds assist as Jets defeat Oilers https://t.co/yNatWK4Mwi https://t.co/39JxG54oC3"
2017-10-10,Two-vehicle crash south of Edmonton sends 1 to hospital https://t.co/vjhmOqbCpT https://t.co/ZpjrnWdJBN
2017-10-09,"Edmonton laundromat serves more than 1,000 people at 25th annual Thanksgiving dinner  https://t.co/s5pifxejXa https://t.co/Hl1arCp48N"
2017-10-09,"Eskimos end 6-game losing run, eliminate Alouettes from playoff contention https://t.co/0sFKzkxtL5 https://t.co/XRgf16wY9g"
2017-10-09,3 children among 6 sent to hospital after Strathcona County crash https://t.co/CIGX3f6rqQ https://t.co/7YTwl4RpeQ
2017-10-09,"NDP's Jagmeet Singh proving to be challenge for media, Sikh activists say https://t.co/lnSPbMLzGS https://t.co/WrFWmJVk2p"
2017-10-09,"From @CBCJRobertson, Take a virtual ride on the Edmonton streetcar: https://t.co/OiOCXyZ3Y1 #YEG #yegtransit https://t.co/nCYy3BJyyw"
2017-10-09,"Alberta students create 'modern, minimal' bong for cannabis use https://t.co/y31aivBeWT https://t.co/Lj6suaxs0l"
2017-10-09,"ICYMI: No Molson beer? Then no #Oilers promotions, Edmonton bar owner told. Read more from @TravisMcEwanCBC: https://t.co/36dEHJv6hG #YEG https://t.co/nyXlGYwxhN"
2017-10-09,Manslaughter charges against alleged fentanyl dealers mount across Canada https://t.co/jTJOHOm7OP https://t.co/g5bJRFk2dW
2017-10-09,Oilers winger Anton Slepyshev expected to slot in tonight against Jets https://t.co/1XbPVvUzFp https://t.co/tKfVtiOSP3
2017-10-09,Edmonton firefighters deliver gear to Ukrainian firefighters https://t.co/2G3D2yylMX https://t.co/cMuvUMGoSA
2017-10-09,How did an Islamic State flag end up in Edmonton? Flag sellers offer theories https://t.co/36edc0qtNs https://t.co/SbgPDPcnCp
2017-10-09,Incumbent Caterina faces strong election challenges in northeast Edmonton ward  https://t.co/vZYxNtK79D https://t.co/AcLyPENXHj
2017-10-09,Home rebuild a 'nightmare' for Fort McMurray wildfire victim https://t.co/C42pKtpgbg https://t.co/S5fGjIGyBU
2017-10-09,"Children with ADHD move twice as much when learning, brain tests show https://t.co/lUtaryCTZl https://t.co/QhDDj2QsRz"
2017-10-09,"Medically unfit for deployment? We'll try to employ you elsewhere, says Canada's top general https://t.co/Eag3La1zfk https://t.co/6Y2JLQjdnl"
2017-10-09,"Tensions mounting at overcrowded Edmonton women's prison, national advocacy group warns https://t.co/ZNuxiUG8xP https://t.co/0f99iOuCP8"
2017-10-08,'It's about opening up the conversation': Ignore No More run raises awareness about domestic violence https://t.co/4JhDPJRsYu https://t.co/sHRav7dImg
2017-10-08,Man drags handcuffed woman back into stolen car as pair escape RCMP custody https://t.co/miwXY7APnO https://t.co/kwQH3D9ezt
2017-10-08,RCMP fire shots following alleged Vegreville-area home invasion https://t.co/B1RDOcCxT0 https://t.co/DJWGq5TYPi
2017-10-08,Former coworker identifies woman killed in Anthony Henday Drive crash https://t.co/CLUdeSkAGZ https://t.co/pERyaEbADC
2017-10-08,"Fraser Institute releases Alberta high school rankings, but some question its methods https://t.co/4CSdkJwj51 https://t.co/Wpx46CDT2s"
2017-10-08,Arabic language program coming to Alberta schools next fall https://t.co/4WhJRmcDsc https://t.co/Fg4yEXAzfl
2017-10-08,Digger the horse dies after being rescued from 6 days stuck in sewage hole https://t.co/RhFxDS8sMd https://t.co/ohVD8pLHtz
2017-10-08,Losing ugly: Edmonton Oilers drop road opener to 'scrappy' Canucks https://t.co/U9Trstcqbh https://t.co/mFINa9UViI
2017-10-08,"Black market will thrive if Alberta government runs marijuana stores, says mid-level dealer https://t.co/graCGUm9y8 https://t.co/2DvSs1iL70"
2017-10-08,"Your wildlife selfies are hurting the animals, study finds https://t.co/a5HPKCi0Jk https://t.co/08xk5QBk3F"
2017-10-08,"Taxes, tiffs and traffic dominate St. Albert mayor's race https://t.co/0V92livzkY https://t.co/zhQ2hjhi3y"
2017-10-08,Riding the virtual rails with the Edmonton High Level Streetcar https://t.co/4SgKWuRs0n https://t.co/0cAK9Ba8ha
2017-10-08,Canucks quick start in season opener buries Oilers https://t.co/JLThSbTuyp https://t.co/Pt0Gd08Ysa
2017-10-08,MMIWG inquiry losing 2 more staffers https://t.co/ZNmQts3ZTd https://t.co/e3lyHkyZ6K
2017-10-08,Digger the horse survives six days stuck in old sewage hole  https://t.co/MteOIiuZ95 https://t.co/R3g5RYYx4l
2017-10-08,Friend of Thorsby Fas Gas owner devastated by fatal gas and dash https://t.co/TBAADnGFf4 https://t.co/cYhMOqzpig
2017-10-07,"Like it or not, the oilsands are a national project and you're a stakeholder https://t.co/zPHTKS17Si https://t.co/9UHddK8B7R"
2017-10-07,Woman killed in early morning crash on Anthony Henday Drive https://t.co/9kKkr7Z5h4 https://t.co/nGcCOKyofN
2017-10-07,Alberta athlete shooting for podium at 2018 Winter Paralympics https://t.co/RZmhuF5Hwe https://t.co/H5aJntDSpO
2017-10-07,Muslim community denounces Edmonton attacks in special sermon https://t.co/vGWDxOFmOY https://t.co/EScA8ZBoik
2017-10-07,Friend of man charged in Edmonton attacks speaks out  https://t.co/MmK9UUUO6c https://t.co/gavIDDcCwF
2017-10-07,"RCMP investigating fatal hit and run in Thorsby, Alta.  https://t.co/AZ7b6uvs1M https://t.co/Fg6EhQfA8U"
2017-10-06,"Edmonton's downtown music scene needs more government support, advocates say https://t.co/qdz8dPNxiZ https://t.co/Ruf0nZ56Lg"
2017-10-06,"Alberta announces more detox beds, expanded treatment options for opioid addicts https://t.co/Bwr1K4LzM6 https://t.co/GuLQEIwRZn"
2017-10-06,Pressure building for Alberta government to get pipeline started before next election  https://t.co/HAc8rdifGb https://t.co/n3Xwp4dZQ8
2017-10-06,"Edmonton gains 4,000 jobs in September as jobless rate falls to 8.5 per cent https://t.co/mDeoxLNXBI https://t.co/iCK62QLWO9"
2017-10-06,Edmonton police investigate pedestrian death on south LRT tracks https://t.co/2VeDBZJylf https://t.co/pa7MVAVDHg
2017-10-06,We don't know who controls this monitor in our newsroom. But it is always amazing. #MysteryMonitor #News https://t.co/unY6HMJIPX
2017-10-06,Serenity's caregivers charged in relation to her death https://t.co/y3mK8t0mNJ https://t.co/rkQ6bAs3PM
2017-10-06,NHL fans losing their hats over early season scoring surge https://t.co/wlkTp2wtCB https://t.co/406Je1Hqvb
2017-10-06,Anti-pipeline activists stage protest on Edmonton's High Level Bridge https://t.co/a0v1osrCxO https://t.co/YXoHmDNBrl
2017-10-06,"Indigenous residential school records can be destroyed, Supreme Court rules https://t.co/gH2VKnDmRX https://t.co/Ge6AynyyPG"
2017-10-06,Edmonton bar owner barred from promoting Oilers games unless he serves Molson beer https://t.co/KQiqOoq943 https://t.co/RJvKqruj6h
2017-10-06,Democracy or dynasty: 3 Edmonton families running related candidates in municipal elections https://t.co/u27EvGCHue https://t.co/pCZ0hANAuM
2017-10-06,Come meet Mark and the crew as we broadcast live in Beaumont. #yeg #cbc https://t.co/dHfRYOtm1v
2017-10-06,"Under Rachel Notley, Alberta government improves access to information, but keeps it secret https://t.co/sPMfC1L7mt https://t.co/d4XBVJD0o1"
2017-10-06,We've arrived at Jeff's Cafe in Beaumont! Swing by for some fresh coffee and sweets! #yeg https://t.co/nETIw2JCkG
2017-10-06,"Energy East's cause of death: Business, politics or climate? https://t.co/oiM3qC5tHA https://t.co/ryoMCmdYzf"
2017-10-06,"Ottawa's $800M for Sixties Scoop survivors a 'slap in the face,' says society president https://t.co/S1K3iQMrNc https://t.co/Fhq1x4lTMC"
2017-10-06,Edmonton police looking for white pickup after hit and run in city's northeast https://t.co/O9pj0JqHb1 https://t.co/gcBruZezst
2017-10-06,MADD urges Alberta pursue public model on cannabis to ensure safety first https://t.co/BLUN091fgd https://t.co/5WxvlFoZvE
2017-10-05,"Religion played no major role in life of man charged in Edmonton attacks, says human rights activist https://t.co/2EwhcCmno8 https://t.co/DiMwMRlv0g"
2017-10-05,Ottawa to announce settlement with Indigenous survivors of Sixties Scoop https://t.co/MyDsJ6Vx6g https://t.co/KGOYVPeXFn
2017-10-05,"Oct. 5, 1992: Say goodbye to Kresge's 104-foot-long lunch counter  https://t.co/6mDvVbd0DC https://t.co/hLhYZ8rr4v"
2017-10-05,"In downtown Edmonton, Rogers Place marks dividing line between 'different worlds'  https://t.co/GnMVbvhCMu https://t.co/usV3Ypdif2"
2017-10-05,"Notley 'deeply disappointed' by Energy East cancellation, which Jean calls 'an attack on Alberta'  https://t.co/9izrxtk1UE https://t.co/7ERgwweHpn"
2017-10-05,Just HOW FAST is @cmcdavid97? Possibly even faster than last year! MORE: https://t.co/SWUrSu7bng  #YEG #Oilers @EdmontonOilers https://t.co/chRKx6jeLq
2017-10-05,Attack of the clones: Sperm-stealing Prussian carp threaten to overwhelm Alberta waterways https://t.co/CayeYcw1UW https://t.co/FE11Ny1Q0S
2017-10-05,Alberta's Amanda Lindhout tells of abduction as kidnapping trial begins  https://t.co/u6il4YJ5F4 https://t.co/JbVMr9ceQ0
2017-10-05,'Travelling Jagrs' dust off their mullets for Czech superstar's Alberta debut  https://t.co/SE2CTkWCTB https://t.co/tDYtkdXNCN
2017-10-05,'Unfortunate outcome for Canadians': Politicians react as Energy East pronounced dead https://t.co/odkLFCZIW2 https://t.co/UTdxvAmf50
2017-10-05,"Giant pumpkins, yoga festival and all that jazz: What's on in Edmonton this long weekend in Edmonton https://t.co/4vMjARQAl3 https://t.co/eLQEVMIISw"
2017-10-05,Police pursuit of suspected Edmonton attacker questioned https://t.co/6sZlvhrgTZ https://t.co/PkyfoXPSB5
2017-10-05,TransCanada won't proceed with Energy East pipeline   https://t.co/Qy6mzpon2r https://t.co/l7KkcxeZn6
2017-10-05,Edmonton mom hopes 15-year-old daughter can smoke medical marijuana at school https://t.co/aDGvT0s8ul https://t.co/J8inPSf8Si
2017-10-05,McDavid's hat trick puts out Flames on opening night https://t.co/ytObvsz6oB https://t.co/B8fX67QeTp
2017-10-05,"Suspects charged after Edmonton traffic stop ends in police shooting, officers injured https://t.co/SOGPEyt9YY https://t.co/f6Qa1AO63B"
2017-10-05,Oilers honour victims of Edmonton truck attack before home opener against Flames https://t.co/cilBsxTw9v https://t.co/XoKfcj4J6n
2017-10-05,Women who escaped Edmonton prison arrested at downtown escape room https://t.co/DgOZogZeuR https://t.co/4XFL8j9fzH
