created_at,text
2017-09-12,"Trial to go ahead for central Alberta man accused of killing parents, sister https://t.co/f2FIIc19lm https://t.co/QaTdueX12v"
2017-09-12,Oilsands trade show returns to Fort McMurray after hiatus https://t.co/jGoDhkulp6 https://t.co/6TVz9pz8zT
2017-09-12,Edmonton council faces decision on whether to spray dandelions https://t.co/uqUhYFRhW9 https://t.co/wIIaE1xkmm
2017-09-12,"Cardston County declares emergency, evacuees flee homes as Waterton Lakes fire burns out of control https://t.co/La1ACDbMA6 https://t.co/T0Jtsr3pJi"
2017-09-12,Holyrood development decision delayed until after Edmonton city election https://t.co/r1tqdf6flr https://t.co/ncZonrWWLA
2017-09-12,"Enbridge Line 3 expansion not needed, says Minnesota Commerce Department https://t.co/hOJEqGhGds https://t.co/AbkkX7KFBS"
2017-09-12,"Former Wildrose boss Paul Hinman seeks Alberta conservative crown, but short cash https://t.co/cQaGzyWDd6 https://t.co/bYuwRfKZlD"
2017-09-11,"'Stop blaming the ref,' says N.L. mixed martial arts fighter after brutal loss https://t.co/uXeHh6lT78 https://t.co/J7OZd8duY8"
2017-09-11,The inaugural #NGE2017 is underway in #YEG. Here's why one family thought it was important to attend. More: https://t.co/8bbLO6kPvy https://t.co/nXsBYdEva7
2017-09-11,Man fatally shot by Edmonton police was due in court on drug and weapons charges https://t.co/YA5eDgbP3E https://t.co/sn5jA81c9G
2017-09-11,Driver charged in Fort McMurray crash that killed two pedestrians https://t.co/1fBBPU5qjt https://t.co/5eg89pIif6
2017-09-11,Someone really got their goat ... and they want her back. Reward offered in disappearance of blind baby goat: https://t.co/H48o08eMRP #YEG https://t.co/TsdeEKn2hZ
2017-09-11,"Edmonton's funicular will be ready by winter, city says https://t.co/6QSE97zj10 https://t.co/0A0AAqZaxj"
2017-09-11,Have you seen Daisy? Reward offered in disappearance of blind baby goat https://t.co/vlX17Gh7aT https://t.co/5DvnTwqgXX
2017-09-11,We're LIVE from the historic gathering of Indigenous elders in #YEG. Taking your questions here: https://t.co/q00pFPJMIa https://t.co/unvJQoUYAh
2017-09-11,Pope Francis urges world leaders to take action on climate change https://t.co/pCW2f59rJp https://t.co/ZgIySEsCeA
2017-09-11,Top dog: Canine cops test their mettle at Edmonton competition  https://t.co/vFX2ddSSwA https://t.co/gwAEagpMQW
2017-09-11,Guard at Evansburg RCMP detachment charged with sexual assault https://t.co/NSiJcVhYqI https://t.co/y2otosZuWL
2017-09-11,"Always the captain: Star Trek legacy lives long and prospers, William Shatner says https://t.co/2wcb3EdaHx https://t.co/CNxsAfb67S"
2017-09-11,National Gathering of Elders begins in Edmonton https://t.co/HXZQllG1mN https://t.co/z5i0BM0Tn8
2017-09-11,Parks Canada personnel removed from Waterton as Kenow wildfire rages https://t.co/skp62VrUEG https://t.co/ZGTia8Pgj2
2017-09-11,"Man, woman killed in separate Sunday night motorcycle crashes  https://t.co/C4y0sDACbT https://t.co/TUDGmMu4DC"
2017-09-11,'It's been a terrifying day': Former Edmontonians living in Tampa wait for Irma https://t.co/ZQRvnazL8x https://t.co/0ltQOC7nZl
2017-09-10,Jim Cuddy talks musical collaborations before performing at Saskatoon's CCMAs https://t.co/JkKDkMqT1A https://t.co/EEgA1V9OfW
2017-09-10,Hanging 'em up: Edmonton-based fighter Mitch Clarke retires after tough loss at UFC 215 https://t.co/MdrWCWN1xD https://t.co/mSuLpm1NOu
2017-09-10,"Amanda Nunes keeps belt, defeats Valentina Shevchenko at UFC 215 in Edmonton https://t.co/uThom8aOiW https://t.co/sAdxO2LnaY"
2017-09-10,Wildfire threatening Waterton Lakes National Park continues to grow https://t.co/1HY2WCRDz4 https://t.co/Uh3G8NdM36
2017-09-10,Water ban lifted for Strathcona County  https://t.co/4u4Z9h7qJq https://t.co/URRUsNjsyk
2017-09-10,"Family forced to pay extra $4,000 for new tickets after Air Canada bars them from flight https://t.co/hiZkpYdUGL https://t.co/2keGThR6nx"
2017-09-10,Who's backing whom in the NDP leadership race — and what that means https://t.co/hplbKWTFOu https://t.co/P4IiTOi8HJ
2017-09-10,"Man crashes into tree, dies while fleeing scene of suspected hit-and-run https://t.co/l44z11sSFn https://t.co/Nn2wgCUCuE"
2017-09-10,Neon guitar last homage to prominent Edmonton music store https://t.co/tNmz8Xcsvj https://t.co/FHgpfdhP8p
2017-09-10,ASIRT investigating incident involving Edmonton police at Westmount Shopping Centre https://t.co/28wX1LtBE4 https://t.co/wn6vRLRjZr
2017-09-10,"Alberta man weathers Hurricane Irma in St. Thomas, prepares for Jose https://t.co/e4qpE3gC34 https://t.co/skTBxigk4O"
2017-09-10,Stamps leave Eskimos cold with comeback win to sweep home-and-home series https://t.co/AwQPKHR8tg https://t.co/Me1B7QN6T4
2017-09-10,Residents of Edmonton's Parkallen community create mural to prevent graffiti   https://t.co/OWlhxJgm7x https://t.co/SLok89lu0f
2017-09-09,"Waterton remains under evacuation as Kenow wildfire grows to 8,500 hectares https://t.co/oaaXktvmI2 https://t.co/hE3n9frvq1"
2017-09-09,Game of Thrones royalty 'The Mountain' flexes his famous muscles in Fort McMurray https://t.co/qaRr4heVw5 https://t.co/6YgElvhMlD
2017-09-09,"Indigenous artists unite to create Edmonton, Ottawa murals focused on water protection https://t.co/zIDCqW40Pe https://t.co/jKGGDKswMR"
2017-09-09,What to do if a bobcat family sets up in your backyard https://t.co/KisVT0pKlO https://t.co/7yjKqDnDNs
2017-09-09,Federal pot plan set for scrutiny at parliamentary hearings https://t.co/9oKk9KPQvC https://t.co/3WBMAqleMb
2017-09-09,"Mah Society of Edmonton centennial: A family reunion for 10,000 people https://t.co/WkJbEHwMb0 https://t.co/oLxulouWi4"
2017-09-09,Edmonton family escapes hurricanes Harvey and then Irma https://t.co/dXiG8ak0CX https://t.co/frYzRJODtc
2017-09-09,Edmonton's new downtown park to honour nation's first Indigenous police officer https://t.co/Ia1lteXw0o https://t.co/ibekCHmbdM
2017-09-09,Edmonton Eskimos getting healthy just in time for rematch with Stampeders https://t.co/DyKaoWEwlA https://t.co/Cgj1znR233
2017-09-08,"Wife, son of Alberta farmer last seen in 2011 charged with murder https://t.co/iPNwPj5Jmq https://t.co/ghK5hFJM2j"
2017-09-08,Driver charged in fatal Edmonton crash that killed elderly woman https://t.co/AT3LMzwZTT https://t.co/YqBBt3qvpj
2017-09-08,"Edmonton added 2,000 full-time jobs in August https://t.co/rUjLwFlHlp https://t.co/KnaWtwrwjL"
2017-09-08,Edmonton wants expanse of river valley designated as provincial park https://t.co/2z9cySlQwY https://t.co/mROjDUOg3q
2017-09-08,Thunder road: Red Deer RCMP try to muffle noisy vehicles https://t.co/dajRaGxuPe https://t.co/hw3534xzQy
2017-09-08,Waterton under mandatory evacuation due to approaching wildfire https://t.co/qV9qgvNOsV https://t.co/QW7qMflg4q
2017-09-08,Edmonton skydiver shaves off beard while plummeting to ground https://t.co/CVNpkMO4Jv https://t.co/OPttYLUt9w
2017-09-08,"Man shot dead by RCMP officer on northern reserve was brandishing knife, ASIRT says https://t.co/Lp6yN1FecW https://t.co/CdcYnPtVwi"
2017-09-08,"Cold Lake toddler was victim of homicide, police say  https://t.co/6MMajGQ7Z6 https://t.co/uhU6VyW3HC"
2017-09-08,Calgary man charged with impaired driving causing death in crash that killed daughter https://t.co/ItcZnQ44iF https://t.co/wrJe6ZSJyC
2017-09-08,Mysterious top hat stolen from national museum turns up in Alberta https://t.co/mu1YAS8Q69 https://t.co/SI80QQfdll
2017-09-08,'Violent and tragic death': Police seek tips in cold-case killing of Edmonton businessman https://t.co/zTZ8ybJllw https://t.co/0CNJS9gRyw
2017-09-08,TransCanada may abandon Energy East pipeline facing tougher review https://t.co/IWiGjIN4rp https://t.co/291Aq6Jj6B
2017-09-08,"Edmonton man accused of sexually abusing child relatives in Alberta, Manitoba, Nova Scotia https://t.co/LNo6EqOvDE https://t.co/kUy4cOK1qn"
2017-09-08,"City of Edmonton, Greyhound strike deal for connecting passengers https://t.co/8LlY6PJ0aV https://t.co/TkkyTkAVZT"
2017-09-08,Shoeshine man gets 'amazing' tip of a lifetime — a new kidney https://t.co/Y4OZ8Kx7Ss https://t.co/urVvVXJ4C7
2017-09-08,Edmonton mother upset after 14-year-old sent across border in taxi to catch connecting flight https://t.co/NCU8jmeYeR https://t.co/XIHAFeISYd
2017-09-08,Edmonton UFC co-main event fight cancelled due to illness of fighter https://t.co/vwcGrgdrHj https://t.co/CHEjonlUAg
2017-09-08,"Edmonton man's wife, daughter found safe after Irma devastation  https://t.co/QB5cTpb94K https://t.co/n3jW6AB1PI"
2017-09-08,"Bat in Banff tests positive for rabies, first in more than 20 years https://t.co/xqdp7siJDw https://t.co/6Yd9A1rTWs"
2017-09-08,Terry Fox's relative keeps legacy alive in Spruce Grove  https://t.co/TEBvEoNKsd https://t.co/CJKu053wcA
2017-09-08,Child psychologist avoids jail time in West Edmonton Mall child-porn charges  https://t.co/nrqDYgLZ7L https://t.co/ENWvQP07kY
2017-09-08,Emergency crews have stopped the gas leak but crews remain on scene to conduct further repairs. https://t.co/Y1SDrduBB3 #yeg
2017-09-08,RCMP evacuate section of Stony Plain due to gas leak https://t.co/4lmasqdPp2 https://t.co/CxBvkrdFV2
2017-09-08,New regional bus system one step closer to hitting the road https://t.co/iO4RoSxxjw https://t.co/VWAJusEgWu
2017-09-07,"Amazon's HQ2 opportunity a 'tasty morsel,' says Edmonton mayor https://t.co/TJ5XxgmPCZ https://t.co/rFIuO5jKLG"
2017-09-07,Activists in B.C. gear up for 'the next Standing Rock' with tiny house protest https://t.co/p80TromYfd https://t.co/JalgEd5bL7
2017-09-07,Strathcona County orders immediate ban on 'non-essential' water use https://t.co/JaJpLaGmCi https://t.co/FP7YbyP9XW
2017-09-07,'We are American': Alberta-born 'Dreamer' will fight deportation in U.S. https://t.co/XW3Ksn9eZT https://t.co/6OHeJkzm8t
2017-09-07,Looking for something to do this weekend? https://t.co/2zQ4yDshzf https://t.co/NUml3cN5Py
2017-09-07,Chinese community challenges city hall on safe injection sites https://t.co/8zW6yboUED https://t.co/KmOPBCl496
2017-09-07,"Sept. 7, 1992: First Big Valley Jamboree couldn't be stopped by snow https://t.co/KO4cTA2IZ5 https://t.co/MnrSw1pXQ1"
2017-09-07,The horror of It: Creepy clown phobia forces Edmonton festival to re-brand https://t.co/g2QMpSnhKI https://t.co/LGS1QuoYSK
2017-09-07,LIVE: The Alberta government updates on the wildfire in southern Alta. that prompted evacuation alert for Waterton. https://t.co/V9tDXF5tef
2017-09-07,Alberta Health deputy minister Carl Amrhein resigns amid controversy https://t.co/GNXYhrDcFS https://t.co/xnT3OVIoLH
2017-09-07,All revved up: Edmonton police target Groat Road as speeders' paradise https://t.co/xVKv6zGsS6 https://t.co/gM5bbKU8M3
2017-09-07,"People of interest sought in 3 shooting deaths in Calgary, Edmonton https://t.co/GtkjgrDKU7 https://t.co/ftX7bAyAQo"
2017-09-07,"Is this a shampoo commercial, @GarretteMcGowan? https://t.co/q2Xo6si19C"
2017-09-07,2 pedestrians killed in Fort McMurray crash https://t.co/jhCtu0xb6e https://t.co/bJYr7g9hwh
2017-09-07,'I still hear her voice': Edmonton man asks missing-women inquiry for help finding mother https://t.co/L3XD71IuOz https://t.co/Fq7rbGLHPG
2017-09-07,Woman found dead after travel-trailer fire in Grande Prairie https://t.co/o5VHdLmGR6 https://t.co/vpvzPIRTd1
2017-09-07,Métis elder won't cut his hair until Alberta respects Métis rights https://t.co/9dO9zY7muF https://t.co/ric0gyOUEU
2017-09-07,New allegations faced by Alberta seniors care facility at centre of assault charges https://t.co/uRUX5sutak https://t.co/HkWWJwO1gF
2017-09-07,Man fatally injured by RCMP officer in Whitefish Lake https://t.co/bKj83oVgU9 https://t.co/3ktl0y8eml
2017-09-07,Edmonton mulls naloxone kits for more city workers https://t.co/0Bsy7ZElUi https://t.co/TdpYXXedVA
2017-09-07,"First Nations will protest, but Trans Mountain pipeline a done deal, Liberals say https://t.co/I1uAF0iixQ https://t.co/a4Me9STHQ8"
2017-09-07,"More study on Holyrood redevelopment needed before vote Monday, councillor says  https://t.co/UoUznnPpPz https://t.co/FXdATVjarM"
2017-09-07,Man killed in two-vehicle collision near St. Paul https://t.co/zrJFbD3sN4 https://t.co/edrUlt4iYk
2017-09-07,Edmonton looking to improve transit for city visitors https://t.co/2brfZwftbl https://t.co/SwF07ADOn5
2017-09-07,"Jason Kenney proposes drastic cut to Alberta's per capita spending, balanced budget in 3 years https://t.co/USuhsAuYSx https://t.co/wTW4G1yif9"
2017-09-07,Fort Saskatchewan toddler walking 100 kilometres in 100 days for Kidney Foundation https://t.co/SGR7WQs06I https://t.co/kUuUeLMDfv
2017-09-07,Edmonton student braces for Hurricane Irma from Puerto Rico dorm room https://t.co/sVChhMaJQ8 https://t.co/cylYsWc9XW
2017-09-06,Edmonton ponders 'missing middle' infill in older neighbourhoods https://t.co/fdawsWO4hB https://t.co/EfIV2xwUZG
2017-09-06,Hepatitis A warning expands to other Save-On-Foods fruit products https://t.co/VMh1To5vbz https://t.co/2X2xztnMEA
2017-09-06,Woman found dead after Grande Prairie apartment fire https://t.co/NpMPKpJg11 https://t.co/x4gKwBnlen
2017-09-06,Pedestrian struck and killed on QE2 near Leduc https://t.co/M3Y1BaEicr https://t.co/Ckj2K36S7k
2017-09-06,"Fentanyl, meth, crack seized in landmark Grande Prairie drug bust  https://t.co/l7YZsVnfK9 https://t.co/Uwh8HnhWHL"
2017-09-06,Albertans holed up in Puerto Rico as Hurricane Irma slams Caribbean https://t.co/FFVgO8m0hS https://t.co/2WO6J0tKuC
2017-09-06,'I did not do it': Alberta MLA Derek Fildebrandt testifies in hit-and-run case https://t.co/yLvNHbGeCI https://t.co/B6WLZ43tgB
2017-09-06,A rockin' concert and a green-haired groupie: Gene Simmons recalls Edmonton firsts  https://t.co/CxVDGC55hk https://t.co/ZgsOQxiiFX
2017-09-06,Campgrounds had banner year as Albertans basked in the sun https://t.co/eW8GjCuo8C https://t.co/bwsnE6GzoC
2017-09-06,"From today's @AlbertaatNoon: The battle of Alberta is brewing, @lonelyplanet travel guide-style. #YEG #YYC https://t.co/wAfhQvrf5N https://t.co/PXX81zUgZR"
2017-09-06,Red Deer RCMP to seize $300K home and $14K cash in forfeiture case https://t.co/PbzymyxLUy https://t.co/JjkJxGffQZ
2017-09-06,Bank of Canada raises benchmark interest rate again https://t.co/PH44JNLL8z https://t.co/SjxUGlwZMG
2017-09-06,Edmonton firefighters battle blazes in abandoned house and industrial building https://t.co/oCiJtOo7d8 https://t.co/H8aYGUHRqU
2017-09-06,"Premier Notley, Jason Kenney clash over changes to school curriculum https://t.co/aatCODaKzV https://t.co/iHOD5lXPM0"
2017-09-06,Foreign students choose University of Alberta as 'Trump Factor' and recruitment take effect https://t.co/1B5vrnkE52 https://t.co/60H20V7ZH5
2017-09-06,"Proposed oilsands mine gets support from Fort McMurray Métis, four other Indigenous groups https://t.co/Um6THRcA9g https://t.co/3ljRY4NKRU"
2017-09-06,"Gregory Tessman, wanted in strangling death of Valerie Maurice, arrested in Vancouver, charged with murder #yeg https://t.co/GrFeB5NO3z"
2017-09-06,Two suspects sought in Edmonton-area armed robbery https://t.co/nLcCh1i7yk https://t.co/YaMW3wfnA5
2017-09-06,Premier defends political speech delivered to elementary school students  https://t.co/28sMLMgVE9 https://t.co/PMM4IyiRnc
2017-09-06,Edmonton plans to buy only electric transit buses beginning in 2020 https://t.co/OixrpVwdLc https://t.co/4pzeCwuGZ2
2017-09-05,"Convicted killer Travis Vader charged with taking drugs, breaching parole during trial https://t.co/JGgKYiRjkg https://t.co/0N0IKgIfQV"
2017-09-05,"""That’s the legacy they left, that there’s hope for kids in this community. That they can...reach for their dreams"": https://t.co/6wCWhQpYk0 https://t.co/FomTtptgGz"
2017-09-05,AHS confirms three more cases of salmonella connected to Folk Fest food booth https://t.co/nydGLMmso0 https://t.co/LzfCYPf4M2
2017-09-05,Read the full heart-warming feature here: https://t.co/mEQ7HYhH6i #YEG #yegsanta https://t.co/AvrPGAJXyt
2017-09-05,"Edmonton can 'absolutely' end chronic homelessness, mayor says https://t.co/oEvB6v7r4d https://t.co/ds590UCldA"
2017-09-05,"Kids went back to school in #YEG today, some at brand new schools. PSA: Don't forget to slow down in school zones: https://t.co/IF8WtURYPF https://t.co/9y1fCaWN47"
2017-09-05,School-zone speed limits extended to include junior highs https://t.co/YQeDi6qYAz https://t.co/23aQ6kgG9v
2017-09-05,"Travel guide 'bit of an insult' to Edmonton, mayor says https://t.co/WYXNgjLgVC https://t.co/KQLpZE9hYB"
2017-09-05,Edmonton police seek suspect in strangling death of woman https://t.co/KdxhcfL363 https://t.co/OU2pppDr6j
2017-09-05,Wolves remain successful hunters amid tailings ponds and oilsands mines https://t.co/SUTMnrvS0c https://t.co/5xGtXh0VVR
2017-09-05,Stump Kitchen: Edmonton woman cooks with big heart and one hand https://t.co/2vi6JVycwa https://t.co/QzpJX64GIm
2017-09-05,"'These kids were loved.' One year after Cory Grey and Dylan Laboucan were killed, their legacy lives on. MORE: https://t.co/S7N32wwmuC #cbc https://t.co/pvWFayzFSd"
2017-09-05,Denis Shapovalov to headline Canada's Davis Cup squad at Edmonton event https://t.co/VdchDhgmCt https://t.co/qI0TIMNYWq
2017-09-05,Sheep parade: Fort Saskatchewan bids farewell to famous flock https://t.co/RJzIrpBRIp https://t.co/iNvp3sEQXO
2017-09-05,Cenovus selling Pelican Lake operations to Canadian Natural for $975M  https://t.co/XJFcNRwIeE https://t.co/nwTFRgu122
2017-09-05,Family of murdered woman offers new reward for information https://t.co/zH1cCfblZq https://t.co/6VWO3d3Mj9
2017-09-05,RCMP receive dozens of calls from Alberta to B.C. about reported fireball in sky https://t.co/IzVjuQiE2L https://t.co/XbA6MTmH9A
2017-09-05,Hundreds gather in Edmonton for Tour of Alberta's final lap  https://t.co/hfSIcOaV1k https://t.co/v4RNe3AwIo
2017-09-04,Amateurs take over downtown course on last day of Tour of Alberta https://t.co/FTt1yap24A https://t.co/cIBMvEgXyy
2017-09-04,Edmonton teen has emergency surgery after Folk Fest food poisoning https://t.co/DRzurOYn6u https://t.co/9UiXTAI4Ry
2017-09-04,Stamps boost division lead with Labour Day trouncing of Eskimos https://t.co/BwhpbziP3q https://t.co/obZQVFSHS6
2017-09-04,Decade of discovery: Edmonton couple pen book about epic roadtrip https://t.co/mx3W5L6Ner https://t.co/dicptx9TVt
2017-09-04,'It is a real danger': Farmer says dry conditions have sparked fear of fire in southern Alberta https://t.co/gQ7muLVjet https://t.co/dsu7UtIXqW
2017-09-04,29-year-old man killed in crash north of Grande Prairie  https://t.co/TCJrqenrmY https://t.co/z1WSXxZqG2
2017-09-04,'It broke my heart': Edmonton woman drowns in Maui on wedding anniversary https://t.co/oC6Fzly19r https://t.co/bYRzuj4ftM
2017-09-04,"Montreal woman strangled in Edmonton led secretive life, says friend https://t.co/aOxKJhvBNF https://t.co/393p7ez0Aq"
2017-09-04,Edmonton Goop-debunker buoyed by renewed attack on Gwyneth Paltrow's wellness brand https://t.co/f34hEftA0M https://t.co/8rhYPRDP1F
2017-09-04,'We'll ride it out': Tour of Alberta falls on lean times https://t.co/Udt15m58dG https://t.co/R0a5Dx0QWl
2017-09-04,Edmonton's only no-tip restaurant to allow tipping https://t.co/3upo3laO6g https://t.co/dvpFVHbTw8
2017-09-04,Mother's efforts to secure child on flights thwarted as Canada delays safer travel rules  https://t.co/Dbmy0ESZds https://t.co/OSMGRnPclm
2017-09-04,Edmonton's accidental beach gets infrastructure makeover https://t.co/tRRP6HGeuf https://t.co/cTLmFCLWNc
2017-09-04,'Every woman is a leader': Speaker series aims to empower immigrant women https://t.co/jd4JUNxyxq https://t.co/ozoaH5xZom
2017-09-03,Is the fentanyl situation an overdose crisis or a poisoning crisis? https://t.co/HFqdSlzjXe https://t.co/fg5fcdfDkg
2017-09-03,100 people stuck on mountain top as winds stall Jasper Skytram  https://t.co/KeE3YoUzx6 https://t.co/IW2tHujUmB
2017-09-03,High winds in central Alberta force residents to seek shelter  https://t.co/IRN0HWkgJ3 https://t.co/l5MiECrye1
2017-09-03,"Oil-producing provinces see highest spike in insolvency, government stats say https://t.co/DSTW0jNV7K https://t.co/togjsSwhi3"
2017-09-03,Fort McMurray prepares for the next wildfire by strengthening its defences https://t.co/pFLKqgakly https://t.co/bsLagwiYdU
2017-09-03,Wouter Wippert wins Stage 2 of Tour of Alberta; Canada's Burke 35 seconds back https://t.co/piYVNyMep7 https://t.co/Wo5pj6PWOs
2017-09-03,Tropical storm Lidia strands Edmonton woman in Mexico https://t.co/tj85a6qNU4 https://t.co/poBRnxeILx
2017-09-03,Politicians get roasted at Premier's Pride Brunch fundraiser for LGBTQ youth summer camp https://t.co/5HDwtkguWI https://t.co/ComU9SiSC1
2017-09-02,Parkland County students to ride on electric school bus https://t.co/oXizxZWl8i https://t.co/mTHFwJVzan
2017-09-02,Staying in the box: a recipe that works for Bottega 104 https://t.co/uT2RZy05gz https://t.co/mp0VicJVVg
2017-09-02,Montreal woman found strangled in Edmonton suite https://t.co/5mL1aKqpK0 https://t.co/9oaIiXxtdt
2017-09-02,Salmonella concerns prompt recall of fish batter mix https://t.co/ya0VzaUWcE https://t.co/sfGkOig0cu
2017-09-02,Hepatitis A found in Save On Foods pineapple cups https://t.co/LxPNWa2sdp https://t.co/rUv2QPlXLk
2017-09-02,"New fire in Rockies sparked by illegal campfire, says Parks Canada https://t.co/uHOqk1nz31 https://t.co/lNZQgeSpN1"
2017-09-02,Opioid crisis a turning point for Edmonton firefighters https://t.co/6EQWjo7AAz https://t.co/pRWrF5TChz
2017-09-02,"Beaumont, Alta. man and Beaumont, Texas flood victim tell tale of cross-border hurricane heroism https://t.co/MKXbGmwuW6 https://t.co/rHY5r9uf90"
2017-09-02,Riverkeeper issues caution about E. coli levels at Edmonton's accidental beach https://t.co/V04JuuT7dp https://t.co/CANACgdEbi
2017-09-01,Texan Kelly Talbot raises donations in Edmonton for Hurricane Harvey victims https://t.co/69dzH8Utmo https://t.co/8zpt2LOzil
2017-09-01,UCP leadership candidates will face off in 5 debates  https://t.co/bbTUhTnLFb https://t.co/NqZjvQX7jv
2017-09-01,"'Thank god for Shiva, if it wasn't for him, we wouldn't be alive' A Texas family is safe thanks to an Alberta man: https://t.co/fjQ49cX7Vr https://t.co/6PLYCr1HJM"
2017-09-01,"LIVE: We're speaking to Keisha Hayward in Dallas. When her house flooded, she got some unexpected help from Alberta. https://t.co/fjQ49cX7Vr https://t.co/np1pjE00bu"
2017-09-01,"LIVE: When a Beaumont, Texas woman called for help during the flood, a Beaumont, Alta. man answered her call: https://t.co/fjQ49deIMZ #YEG"
2017-09-01,"A Beaumont, Alta man is about to meet the Beaumont, Texas woman he helped during the flood. Coming up on https://t.co/oATmbBp1aW #YEG #Texas"
2017-09-01,Firearms stolen from torched northern Alberta home https://t.co/DtrYQOt5yM https://t.co/V01QlgKcV8
2017-09-01,'A selective witch hunt': Former Westlock administrator responds to critical report https://t.co/knQSyn60PY https://t.co/GGVUjJ4b5P
2017-09-01,"In other news, #accidentalbeach is catching on! For more: https://t.co/nUFwSuAwCT #yegbeach #yeg https://t.co/zXxDhrwyZB"
2017-09-01,Edmonton tradesman-turned-model gets Hollywood break with cat work-out video https://t.co/Vd3SnV7MrN https://t.co/PnNK8Q7BBU
2017-09-01,Unbreakable bear: Grizzly survives crash that totals car without even a lasting limp https://t.co/Sp2MllOW2S https://t.co/j5T1oBoNlb
2017-09-01,Clark Builders victim of identity theft in 'phishing attack' on MacEwan University https://t.co/X7BL32l89u https://t.co/yxIhfMj9UF
2017-09-01,Father of infant killed in arson fire emotional after accused makes court appearance  https://t.co/xyFMDAoeNF https://t.co/Xro8PDFNxU
2017-09-01,"Did you eat at the Haweli Restaurant booth at #yeg Folk Fest? It's linked to Salmonella, AHS says. https://t.co/m2PytwiRk4"
2017-09-01,"Salmonella outbreak linked to Edmonton Folk Festival food booth, AHS says https://t.co/ARXCzQtdHW https://t.co/FAJU9gr6yh"
2017-09-01,National champion Matteo Dal-Cin among Canadians to race in Tour of Alberta https://t.co/Ou7SngHF9Y https://t.co/fP7Kqxg4Xy
2017-09-01,The Beast finally out: Fort McMurray wildfire declared out 15 months later https://t.co/QOLyu3gjyW https://t.co/4b6ibCmRC7
2017-09-01,All hands on deck as Eskimos look to turn the tide in historic Labour Day Classic https://t.co/Tk48O4tTYh https://t.co/Oc0eIiPjJM
2017-09-01,Bitumen bites: Fort McMurray eats up new Mexican food truck https://t.co/ZHaOQFvc1f https://t.co/TRKiHoy7JX
2017-09-01,Edmonton firefighters deploy naloxone nearly every other day as Alberta opioid crisis continues https://t.co/msZo97F2me https://t.co/5pP4ZWIuBp
2017-09-01,Outpouring of support overwhelms family of Edmonton mall Santa in intensive care unit https://t.co/pa3I4lGSIi https://t.co/KZ9PK1UwkY
2017-09-01,Province 'moving very quickly' to get approval for Edmonton supervised injection sites https://t.co/xsebG633uz https://t.co/jaYBKhFBs1
2017-08-31,'It's lethal': Fentanyl so toxic RCMP show media only photos at news conference https://t.co/BARhDvsiDl https://t.co/Wr9MvsGV3I
2017-08-31,Luck only part of the equation for professional poker-playing Edmonton mom https://t.co/2cywqBldTG https://t.co/ItWWMV0LrJ
2017-08-31,.@MacEwanU failed to call a vendor to verify whether emails requesting a change in banking info was legitimate: https://t.co/zCwCdCMdkB #YEG https://t.co/zzRGOtCK9C
2017-08-31,"'I've lived here almost four years and I've never even seen him,' says neighbour of man killed in morning fire: https://t.co/mZe5mat5fy #YEG https://t.co/EtGVlLCn2O"
2017-08-31,Killam hospital workers charged in assault of 88-year-old female patient https://t.co/yJIlMurkhc https://t.co/dSwORPDBWn
2017-08-31,MacEwan University defrauded of $11.8M in online phishing scam https://t.co/B3bkPZW3M4 https://t.co/t2butFJcyR
2017-08-31,MacEwan University defrauded of $11.8M to bank account staff believed belonged to a vendor #YEG https://t.co/GcN3zD6Ykf
2017-08-31,Enrolment up as Fort McMurray schools re-open for first full academic year since wildfire: https://t.co/hj56DgQWlO #YMM https://t.co/xihQtpJPOt
