created_at,text
2017-11-13,"Brother, can you spare a goal? The good, the bad and the ugly from the Oilers' road trip https://t.co/6wzb0dTZaT https://t.co/6AYHiJlrPX"
2017-11-13,Teen barrel racer takes on Canadian Finals Rodeo https://t.co/xMbElNq17U https://t.co/4NG1YTvmnL
2017-11-13,Councillor wants inquiry into safety of Metro Line LRT after 2 trains end up on 1 track https://t.co/AG3RVsOGtb https://t.co/wafYnzwFK5
2017-11-13,Alberta teacher races to save dying Indigenous language before time runs out https://t.co/oMo3UrAiot https://t.co/6s4KL5MnhA
2017-11-13,"'We're not done after 44 years': Candian Finals Rodeo needs a new venue, but it could be in Edmonton https://t.co/8x56gWRUXU https://t.co/InIfBr3OZ9"
2017-11-13,"Capitals come from behind, knock off Oilers in shootout https://t.co/KgmEuZot0N https://t.co/lrsK9bxG8O"
2017-11-13,"Unstoppable offence vaults Eskimos past Bombers, into Western final https://t.co/8eESsrLK6m https://t.co/pJIkcbVobd"
2017-11-12,Jamie Foxx asks people to support Edmonton charity in social media video https://t.co/nZiV7qWGgR https://t.co/hbcnvNBudb
2017-11-12,"They thought we'd be further along: Canada 150 Women author says despite progress, gender parity still elusive https://t.co/cFNbmSdvLO https://t.co/3X8tgDb9ms"
2017-11-12,Inmate dies at Bowden Institution  https://t.co/G4tv7SmSfu https://t.co/NW9fgitM8j
2017-11-12,Bowden Institution inmate dies in hospital Sunday https://t.co/rfL2FIJ9t0 https://t.co/6unpfxBlLT
2017-11-12,"Devon donut shop a Frickin' Delight, says food critic Twyla Campbell https://t.co/gp2kPR979m https://t.co/duf0WTh05j"
2017-11-12,"Future of rodeo in Edmonton back on the table, right after the dust settles https://t.co/XsLetz72q0 https://t.co/rGFPfpOuxZ"
2017-11-12,'He came out in his own time': Alberta mother urges acceptance as GSA debate intensifies https://t.co/l8RHe7nIY3 https://t.co/DIv3QXoHd0
2017-11-12,"Passengers scramble after WestJet, Air Canada cancel Puerto Rico flights. Who's to blame? https://t.co/s2UYKNhP73 https://t.co/ZClKDVbl7r"
2017-11-12,Stepping back but not down: How the Queen is gradually shifting duties to the next generation https://t.co/0APa1PvogR https://t.co/tS3J8rxWuD
2017-11-12,Ottawa responds to NAFTA challenge that it's not tough on tailings pond leaks https://t.co/pCseAb4s3U https://t.co/Jwvgk8mmCj
2017-11-12,What does it take to feed an army? Chow chat at the Edmonton Garrison https://t.co/83eawsgxHB https://t.co/0eZb6II10w
2017-11-12,"Edmonton's Cold War command centre sealed tight, but not forgotten https://t.co/66kRMW3TsK https://t.co/mPgGEoEmzJ"
2017-11-11,Rangers use power play to defeat Oilers for 4th straight time  https://t.co/bDhrjTIChs https://t.co/B7JxTeaYW2
2017-11-11,'Very close to our hearts:' Cello sisters dedicate new song to fallen soldiers https://t.co/OLCCQR779q https://t.co/7mEdPFFGnV
2017-11-11,Lest we forget: Edmontonians pay their respects on Remembrance Day  https://t.co/0HIW9p4vjF https://t.co/NC5gQWXZnD
2017-11-11,"Alberta family taken in naked kidnapping case were frightened, want answers https://t.co/moJrYT0452 https://t.co/fun3pzXvXG"
2017-11-11,'This is going to be a 5-year high': Police across Alberta sound alarm over massive jump in vehicle thefts https://t.co/6dBA6z31TP https://t.co/NAefWC5q0r
2017-11-11,"Woman killed, 3 injured in northeast Edmonton crash https://t.co/RNVZ0rYImi https://t.co/EUfAOQWZtF"
2017-11-11,Canada's first Indigenous police officer remembered in Passchendaele centennial https://t.co/sBLc1AGAof https://t.co/F9lg2XI3cP
2017-11-11,"Man, woman killed in Friday night crash northwest of Stony Plain https://t.co/R56OPvWsDf https://t.co/j2PQy8UktR"
2017-11-11,Star-cross plaque destroyed by wildfire reissued in time for Remembrance Day https://t.co/axmlaHyc92 https://t.co/TnSwgL4tpf
2017-11-11,'I Am War': Edmonton medal of valour winner relives Afghanistan conflict in new documentary https://t.co/38HCJZULVR https://t.co/xP6mHZkI0G
2017-11-11,Edmonton hero gets bravery medal for saving man on LRT tracks https://t.co/62mFmzabZg https://t.co/HbDtZ62OSL
2017-11-11,"The Ledge: Mansplaining, hepeats and gay-straight alliances https://t.co/olNwNEhQDt https://t.co/ZLr6uuaJNA"
2017-11-11,Edmonton Eskimos carry winning momentum into Winnipeg playoff game https://t.co/hn0UAzvlpT https://t.co/0sWSX0pRqU
2017-11-11,Edmonton left out of marijuana talks as Alberta rejects Ottawa's proposal https://t.co/p929S1gniE https://t.co/IXfp3Ebqq4
2017-11-11,'It's a journey:' coming out can be a family affair https://t.co/B3hMHkFlNn https://t.co/GnugdIUIoD
2017-11-10,Greg Clark steps down as leader of the Alberta Party https://t.co/KvqFNMYEaX https://t.co/uLwSC2SBuD
2017-11-10,CNRL proposes bitumen-only expansion at its Horizon oilsands mine https://t.co/X6NWtlbSbv https://t.co/FDd8m6w5rJ
2017-11-10,"Federal marijuana tax plan 'completely unacceptable,' says Alberta's finance minister https://t.co/h2kDSRjcVx https://t.co/s7O7X5TzAt"
2017-11-10,Province offers $40M to offset job losses in Alberta coal industry https://t.co/GcizIAgqTo https://t.co/HiA6fvCZ3D
2017-11-10,Accused killer's confessions ruled inadmissible because he was denied bathroom break https://t.co/S0B7YgAJdR https://t.co/UIuOZ7cOoJ
2017-11-10,Tug-of-war over Alberta murder trial resources sees chief judge called in to referee https://t.co/2hWcBAtB6D https://t.co/GAWeOnbAVU
2017-11-10,"'It just happens that quickly:' theft of idling cars an epidemic, police say https://t.co/CJz7jamBT1 https://t.co/Poos8qmx2k"
2017-11-10,Help on way as Oilers recall Jesse Puljujarvi from American Hockey League https://t.co/nU4j4atcuX https://t.co/4uTcbo5MoO
2017-11-10,"Scissors, sponges: some Alberta surgical patients get more than they bargained for, report finds https://t.co/hZuFRfNPNQ https://t.co/uhir26387X"
2017-11-10,CFL playoffs: Can the Eskimos roll over the injury-stricken Bombers? https://t.co/Q30e7eUmR9 https://t.co/MzqHENdlTQ
2017-11-10,Alberta Children's Services worker charged with child exploitation offences https://t.co/sm2bedyBuJ https://t.co/6YO1AKuO4q
2017-11-10,Gay-straight bill could allow covert sex ed: Alberta United Conservatives https://t.co/ornFqeHeLM https://t.co/kUSH0kakHC
2017-11-10,Orphan Well Association spending tops $2M on care of Lexin assets https://t.co/iQR0HdbUow https://t.co/sYozqcL6Md
2017-11-10,'He wouldn't have had a problem shooting me:' Trucker recounts being hijacked https://t.co/kdmACUTz7Z https://t.co/G3Kv7T18bd
2017-11-10,Churchill construction chaos to last until 2019: TransEd https://t.co/vqCcOxnbqt https://t.co/S1ElZdl41J
2017-11-10,Resident found dead after fire at Edmonton seniors' home https://t.co/TbgNxuP6Kp https://t.co/QkLtz5pBdU
2017-11-10,More seniors using Fort McMurray food bank since May 2016 wildfire https://t.co/97tVwOesOH https://t.co/Tg7EScd8cu
2017-11-10,Century Park LRT to lose 200 parking spaces to developer https://t.co/YRFgVrZm9j https://t.co/mQVz6vyAlm
2017-11-10,Strathcona Spirits set to open to the public — finally https://t.co/c1I3EecTwA https://t.co/IEwXxRJDqT
2017-11-10,"Oilers win game, but Devils' Boyle wins hearts with inspirational goal https://t.co/9e6aJFZTI1 https://t.co/734EhCBDVN"
2017-11-10,"First there was #mansplaining, now @RachelNotley is offering definitions of #hepeating: https://t.co/LQQTbOpMfK #ableg #abpoli #WomenInPolitics https://t.co/Fq5wbaGUrs"
2017-11-09,'Crazy spell': Naked suspects in Alberta kidnapping may have sipped trippy tea https://t.co/tSdwIDXbvD https://t.co/y3M48L2Ji1
2017-11-09,"Remembrance, rodeo and red carpet music: What's on in and around Edmonton https://t.co/PwbxGUCcrF https://t.co/Y0CuyggEed"
2017-11-09,"Remembrance, rodeo and red carpet music: What's on in and around Edmonton https://t.co/PwbxGUCcrF https://t.co/cWxZrIPAWh"
2017-11-09,'I felt let down': Missing woman's daughter disappointed in Edmonton police response https://t.co/xoCgqbPYWT https://t.co/6e5BilTMND
2017-11-09,Edmonton proposes 3.6 per cent property tax hike for 2018 https://t.co/skyJolPD59 https://t.co/bEaRCGVdcM
2017-11-09,"Woman, 60, charged with murder in death of 59-year-old man in west Edmonton https://t.co/zKKOiWL06R https://t.co/F1alPUPnZ2"
2017-11-09,"Nov. 6, 1998: Cameras introduced to Edmonton intersections https://t.co/NlX8Le6J7S https://t.co/qYSrFwntzm"
2017-11-09,Edmonton mayor urges Eskimos to move quickly on name change  https://t.co/nlEVPxvsO2 https://t.co/moIc5Dlfx9
2017-11-09,Union offers support to 'suffering' workers at Edmonton Institution https://t.co/2InVKaCnZI https://t.co/E60ZsQvqYZ
2017-11-09,"QBs Mike Reilly, Ricky Ray finalists for CFL outstanding player https://t.co/bI8VBIYUCy https://t.co/Xq201tOrLX"
2017-11-09,"For this artist, making art with an MRI is no different than taking a photo https://t.co/7oFeh49Dni https://t.co/Qn5eL9pGnh"
2017-11-09,Legal battle over abandoned oil wells bound for Supreme Court  https://t.co/yeN4m6MeKs https://t.co/fXWQ1jTXc3
2017-11-09,"'Mansplaining,' 'hepeating' roiling debate at the Alberta legislature https://t.co/F6eBt89AWO https://t.co/wIPVgYnJFk"
2017-11-09,Lost mail prevents Venezuelan in Alberta from helping struggling family back home https://t.co/qC0mpFnq9B https://t.co/krnMkonW2m
2017-11-09,'Walk of shame:' Alberta RCMP lay kidnapping charges against naked suspects https://t.co/4Fyg1e3Fje https://t.co/oZNB5G0NAC
2017-11-09,'It takes forever': Another delay hits proposed Fort McMurray oilsands mine https://t.co/FrED3e1KQj https://t.co/1qsOIWRBv7
2017-11-09,'Take a deep breath': Evolution of Darnell Nurse one bright spot for Oilers this season https://t.co/iH25sxJAU7 https://t.co/FwLFAfNRQF
2017-11-09,Rodeo's future in Edmonton to be determined by weekend events https://t.co/mRI8x7yR7B https://t.co/DwNAMZ42ds
2017-11-09,RCMP's denial of bathroom breaks could render accused killer's confession inadmissible in triple-murder trial  https://t.co/tpn7k2DvNz https://t.co/Y3acwN0eSu
2017-11-09,'A tremendous individual': Edmonton basketball player signs professional contract https://t.co/3NDMJoiqtu https://t.co/pVI5JsWj4X
2017-11-09,Albertans receive awards for courageous water rescues https://t.co/4rKF49WJ6f https://t.co/O3lFm50rnH
2017-11-09,Alberta premier urges UCP MLAs to 'stand on the right side' of GSA issue  https://t.co/AnONHIVQKc https://t.co/g6Vs7z5ygP
2017-11-09,"One dead, two in hospital after highway crash near St. Albert https://t.co/XerZ9HWT4c https://t.co/GKy64BQi33"
2017-11-09,"""Just because sexism is polite, it doesn't make it not sexism""- @KathleenGanley during #mansplaining debate @ #ableg https://t.co/s3hI5nidnr https://t.co/LtFKwstlrk"
2017-11-08,Or ... if you drive pretty much anywhere in Alberta in the winter! Here's tips you should know #yegtraffic https://t.co/mXN4fAy8Ui
2017-11-08,Winnipeg mayor raises name of CFL Eskimos with Edmonton counterpart https://t.co/GH10f4cRrF https://t.co/3LuC6gQnlK
2017-11-08,"Notley's 'mansplaining' comment not unparliamentary, Speaker rules https://t.co/i25rJwfqYv https://t.co/TPwfqEDOK2"
2017-11-08,Ready for a magical story? Hedwig (the owl who lived) is now recovering in #YEG after being rescued with what looked like a broken wing in #YMM: https://t.co/vOCkBTGaOx @jk_rowling #HarryPotter #Hedwig #Always #Rescue https://t.co/0WPCM0TOWv
2017-11-08,Woman recounts 'horrific' gunpoint kidnapping at MMIWG Inquiry in Edmonton https://t.co/czDKBLk2Qx https://t.co/R5u5bVP4EJ
2017-11-08,"Agencies, boards, commissions to have codes of conduct, ethics rules under new bill https://t.co/SqM7JEwRL3 https://t.co/LA5FTy2kn2"
2017-11-08,Astronaut Roberta Bondar's earthly photographs touch down in Sherwood Park https://t.co/kV6nkSKj6k https://t.co/kTg0gMtDSA
2017-11-08,"""I just want the pendant back,"" St. Albert man pleads after a necklace containing wife's ashes stolen from his home: https://t.co/xNuHhLsxb1 #yeg https://t.co/NuKR3fuQ5f"
2017-11-08,"Person found dead after Edmonton house fire didn't die in blaze, investigators say https://t.co/8XjvXbC1AP https://t.co/I11t5rqpSo"
2017-11-08,"2 Sherwood Park children chased by suspicious man in cube van, police say https://t.co/7ubsPCIam3 https://t.co/M55Vsrec0d"
2017-11-08,"Globetrotter, stormchaser George Kourounis brings climate-change message to Edmonton https://t.co/3znQ3XZ2pD https://t.co/AQ9aZAytdG"
2017-11-08,4 charged in largest fentanyl pill seizure in Canadian history  https://t.co/eE4s6fLdle https://t.co/5NrwE67eah
2017-11-08,Alberta RCMP hunt for armed carjacking suspect who fled on snowmobile https://t.co/ZoHATyzZJy https://t.co/N8lGbz6Jia
2017-11-08,LGBTQ apology will keep remedies separate from regret: PM special adviser https://t.co/mx9GRVljun https://t.co/pWNV7rfH9p
2017-11-08,82-year-old man dies in overnight fire in Athabasca County https://t.co/6P0lLEd96s https://t.co/0EdWsrc8bk
2017-11-08,Edmonton police investigating suspicious death of man in late 50s https://t.co/P5vqDGH5ID https://t.co/Lbqm5tWZc6
2017-11-08,Province commits to fixed funding for air ambulance in northeastern Alberta https://t.co/46cW253ecP https://t.co/58eFKHttmR
2017-11-08,"Hedwig, the owl who lived: Rescued Fort McMurray bird attracts Harry Potter fame https://t.co/F27YG9jok8 https://t.co/JxbPFzsTAy"
2017-11-08,Top U.S. creationist's invitation as keynote speaker for Alberta homeschooling convention draws fire https://t.co/6tLhhIcp83 https://t.co/Y1zHtyxnW9
2017-11-08,Free entry boosts attendance at Art Gallery of Alberta https://t.co/YH4baPdKAM https://t.co/v70KlzH1mV
2017-11-08,"An Indigenous soldier's story: equal on the battlefield, but not at home https://t.co/w9BOUFfZl2 https://t.co/YRIEaUJB7t"
2017-11-08,Murder charge laid against Alberta man in shooting death of Abbotsford police constable https://t.co/feE1Zc6n7i https://t.co/CQK7W99Tkc
2017-11-08,'I just want the pendant back': Husband pleads for return of wife's ashes https://t.co/I8YVotEth7 https://t.co/Zp6Cu1OQND
2017-11-08,"Accused confessed to Red Deer triple-murder charges, claims he was sexually coerced by co-accused https://t.co/EXHM6UnvPn https://t.co/23cZRr21L0"
2017-11-08,"McDavid, Draisaitl work overtime to steal crucial road win against Islanders https://t.co/TUV7VohvLs https://t.co/1EONSzEQhc"
2017-11-08,Foreign students claim they were misled about chances of staying in Canada https://t.co/NT6vRUZa0A https://t.co/UkMHVRITH2
2017-11-08,Edmonton to net $20 million from EPCOR drainage profits https://t.co/xWWEfW9Jp3 https://t.co/KiTHyRaoIG
2017-11-08,Carbon monoxide leak sends 2 to hospital in Edmonton https://t.co/6n2cjonx3t https://t.co/Vt9bWCwrnT
2017-11-07,Kidnapping charges pending after two-vehicle crash in Nisku https://t.co/ypbuPh3mrn https://t.co/4K0VQobth9
2017-11-07,"""Teachers, not politicians, should decide when it makes sense to engage parents,"" @jkenney says.  https://t.co/XYLPxbaXky #GSA #ableg https://t.co/L9Fbk1s3Xn"
2017-11-07,Fat tires and warm clothing: a beginner's guide to night mountain biking https://t.co/59GmBzUmgK https://t.co/61Z4f9maQQ
2017-11-07,Victim's brother questions police responses to MMIWG cases during hearings in Edmonton https://t.co/DY7I7eC1eE https://t.co/W7TMVT5BYN
2017-11-07,Edmonton Christian couple says adoption nixed over views on sexuality https://t.co/keO5MeQ77W https://t.co/uxaBCGSO0b
2017-11-07,'Really heroic people': Documentary chronicling life on the streets screens in Edmonton https://t.co/p3CKKAcXSv https://t.co/9eYxoOZuvP
2017-11-07,"Teen dies suddenly at home, one week after Halloween crash that killed two others https://t.co/c99gSNG6LY https://t.co/gSv2UTdjzG"
2017-11-07,"Speeding is bad but we do it anyway, Alberta drivers tell AMA https://t.co/7hFAU8CIye https://t.co/95ug7eSepC"
2017-11-07,UCP to oppose GSA bill banning parental notification  https://t.co/aEQ9xEkih7 https://t.co/cCqd14JPaX
2017-11-07,"Alberta street gangs recruit with false promises, new study concludes  https://t.co/vA71Lo39GX https://t.co/PtzyMLKG8l"
2017-11-07,"Edmonton fencing phenom dominates junior world cup, sharpens skills for Olympic bid https://t.co/F07JMDmYtU https://t.co/oG7z94goJG"
2017-11-07,"Alberta man suspected in fatal shooting of police officer in Abbotsford, B.C. https://t.co/21XSztmLyr https://t.co/YlOGw0ZFDP"
2017-11-07,'It's really special:' Edmonton professional paintball team takes world cup trophy https://t.co/0EvDWuuQH0 https://t.co/8UQ57CSXJY
2017-11-07,Future of FC Edmonton in doubt as North American Soccer League threatens to go under  https://t.co/vScce1bpdw https://t.co/v6ZhBehcJi
2017-11-07,Alberta ranks 2nd highest on health-care spending despite youthful population https://t.co/pJnp7DBsCH https://t.co/3b5nvzJqzx
2017-11-07,'Going in disappointed': Longtime rodeo fans gear up for final CFR at Northlands Coliseum https://t.co/IsJk7hpxXh https://t.co/U39EHjWa5E
2017-11-07,Two former Alberta cabinet ministers part of group promoting legal pot industry https://t.co/64JeYkRWI4 https://t.co/Np6pM56nmU
2017-11-07,Fort McMurray makeover: Volunteers surprise sick girl's family with home renovation https://t.co/BHhEoXXQqY https://t.co/E2EN071X3e
2017-11-07,Diphtheria case confirmed at Edmonton elementary school https://t.co/CXAzHYjMly https://t.co/7KhiE955gu
2017-11-07,Accused killer tells of meeting Mr. Big in Red Deer triple-murder trial https://t.co/r3DW5loLJ2 https://t.co/PS26yTonAa
2017-11-07,$4.3 million in policing costs for Lecuc annex hard to justify: Edmonton mayor https://t.co/HTzWHxqIoL https://t.co/Ua592LHV4g
2017-11-07,UCP MLAs allowed free votes on Alberta gay-straight alliance bill  https://t.co/aQpAvJLLD9 https://t.co/CovtrmnWlQ
2017-11-07,"Premier Rachel Notley to embark on pipeline pitch in B.C., Ontario https://t.co/W3r7jobIHa https://t.co/chwXvZ8cX1"
2017-11-07,Man sentenced to life in prison for Whitefish Lake double-murder of high school sweethearts https://t.co/rxbK8mHUgX https://t.co/OGWfBLTY2k
2017-11-06,"Alberta Party gets more funding, more questions in legislature  https://t.co/fUJr4fRz15 https://t.co/gN7F5wQojl"
2017-11-06,Edmonton detergent maker fined $600K for high phosphorus levels https://t.co/FfW4WropRZ https://t.co/kYYpHavNss
2017-11-06,Five nude suspects in custody after two-vehicle collision south of Edmonton https://t.co/MIX1wxW455 https://t.co/B49Qt0WirE
2017-11-06,Not every news release is created equal. #cbc #yeg #news https://t.co/6pMwCLFrKX
2017-11-06,WestJet flight cancelled after de-icing spray enters plane at Calgary airport https://t.co/K1psv4vcok https://t.co/aqfW1SHvHj
2017-11-06,"Man dead, passenger injured in single-vehicle rollover north of Grande Prairie https://t.co/sxv8Y9pV2U https://t.co/buXg0OKd6Y"
2017-11-06,Calgary police lay pill-press possession charges for first time under new Alberta law https://t.co/lIeUNZUwc4 https://t.co/Qtbcz6Wi9i
2017-11-06,Deaths of 3 Indigenous teen girls lead to calls for trauma training https://t.co/seHj4E2RdM https://t.co/GIrJqd6n2O
2017-11-06,Edmonton Oilers send rookie forward Kailer Yamamoto back to junior https://t.co/jzSpgUpdTw https://t.co/WuMz9cgvTs
2017-11-06,Ghost bike to be installed in memory of cyclist killed in weekend hit and run https://t.co/hQWIt1KY3T https://t.co/s1K5qzCHLO
2017-11-06,Zamboni driver offers 5 tips for driving on ice  https://t.co/IQxd5SrYSX https://t.co/1Y1Ntp3cCx
2017-11-06,'High hopes' for MMIWG national inquiry in Edmonton https://t.co/dJR32BO2rS https://t.co/tQhPAOGk0w
2017-11-06,"Personal mental health plans needed after Fort McMurray wildfire, experts say https://t.co/IX2MaTakey https://t.co/Vyjv2CcWd2"
2017-11-06,Settling Treaty 8 claim means 'money in the bank' for future of Athabasca Chipewyan First Nation https://t.co/WQ3tKzVhEn https://t.co/03xdv2Nxy6
2017-11-06,Sentencing begins for man accused in Whitefish Lake double-murder https://t.co/2MJaNvXSnA https://t.co/0gI8duFu47
2017-11-06,Edmonton gamers team up and fight for sick children https://t.co/7blYsNzJaG https://t.co/P2TvNicCti
2017-11-06,"Using poison to cull wolves in Alberta is inhumane, says animal advocacy group https://t.co/xFXHmsKPMd https://t.co/Rzgpt7jBxR"
2017-11-06,'One-and-done-itis' has Oilers playoff hopes in critical condition https://t.co/cgGUAumFye https://t.co/TfYi8A72Dt
2017-11-06,Documentary 'Into the Fire' looks at the science of fires in the wild and the home https://t.co/rnP8qf649Y https://t.co/oj699dxQun
2017-11-06,Sudden cold snap leaves Edmonton's homeless shelters struggling https://t.co/jFtC918Huz https://t.co/YLMexdjMwD
2017-11-06,"Transit regulator rejects Via Rail's efforts to limit wheelchair, mobility access on trains https://t.co/YajbNlgLa0 https://t.co/W3qL04uMxK"
2017-11-05,'They'll always be remembered': No Stone Left Alone honours fallen soldiers for 7th year https://t.co/aklNNhowTP https://t.co/adomnGoKUw
2017-11-05,Movember Canada trying to move beyond the moustache https://t.co/Ca6TLJ5I2T https://t.co/B1hroOpNlj
2017-11-05,Cyclist killed in early morning hit and run https://t.co/OajO98m2zg https://t.co/oLtVeqzyyu
2017-11-05,Water restored to northern Alberta town after emergency shutoff https://t.co/bkeAIfzYoq https://t.co/sTQp0nTlal
2017-11-05,Debate over drug consumption sites might be coming to end https://t.co/f7nOvoVOzB https://t.co/zYDGDeZFHz
2017-11-05,Latest Shared Services Canada outages disrupt border traffic   https://t.co/AZuqBD22b0 https://t.co/PWq6wQoyzg
2017-11-05,Atco's plans for power line in Jasper National Park meeting resistance https://t.co/Bm6KsMoSpE https://t.co/3Oey5s6XOX
2017-11-05,"City of Edmonton aims to relax rules on making beer, wine, spirits https://t.co/E3CoeIALCt https://t.co/m7frC3m39C"
2017-11-05,Restaurants finally opening in new Kelly Ramsey tower https://t.co/6JuEGMTNaE https://t.co/sdUfZb19Bh
2017-11-05,'We're really getting left behind': AISH recipient laments lack of new funding https://t.co/LCCBlv8hWo https://t.co/17cDe08xo6
2017-11-05,City leaning on LRT drivers to catch software glitches https://t.co/NriTC6Ih7I https://t.co/vCg2NwcKtW
2017-11-05,Eskimos down Roughriders to set playoff date with Bombers  https://t.co/AQtfldd2oT https://t.co/JwcsNy8rIW
2017-11-04,'Hopefully we can make a difference': Edmonton veterans march for suicide prevention https://t.co/SjOVjBX8rL https://t.co/meGvJ0IgE1
2017-11-04,Friends and family remember slain Saint John dentist https://t.co/GYrfIahxGn https://t.co/Z1hfg9M5IA
2017-11-04,Northern Alberta town without water after emergency shutoff https://t.co/ftM8kBhEHC https://t.co/hH0k7IEdWD
2017-11-04,Half-finished homes and lots of questions after Alberta homebuilder goes into receivership https://t.co/0uNCGUI8RR https://t.co/bzNGt1E959
2017-11-04,"Edmonton Oilers score early, ride momentum to huge win over Devils https://t.co/qSoQOno4nx https://t.co/d34RfuYOXW"
2017-11-04,New Canadians take first shot at road hockey in Edmonton tournament https://t.co/3vQMN78jtO https://t.co/sfStYCwKtO
2017-11-04,"Daylight time comes to an end this weekend, amid renewed scrutiny https://t.co/qo6tMhmcqW https://t.co/3A6djUwn34"
2017-11-04,"It seems that no matter what women do to deal with assault or harassment, it is wrong https://t.co/xh3bNYq12X https://t.co/G25t8OjUpC"
2017-11-04,'Anything But Sorry': What to say when a baby is born with Down syndrome https://t.co/F6uw3i6pOe https://t.co/7Vcu1a1LzE
2017-11-04,True North Seafood Company product recalled over Listeria concern https://t.co/S4d3NvLYSc https://t.co/kfbTa5Gu56
2017-11-04,The last charge of the Canadian Finals Rodeo into Northlands Coliseum https://t.co/UU9NPcArmE https://t.co/BzwaNWut7r
2017-11-04,Moonshine distillery adds to unique businesses coming to Edmonton International Airport https://t.co/A4XoIQqwBs https://t.co/wq37jjOXCz
2017-11-04,Edmonton Indigenous artist in residence honours Treaty 6 in final exhibit https://t.co/zwYdbJOtI9 https://t.co/4ED70Hu8gB
2017-11-04,Connor McDavid's 3 assists help Oilers double up Devils https://t.co/gblLGtLr9S https://t.co/Biz40i3xYN
2017-11-04,Transgender woman on Top 40 Under 40 list an Edmonton 1st https://t.co/rgPNBUCVus https://t.co/OqN9BSZQvm
2017-11-04,The Ledge: a new CBC podcast about politics in Alberta https://t.co/YjbR7JXDi5 https://t.co/7sf2JNRTQ6
2017-11-04,Saskatchewan applies for intervener status over Trans Mountain pipeline delays https://t.co/ojdO7OVK9B https://t.co/k9ONrrO6I9
2017-11-03,Father pleads to see his dying baby in Edmonton for first time https://t.co/tRxnFUfaF3 https://t.co/JK8fTtzaic
2017-11-03,Edmonton's Harbin Gate on the move this weekend https://t.co/efnHxNUCst https://t.co/HQm7XawpOO
2017-11-03,Repeated failures of Metro LRT Line signalling system raise safety questions https://t.co/CKSF5RpuGQ https://t.co/6lDVw5p50H
2017-11-03,"Proposal to increase parking fines no 'cash grab,' mayor says https://t.co/56l1K9KPCn https://t.co/BvNBScG65c"
2017-11-03,Syncrude facing new charges in deaths of 31 great blue herons https://t.co/aJgMM44d5m https://t.co/5N83UtV1AP
2017-11-03,One person dead in northwest Edmonton house fire https://t.co/EykqXN0dgJ https://t.co/vFjbPkjT9P
2017-11-03,'Vibrant and beautiful girl' fighting for life after Manning Drive crash https://t.co/rlcPvG1TGr https://t.co/WVk5doXQGh
2017-11-03,Controversial former judge Robin Camp seeks to practise law again in Alberta  https://t.co/JKdwXn8WJ0 https://t.co/R1a0rVp5A5
2017-11-03,FUBAR creators bring the Alberta headbangers into the modern age  https://t.co/QVHPzhEK8R https://t.co/pcvLji2cQA
2017-11-03,St. Albert teen charged for threatening classmate with fake handgun https://t.co/XQJHlqs7VA https://t.co/qRz7lrdyhv
2017-11-03,"Alberta's unemployment rate dips to 7.8% as province gains 12,000 full-time jobs https://t.co/8z4tMg40u8 https://t.co/tLud5qivHa"
2017-11-03,"Canada adds 35,000 jobs in October, as full-time positions surge https://t.co/EkcRvNR4qt https://t.co/OdahoWms5n"
2017-11-03,Renewable energy jobs provide new opportunities for Alberta workers  https://t.co/YNkmi6FN3p https://t.co/i2TVG02ZCm
2017-11-03,"'My mom was the light of the house,' says daughter of crash victim in northern Alberta https://t.co/Pp8JW9gPl2 https://t.co/nvkSodEaZ7"
