created_at,text
2017-10-10,Newfoundland hunter airlifted to hospital after wounded moose fights back https://t.co/l1Fhc51MeJ https://t.co/mcQFMUTVYo
2017-10-10,"Beverly Elanik, Inuvik woman who died in RCMP custody, died of natural causes, inquest finds https://t.co/WLHxXqm6kG https://t.co/33coi2dIB2"
2017-10-10,Cut out the 'middlemen' and fund First Nations in N.W.T. directly says Dene Nation Chief https://t.co/5qm91fQr5s https://t.co/Rxs3Uh6FCe
2017-10-09,10-year-old 'Recycling Guy' cleans up the streets of Yellowknife https://t.co/H2Gr8HYvNX https://t.co/42yGBF8pKE
2017-10-09,"Unilateral cash settlement no replacement for stolen time, says Sixties Scoop survivor born in N.W.T. https://t.co/WmIH2yBzat https://t.co/QThHl0W7lo"
2017-10-09,Manslaughter charges against alleged fentanyl dealers mount across Canada https://t.co/AMy7lG7eCA https://t.co/fY7tUC3frV
2017-10-09,Ehphé T'ah Lae-chí: Wrapped in Moose hide https://t.co/he8G0XiGIA https://t.co/CjfwUwyatN
2017-10-09,Yukon Liberal MP backs petition to drop Phoenix pay call centres and deal directly with affected gov't workers https://t.co/3vx6u3GC1P https://t.co/BxxRtASAH7
2017-10-09,Yukon Rivermen set for opening of groundbreaking hockey season https://t.co/0bxCOOw0Za https://t.co/ykPRwiAObi
2017-10-09,"Misdirected faxes, personal phone use 'urgent' issues in N.W.T., says gov't privacy watchdog https://t.co/GHo7cG7OKI https://t.co/oeC1txffDQ"
2017-10-09,Snorkelling in icy waters and hiking remote terrain: Adventure tourism arrives in the vulnerable Arctic https://t.co/PajrodMF1H https://t.co/G1reQwtri2
2017-10-08,"Youth mental health 'must be given greater priority,' Kwanlin Dün chief https://t.co/A6HePRlymD https://t.co/k3BuTFdX8l"
2017-10-08,Taxes dominate debate in week 1 of Yukon legislature's fall sitting https://t.co/yulQXDIBjo https://t.co/vorHLZayA6
2017-10-08,Nunavut teen with dwarfism trained for World Dwarf Games with rocks and a harpoon https://t.co/V9K3u6NDlw https://t.co/1Ptopk95ph
2017-10-08,MMIWG inquiry losing 2 more staffers https://t.co/saE5Tl5qcB https://t.co/o5mOFHyeVa
2017-10-08,N.W.T. 'bush kids' thrive at Sweetgrass Station in Wood Buffalo National Park  https://t.co/t2YCp5Am9u https://t.co/eLYyxTGXFI
2017-10-08,"Inuit, Ottawa launch task force to fight tuberculosis in the North https://t.co/fZWd9tfkgV https://t.co/GymdIXycvA"
2017-10-07,Yukon man charged with 1st-degree murder in Carmacks homicide https://t.co/OLrwfEJI0P https://t.co/Q3hRrBvx50
2017-10-07,No more power outages? Inuvik man installs Tesla's 1st 'Powerwall' in the North https://t.co/QsUylvmj9w https://t.co/UPI7yeTxBo
2017-10-07,"3 inukshuks outside Toronto airport were supposed to be 1 giant inukshuk, builder says https://t.co/RkMUDFrb3Z https://t.co/vPKwN8j4s2"
2017-10-07,"Whitehorse food bank's annual drive so successful, they've run out of room https://t.co/WC8pG4Xb55 https://t.co/ChuAKmBniX"
2017-10-06,"Salvation Army's new, improved homeless shelter opens in downtown Whitehorse https://t.co/52BQKJK2x8 https://t.co/YNPplQLbMk"
2017-10-06,"Whitehorse taxi driver charged with sexual assault, kidnapping https://t.co/TWtgiIIZre https://t.co/eynYBl4RUS"
2017-10-06,B.C. man pleads guilty to multiple sexual offences against children in Yukon https://t.co/Cfwgp64VMx https://t.co/AxYKNysEUh
2017-10-06,"Indigenous residential school records can be destroyed, Supreme Court rules https://t.co/uAI08jMNtf https://t.co/9DtWT8Ale0"
2017-10-06,Carolyn Bennett announcement on Sixties Scoop LIVE https://t.co/SBNX13jCqB https://t.co/fB2xWyyzFi
2017-10-06,Where are Yukon's new mental health workers? NDP asks government https://t.co/EB3k5MSnVp https://t.co/2txUjabApy
2017-10-06,Are N.W.T. MLA salaries relevant in union talks? Depends who you ask https://t.co/k7hwjqg571 https://t.co/jT78eBbVrA
2017-10-06,"10 years after Mountie slaying, Hay River, N.W.T., remembers Const.  Christopher Worden https://t.co/MaAWMtpJPw https://t.co/eqC7lVFsWD"
2017-10-06,Iqaluit-Niaqunnguu a riding to watch in Nunavut election https://t.co/m7KS3hNpTm https://t.co/cDPZL5R3G5
2017-10-06,"In 1st systemic review, Nunavut child and youth rep takes aim at mental health https://t.co/atfCgjayB3 https://t.co/VGCs9v1GhC"
2017-10-05,Search for missing man focuses on Yukon River in Whitehorse  https://t.co/zt4FlJgcVl https://t.co/k6tP8VAaZi
2017-10-05,Former 'Yukon Gold' TV star fined $145K for leaving big mess at mining claim https://t.co/YMaLDz0B8j https://t.co/ztZXPkfYir
2017-10-05,Dawson City plans new water treatment plant https://t.co/oclHgNsPxX https://t.co/t3ncBWVBig
2017-10-05,Ottawa to announce settlement with Indigenous survivors of Sixties Scoop https://t.co/Kv9LTHGa76 https://t.co/DZkunKteNm
2017-10-05,"N.W.T. ministers say they won't resign, even if they lose non-confidence vote https://t.co/rXGSygiFjv https://t.co/YalwFz80qW"
2017-10-05,Inquest into death of 4-month-old Iqaluit baby in care to take place in April https://t.co/5k4tdezrjz https://t.co/0Cd90XkzAL
2017-10-05,Visibly shaken mayor says he will not be intimidated by 'vexatious' complaint from Yellowknife councillor https://t.co/v1utGLSFl4 https://t.co/WygMN3RDVU
2017-10-05,What to expect as N.W.T. MLAs head into Thursday's midterm review https://t.co/jGFjKba63p https://t.co/1RKnn507z5
2017-10-05,"'No intent' to raise gold royalty rates, says Yukon premier https://t.co/hpUoQIKPyY https://t.co/kzlZFKvtYS"
2017-10-05,"Behchoko, N.W.T. man receives 10 months for highway ramming incident https://t.co/Ah9dp3PSCj https://t.co/HRdEJ6Wzi6"
2017-10-05,New details on Inuvik hospital data breach revealed in Privacy Commissioner's annual report https://t.co/9cLpPLmn5G https://t.co/o5JEORfT6D
2017-10-05,Building maintenance program opening doors for locals in Quebec Indigenous community https://t.co/PrrthhgCAN https://t.co/uFAXCERXhz
2017-10-05,Prisoner who took part in riot at notorious Iqaluit jail says conditions making inmates worse https://t.co/XbvjB8Ws6Y https://t.co/5WVLbqGNjP
2017-10-05,'It gave me a sense of closure': Database on Inuit tuberculosis graves offers some answers https://t.co/gI3qkcWqhE https://t.co/tlW5AbauOM
2017-10-05,'Everyday they're with us': Northerners march to remember MMIWG https://t.co/0E0GRJyjCR https://t.co/aY3f7Sgqta
2017-10-05,Police ID victim in fatal Whitehorse shooting; confirm seizure of red truck https://t.co/Kh3ucsVoyU https://t.co/BdjI0FkT2r
2017-10-05,Yukon government stubbornness blamed for Whitehorse man's eviction https://t.co/p7nLJDXbc4 https://t.co/GJOBoj6xkF
2017-10-04,Indigenous languages to show up on northern grocery shelves https://t.co/H2Kmb9Ifdo https://t.co/yDLqU3QAf3
2017-10-04,Trudeau speaks on MMIWG LIVE https://t.co/rJpET1yert https://t.co/FN0woJWfBq
2017-10-04,U.S. government will not list Pacific walrus as threatened species https://t.co/Xz9oMroSJL https://t.co/lwhI0MeIUw
2017-10-04,Yukon pot survey territory's 'most successful survey' yet https://t.co/aVNctRY4jc https://t.co/LnmFA4qtC3
2017-10-04,"More than a year late, N.W.T.'s power generators still being built in California https://t.co/sBsfR7mOrv https://t.co/isN4Y5cAnu"
2017-10-04,'Unusable' N.W.T. child and family services audits included recommendations to the minister https://t.co/0Y0efRPOM0 https://t.co/pdac8CAX4a
2017-10-04,Cape Dorset woman gets 9 months in jail for arson https://t.co/1zDPQD3BfK https://t.co/7tqp426K5L
2017-10-04,Calling more women: Nunavut's 1st woman premier says equal representation a work in progress https://t.co/mPhEYrjF66 https://t.co/n3wRpIxP1i
2017-10-04,"Finding Yukon Indigenous artifacts, one museum at a time https://t.co/eFgztVCjnT https://t.co/cNmz4TWBky"
2017-10-03,"No environmental review needed for Iqaluit port, says Nunavut board https://t.co/W4dyhHkPTW https://t.co/IMsu6B9Zpf"
2017-10-03,Northern Frontier Visitors Association votes to disband https://t.co/c5C27c6VtL https://t.co/ibq7yyP6GY
2017-10-03,Whooping cough cases confirmed in Rankin Inlet and Arviat  https://t.co/bYu51Nxu8Y https://t.co/5lzsAwuZC8
2017-10-03,"After a battle for custody, Cree woman finally brings back her daughters from Egypt https://t.co/q8FfonMEPh https://t.co/hmUlZLx1C4"
2017-10-03,Arsenic in toenails? Study on arsenic and human health begins in Yellowknife region https://t.co/SY9Sw2NsQW https://t.co/Dg6Ty6zOw1
2017-10-03,Five things to watch in the Yukon legislature's fall sitting https://t.co/FQ2W64XnUm https://t.co/d38lwCi3D4
2017-10-03,"Mila Kamingoak is ready to get down to business as Kugluktuk, Nunavut's, new MLA https://t.co/HJkFrC73G9 https://t.co/jtqindcZhm"
2017-10-03,Yukon's Wolf Creek 'research basin' helps track and plan for climate change https://t.co/m5uasHUFfF https://t.co/Holb4MPxLr
2017-10-03,Former Yukon Speaker David Laxton found not guilty of sexual assault https://t.co/w3Hqwf7ZOx https://t.co/Pb1gz9Xyr6
2017-10-02,Northland Utilities warns of text messaging scam https://t.co/yQ05QBGQrL https://t.co/7p5fzeB7L8
2017-10-02,28-year-old woman found dead in Iqaluit's Happy Valley neighbourhood https://t.co/ZfPndU3i6y https://t.co/yTohh9HPe2
2017-10-02,'Terror and relief': Yellowknife's Mikey McBryan safe after Las Vegas mass shooting https://t.co/rUfzRhJbA5 https://t.co/L0vecOFksu
2017-10-02,Alaska communities weigh marijuana bans 3 years after legalization https://t.co/gM5mODjvTW https://t.co/oCrfl8qziQ
2017-10-02,"Yukon gov't, First Nations agree to roadmap on government relations https://t.co/AMTWeCRJ6D https://t.co/NXKR1zAJE2"
2017-10-02,N.W.T. MLAs lift salary freeze as government claims it can't afford raises for unionized employees https://t.co/LtnulBJjWV https://t.co/PdMJ2UWcFd
2017-10-01,"Canadian North sends crew, aircraft to help hurricane relief efforts in the Caribbean https://t.co/YJdGhf55CA https://t.co/jv424RIYbE"
2017-10-01,"'I'm trying my best': Yukon woman, front-line worker on the MMIWG inquiry https://t.co/IajkU1TZ2j https://t.co/4o7pGTywXd"
2017-10-01,Whitehorse micro-brewery production grows 10-fold since opening https://t.co/5ZCRHALbWS https://t.co/Xjr0NGozJ6
2017-10-01,Lynx mama and kittens crash Alaska photographer's deck https://t.co/J7ymJk643i https://t.co/Y2S56zepR7
2017-10-01,'You've been framed': Yukon party politics in the age of spin  https://t.co/ndvjZYUtZv https://t.co/kaRDTJwUmN
2017-10-01,"Edmonton police investigate 'acts of terrorism' after officer stabbed, pedestrians run down https://t.co/3j7XWHodwz https://t.co/OrAR1hdMwi"
2017-09-30,Man expected to make full recovery after predatory attack by 'emaciated' grizzly near B.C.-Yukon border https://t.co/25A4ntAClJ https://t.co/0sieSG1sMW
2017-09-30,Build it and they'll ride it: Olympic glory to come for Nunavut BMX riders? https://t.co/55UwtJG2Bh https://t.co/heWTzsCjKX
2017-09-30,Cree lessons with a bit of a Kung Fu kick  https://t.co/wnPKQDBHeO https://t.co/H138LvJokN
2017-09-30,Heart-shaped rock discovered at sacred site near Nahanni Butte https://t.co/zzum8XdYj1 https://t.co/RdCD826GbL
2017-09-30,Did giants roam Canada's Northwest Territories — or do they still? https://t.co/oMZFg5xtTd https://t.co/6prTVx6li2
2017-09-30,"'Respect, equity and empowerment': Indigenous elders on reconciliation and a new path for younger generation https://t.co/CR4wKunQFv https://t.co/Nn3Nt61K18"
2017-09-30,Canada's army looks to recruit reservists in face of dwindling numbers https://t.co/7wldiWydz5 https://t.co/q3jpR4tDdg
2017-09-29,"Doug Twiss acquitted on axe assault charge, convicted of mischief https://t.co/iT79jeBQ2v https://t.co/xCTrXqxR9V"
2017-09-29,Yukon opposition supports RCMP's call for more funding https://t.co/U1nD8eVyYh https://t.co/eT49QeEFBs
2017-09-29,"With firefighters home for the season, N.W.T. exploration company puts out forest fire https://t.co/2RjhxQWphq https://t.co/DNQ0buOPvT"
2017-09-29,Four N.W.T. communities to get new homeless shelters https://t.co/sSEcwghgAK https://t.co/3HFnCAcBGX
2017-09-29,Nunavut Premier Peter Taptuna will not seek re-election https://t.co/DJwCPpkEHe https://t.co/wpt1nj0kem
2017-09-29,The world is listening: first Nunavut Music Week festival underway in Iqaluit https://t.co/fsP9GockHM https://t.co/QphBjJLVaT
2017-09-29,Yukon business owners denounce 'disgusting' tax proposals https://t.co/OOqUbKz4Zh https://t.co/zT4FWcMnF6
2017-09-29,Yukon man charged with second degree murder in Carmacks homicide https://t.co/WFwC9VM3eT https://t.co/70T6q9XHFv
2017-09-29,Nunavut 'throat boxer' Nelson Tagoona to perform at Nuit Blanche Winnipeg https://t.co/xPS94QWc5w https://t.co/OJhlpq0wq6
2017-09-29,"Prosecutor says rage led to N.W.T. highway ramming, driver says it was unintentional https://t.co/oHj0g1sRWW https://t.co/2nVi8JyMi8"
2017-09-29,Accused in alleged Yukon axe attack says he was defending himself https://t.co/qrKPwYZbWS https://t.co/SwRq88mhUG
2017-09-29,"N.W.T government agrees to pay for quarter of new shelter in Hay River, if feds pay the rest https://t.co/UDJ7Sbg2cB https://t.co/kUQyeiDojC"
2017-09-29,"Straight-A student, aspiring Inuk doctor, from Rankin Inlet, Nunavut, wins $5K scholarship https://t.co/agajXPpdLO https://t.co/NgNQbLjeFS"
2017-09-29,"Nunavut MP Hunter Tootoo says feds should allocate funds based on need, not population size https://t.co/hIwxoXqbFQ https://t.co/SJHM2NxKUK"
2017-09-29,"Kugaaruk, Nunavut, man sentenced on child porn and related convictions https://t.co/H8DljPXzv2 https://t.co/ebrxCPP2EC"
2017-09-28,Iqaluit prison attacked from within as 4 inmates wreak overnight havoc https://t.co/RjMUoIuJcv https://t.co/iJ4eZLo475
2017-09-28,RCMP arrest Carmacks man in relation to June homocide https://t.co/aFdiHlt58k https://t.co/RMWRtEp4yb
2017-09-28,RCMP request more funding from Yukon government https://t.co/HpwB6sQBN3 https://t.co/nqd6aDvkgb
2017-09-28,Federal government begins to make good on 100-year-old promise to Treaty 8 First Nations https://t.co/u4EvHWW4Cg https://t.co/JF8u2DBPTT
2017-09-28,"Former MP, mayor, NTI president among declared candidates for Nunavut election https://t.co/mqtzF5Y61E https://t.co/4MZRomIQEO"
2017-09-28,Digital media skills served up at Inuvik Youth Centre  https://t.co/M5slOrdqcI https://t.co/mjoIMODlTf
2017-09-28,Digital media skills served up at Inuvik Youth Centre  https://t.co/M5slOrdqcI https://t.co/ZpnGsbPMBt
2017-09-28,"With midterm review looming, MLAs accuse ministers of dodging questions in N.W.T. legislature https://t.co/Gc20Jf2qJc https://t.co/sIL1Yi3GrU"
2017-09-28,"Yukon Indigenous icon, prolific artist take places on Main Street https://t.co/MjtUS9ZwSz https://t.co/IwH1sgLoDd"
2017-09-28,Organization in Nunavut looking for solutions to demand for affordable art and souvenirs https://t.co/ujccSLF8Q8 https://t.co/jMQIPfrFRi
2017-09-28,Court settlement pushes U.S. agency to decide if Pacific walrus is threatened species https://t.co/W4xQa47oR8 https://t.co/YSyo77Ux4n
2017-09-28,Yukoner heading to Winter Olympics as Team Canada athlete mentor https://t.co/WIsn3Q22EF https://t.co/NjevOdipNA
2017-09-27,City of Yellowknife to take over visitor services  https://t.co/na41S4EboJ https://t.co/BA4H85Ce29
2017-09-27,Yukon jury hears audio recording of alleged axe assault incident https://t.co/2VHAHPwUfU https://t.co/XipqtoCu5H
2017-09-27,"Indigenous people need 'culturally appropriate' health care, say Whitehorse conference delegates https://t.co/UhG8XGIXZm https://t.co/ZFe1feqDQn"
2017-09-27,Residential school's legacy of violence noted in sentencing of Fort Good Hope man https://t.co/HjtR1klIFB https://t.co/vdfNU4uEVb
2017-09-27,Inukshuk art at Toronto's Pearson airport angers some Inuit in Nunavut https://t.co/XoBKQfxKig https://t.co/E30G8DYVgz
2017-09-27,'Nobody else saw him': Yellowknife woman saves man dumped from garbage bin into truck  https://t.co/Up4G2Ichq6 https://t.co/3IRpO3AmeU
2017-09-27,$1K reward posted for information on suspicious fire at Tuktoyaktuk youth centre https://t.co/bclQ5y92TB https://t.co/68Wa0LIgmR
2017-09-27,Indigenous group targets U.S. Senators to oppose drilling in Arctic wildlife refuge https://t.co/lCN7Hee4Qr https://t.co/KdGptoAupn
2017-09-26,Researchers puzzle over why beluga whales in Alaska haven't recovered https://t.co/UjGLH539i5 https://t.co/TuhZCGtoOU
2017-09-26,'Closed' highway sign drives former N.W.T. politician to write fuming Facebook post https://t.co/i5qQJPP7jX https://t.co/y7rGk6Ko1D
2017-09-26,"RCMP assure Yukoners they 'have a handle' on violent crime cases, after latest homicide https://t.co/mqQPRHQTwF https://t.co/yFS3s4oqCu"
2017-09-26,"Preserve Indigenous residential schools as sites of conscience, MPs urged https://t.co/BSZi6FzHLF https://t.co/m31oU9uy4J"
2017-09-26,"Changes urged after weather delay leaves passengers, including newborn, sleeping in Nunavut airport https://t.co/3rhi1ibYbg https://t.co/KHtVf0g6TM"
2017-09-26,"Multiple landslides take out a log house, uproot trees near Reindeer Station, N.W.T.  https://t.co/xyZnnclz0n https://t.co/hyZIiXg1zY"
2017-09-26,Trial begins for Yukon man accused of axe attack on romantic rival  https://t.co/cH1N38tpoj https://t.co/ZKaBGfcCR1
2017-09-26,"Black bear, roaming wolf pack leave N.W.T. community on edge https://t.co/Jn27EJnlPQ https://t.co/rrMshXGVyd"
2017-09-26,Jamie Mikijuk's jail stay lengthened after Crown appeals original sentence https://t.co/D5Tv69F09a https://t.co/kKILun8KGt
2017-09-26,Iqaluit RCMP continue to investigate disappearance of Lucassie Etungat https://t.co/9yTpOCH0wo https://t.co/I3SgTY4aVY
2017-09-26,"Grieving Inukjuak father skeptical no one in village of 1,800 has information on daughter's homicide https://t.co/RiuU3lzkrQ https://t.co/ss5J4Sfh83"
2017-09-26,"Hop, skip and jump to it: Annual N.W.T. literacy week turns 'physical' https://t.co/CFPzNvHhEF https://t.co/PIhH4NHSGK"
2017-09-26,Yellowknife drug trial hits sudden snag after accused dumps lawyer https://t.co/khpFH4amJm https://t.co/x3DYW3LXNa
2017-09-26,"Tourism soars in N.W.T, setting new record for visits and spending https://t.co/jWYfFcaRDF https://t.co/zVkpkVGx9Y"
2017-09-25,'A big step forward': Cree women's shelter opens in Waswanipi https://t.co/5gmJ5PKSsN https://t.co/TOS17e2ZvT
2017-09-25,Inuvik wind farm part of latest N.W.T. plan to reduce greenhouse gas emissions https://t.co/eJA1fZTS49 https://t.co/Zm2VLbGSsj
2017-09-25,Planes designed for Alaska to take final flight https://t.co/NvGfv1ZID6 https://t.co/GKLadf25bf
2017-09-25,Many familiar faces in race as territorial election campaign kicks off in Nunavut https://t.co/5NIBkcocbM https://t.co/Cb521U7wNS
2017-09-25,Toasting to roasting: Inuit-owned coffee company teams up with Indigenous farmers in Peru https://t.co/4iOwMVjiFj https://t.co/TuHVKQU9HM
2017-09-25,"Northern air operators threatened by 'stupid' Transport Canada rules, says advocacy group https://t.co/HKmH0LUKEG https://t.co/qNW6RkZJmi"
2017-09-25,Former Baker Lake SAO who stuffed suitcases with stolen bingo money sentenced to 2 years https://t.co/EClcsefBbl https://t.co/Xl8tYVA6AJ
2017-09-24,"Your North: Best reader photos for the weeks of September 11, 18 https://t.co/4tI9coPDng https://t.co/74clI8LJwk"
2017-09-24,Yukoner off to Abu Dhabi for WorldSkills Competition https://t.co/4satc3uSLd https://t.co/NpCIC50GSY
2017-09-24,'We're sharing culture': Whitehorse's Elijah Smith School celebrates 25 years https://t.co/5T7Ezm7efm https://t.co/KFozoAasEO
2017-09-24,Gwich'in fiddler fulfills childhood dream as Air Canada pilot https://t.co/YR51AeVoTW https://t.co/lqXcThKdr9
2017-09-24,"Fall is here, but this Whitehorse man's garden is going strong. Here's why. https://t.co/IVfrwFssZX https://t.co/bMi6wK6VQ6"
2017-09-24,"History, science, and the 'Year of Two Winters': uncovering the secrets of Dene migration https://t.co/q5eeTxI10o https://t.co/K7b7X0sAi4"
2017-09-23,'It's very scary': Whitehorse residents rattled after fifth homicide in 2017 https://t.co/7b2MrR8w6P https://t.co/SHz9irH2Gg
2017-09-23,Whitehorse moms offer support to others raising 'quirky kids'  https://t.co/RnbOAmSpYs https://t.co/WyDhLN6R2y
2017-09-23,New fresh food delivery services in Nunavut seek to combat territory's high grocery prices https://t.co/mxFQ0AWuWZ https://t.co/G11LIkuTtE
2017-09-23,'Where kids can come express themselves': Yukon's Shakat Journal rises again https://t.co/j1qD9Wwg7A https://t.co/jrVnCFgpkp
2017-09-23,Inuvik students bag two moose as part of on-the-land program https://t.co/RR8Qn6AGzD https://t.co/05Nl9xW1kW
2017-09-23,High Arctic research lab once again on edge of funding precipice https://t.co/6tgWbbaS4c https://t.co/xqE9YP1GE0
2017-09-23,'I didn't realize I could have such a big impact': Katimavik focuses on reconciliation https://t.co/Zf3yD9D938 https://t.co/LIcLP0LtW6
2017-09-22,Alaska officials: Budget error could shut down ferry system https://t.co/vcTpC1tPhR https://t.co/2c2QCdqDoE
2017-09-22,"Can't stop dogs barking, says Yukon kennel owner being sued by neighbours https://t.co/vtID6Y1gOO https://t.co/uNRsKNJaRe"
2017-09-22,Nunavut RCMP make contact with fugitive David Mikkigak after nearly 3 months in hiding https://t.co/zDER1jQygq https://t.co/R2v9VMrSDs
2017-09-22,N.W.T. government outlines familiar game plan for 2nd half of term https://t.co/pEmcPT498o https://t.co/OA4BQbnPb6
2017-09-22,"Come talk to us about tax changes, Yukon businesses ask Bill Morneau https://t.co/QpBKK71mUs https://t.co/wYmgsYxUYX"
2017-09-22,'They were scared': Family of Whitehorse man shaken by Mexican earthquake https://t.co/jVR7AFSzX4 https://t.co/D5a7yy7FBz
2017-09-22,'Things haven't changed': NTI to fund Inuit training programs with federal lawsuit money https://t.co/1Oql3oIoXQ https://t.co/q65DeXplZs
2017-09-22,"In hiding for nearly 3 months, fugitive David Mikkigak reaches out by sat phone https://t.co/QCzEsznHT8 https://t.co/BozokPceK3"
2017-09-21,"Whitehorse shooting victim dead of injuries, police investigating as homicide https://t.co/XnsjyqB2fl https://t.co/5YbINGms8U"
2017-09-21,Last stop in Behchoko for N.W.T. gov't cannabis tour of the communities https://t.co/TEV9NTQ8LT https://t.co/FAziM5hXna
2017-09-21,N.W.T. Senator Nick Sibbeston resigns https://t.co/0itur4PdrD https://t.co/Zxe46ciozl
2017-09-21,Missing and murdered inquiry commissioners to review police conduct and 'investigate the investigations' https://t.co/5r8sL7bVaT https://t.co/9SxGmBfTf8
2017-09-21,New owners lay off employees at Alaska's largest newspaper https://t.co/qZ8yk4FRZq https://t.co/bIxDCQzk9B
2017-09-21,Yukon placer miners don't dig the idea of higher gold royalty rates https://t.co/bsWNId3SbL https://t.co/nLK6lRBpFM
2017-09-21,'He can make a major impact': Inuvik accidentally gets a local veterinarian https://t.co/JHKhSEDY5S https://t.co/dqhMAy6D3P
2017-09-21,Lynn Beyak removed from all Senate committees https://t.co/d5cMLssdkv https://t.co/6lF6pm6an9
2017-09-21,Traditional Indigenous food in a hospital? That's the plan for new N.W.T facility https://t.co/9RxqUtNH75 https://t.co/RuJd8fSFY8
2017-09-21,"Interviewing the homeless: Project aims to count Behchoko's needy, find solutions https://t.co/DX7RsfcuOx https://t.co/7JonBYl8mJ"
2017-09-21,Chicago museum gets 'cultural repatriation' award for returning Inuit remains to Labrador https://t.co/AOwsUn7s5a https://t.co/0DgyyrUaKf
2017-09-21,Yellowknife woman to husband with Alzheimer's: 'I'll remember for you' https://t.co/cK8jMWctgO https://t.co/Cb6TOYvwJe
2017-09-21,Iqaluit man thousands of dollars out of pocket after Hyundai warranty spat https://t.co/zZQ3ef1LNC https://t.co/ZYDJa2tQ8K
2017-09-21,"Iqaluit couple sues Nunastar for wrongful eviction, harassment and slander https://t.co/ztyRkQ3xE8 https://t.co/ehxetZ6p2C"
2017-09-21,Residential school runaway remembers harrowing journey that killed his two friends https://t.co/4EMzz1HKgC https://t.co/gJLwhgDQe0
2017-09-21,"'It's achieving a balance,' says newest of 4 female chiefs in 10 Quebec Cree communities https://t.co/M3GWI0Yaps https://t.co/mHvCRa1BAi"
2017-09-21,Man shot in Whitehorse: Police seek driver of red pickup truck https://t.co/PSRdJIqa38 https://t.co/kxDgpV9Upp
2017-09-21,Yukon communities getting ready to roll with legal pot https://t.co/Qcd3MK8PlY https://t.co/7s7bq7SuZL
2017-09-21,"Amid hotel room shortage, Yellowknife tourists sleep in tents and cars https://t.co/yu8iN6CCMQ https://t.co/srZycpW2Qz"
2017-09-20,Hundreds line up for hazardous waste drop-off in Whitehorse   https://t.co/5Ay1cGqyp4 https://t.co/RoXBDIae7R
2017-09-20,New post-secondary program puts Inuit youth in touch with their culture https://t.co/DopZLsL1Xe https://t.co/M70KlNnyeN
2017-09-20,Northern innovators championed at Startup Canada regional event https://t.co/PXNxVz3KSk https://t.co/6Q8t4Jgh4n
2017-09-20,Retired Mountie accused of smuggling narwhal tusks to be sentenced in U.S. https://t.co/71Iy1bIXkj https://t.co/nwAfWL5lkD
2017-09-20,Big load: Expect traffic delays as barge is hauled up highway to Hay River https://t.co/31nzjYBWfn https://t.co/8vpZnN3TVB
2017-09-20,Radio waves 'make the sky glow': Artificial aurora to be created over western Arctic https://t.co/omVavbSwDI https://t.co/5BabJxjEOF
2017-09-20,'Bound to have an impact on global climate': Arctic sea ice drops to 8th lowest summer level https://t.co/iXrgWLAzWC https://t.co/aySL6GXmgw
2017-09-20,Roger Warren granted full parole https://t.co/ZVlKEmS3Lz https://t.co/RFjgm7ZWBY
2017-09-19,Neighbours in court to shut down noisy Yukon kennel https://t.co/gg6fIMBYoM https://t.co/CcuR3cIBUB
2017-09-19,"Whitehorse needs more building lots, and fast, councillors say https://t.co/aRg1jTnxOO https://t.co/ZGyo57F7yP"
2017-09-19,"Mayor troubled by series of fires in Pangnirtung, Nunavut  https://t.co/kvxOJmp2aU https://t.co/8xQkPx5iUp"
2017-09-19,"16-year-old arrested after firing 11 shots into the air in Pangnirtung, Nunavut https://t.co/3neWxsoivR https://t.co/D0C4OMLDjB"
2017-09-19,"Yellowknifer finds her cool in Brrrlesque, takes to stage in Australia https://t.co/SLT9x8Kx94 https://t.co/ULtW41QnRM"
2017-09-19,Minister Carolyn Bennett urges Conservatives to kick Lynn Beyak out of caucus https://t.co/lGydUguV52 https://t.co/Nr3l0bVYMS
