created_at,text
2017-08-06,Yellowknife's Tree of Peace Friendship Centre wins national acclaim  https://t.co/lw97JhjXKx https://t.co/nejaK6P3t6
2017-08-06,New role model: Hay River woman elected national youth rep for Native Women's Association https://t.co/Db8m3M5bUb https://t.co/lfcBIoEFgw
2017-08-06,N.W.T.'s gyrfalcon featured on Canada Post stamp https://t.co/Azl9nbkElP https://t.co/nn6O9i7bRh
2017-08-05,"'Dad's being paranoid'? Not so much, kids: Yellowknifers happy latest arsenic data now available online https://t.co/RlOQH46GAV https://t.co/Bc938xubEj"
2017-08-05,Chilkoot Trail could see banner year for hikers https://t.co/fM9TOuDzS1 https://t.co/tTmbYmVleX
2017-08-05,'History in the making': New exhibit honours legacy of RCMP special constables in the North https://t.co/OHzO8Hmrbl https://t.co/JZ0sFhTF0z
2017-08-05,Team Nunavut wrestles big challenges on its way to the Canada Summer Games  https://t.co/TtZkG23B27 https://t.co/yHoMw3wDFp
2017-08-04,"Yellowknife, Whitehorse have more same-sex female couples per capita than any other city in Canada https://t.co/cH5JPuTdQd https://t.co/FGd4Su0knF"
2017-08-04,"Arsenic warning signs will go up at Yellowknife lakes after all, says health minister https://t.co/VO4CHu9bUw https://t.co/C1kUFTOpp1"
2017-08-04,Travelling to the Yukon made me feel like an international tourist https://t.co/PW7kAQ1WWc https://t.co/PJarKBxCmX
2017-08-04,"Ross River school structurally sound, says engineers' report https://t.co/fAtKAlmbxw https://t.co/QycN26U351"
2017-08-04,20-year-old Yellowknife man charged with assault on female victim https://t.co/DkNnMzP6jo https://t.co/48ZYgYxamF
2017-08-04,"No consultation, no build date for new Whitehorse running track https://t.co/yAFPEj2GRG https://t.co/IrA5VoVc28"
2017-08-04,Town hall on arsenic levels in Yellowknife lakes set for Friday night  https://t.co/ae6OOb0O5P https://t.co/TxWwo36BtX
2017-08-04,RCMP remove radio tower from sacred Dene site https://t.co/dPu5udV7iY https://t.co/KN2AFkAnq0
2017-08-04,"Though ownership still contested, Franklin artifacts go on display  https://t.co/JT9604BLoG https://t.co/KBaoR08uJt"
2017-08-04,Syncrude charged in deaths of 31 great blue herons at oilsands mine https://t.co/fUYSexCK50 https://t.co/G4Zeq7NxAx
2017-08-03,Nominees for Tlicho Grand Chief step forward https://t.co/oQIwlImZQQ https://t.co/mLji5SIyz8
2017-08-03,"No cops, no problem: Alaska town loses police, but not order https://t.co/aeBZa49nSM https://t.co/olWzmce1ng"
2017-08-03,Employee: camera discovered in Ekati washroom went missing shortly after it was found https://t.co/NXR9fcuHS6 https://t.co/3abkJt1Z64
2017-08-03,'Dream come true': Japanese bakery wins free lease in downtown Yellowknife https://t.co/BJ1giQSPqI https://t.co/Hk8YlvwlBg
2017-08-03,"RCMP 'greeted' by loaded gun at home in Pond Inlet, woman facing charges https://t.co/1CURsPoziI https://t.co/Ddk8IJrIn8"
2017-08-03,"Several areas of Whitehorse, Alaska Highway without power https://t.co/K7oqAUW7ci https://t.co/GbjTbHTZuX"
2017-08-03,"Man in Inukjuak, Quebec, dies after being struck by ATV, released from health centre https://t.co/A17Aj7j5De https://t.co/ObfHaLUxNy"
2017-08-03,Parvovirus outbreak in Inuvik kills 7 dogs https://t.co/lhsuDHVZrj https://t.co/gYOYyMcV0r
2017-08-03,N.W.T. gov't to test lease-to-own arrangement with 10 public housing renters https://t.co/CmPBcSWxYa https://t.co/VvBbYnWdWz
2017-08-03,"'These kids, they just light up': Players descend on Watson Lake for hockey camp with NHL players https://t.co/S47TPP9Kjv https://t.co/37SPYg0xB7"
2017-08-03,'This job is really important to us': At-risk teens building multi-use trail in Whitehorse https://t.co/8vEbO3g46C https://t.co/KHk4ARz3SU
2017-08-02,N.W.T. gov't challenges arbitrator's order to review its hiring of relief workers https://t.co/HVBosvn1dV https://t.co/g6xwwK8nMP
2017-08-02,Mom says child lucky to be alive after repeated misdiagnoses at Cape Dorset health centre https://t.co/QCAdvDombv https://t.co/uqMZW3n2us
2017-08-02,Disagreement on management of Yukon River Chinook fishery https://t.co/KxRX1iGgE1 https://t.co/4BaXTHF0T0
2017-08-02,Yellowknife taxi driver charged with assault on passenger https://t.co/G7HKufYDLR https://t.co/nV3az2Lbc2
2017-08-02,N.W.T. Supreme Court judge declares Noel Avadluk a dangerous offender https://t.co/OV50Iq4hcw https://t.co/OqbVBvMcNb
2017-08-02,Military developing new Arctic surveillance system https://t.co/nzRkfGpXH5 https://t.co/6BiFloypP8
2017-08-02,"6 bears killed in Yukon since Saturday by residents, conservation officers https://t.co/SIBpBkZquX https://t.co/tSSfrbiT3c"
2017-08-02,"Absence of malice: Jamie Takazo sentenced to 18 months for gun crime in Deline, N.W.T. https://t.co/SF3NdTwzlJ https://t.co/n4oSs3c6mV"
2017-08-02,Tlicho Grand Chief to be paid over $200K annually after salary increase https://t.co/Nk96t4R3Is https://t.co/ehC2NijtA1
2017-08-02,Gwich'in woman publishing guide to reconciliation for non-Indigenous Canadians https://t.co/ry8OVxAKm0 https://t.co/RbTXCrMxqD
2017-08-02,Residents of northern Quebec village worried that teenager's killer still hasn't been found https://t.co/JXq2S1882L https://t.co/fCYrCuWGZL
2017-08-02,High waters on Pelly River hamper salmon harvest https://t.co/j7o89yKK12 https://t.co/0lIppGeCCQ
2017-08-02,Bonanza for Yukon mining exploration as spending doubles https://t.co/5xpseOMSBW https://t.co/q11vEVCcwi
2017-08-02,No signs: N.W.T. health dept. spreading arsenic message online https://t.co/0dpiJEfwJK https://t.co/xsOyePo2Y1
2017-08-02,Assumed drunk: Inquest into Nunavut man's death recommends cultural training for RCMP https://t.co/E6M8CxQTMe https://t.co/S6exxG9Ejd
2017-08-01,Inuvik school will offer half-day junior kindergarten to soften impact on local daycare https://t.co/CLGA4UCzQl https://t.co/1eLH0ncU0q
2017-08-01,RCMP investigating after camera found in women's washroom at Ekati mine https://t.co/Iro4E1bzLw https://t.co/chczxqM8Km
2017-08-01,"Pat Bobinski, the N.W.T.'s 'Mr. Biathlon,' dies at 77 https://t.co/CUx531ID1H https://t.co/ZY7ZaXcnu7"
2017-08-01,Watson Lake food bank volunteers trained to administer life-saving overdose drug https://t.co/fE2tZGkrs8 https://t.co/KpksAwnlA5
2017-08-01,"2018 Arctic Winter Games on track, but facing volunteer, housing challenges https://t.co/cV63FFPOUJ https://t.co/zNkrXqEg1U"
2017-08-01,Alaska Highway convoy celebrates military history https://t.co/QyXqSuihMC https://t.co/nFgc7qXPnE
2017-08-01,"Follow the dots: N.W.T. issues health advisory, new map showing arsenic levels in Yellowknife lakes https://t.co/0q6NJluPTO https://t.co/3M06fg5kj9"
2017-08-01,"Polar bear at Assiniboine Park Zoo died from trauma, vet says https://t.co/W9leyrMFcB https://t.co/yzUC1sFNEH"
2017-08-01,Young mother of 3 identified as N.W.T. woman who died in Yukon crash  https://t.co/jFxw6FImPD https://t.co/jcIhBOLaj4
2017-08-01,Milk containers now refundable at Yukon recycling depots https://t.co/y9sHNZfeOe https://t.co/1Sl7FDPaKq
2017-08-01,Dawson art school gets bare minimum enrolment https://t.co/E17ghDLfgb https://t.co/isoRq7yEA1
2017-08-01,Qikiqtaaluk Corporation the buyer caught up in Hotel Arctic legal battle https://t.co/3rQpLHVbt1 https://t.co/zMafqIOg7K
2017-08-01,Regina woman shocked to discover lack of colour options for prostheses https://t.co/km35Hu13wv https://t.co/k51Ku98Cqp
2017-08-01,Local rivers possible solution for Iqaluit's imminent water shortage https://t.co/hn9HSgmeYn https://t.co/MKPjVJfhaz
2017-07-31,"RCMP, Yukon coroner investigating sudden death of man near Haines Junction https://t.co/2ADgwNpHqQ https://t.co/27ruTWqXQo"
2017-07-31,Census data on language shows tip of statistical iceberg about Canada's diversity https://t.co/2EKoQBIs3P https://t.co/iPoRcRputS
2017-07-31,'I got punched in the face': Charges pending against Yellowknife cab driver for alleged assault https://t.co/NhySTIBcrr https://t.co/hoeQNr9Lkb
2017-07-31,International scientists flock to Nunavut's cutting edge Arctic research station https://t.co/T8ZeBN5rBu https://t.co/PwjCir0pQb
2017-07-31,Black bear spotted in Yellowknife Sunday  https://t.co/aTID5gFXFE https://t.co/TN0neGchJV
2017-07-31,Lottery license? Food permit? No problem. Inuvik mom won't give up fundraising to finish university https://t.co/DbuYAER0Zk https://t.co/QBqSfXLlM4
2017-07-31,Sister of missing N.W.T. woman applauds MMIWG inquiry's decision to review police conduct https://t.co/XN8i7YXFSt https://t.co/3S06qlswM2
2017-07-31,Researchers unearth 'tectonic events' that formed Canadian sapphires https://t.co/4R5r7HRJTU https://t.co/fH2XyB6C3e
2017-07-31,"Nunavut gov't explores possibility of trauma, addictions treatment centre https://t.co/KGrJfIRPFB https://t.co/asi3cKhRlH"
2017-07-30,"'We're living out the vision of our elders': Teslin, Yukon, hosts cultural celebration https://t.co/AuzxP7vUUS https://t.co/ywnAQh9q6w"
2017-07-30,Your North: Best reader photos for the week of July 24 https://t.co/FiyW9obxSv https://t.co/C3j6IsD4Em
2017-07-30,"All in a day's work: Dene archaeologist following his dream, reconnecting with roots https://t.co/2ZsXpTXDzo https://t.co/N17SThVphH"
2017-07-29,'All the kids were super excited': Chinook salmon arrive at Whitehorse fish ladder  https://t.co/BRxHbVjwIG https://t.co/yRiEGujEv0
2017-07-29,Carolyn Bennett 'agrees with' MMIWG inquiry reset request https://t.co/1bW20T5S9U https://t.co/wRrKc2IzO4
2017-07-29,Ship sets record for earliest crossing of Northwest Passage https://t.co/PYfoE7rB9x https://t.co/WOhefYORq6
2017-07-29,"Crime severity, frequency drops in the N.W.T. in 2016 https://t.co/ULQjMXe7GI https://t.co/YhOvcKeLHW"
2017-07-29,"220,000 kilometres later, world traveller fulfils dream to see Great Slave Lake https://t.co/4zb9WKjWdh https://t.co/Hcp7nAQPXO"
2017-07-29,From 'Chopsticks' to 'Heart and Soul': first public piano unveiled in Whitehorse https://t.co/CUFT698Xep https://t.co/HkupO8M5de
2017-07-29,"N.W.T. woman dead, 2 injured after car accident near Pelly Crossing, Yukon https://t.co/n4S8E9WVv8 https://t.co/bf8HQZYFYo"
2017-07-29,"Yukon sends more fire crews, equipment to B.C. https://t.co/djE6Qx7FY4 https://t.co/5OzbDfzwRd"
2017-07-29,Jail time for Yellowknife artist convicted of physical and sexual assault  https://t.co/0HgxBbIww4 https://t.co/rztE6uZVt3
2017-07-29,Provisions of Inuit Language Protection Act now in force across Nunavut https://t.co/ducbMvrxvE https://t.co/RW3rvgrUtk
2017-07-28,Gather round the campfire: Yellowknife fire ban lifted https://t.co/jm7jo0L1n1 https://t.co/AGAhgNPQSl
2017-07-28,Grizzly killed after breaking into kitchens in Alaska town https://t.co/RhtZ8sjsxQ https://t.co/P3kjTQox19
2017-07-28,"RCMP charge Jeffrey Killiktee following standoff in Pond Inlet, Nunavut https://t.co/SlhqRgKVYh https://t.co/bH8hCfLumu"
2017-07-28,"The AFN meetings are over, now where does the work begin? https://t.co/gQaINpdvLw https://t.co/IEmQVIHvPw"
2017-07-28,'Reclaiming what is ours:' 1st Vancouver Indigenous Fashion Week instils pride https://t.co/inw7frL9Q4 https://t.co/VztxDK933W
2017-07-28,"N.W.T. releases first carbon tax estimates, asks public for input https://t.co/Fc0enkeCxQ https://t.co/BvWRa9yLHl"
2017-07-28,Federal gov't announces plan to protect caribou after legal action taken https://t.co/a1BPFG76sT https://t.co/4gvnXgPfzp
2017-07-28,Assembly of First Nations vote a relief for Yukon Aboriginal Women's Council https://t.co/KOGghRt1wh https://t.co/zTG8t7y8Kz
2017-07-28,"Youth crime frequency and severity drops across the North, especially in the N.W.T. https://t.co/3NLxrvDk2S https://t.co/33ueWWw96s"
2017-07-28,"Mars researchers return to Devon Island, Nunavut, for 'twin mission' with Utah https://t.co/oUmQfFvZoW https://t.co/3djcUZfHlH"
2017-07-28,"Ready, set, go: New Iqaluit airport terminal expected to open Aug. 9 https://t.co/5wzUudjAbd https://t.co/uUIOr2GNiV"
2017-07-28,Yukon looks south to Alaska for redundant fibre optic line https://t.co/HyXRNT75y4 https://t.co/j0GlzLpjJt
2017-07-28,Street piano project hits #Whitehorse tomorrow. See it live on the CBC Yukon Facebook page at noon when the first piano is unveiled. https://t.co/g9sgkHLhkf
2017-07-27,"Canoeists rescued from Pelly River near Faro, Yukon https://t.co/KMQtqZRH9k https://t.co/OMrK1lq5UT"
2017-07-27,"Owners of Whitehorse taxi companies, pawn shops may soon need criminal record checks https://t.co/YcTVhPEUnZ https://t.co/0NwILrgmgq"
2017-07-27,MMIWG inquiry now reviewing conduct of police officers https://t.co/Oz0eTZYEo6 https://t.co/6mPPGaUmUb
2017-07-27,"B.C. wildfires, evacuations don't stop Yellowknife couple from welcoming 1st child https://t.co/UWwPIH2rfP https://t.co/EEvre36zOn"
2017-07-27,Polar bears in Finland frolic in donated load of snow https://t.co/mpW4faSwn3 https://t.co/89YNrE3Qdr
2017-07-27,Federal authorities to announce charges in cruise ship death off Alaska https://t.co/a0O6DuBhqq https://t.co/ztW6dYpwo3
2017-07-27,Chiefs set to debate call for MMIWG commissioners to step down https://t.co/MYyt5tkk9j https://t.co/Idlsgzemp7
2017-07-27,"Whitehorse totem pole lacks signage, leaves people with 'questions that should be answered' https://t.co/C2V0MsE6rN https://t.co/Qbmcy1yrSp"
2017-07-27,Couple stranded at cabin in Yukon for three weeks rescued by RCMP https://t.co/JNS61c3aQR https://t.co/3I7l40k1ot
2017-07-27,Inuit leaders applaud landmark Supreme Court ruling https://t.co/BJVXa6uaav https://t.co/M2rquaHeog
2017-07-27,Nunavut gov't looks to expand Iqaluit's fuel farm as gas sales approach storage capacity https://t.co/tPOIvotiqv https://t.co/T0WN30omAY
2017-07-27,"Indigenous, non-Indigenous wage gap in the North up to 3 times national average: Conference Board of Canada https://t.co/ppIxZSKM7t https://t.co/PIxTwgLCVQ"
2017-07-26,FBI investigating death on cruise ship off coast of Alaska https://t.co/OBsUjBgeAD https://t.co/jekXNLGgGU
2017-07-26,"Sanikiluaq, Nunavut, gets a boys hockey team after almost 50 sets of equipment donated https://t.co/knSP35r7Wa https://t.co/X6tGBU4C1f"
2017-07-26,Get in line: Dawson City streets 'bustling' with tourists https://t.co/LbDJeC7afn https://t.co/ZpIvC6YHEh
2017-07-26,Orca attacks fishing boat off Alaskan coast https://t.co/VRUEDxQHGP https://t.co/DPnYJqJRbs
2017-07-26,Air Canada to add daily direct Yellowknife-Vancouver flights in December https://t.co/hWIaziGwNK https://t.co/STOgAPFh2K
2017-07-26,'It's Louisa's cabin': Yellowknife family shocked after memorial ransacked  https://t.co/SZvhxBIagN https://t.co/R9LC0QKsco
2017-07-26,Supreme Court quashes plans for seismic testing in Nunavut https://t.co/4M3EbTUkfM https://t.co/kkqdOh0879
2017-07-26,RCMP ask Pond Inlet residents for help finding Jeffrey Killiktee https://t.co/eVunXtgqZP https://t.co/wlzSuikiql
2017-07-26,"Haines Junction, Yukon looks at reducing minimum home size https://t.co/9OopWOnu09 https://t.co/0GD64ztk0j"
2017-07-26,Electric bear fence allows tenters to return to Yukon campground https://t.co/gVQsw44nZg https://t.co/b8wfiA38T6
2017-07-26,"Pot charges continue downward trend in N.W.T., Nunavut, stay the same in Yukon https://t.co/dhIYeFxmEE https://t.co/9zEcnKxskk"
2017-07-26,Same-day mental health services now available in N.W.T.'s Beaufort Delta region https://t.co/1HreQvikcQ https://t.co/Jt84rm9ouo
2017-07-26,"Ducks Unlimited, First Nations and Metis partner to study N.W.T. Boreal forest https://t.co/oGosBVItD0 https://t.co/hrJnFOvCfk"
2017-07-25,Yukon duo burst into first place at fireworks competition https://t.co/A5SYui3CQx https://t.co/x4lUDy5sST
2017-07-25,"Antoine Michel, Lutselk'e elder and former chief, dead at 64 https://t.co/rufZDNShaX https://t.co/KmpHZGzff7"
2017-07-25,Supreme Court to issue landmark rulings on Indigenous relationship with energy sector https://t.co/2hHpAx6bcI https://t.co/XiIaVBScaF
2017-07-25,Changes to N.W.T. lands acts could be bad news for squatters https://t.co/qf7ZLXrOvp https://t.co/XGG2HGhuDG
2017-07-25,Yukon study to look at impacts of climate change on river flow and energy generation https://t.co/mhMe4kzHup https://t.co/CKt7aZcHS8
2017-07-25,Boat captain leaps into sea to save crew after capsizing off Alaska Coast https://t.co/FroVWBNkBy https://t.co/pVjmy2TsTt
2017-07-25,"13,000 litres of chemical spilled at Cambridge Bay airport https://t.co/HR7U1zCxO9 https://t.co/DTXl07sfZA"
2017-07-25,Abel Bosum new Grand Chief of Quebec Cree https://t.co/CIfNWTRekA https://t.co/jDrN9BrlVH
2017-07-25,Montreal boarding home for Nunavik medical patients over capacity since opening https://t.co/t9qFimkllc https://t.co/ovGFcoRSIp
2017-07-25,Whitehorse awards operations building contract to local company https://t.co/Fw73V5H0sS https://t.co/xrMvpKfyka
2017-07-25,Getting stuck in the icy Arctic means you're on your own https://t.co/zVnpGDoOrp https://t.co/ThLweLMGHP
2017-07-25,"'Shift in behaviour' needed in Yukon to avoid bears being killed, says wildlife group https://t.co/7QKbCzhS1g https://t.co/o2eNGgXvFc"
2017-07-25,Mother seeks apology from First Air after eventful flight leads to RCMP call https://t.co/tGUkp632oW https://t.co/5h8Me76eGP
2017-07-25,'It feels good': Mural in Whitehorse will honour 2 homicide victims  https://t.co/iPW9T8INFg https://t.co/cGdb93m3XZ
2017-07-25,RCMP detain senior in Hay River selling legal cannabis oil at town market https://t.co/PEF2iMirdr https://t.co/Vyntsk3EHv
2017-07-25,"Gov't of Nunavut coerced employee by withholding sick leave benefits, privacy commissioner says https://t.co/L8fmMGfaTu https://t.co/hvYj9hF494"
2017-07-25,"Judge says Deline, N.W.T., man who enticed police to kill him last January a 'struggling human being' https://t.co/co98JArQgu https://t.co/je8Bb1w4Pc"
2017-07-24,"Float plane capsizing was like 'slow motion,' says N.W.T. pilot https://t.co/kx5EcNOhua https://t.co/651aIxNOWd"
2017-07-24,Hazardous material from 1960s finally getting cleaned up near Sylvia Grinnell park in Iqaluit  https://t.co/4HRk7maKaK https://t.co/CDo4ozV6gV
2017-07-24,"Sleepy Yellowknifers say emergency sirens keeping them up at night, ask for change https://t.co/yxzzRTvcxf https://t.co/uqNM5FNL7a"
2017-07-24,"2 homeless youth housed in Yellowknife, thanks to housing first program https://t.co/FY7P2Huq1Z https://t.co/WdFbQVl86w"
2017-07-24,Beloved honourary cat mayor in small Alaska town dies at 20 https://t.co/ldFrSRzVhA https://t.co/k8BCLezsJP
2017-07-24,"Police investigate murder of young woman in Inukjuak, Quebec  https://t.co/Kpn4zYY7QA https://t.co/FzKOTJYfla"
2017-07-24,"'An apology after death is no apology at all,' says lawyer for N.L. residential school survivors https://t.co/8zF9bheCTQ https://t.co/MLdGG4tkrn"
2017-07-24,Canada wasn't — and isn't — ready for an Indigenous governor general https://t.co/cPcCtJ1e2u https://t.co/NaAhmYCUvK
2017-07-23,Indigenous children are dying while Ottawa fights a ruling that calls for action https://t.co/LdHZS95xoz https://t.co/eoEDoj1eHF
2017-07-23,"Ottawa police investigate death of man in Arviat, Nunavut, who may have died in police custody  https://t.co/1Bv6YIPZ3C https://t.co/WiehNDvmic"
2017-07-23,A look back at Northern stories from the Indigenous Games  https://t.co/XSc0Kd5D4U https://t.co/GTmG0bpBcQ
2017-07-23,Your North: Best reader photos for the week of July 17 https://t.co/eJ7qV4SC6I https://t.co/PBwLcWzYSu
2017-07-23,"'Just exercise some caution': 10 tips for avoiding, or staying safe in, stormy waters https://t.co/TFUWlNOY68 https://t.co/aQ5g6EiqnC"
2017-07-23,'Last fur trader' reconnects with northerners nearly 70 years after his first trip to the Arctic  https://t.co/7m4qNBFkdF https://t.co/V4oA19CM1z
2017-07-22,"North American Indigenous Games, in pictures https://t.co/I9enb2QFwg https://t.co/Uko7NxkkpJ"
2017-07-22,Indigenous Games leaves lasting impact on all who participated https://t.co/bwlV6lnMKC https://t.co/GaZvddfGDb
2017-07-22,Hummingbird moths spotted in Yellowknife gardens https://t.co/NSN1uMy0rC https://t.co/kVBpdDWZWU
2017-07-21,Nunavut Judge orders inmate who attacked two jail guards to see a psychiatrist https://t.co/Z0rRWxwvLy https://t.co/BfBNkRdBIA
2017-07-21,"Dusty, noisy days and nights for people in Yellowknife's Lakeshore Developments https://t.co/2PL3uWVMPW https://t.co/ip8QbjboMO"
2017-07-21,Medals stack up for Yukon swimmers at 2017 North American Indigenous Games https://t.co/JRPMHgQ6SH https://t.co/oMfSn1yDZh
2017-07-21,"Smoke visible on the horizon in Whitehorse, fire now out https://t.co/g2IKhQRdEY https://t.co/TOJlW3Xjlk"
2017-07-21,Canada child benefit not being collected by many Indigenous families https://t.co/8KDzg88f96 https://t.co/4kDzFvkoAB
2017-07-21,"'We don't talk about it enough,' says Fort Resolution wellness worker after 2 suicide attempts https://t.co/SwGiDoqeCJ https://t.co/Hdp2lN8l71"
2017-07-21,Food for thought: Northerners asked to inform national food policy https://t.co/j1LXfE4Jt4 https://t.co/u63ZksNWlY
2017-07-21,"Hammock used by autistic child stolen in Yellowknife, but online response restores faith in community https://t.co/1hFFoxE615 https://t.co/y5BNwqVr1a"
2017-07-21,Mining properties in Yukon's White Gold district changing hands https://t.co/fYrsryj3lj https://t.co/UEMXYI1OL2
2017-07-21,Father of Yellowknife teen at centre of coroner's report offers support for parents navigating health system https://t.co/YAIPT3lkP9 https://t.co/DDsem50gCy
2017-07-21,"Nunavut boy uses Children's Wish to fly grandparents 3,400 km for a visit https://t.co/MVQYY1U149 https://t.co/9qJi8IQTG1"
2017-07-21,It's gold on the green for Yellowknife's Deanne Whenham at the 2017 North American Indigenous Games https://t.co/cvOLr3xSXA https://t.co/GNrF6ohyPi
2017-07-20,"Nunavut inmate who attacked 2 prison guards with breakfast tray, hot jug of tea, pleads guilty https://t.co/kgbNq3mOdR https://t.co/OxRi5UtBPK"
2017-07-20,More medal action for @TeamYukonNAIG at #naig2017! https://t.co/Ds58bQSVGE
2017-07-20,Real magic at #naig2017 https://t.co/JtdsKfRwGK
2017-07-20,Toy gun arrest prompts warning about fake firearms from Iqaluit RCMP https://t.co/eyYjB1ZCdX https://t.co/g4EUylDbJV
2017-07-20,Big win for Yellowknifer Deanne Whenham at #NAIG2017! https://t.co/Tf8UvNaNBt
2017-07-20,"3 rescued after 2 float planes crash on the same day near Lutselk'e, N.W.T. https://t.co/KX3PcAOntv https://t.co/W2J6uUSVZ2"
2017-07-20,Together since Grade 6: Team N.W.T.'s '3 amigos' to play last volleyball games at Indigenous Games https://t.co/fmTSP9j1vk https://t.co/KDBWYrL12W
2017-07-20,De Beers to offload $30M in Snap Lake assets at 'massive' Yellowknife auction https://t.co/mzvGz9YpU1 https://t.co/RBuSVbteae
2017-07-20,Government pot survey sparks record response in N.W.T. https://t.co/gzPTRJGEc4 https://t.co/NV5lUFuJTz
2017-07-20,Follow @garretthinchey for the latest from our north athletes at #NAIG2017 in Toronto! https://t.co/RsXUcHsDu6
2017-07-20,MMIWG community hearing in Rankin Inlet delayed 1 week https://t.co/MsEfbH2h0R https://t.co/Om5NoWVtpc
2017-07-20,'You know you're helping': Yukon gets first 24/7 daycare  https://t.co/FrL4rWbmdQ https://t.co/ke80y3RaMs
2017-07-20,N.W.T. First Nation files lawsuit alleging business partner treated venture as 'personal fiefdom'  https://t.co/I6GqtKHNTh https://t.co/5EDm7IlwD6
2017-07-20,"Young Yellowknife man did not appear to be receiving the care he needed when he died, says N.W.T. coroner   https://t.co/t583Gtfu3J https://t.co/SIiXhEDa8i"
2017-07-19,Team Nunavut dominating in badminton at the North American Indigenous Games https://t.co/ivaEMwvK8S https://t.co/YXxvaBiCPX
2017-07-19,Once-rejected gold mine in Kitikmeot gets go-ahead from Nunavut review board https://t.co/XHBhEmzIQ6 https://t.co/bVBsnXQcaB
2017-07-19,Yukon sending fire equipment to help fight B.C. wildfires https://t.co/CTIoKbTxXm https://t.co/01VExRg1ss
2017-07-19,"'Imperative' that axed court workers return to Watson Lake, says chief  https://t.co/miSqMS0ufT https://t.co/RaS3v7Q7IK"
2017-07-19,Follow @garretthinchey for the latest from @TeamNunavut at #NAIG2017! https://t.co/win7kGrmP3
2017-07-19,FOXY co-founder awarded prestigious international fellowship https://t.co/GORj34DgqK https://t.co/zI3OytB9gi
2017-07-19,Whitehorse residents overwhelmingly agree: Whitehorse is a great place to live https://t.co/j4CbqWlbij https://t.co/HQbP0Ab8q7
2017-07-19,'I'm sorry': Kugluktuk sex offender apologizes ahead of dangerous offender decision https://t.co/418K33xvXG https://t.co/cNFPmaFVf3
2017-07-18,Changes to N.W.T. child benefit program mean more money for families https://t.co/bNdnXJdtzd https://t.co/x71HfcIFyR
2017-07-18,"'Reconciliation in action': Quebec Cree leaders sign governance, funding agreement with Ottawa https://t.co/tOweEBN7GT https://t.co/f2jggyGx5o"
2017-07-18,Canoeists take first medals for Team N.W.T. at the North American Indigenous Games https://t.co/T8iJnMt22H https://t.co/JTmlttJANt
2017-07-18,N.W.T. judge overturns custom adoption after father files lawsuit https://t.co/3fJ5z6dhey https://t.co/48CQtbCiPX
2017-07-18,'I'm going to lay it all out there for her' https://t.co/OpvGlKc48N
2017-07-18,"Team NWT's first GOLD medal just came in Kaiden McDonald from Inuvik and Davina McLeod from Aklavik in the 3,000-metre tandem canoe race. https://t.co/PupAEJpn2U"
2017-07-18,"Doctor's notes to cost $23 across the N.W.T., according to new fee structure https://t.co/io6Nr4r5K6 https://t.co/VORsNJ9cfq"
2017-07-18,"More flights, more lineups at Whitehorse airport https://t.co/JG7nPsTknr https://t.co/rpDY9bXHrI"
2017-07-18,Out of town fire crews pull out of Fort Good Hope as danger subsides https://t.co/NOvFXzQYYx https://t.co/DhVAfrcbxd
2017-07-18,Yellowknife RCMP seek help finding missing youth from Alberta https://t.co/rSVZHOdw28 https://t.co/Ub8Sj0BiOw
2017-07-18,Arrest made in Iqaluit after carvings stolen from grieving widow's home https://t.co/THJjf9ao62 https://t.co/RrBZrFtyC0
2017-07-18,Immersive language program coming to Champagne and Aishihik First Nations in Yukon https://t.co/gGCZvUdhuJ https://t.co/tSy6I8r8r2
