created_at,text
2017-06-02,Survivors of crime honoured by Native Women's Association of the NWT https://t.co/epbjeuavGS https://t.co/y73BqkkvyH
2017-06-02,Nunavut's infrastructure spending split to avoid delays from October election https://t.co/hlqatFBZ5p https://t.co/dh6BCSAwvN
2017-06-02,Missing and murdered inquiry wraps emotional 1st hearings in Whitehorse https://t.co/Bb3wql4pqX https://t.co/52xmosbuUc
2017-06-02,Alberta launches Indigenous environment advisory panel  https://t.co/bT9Du69p4T https://t.co/meWmuJRKR0
2017-06-02,Flight over Fort Liard: Canadian Arctic Aviation Tour takes off https://t.co/hN2MaF3ts5 https://t.co/plHXMZ0jzp
2017-06-02,"Nunavik beluga hunt quota gets bump, but it's complicated https://t.co/uPN6M41Mpe https://t.co/7UYncErXdJ"
2017-06-02,"School buses are too crowded, say Iqaluit parents https://t.co/GOc2IAVxAh https://t.co/QqlOAA7jg1"
2017-06-02,Yellowknife teacher honoured with N.W.T. Education Hall of Fame induction https://t.co/KkspL5xJ3B https://t.co/OPx7YZorLU
2017-06-01,Asbestos blamed for growing cost to demolish old Whitehorse high school https://t.co/CngJAlJQwV https://t.co/J1PbaBdolQ
2017-06-01,"Drugs, cash and weapons: Yellowknife RCMP charge 6 following 2 week investigation https://t.co/g2HjeUIRMZ https://t.co/qTZi0sJdCD"
2017-06-01,'Please give us closure': A family's emotional plea to the MMIWG Inquiry https://t.co/jlJPUrzCTU https://t.co/OQ8Cp2O1ah
2017-06-01,Who pays for cost of growth? Iqaluit mayor says 'we're in trouble' https://t.co/Nb0Ze3aDz8 https://t.co/HbgRQSiGBe
2017-06-01,"Fewer seasonal workers are knocking on doors in Dawson this year, say businesses https://t.co/eIPFNm1IrQ https://t.co/DrLNcP8FEh"
2017-06-01,"Boater gets stuck in ice blocks on Mackenzie River, uses 2x4s to signal help https://t.co/HxCsi7MsuX https://t.co/sfEJ7bnW1T"
2017-06-01,Canadians asked to weigh in on food policy https://t.co/s6iHbel7kD https://t.co/zgba9TzN0J
2017-06-01,"As weather extremes become the norm, taxpayers must foot the bill for climate chaos: Don Pittis https://t.co/XHW6yc58Rn"
2017-06-01,Yesterday at the #MMIWG inquiry in #Whitehorse. https://t.co/ugrDD5g7sv
2017-06-01,N.W.T. gov't on track to reduce school hours this fall https://t.co/Ygt4cyUuFP https://t.co/8Toog7PJ7D
2017-06-01,Let the Nunavut gov't know how it should legalize marijuana https://t.co/oNjOYhuDhd https://t.co/o6nACOBF1x
2017-06-01,School on a river: N.W.T.'s 'bush university' offers credits for paddling down Peel River https://t.co/hkrNiWibwH https://t.co/eyKa3T2xx9
2017-06-01,'Sense of community' can help Yukoners prevent opiate addiction https://t.co/3BujAk3jkT https://t.co/ROLouOEG8l
2017-06-01,"Mom crosses Canada to say goodbye to daughter who died in Windsor, Ont. jail https://t.co/GfOjDtL1e8 https://t.co/JGjMSdoWFe"
2017-06-01,"As more families share, themes, patterns emerging in 1st MMIWG public hearings https://t.co/jy5K3dQ6XX https://t.co/vOreJjzpij"
2017-05-31,"Overdue traveller spotted in Lower Post, B.C. https://t.co/mw5rffvDry https://t.co/PEJh58WOuP"
2017-05-31,Dehcho First Nations to decide if GNWT to be part of land claim negotiations https://t.co/ddOk3SkghZ https://t.co/EpN9GeoEqg
2017-05-31,"'Gobsmacked': Marley the Whitehorse pooch dognapped from front yard, social media helps find her https://t.co/1Tw1o4Xt2Y https://t.co/etLllKI02F"
2017-05-31,It's a new day for N.W.T. men's domestic violence reduction program https://t.co/kfegUliSzN https://t.co/BEiDyQC5dB
2017-05-31,"Dropping water level on Kluane Lake causing problems, MLA says https://t.co/lBVqExyJLt https://t.co/JkZKwG4Ptx"
2017-05-31,"Missing boater rescued from Mackenzie River near Inuvik, N.W.T. https://t.co/pSYRpUejou https://t.co/enT4aCT05J"
2017-05-31,6 N.W.T. residents receive highest honour in territory https://t.co/9hljPil8T6 https://t.co/rBEMOFC6gH
2017-05-31,'We're going to need more time': MMIWG inquiry promises more Yukon hearings https://t.co/dNRDdMtpfy https://t.co/OJklZuP1eY
2017-05-31,"Young Inuvik, N.W.T., mom to graduate high school 5 years after dropping out https://t.co/LixKd4xlum https://t.co/3akn1DxuDT"
2017-05-31,Community works with elders to learn traditional remedies to fight cancer https://t.co/JWeFuJqNqw https://t.co/m3nyizkW2t
2017-05-31,"'Very, very serious situation': In northern Labrador, it's getting harder to find food https://t.co/cZnAi6pvDx https://t.co/MoX1GWPB8C"
2017-05-31,Who is responsible? MLA concerned N.W.T. taxpayers will get stuck with mine cleanup bills https://t.co/NPCGxzvi5g https://t.co/HAJFpbqWRT
2017-05-31,"Nunavut francophones hesitant to ask for help with mental health matters, report says https://t.co/cPelz1Eekf https://t.co/xUh2MIN95i"
2017-05-31,"Indigenous culture not protected in Canadian law, lawyers and academics say https://t.co/us5eSbrc1K https://t.co/uWaFDn1o0O"
2017-05-31,Some fear outcome inevitable as 2nd round of Sabina gold mine hearings get underway in Cambridge Bay https://t.co/WJoXcIDSeN https://t.co/xw9z7Qqy9T
2017-05-31,Iqaluit school board looks for options in face of potential overcrowding https://t.co/Hl1DWZS9bZ https://t.co/t9a7A5xIv3
2017-05-31,Pine Point rail bed survey seeks to profile current land use https://t.co/yKtGrxh4sf https://t.co/gLB3aCKKaR
2017-05-30,Yukon RCMP seek help in locating overdue traveller https://t.co/KEdMfVLoCh https://t.co/EuYSXlg7g8
2017-05-30,Whitehorse resident describes weekend crash https://t.co/1PXyrU4nV7 https://t.co/SLZI5VC18B
2017-05-30,"New fire burns northeast of Watson Lake, Yukon's lightning season begins https://t.co/6YFgXp35GQ https://t.co/fyeMxyrAip"
2017-05-30,Sex charges against ex-RCMP officer Lauren McKiel withdrawn https://t.co/vdJMEISYVf https://t.co/cPUxAXnAnm
2017-05-30,Lessons learned: N.W.T. gov't acts on Namushka fire report recommendations https://t.co/vVVpUVIGm0 https://t.co/x005IQTdP5
2017-05-30,"Injured climber airlifted from Mount Logan, Yukon https://t.co/PF9PUIcfFq https://t.co/xwuiNvHpaj"
2017-05-30,Messages of hope adorn quilts for MMIWG inquiry in Whitehorse https://t.co/KHCv0qh9w3 https://t.co/E5As6v70vq
2017-05-30,Revamped men's healing program draws criticism from advocates  https://t.co/WH1sFcYETG https://t.co/eBN84KRQzH
2017-05-30,"'From our side, no': Bill 37 not on agenda for spring sitting of Nunavut Legislature https://t.co/eIT7zBYU7C https://t.co/4oUusS2AqN"
2017-05-30,Yukon education minister explains cuts to educational assistant positions https://t.co/8VF9GuldHS https://t.co/G8bE90vDSp
2017-05-30,Trudeau asks Pope for an apology over church's role in residential schools https://t.co/XFyE53pOfQ https://t.co/mSRDDCjgAR
2017-05-29,'Open the books': Investigative society challenges Sahtu Secretariat https://t.co/kQPZ8w5zRY https://t.co/rLzi2zCTSp
2017-05-29,"Yukon gov't still weighing options for Ross River school, in need of repairs https://t.co/JAx4LvKByZ https://t.co/2gAS8EeAkM"
2017-05-29,1 man dead after Alaska Highway collision in Whitehorse https://t.co/IcCfUeeTL7 https://t.co/zcMMcc7Ewf
2017-05-29,"Weekend fires in Chisasibi and Waskaganish, Que. prompt fire safety warnings  https://t.co/mLjNt8w08L https://t.co/f8Q22XRd5n"
2017-05-29,"Man charged after firing a gun inside Igloolik home, and pointing weapon at police https://t.co/Z8bmIJHloE https://t.co/X4rCYTnB0r"
2017-05-29,"'What we need is a job': Behchoko residents talk jobs, homelessness ahead of Tlicho elections  https://t.co/tCaDnYQYbo https://t.co/gcfQ4B0V3k"
2017-05-29,First public hearings for MMIW Inquiry to begin in Whitehorse https://t.co/f9BhEUhDkX https://t.co/iBj5q8qwbd
2017-05-29,Fire in Rankin Inlet sixplex under control  https://t.co/EhRr1DvxTe https://t.co/PXCTQbfGtB
2017-05-29,Yukon firefighters battle wildfire northwest of Haines Junction https://t.co/Rm8p2GTutP https://t.co/G0awKxkpzc
2017-05-29,"U.S. federal officials in Alaska investigate 2 plane crashes, 4 dead  https://t.co/Lr1LW7Obc5 https://t.co/CpGFkwUyoJ"
2017-05-29,"Aurora College gets nearly $10.6M for new facility, campus solar power project https://t.co/ruooonjZ7B https://t.co/2kLQv3J3ql"
2017-05-29,"Yukon to cut educational assistants, teachers' union says https://t.co/rVM2jGPfjJ https://t.co/rmYU0eWP6X"
2017-05-29,Nunavut girls home set to reopen after 8-month closure https://t.co/9EkRO79puh https://t.co/7WCSruRJkF
2017-05-29,Nunavut considers reforming investigations into RCMP-involved death or misconduct https://t.co/ZpeoUmTzSS https://t.co/rr6NCCeMBg
2017-05-29,"Destroy 'highly personal' residential school records, NTI says  https://t.co/9BSNbXNh9G https://t.co/lbIA5RnLP3"
2017-05-28,Andrew Scheer's unlikely path to victory: Social conservatives and Quebec https://t.co/FcVoCuMMpi https://t.co/On0nmzZAk0
2017-05-28,Round 3: NDP leadership debate brings 2 new candidates to the fray https://t.co/Jf1FUORFqf https://t.co/3SEUax9ew6
2017-05-28,'I was in shock:' experienced bear hunter jumped by bruin https://t.co/uQeRLLtKZI https://t.co/xZmAtyYH9F
2017-05-28,Your North: Best reader photos for the week of May 22  https://t.co/raTPO2lXCF https://t.co/rDJ4Ulf1No
2017-05-28,"Congrats to our talented writers, reporters and producers! | CBC North takes home 4 RTDNA national awards  https://t.co/AW9nWg95kq"
2017-05-28,Artist wants residential school stories saved for future generations https://t.co/26uXB7W5VD https://t.co/RbflcmxX1E
2017-05-28,CBC North takes home 4 RTDNA national awards  https://t.co/nN1v9C5A4O https://t.co/cVgmuphKIq
2017-05-28,Andrew Scheer elected new Conservative leader https://t.co/0C4NmHRQJb https://t.co/4IhOtyvlgh
2017-05-28,'One proud mom': Mother and son share graduation memories 18 years apart https://t.co/fgwoVO3pkq https://t.co/zWI9LSiqZ6
2017-05-28,Iqaluit air cadet heads Down Under on international exchange https://t.co/nSliHeViZ8 https://t.co/rdkTYRp7lm
2017-05-27,'We just went for it': Yukon's Dakhká Khwáan Dancers celebrate 10 years https://t.co/wJGTwPQBdG https://t.co/etL6C2RxF7
2017-05-27,"RCMP recover body from Yukon River, foul play not suspected  https://t.co/eBkEc6kEHU https://t.co/cVLwQmAEY1"
2017-05-27,More flour products added to growing list of national flour recall https://t.co/gcWhKw7w8r https://t.co/os6CGjViE9
2017-05-27,Yellowknife's 15-year-old 'fighting girl' competes at judo nationals https://t.co/37SwmGTqQc https://t.co/PBjvRGw1gS
2017-05-27,Yukon entrepreneur with disability celebrates 1 year anniversary of successful startup  https://t.co/6Mho5UkUJd https://t.co/EkYGWjZA1x
2017-05-27,Trapped 'like a caged animal': Climate change taking toll on mental health of Inuit  https://t.co/31VZ1DvN0x https://t.co/eVG7fhOLay
2017-05-26,Native Alaskans who protected Alaska in WWII to be honoured https://t.co/IQOsg4Gqie https://t.co/ckfAqwnlMe
2017-05-26,"Federal gov't promises millions to Nunavut, N.W.T. for Indigenous language services https://t.co/qHZcar18u1 https://t.co/gxsvoKVpBO"
2017-05-26,Fate of residential school records in hands of Supreme Court  https://t.co/oELaRxb0BP https://t.co/i1fohrRep8
2017-05-26,N.W.T. RCMP blame data entry mistake on high number of unfounded sexual assault complaints https://t.co/bhQ24sFssh https://t.co/vZevzz32kg
2017-05-26,What's that Yukon plant? Upload a pic to this app to get an answer https://t.co/rdOiZPfYDy https://t.co/en2gxS5W2H
2017-05-26,Freezer full of game meat and pelts found at Ross River dump https://t.co/jwrmHD09is https://t.co/MRjCcNZyeW
2017-05-26,Ex-director of Folk on the Rocks taking fight for compensation to Supreme Court https://t.co/lQguZKyMBT https://t.co/2Yq65npT8g
2017-05-26,Yellowknife to hold vigil Friday to honour victims of Manchester bombing https://t.co/5Hk2YQduvU https://t.co/K6RrF09PrZ
2017-05-26,Yellowknife Housing First program expands to include families in 1 year pilot project https://t.co/IMh0I0YO5a https://t.co/bDGQPy6ogq
2017-05-26,"Iqaluit RCMP, family of Mary Ann Birmingham plead for help solving 31-year-old murder https://t.co/dngsaEkuB3 https://t.co/ECC9p6JuX2"
2017-05-26,"Yellowknife man gets 30 months for his part in ""dial-a-dope"" drug network  https://t.co/Gmlx8eQusQ https://t.co/W7FAsr2TQN"
2017-05-26,Yukon looks to preserve and manage grizzly bear population  https://t.co/lzrA77kbD7 https://t.co/ZWsWnGKwIr
2017-05-25,N.W.T. RCMP see major increase in impaired driving charges over long weekend https://t.co/52oI2lydjK https://t.co/fX7f652hOa
2017-05-25,"Families of missing, murdered women urge critics to get behind national inquiry https://t.co/jVkefgZQVb https://t.co/fAhHjLzp6X"
2017-05-25,Opposition presses Yukon government for carbon tax details https://t.co/VLKynV9fkn https://t.co/2fVt0jNaZ2
2017-05-25,"N.W.T.'s 2017 fire season should be 'relatively quiet' after June, says researcher https://t.co/GxupHbsnpA https://t.co/mXEW2syKMA"
2017-05-25,48-year-old man drowns outside Pangnirtung Wednesday night https://t.co/zmfQCy54DT https://t.co/wdjQTWSArn
2017-05-25,Major sponsor pulls support from Alaska's Iditarod race https://t.co/UohdiRCls4 https://t.co/ee4HM9siC4
2017-05-25,Royals to kick off Canada 150 visit in Nunavut https://t.co/qVXmEkNJuE https://t.co/gmGOLlYwW6
2017-05-25,Tundra design unveiled for Nunavut Arctic College expansion https://t.co/RSmHoZVzP3 https://t.co/3fKDkfQK1L
2017-05-25,Renowned choir to sing Tlicho lyrics written and translated by N.W.T.'s own  https://t.co/GfVkte5AiE https://t.co/Qmyo6pCGHw
2017-05-25,Whitehorse will ask territory to extend mineral staking ban https://t.co/IjGgal3eww https://t.co/AjG0u0CELv
2017-05-25,Wildlife officials seem 'busier than normal' with bears around Whitehorse https://t.co/I2Ffm9CPvY https://t.co/ecbQSKZe5A
2017-05-25,Canoe reported stolen from foster care summer camp near Yellowknife https://t.co/sAx81HqEHt https://t.co/NbkhnuTtHw
2017-05-25,Weighty matters to occupy N.W.T. leaders for next 7 days https://t.co/NeaQeKZhiP https://t.co/yayDk2j4iC
2017-05-25,"Police investigating police is not enough, town hall on Nunavut RCMP oversight hears https://t.co/tmSgNxCQl0 https://t.co/AL1NTFOUvD"
2017-05-25,Rabies outbreak under control in Whapmagoostui https://t.co/FrLVKr9RJ5 https://t.co/t6y87aFItY
2017-05-24,"Beloved Edmonton priest told, once again, it's time to move on https://t.co/R2ICiQP7bm https://t.co/dF2YACV5rS"
2017-05-24,'She should have been safe': Family searching for answers after N.W.T.-raised woman dies in Ontario jail https://t.co/y8wGCBJd3V https://t.co/aNQUyFQggI
2017-05-24,"Warmer summer forecasted for Yukon, average for N.W.T.  https://t.co/BhQpEOl2v3 https://t.co/OSOBu8sDO0"
2017-05-24,Sophie the 19-year-old python missing from Yellowknife school https://t.co/b6gD2hwpnJ https://t.co/F5VhWUHywU
2017-05-24,Jody Wilson-Raybould's father calls missing and murdered inquiry a 'bloody farce' https://t.co/WYOW1XPuXw https://t.co/dExcjYXXC5
2017-05-24,"Nunavut man stabbed in head, 24-year-old man arrested for aggravated assault https://t.co/0kQ33zNzv0 https://t.co/ABQaWsGsgc"
2017-05-24,Human leg in a fishing boot washes up on Alaska beach https://t.co/6V1lKRvxGz https://t.co/RvqDBnee1R
2017-05-24,Arctic Winter Games returning to Whitehorse in 2020 https://t.co/NpB8EwCEAo https://t.co/3tRxVExO0X
2017-05-24,"Everything is on the table, including exemptions, for North carbon tax: federal official https://t.co/rUSoeThHAt https://t.co/zm2A7rNDYF"
2017-05-24,'It's people being lazy': Yellowknife councillors talk trash to curb littering https://t.co/GLtyPErbf8 https://t.co/2Rpb9aumDK
2017-05-24,"Alaska aquiver: With 40,000 earthquakes a year, state to have its ground examined https://t.co/WSmInIz82x https://t.co/rUwaorx2d6"
2017-05-24,Yukon-based exploration company has high hopes for good season https://t.co/LaqyehEejE https://t.co/HB7YDj1Qg6
2017-05-24,Nunavut gov't to conduct forensic audit of YWCA Agvvik amid allegations of financial mismanagement https://t.co/4Px2fBz7Vj https://t.co/z5e0BZCXm5
2017-05-24,"'With a heavy heart', Yellowknife's Lenny Burger to close barely five months after opening https://t.co/gM2G8z5ULb https://t.co/baLFvh6BZ4"
2017-05-24,Worker injured in Minto Mine explosion released from hospital https://t.co/dIzZZaBhdP https://t.co/oxGWsb8Izm
2017-05-23,WSCC lays charges in 2016 death of 19-year-old Australian in Inuvik https://t.co/kaMSxvHmgs https://t.co/1eIltPpUkH
2017-05-23,Dawson City miners wary of UNESCO World Heritage bid https://t.co/df8x2z4ubK https://t.co/BboU4z1rbD
2017-05-23,"Woman dead, man charged with impaired driving after weekend accident near Yellowknife https://t.co/MT7gFH3ge7 https://t.co/Fn0AaJxubW"
2017-05-23,Man charged with murder in Iqaluit after sudden death of 23-year-old man https://t.co/Sk264ERxv1 https://t.co/pGAKTHS7L7
2017-05-23,Goldcorp moving ahead with Coffee Gold mine project near Dawson City  https://t.co/z94e8XmElK https://t.co/i6R7c3U6Qm
2017-05-23,"Don't judge a sheep by its coat colour, says genetic researcher  https://t.co/JOspvWoTDc https://t.co/MUbTrw3vzY"
2017-05-23,"Yellowknife elder left isolated after seniors' day program suspended, family says https://t.co/f7pZQYS6Lj https://t.co/a5tDZQB2hM"
2017-05-23,Summer heat has Yellowknife planners primed for sidewalk patios https://t.co/2zFBVreeYN https://t.co/xcNMHlT9x2
2017-05-23,No permanent home in sight for Yellowknife visitors' centre https://t.co/qb4XPGlFVB https://t.co/xK1MSRB8bF
2017-05-23,'To give them hope': 3 Iqaluit locals help homeless living in abandoned shacks https://t.co/bdTo7pZNko https://t.co/ruxoDzf4vv
2017-05-23,Iqaluit education authority bows out of fight with government https://t.co/Tx7zwqpKMd https://t.co/ah9K6M8otw
2017-05-22,Emergency crews respond to Sunday crash on Ingraham Trail https://t.co/HAATlp5rUU https://t.co/x7BotHhwV0
2017-05-22,Yukon's Carcross Commons ready for business as tourism season begins https://t.co/BO8tY48PJG https://t.co/fabFw5OUTp
2017-05-21,"4.2 magnitude earthquake hits near Yukon, B.C. border https://t.co/HOm2ekcDC1 https://t.co/S9eXcrvSgw"
2017-05-21,Your North: Best reader photos from the week of May 15 https://t.co/lRjbkMewqH https://t.co/sPjpPmRzQl
2017-05-21,What it was like to race a canoe down the Mackenzie River in 1989 https://t.co/MOa3g6qssa https://t.co/cyfL8zsd2K
2017-05-21,"Protests, court challenges, B.C. recount: Trans Mountain IPO comes at awkward time for Kinder Morgan https://t.co/RFrrOfjVgZ https://t.co/7ZOHwK6GhV"
2017-05-21,MMIWG chief commissioner still has 'hope' despite rocky start https://t.co/tyPyaqYIXb https://t.co/bOrhHKZHoM
2017-05-21,N.W.T.'s 'bush university' celebrates 11 new grads and leaders of tomorrow https://t.co/TO0yDpuvRU https://t.co/8qP7WbjdpD
2017-05-20,1 injured in explosion at Yukon's Minto Mine  https://t.co/bcOMvL8oKB https://t.co/wecdzlSFKV
2017-05-20,Diga in Denmark: Behchoko musician to record newest album in isolated Danish barn https://t.co/gMRCM7Pl29 https://t.co/JGXSyDxX6o
2017-05-20,Bryan's cars: Prized collection of classic automobiles up for sale in Yukon https://t.co/gjtB7tHaZx https://t.co/BXRVLxyEN1
2017-05-20,"Commission on missing, murdered Indigenous women has become a fortress of bureaucratic incompetence https://t.co/jWZndln64r https://t.co/ORaiiZCVJB"
2017-05-19,"Stop feeding and gawking at roadside bears, Yukon groups urge  https://t.co/LDWUDXOFlp https://t.co/Uxo01GJ8MJ"
2017-05-19,"Wildfire danger 'extreme' around Whitehorse, as long weekend begins https://t.co/E5cgwcPYvy https://t.co/VxheXMVtUt"
2017-05-19,Iqaluit RCMP investigate sudden death in Apex https://t.co/Zu0Kcoobyq https://t.co/FJL9y83L89
2017-05-19,Science fair junkie: Nunavut woman selected as 1st Inuk ambassador for Canada-wide science fair https://t.co/A2UxAzURox https://t.co/JXitqIT6iE
2017-05-19,'Getting to know my new voice': Grey Gritt vies for Indigenous Music Award amid vocal change https://t.co/OYm9YvFt7T https://t.co/t9lbGllBkv
2017-05-19,"Safety gaps persist years after parole officer's murder, audit finds https://t.co/cCgwx5nD74 https://t.co/b073Bque6a"
2017-05-19,Yukon gives $1.6M to mineral exploration projects https://t.co/Uhm7CgnLzc https://t.co/tPPKSDJmPo
2017-05-19,Inuit homelessness the subject of brother and sister documentary https://t.co/fQv5uIogHG https://t.co/oEYEjPJIrA
2017-05-19,Dan Mangan ventures above the tree line for Iqaluit's Alianait concert series  https://t.co/YDhEhUENZ6 https://t.co/ujqPxTxTJF
2017-05-19,"Who speaks for Nunavut youth? In Cambridge Bay, these guys https://t.co/bAieNYag4K https://t.co/7UFC8YYH4x"
2017-05-19,Norman Wells mayor hopes for quick approval of Enbridge pipeline repair https://t.co/cebjGbrYVK https://t.co/iUqO8g9OJQ
2017-05-19,Yellowknife aims for biggest pellet heat system in N.W.T. https://t.co/xeSEws4ELe https://t.co/xiri3HEBAg
2017-05-19,"Food insecurity in Nunavut 'needs remedial action,' new report says https://t.co/C9uDXtbju2 https://t.co/xh9ao4D2i4"
2017-05-19,"Legislation must change for workplace PTSD, says Yukon flight nurse https://t.co/U7zjuNlFTh https://t.co/njRmVyHNqL"
2017-05-18,"A quarter of Nunavut's population faces moderate to severe food insecurity, report says  https://t.co/tCRbwYzW67 https://t.co/kzAo3y29gt"
2017-05-18,Dealership gives $30K van to Yukoner who needs wheelchair-accessible vehicle https://t.co/dWAEJoNe5V https://t.co/U0gk3zDrBn
2017-05-18,Cree Health Board calls for careful viewing of popular drama 13 Reasons Why https://t.co/a7uEEGnXuE https://t.co/ma0bRvMX76
2017-05-18,"'I am flabbergasted': Hay River SPCA dissolves, sends local donations to Yellowknife https://t.co/tuyoBLhGKO https://t.co/rOhy2j0GIf"
2017-05-18,'A place to grow and make memories': Iqaluit family of 5 to get new Habitat for Humanity home  https://t.co/AFwJdPNNLz https://t.co/7LzHeZMAVT
2017-05-18,Hazmat suits required: 116 Nunavut public housing units need heavy duty mould clean-up https://t.co/KiHn4YIu38 https://t.co/hDKodnOqKa
2017-05-18,"Dempster Highway fibre optic line cost could soar to $80M, twice the original estimate https://t.co/UqQeTOWm78 https://t.co/TzGoqA1s0x"
2017-05-17,Yellowknife man plunges through lake ice to save his dog https://t.co/tKfMYAbaMQ https://t.co/c1zam9QQZP
2017-05-17,"N.W.T.-brewed beer hits shelves across Canada, sells out quickly in Yellowknife https://t.co/Gx47UUaH96 https://t.co/Zip694FqqK"
2017-05-17,N.W.T. fishing lodge seeks $3.2 million for power corp.'s impacts on lake https://t.co/P3VflPn9yH https://t.co/eAGZnufr22
2017-05-17,'Off site' arsenic contamination a growing public concern in Yellowknife https://t.co/ThafDWdOln https://t.co/OLH2tCwOt0
2017-05-17,Cree singer looks to pick up Indigenous Music Awards after breakout debut album https://t.co/d8NKa2TmtH https://t.co/Cj5Qwkhs1m
2017-05-17,Alaska owner plans to resurrect strip club boat for summer https://t.co/EyIFkEah5R https://t.co/lWOHiQKkoU
2017-05-17,Canada will celebrate its first National Seal Products Day this Saturday  https://t.co/aG62Ak0UUP https://t.co/ScbbRIZ8Ik
2017-05-17,"First Nations teaching farm in Dawson City expands, adds animals https://t.co/LdRpbEjNQm https://t.co/fG9Npy0FZj"
2017-05-17,Yellowknife's visitors centre sets sights on temporary home  https://t.co/wa7OkSOGo7 https://t.co/hAMm2yUSF4
2017-05-17,Reindeers and language revitalization: Inuit students visit Finland's Sami people https://t.co/e8iGnWo337 https://t.co/rt04x6e8nR
2017-05-17,Pauktuutit gets funding to be part of National Inquiry into MMIWG https://t.co/fCg4gZK2oo https://t.co/cwVEjyJth8
2017-05-17,'I wanted my son to live': Inuk lawyer leaves Nunavut to treat teenage son's PTSD and depression https://t.co/9kw4EHIiau https://t.co/oCbCIXjT9H
2017-05-16,Crowdfunding against crime: Online campaign aims to make restaurant burglar-proof https://t.co/oFORJHirry https://t.co/pInoM6ZFKI
2017-05-16,"Stay away from 700 block, RCMP warns Arviat residents https://t.co/RHBNTveTAV https://t.co/N2Jg4juglX"
2017-05-16,Whitehorse identifies 13 residential lots that could go to market https://t.co/mFILIfYk4z https://t.co/SPVD0E9Bbz
2017-05-16,Yukon gov't won't commit to paving Dawson airport runway https://t.co/9tg9YB9ey6 https://t.co/26FjX7sN7Y
2017-05-16,"Alaska professor, student to study impact of whale watching https://t.co/CjNLdHYk82 https://t.co/i7tmryO1TH"
2017-05-16,'Our town can't handle a hit like that': Hay River looks to GNWT to help pay back NTCL debt https://t.co/0LxwnPGChS https://t.co/TmhZZ9t1PW
2017-05-16,"Failing grades for MMIW inquiry so far, women's group says https://t.co/APZwScx5N1 https://t.co/CzHzKuHgWZ"
2017-05-16,Gene Hope elected new chief of Acho Dene Koe First Nation https://t.co/x6C77y5FzY https://t.co/ImEhn7ZSWw
2017-05-16,"Improvements to Canada's outdated northern airports overdue, auditor says https://t.co/mIH0FWlOSO https://t.co/F357g4YI2z"
2017-05-16,Charlotte Lafferty's killer's violent past exposed as identity revealed https://t.co/lJHWXtbyPq https://t.co/7ZluHKUE6o
2017-05-16,Study of ancient ice cores stored in Alberta provides new clues on climate change  https://t.co/o2Bj3VV6ug https://t.co/V30Udpj1EL
2017-05-16,Natan Obed speaks on cultural appropriation debate https://t.co/1b6wk0382w https://t.co/LKVuOnUF87
2017-05-16,"Yukon's Keno Hill district 'far from' mined out, says Alexco Resources https://t.co/0RK6sijI8u https://t.co/9UCHsBby2a"
2017-05-16,"Let territorial job applicants see their references, says Nunavut MLA  https://t.co/4bStCHoydX https://t.co/9FaNWJoRbI"
2017-05-16,First Air and Canadian North codeshare agreement ends today https://t.co/afzjGQuRq5 https://t.co/nnPN7wsPIG
2017-05-16,'My first reaction was bingo!': winner recalls exciting night https://t.co/BXsgOzGgYM https://t.co/X1DGgT1Lqx
2017-05-16,"Whitehorse tries to stop illegal dumping, with an app https://t.co/aszsyHyOk4 https://t.co/ZmTDtUKMmF"
2017-05-15,"Scrap NEB and replace it with 2 separate agencies, expert panel recommends  https://t.co/5nlL9wDaGu https://t.co/K0fVMBqXMb"
2017-05-15,"Yukon gov't keeps staff out of Lynn Building, cites safety concerns https://t.co/AEyrt3Py6p https://t.co/LncAoN3EEt"
2017-05-15,"Families, activists demand extension to 'disorganized, haphazard' missing and murdered inquiry https://t.co/U1kz5ZzfiP https://t.co/XFATTZeajY"
