created_at,text
2017-11-02,Snow! Mt. Norquay (@MtNorquay) and Nakiska (@SkiNakiska) set to welcome skiers and snowboarders this weekend https://t.co/vapFHHcoUs #yyc https://t.co/mhoteqKR9o
2017-11-02,Saskatchewan man finds mysterious brand-new house in his farm field https://t.co/x74lnmZX7c https://t.co/GJZjZvYsz5
2017-11-02,US$42 million to spare? This 'Pink Promise' diamond may be for you: https://t.co/bHwmHFSrvl https://t.co/khR6UGVhSk
2017-11-02,Have you seen Cameron David Randall? #Okotoks RCMP name suspect in ramming of police units in WalMart parking lot  https://t.co/7Jlwhz3zo1 https://t.co/aXzGf4lb81
2017-11-02,Canadian lumber producers hammered after negotiations failed to reach deal: https://t.co/AhBe2IDGwU https://t.co/s09KfUnEq4
2017-11-02,Man convicted of sex assault in #Saskatchewan released in #Calgary area: https://t.co/CTXJKMOE6c #yyc https://t.co/ENqyw5LW7j
2017-11-02,More than 40M fire extinguishers that may not work recalled https://t.co/0l2mgg3Jl7 https://t.co/VlSjBjyQaT
2017-11-02,SNOWFALL WARNING from Environment Canada:  https://t.co/7LojZuDAuO  #abstorm #yyc #Calgary https://t.co/6iR8fHEKGr
2017-11-02,"Scaredy Cat: Skunk scares off cougar on the prowl - Greg Shyba caught it on camera near Tsuut'ina, Watch here: https://t.co/pI7Cbyptit https://t.co/pT5y5nZ5pk"
2017-11-02,Carstairs massage therapist charged after videos of clients found on laptop: https://t.co/rzl5ilvQEF @RCMPAlberta https://t.co/mWSeuunqnC
2017-11-02,Scientists discover hidden chamber in Egypt's Great Pyramid https://t.co/4iAy7pFLy4 https://t.co/Un0gfslbAB
2017-11-02,Man wanted for questioning in fatal assault in Kingsland - Have you seen Jonathan Sylvester? More here...  https://t.co/KetRQE1qvA #yyc https://t.co/Gqb5hXtTvK
2017-11-02,Federal report shows workplace violence rarely dealt with properly: https://t.co/tANTnjM3p1 https://t.co/yl2UGuE6TO
2017-11-02,SNOWFALL WARNING from Environment Canada:  https://t.co/7LojZuDAuO  #abstorm #yyc #Calgary https://t.co/Wm41Eqtly3
2017-11-02,WINTER STORM WARNING from Environment Canada:  https://t.co/7LojZuDAuO  #abstorm #yyc #Calgary https://t.co/MhY4f5hqmq
2017-11-02,Police arrest man suspected of killing 3 at Colorado Walmart: https://t.co/18MT2pKd29 https://t.co/VhROSfGIMc
2017-11-02,Human remains found on rural property near Salmon Arm identified: https://t.co/PYs6boQJpa https://t.co/OzWQzvcMZY
2017-11-02,Province will table new legislation on gay-straight alliances in schools https://t.co/zEb6Glh6RN https://t.co/WfYNwdee5C
2017-11-02,"Three Macs stores robbed overnight could have been hit by the same suspects
https://t.co/aZxjvBHKbt https://t.co/a4LNBxrcau"
2017-11-02,Great Bear Rainforest focus of new IMAX film https://t.co/L4Wu6SOsML https://t.co/ro4se7yHta
2017-11-02,Stay on top of today's snowy forecast w/ our Sky Watch Weather App- FREE here... https://t.co/mJK7QNXpji #yyc #yycweather https://t.co/kcaSoSrYBG
2017-11-02,Catalan politicians to be quizzed in Spain rebellion case https://t.co/28Zp2lK9h9 https://t.co/6B0YuhsZjw
2017-11-02,More snow! @CTVStanfield has more... https://t.co/GSCfUuznPe https://t.co/EgqpHSdIOf
2017-11-02,Climbing Australia's giant red rock Uluru banned https://t.co/irxLMEFGts https://t.co/emLQ48vhCv
2017-11-02,Truck suspect said 'he felt good about rampage': officials https://t.co/i10fa7zAra https://t.co/YEWp70H9Aa
2017-11-02,Baby gene therapy study offers hope for fatal muscle disease https://t.co/v0YyzzUGWl https://t.co/SQJ0j0gmT1
2017-11-02,Snowfall leads to dozens of crashes on city streets https://t.co/ejJAkDws3T https://t.co/WRYg5dudV6
2017-11-02,SNOWFALL WARNING from Environment Canada:  https://t.co/7LojZuDAuO  #abstorm #yyc #Calgary https://t.co/hgiimzxbWw
2017-11-02,Hwy. 400 now open following deadly crash south of Barrie https://t.co/Zdi82FycnL https://t.co/TfYSWWKQIk
2017-11-02,Supreme Court to rule in B.C. case involving Indigenous spirituality https://t.co/RB1V2P47Iw https://t.co/kO306AHNCM
2017-11-02,Philpott calls emergency meeting over Indigenous child welfare https://t.co/B5wkwP57t9 https://t.co/LrqrTpBzZp
2017-11-02,WINTER STORM WARNING from Environment Canada:  https://t.co/7LojZuDAuO  #abstorm #yyc #Calgary https://t.co/Eli5pQuWcw
2017-11-02,SNOWFALL WARNING from Environment Canada:  https://t.co/7LojZuDAuO  #abstorm #yyc #Calgary https://t.co/wt7WVOm8Mf
2017-11-02,SNOWFALL WARNING from Environment Canada:  https://t.co/7LojZuDAuO  #abstorm #yyc #Calgary https://t.co/cZNJZhrsbg
2017-11-02,Walking in their patients’ shoes. @CTVBradMacLeod reports on effort to allow medical professionals a new experience  https://t.co/oowEpSMpnI https://t.co/inwsiUG0D3
2017-11-02,"Kent Hehr says decision to share table with his campaigning father an oversight as call for investigation surfaces
 https://t.co/6r5Na6qzJI https://t.co/rMUp1jeUBR"
2017-11-02,Province says Springbank Reservoir passed environmental assessment but not everyone is pleased w/ project's progress https://t.co/Uq0tun5W9O https://t.co/ksaPnWYrkG
2017-11-02,WINTER STORM WARNING from Environment Canada:  https://t.co/7LojZuDAuO  #abstorm #yyc #Calgary https://t.co/TvM90YeMpg
2017-11-02,SNOWFALL WARNING from Environment Canada:  https://t.co/7LojZuDAuO  #abstorm #yyc #Calgary https://t.co/YgeiJUiG6Y
2017-11-02,Addressing Alberta's opioid epidemic. @CTVKathyLe reports on recommendations of Opioid Emergency Response Commission https://t.co/rmzhs7QSwP https://t.co/k38P9Ca22o
2017-11-02,Remains found on B.C. farm property identified as missing woman Traci Genereaux https://t.co/Z6dOCrtXNb https://t.co/uPPfGloGdF
2017-11-02,Sunrise ceremonies to honour the fallen. @ctvkevingreen reports from the field of crosses along Memorial Drive https://t.co/xj3Uk8z0nm #yyc https://t.co/fnAymDbmrf
2017-11-02,"2 dead, 14 injured in 2-vehicle crash on Alberta reserve after trick or treating https://t.co/kVw5U3EwlS"
2017-11-02,City makes millions off drain assumption? @CTVLWDoherty investigates claim #yyc is profiting off lawn watering https://t.co/E13YJth8rG https://t.co/2YylPIddsJ
2017-11-02,The @CTVCalgary News at 6 with @CTVTaraNelson for Wednesday November 1 is available in its entirety here: https://t.co/PgNl8wwW2X #yyc https://t.co/DufxLDHVP9
2017-11-02,Allowing open alcohol along 17 Avenue? @KamilKaramali reports on proposal to attract customers during construction   https://t.co/dWcZ3xPeAk https://t.co/1QwTMmVDgm
2017-11-02,"Start of the snow. @CTVdavidspence has Calgary's five-day forecast for November 1 here:
https://t.co/ljm9OBJokH #yyc https://t.co/hqNyZkMzhL"
2017-11-02,"Staying cold, with 12-15 cm of snow by Saturday night.   The @CTVCalgary 5 day forecast.  #yyc #Calgary https://t.co/R20IbcWpl3"
2017-11-01,Meet this week's Inspiring Albertan Lynne Penko - Here's @CTVDarrelJanz with more... https://t.co/J1fsH2LSiN #yyc https://t.co/H6nAC4ASIj
2017-11-01,"After the snow ends Saturday, the cold lingers.  The @CTVCalgary 7 day trend.  #yyc #Calgary https://t.co/W1uaawc6yK"
2017-11-01,Update: #Calgary man identified as victim of fatal assault in Kingsland -   W/ Extended update from police... https://t.co/D44D9gB47P #yyc https://t.co/K01PEodD7a
2017-11-01,"Extended: CPS update on fatal Dover shooting, arrest of murder suspects in Montreal after 3,600+ km getaway  https://t.co/x9XI0I23iG #yyc https://t.co/ItQKN91Rgr"
2017-11-01,WINTER STORM WARNING from Environment Canada:  https://t.co/7LojZuDAuO  #abstorm #yyc #Calgary https://t.co/U024SFOMcV
2017-11-01,'The Force' inspires dad to build daughter's epic R2-D2 costume: https://t.co/GXCT86Bo6Z https://t.co/GPx6Y7ACHm
2017-11-01,WINTER STORM WARNING from Environment Canada:  https://t.co/7LojZuDAuO  #abstorm #yyc #Calgary https://t.co/0VoA4UuygV
2017-11-01,Watch Live Now: CPS update on investigation into fatal shooting in Dover &amp; arrest of suspects in Montreal #yyc  https://t.co/roe81XxtUI https://t.co/L7fGQMUlaC
2017-11-01,SNOWFALL WARNING from Environment Canada:  https://t.co/7LojZuDAuO  #abstorm #yyc #Calgary https://t.co/s70yRtPBOv
2017-11-01,Watch Live at 3: Suspect vehicle in fatal shooting in Dover stopped in QC. Suspects arrested. CPS update. https://t.co/roe81XxtUI #yyc https://t.co/RyEmpY1Z8S
2017-11-01,Woman found clinging to life ring after 5 hours in frigid Pacific waters: https://t.co/fCIvc7V5vS https://t.co/OZMmfStWTV
2017-11-01,Suspects in Saturday morning's fatal shooting in Dover arrested in Quebec during traffic stop https://t.co/znhvFU3m5D #yyc https://t.co/y9MMW3HwLr
2017-11-01,"BREAKING: Victim of Friday’s homicide in Kingsland identified as Jordan Gregory Frydenlund, more to come…https://t.co/7YSQ2cJQgj #yyc https://t.co/nTiz8tO7UZ"
2017-11-01,Watch Live Now: City officials provide update on closures around Brookfield Place: https://t.co/x1iQLT6sd6 #yyc https://t.co/yGsvTj4RFg
2017-11-01,"BREAKING: Two arrested in Montreal in connection to weekend homicide in #Calgary, more to come... https://t.co/7YSQ2cJQgj https://t.co/rorhxoj08Q"
2017-11-01,Closures continue around office tower in Calgary’s core - Live update from city officials at 2 PM: https://t.co/7UbeF7O6B7 #yyc https://t.co/wjiwOsutJu
2017-11-01,Search and rescue aircraft hit by laser strike in B.C.: https://t.co/UPtStSxDKz https://t.co/2LpFazKnHU
2017-11-01,Trading of Hudson's Bay shares halted on Toronto Stock Exchange: https://t.co/mB96ItW9EZ https://t.co/SrbMB2o74d
2017-11-01,"Warning issued after high risk offender, Michael Andrew Scott,  returns to #Calgary area: https://t.co/i1UxAnsuIl #yyc https://t.co/6t8imxlpvo"
2017-11-01,"Wendy Williams passes out, collapses on-air during chat show https://t.co/nFvDxVQvAx https://t.co/uHGuZiRHT9"
2017-11-01,Man charged with sex assault of teenage girl on Calgary Transit bus https://t.co/gULpqgc4Bt #yyc https://t.co/wZwRSWbRgX
2017-11-01,Saskatchewan is taking action against users who post so-called 'revenge porn': https://t.co/HqRmB6QM6x https://t.co/GxUykcn8qy
2017-11-01,SNOWFALL WARNING from Environment Canada:  https://t.co/7LojZuDAuO  #abstorm #yyc #Calgary https://t.co/S4hrUhPSgV
2017-11-01,WE Day welcomes Alberta youth to day of inspiration &amp; empowerment: https://t.co/kTqZjScs3F #yyc @WEMovement https://t.co/TGrO1kjWqn
2017-11-01,Royal Canadian Mint says fake gold is not from its vault https://t.co/U864MNmgrL https://t.co/C1o7E28Vfn
2017-11-01,A Langdon family went all out for Halloween this year and attracted hundreds of kids. @CTVBradMacLeod reports: https://t.co/UYvzFKGAlh #yyc https://t.co/UEusKBY7t3
2017-11-01,Money stuck in cyberspace amid e-transfer issues at TD Canada Trust https://t.co/HqsUSCkwpd https://t.co/XB1oUMJ4zb
2017-11-01,A Cardston family says they're struggling with a man claiming squatters' rights. @CTVTerryVogt reports: https://t.co/Nyby20EB1h #yyc #yql https://t.co/6sX23txv1Q
2017-11-01,ICYMI: Calgary traveller troubled after lost luggage complaint lingers for months https://t.co/w5mPwdtmLA https://t.co/DIoH8fEnBw
2017-11-01,Cochrane man says his anti-theft poppy box design ready to go large scale https://t.co/Btg7tSlQgh #yyc https://t.co/Li488Ebhxh
2017-11-01,"New allegations levelled against Kevin Spacey, Jeremy Piven https://t.co/EM2NK34WOM https://t.co/b5DJl6rRFq"
2017-11-01,ICYMI: Five teens arrested in bear spray attack at CrossIron Mills https://t.co/O9ZQgC1nfw #yyc https://t.co/ZG0PrFbPKn
2017-11-01,UPDATE: Calgary's first sunrise ceremony to take place at 8:29 at the Field of Crosses https://t.co/XN9kmKswKL @CTVJKanygin #yyc https://t.co/rn2ADHCZLv
2017-11-01,Man charged in random assault of women has a history of violence https://t.co/P7IS8U8FO8 @CTVLWDoherty #yyc https://t.co/OXsImQghOx
2017-11-01,ICYMI: Concern for falling glass forces closures around Brookfield Place https://t.co/yXh6tSojMD https://t.co/Jfr17eQSpq
2017-11-01,Highway 400 crash: 14-vehicle collision causes multiple deaths https://t.co/6FH19OTLZp https://t.co/0P9nHx3k1u
2017-11-01,Calgarians gather to honour fallen soldiers in sunrise ceremony https://t.co/XN9kmKK89l @CTVJKanygin #yyc https://t.co/1KIO6iiBKK
2017-11-01,Investigators scour driver's background in NYC truck attack https://t.co/KE1FfMHCZO https://t.co/Hi7zh1WvLx
2017-11-01,SNOWFALL WARNING from Environment Canada:  https://t.co/7LojZuDAuO  #abstorm #yyc #Calgary https://t.co/03fSwufC0N
2017-11-01,SNOWFALL WARNING from Environment Canada:  https://t.co/7LojZuDAuO  #abstorm #yyc #Calgary https://t.co/tF8gck5Mr2
2017-11-01,SNOWFALL WARNING from Environment Canada:  https://t.co/7LojZuDAuO  #abstorm #yyc #Calgary https://t.co/ZzJLtsbLGn
2017-11-01,Slurping signal + Cheesy emoji controversy - Take a look at What's Trending tonight here... https://t.co/UFYegHlr7k #yyc https://t.co/KL34AF5eQg
2017-11-01,Luggage lost on @AirCanada flight leaves #yyc man in limbo - @CTVShaunF has more on the complaint: https://t.co/GlqEp08sgd #yyc https://t.co/664A12Mipj
2017-11-01,Hamlet takes Halloween to whole new level - @CTVBradMacLeod has more on a spooky display in #Langdon https://t.co/UYvzFKYbcP https://t.co/T2dQ09jQKB
2017-11-01,Calgary traveller troubled after lost luggage complaint lingers for months: https://t.co/nDI2gcLcqs #yyc @AirCanada https://t.co/502kTkE74u
2017-11-01,Safety concerns at downtown skyscraper - @KamilKaramali has the latest on closures around Brookfield Place: https://t.co/VZtSgxhSeh #yyc https://t.co/8tPlTB1ngj
2017-11-01,"See the full @CTVCalgary News at 6 w/ @CTVTaraNelson for Tuesday, October 31, 2017 here.. https://t.co/8bqPHfycCt #yyc https://t.co/Rh2QXNO7w1"
2017-11-01,Deserted town in Cape Breton believed to be haunted by locals. more on this supernatural story here... https://t.co/0jqfGeFKsW https://t.co/9jHEbWxON1
2017-11-01,.@donshobbyshop big hit at #Halloween - @CTVKevinFleming  has more on the store's success…https://t.co/JXaIjCw0rO #yyc https://t.co/DQpWeEyQpG
2017-11-01,"Man charged in pair of violent attacks at Macleod Trail businesses, @CTVLWDoherty has an update: https://t.co/K7Ldev3rzb #yyc https://t.co/2Hv0bx1mnR"
2017-11-01,"Weather Update: Snow from Wednesday to Saturday, @CTVdavidspence has details… https://t.co/10uzKcKcks #yyc #yycweather https://t.co/JS9JsEkLXb"
2017-11-01,Squatter has settled on a Cardston driveway &amp; property owner says there’s nothing he can do @CTVTerryVogt reports #yql https://t.co/YyoQOkpcvr
2017-11-01,Story Update: Southland CTrain Station reopens following suspicious package investigation: https://t.co/LQBqOvelGO #yyc https://t.co/izB02cxj19
2017-11-01,"Police investigation shuts down Southland LRT Station - @CTVAlesia
has more on the suspicious package investigation: https://t.co/anFKwCTw8i https://t.co/VQ2IwSUK1z"
2017-11-01,"Bus narrowly misses hitting pedestrian in West Palm Beach, Florida, take a look... https://t.co/bvpCgbDUMZ https://t.co/yfo8RKrrwN"
2017-10-31,Updated Story | Concern for falling glass forces closures around Brookfield Place: https://t.co/iswPL9Ichc #yyc #yycroads https://t.co/qjXJY4n6I4
2017-10-31,B.C. family make elaborate costumes to help son experience Halloween: https://t.co/xYtGt0YqHY https://t.co/HARtDGvPIa
2017-10-31,Police investigate suspicious package at Southland CTrain Station - More to come... https://t.co/LQBqOvelGO #yyc #yyctransit https://t.co/ipb99c8zjw
2017-10-31,Google-bred Waymo aims to shift robotic cars into next gear: https://t.co/h3K1JuYA8B https://t.co/heWtTU4Ou3
2017-10-31,Concern for falling glass forces road closure around Brookfield Place - More to come: https://t.co/m8BjRUwCdL #yyc #yycroads https://t.co/Jb0zT23oZ5
2017-10-31,Air Canada CEO says NAFTA erosion would be bad for country's largest airline: https://t.co/zlhQxBOor4 https://t.co/wsFXTUmSYD
2017-10-31,Feds announce $36.4M public education campaign on legalized pot: https://t.co/KKrbWrGSTQ https://t.co/jnWKRRNJ0m
2017-10-31,"#NYC Update: 8 dead, others hurt after motorist drives onto busy NYC bike path near World Trade Center site: https://t.co/P5wI1ACPUY https://t.co/mw9zVpwBbZ"
2017-10-31,WATCH LIVE SOON: Police update on deadly incident in New York - 6 dead after motorist drives onto #NYC bike path: https://t.co/4vrE0nPfzS https://t.co/yVfROvFHXa
2017-10-31,"Law enforcement official: 6 dead, 15 hurt after vehicle hits people near World Trade Center site: https://t.co/1H52MfF3ec https://t.co/L8FeztBS5A"
2017-10-31,Fund established to help find Canadian Jesse Galganov missing in Peru https://t.co/8uVmoJkIj0 https://t.co/06n1M7bu3K
2017-10-31,Teens arrested in connection with bear spray incident at CrossIron Mills https://t.co/R9XBefntKB #yyc https://t.co/NAUDEiGtc8
2017-10-31,Doctors find inventive way to remove magnets stuck inside boy's nose  https://t.co/UVU1HlTiVz https://t.co/TWhOQAfvHk
2017-10-31,Loonie loses ground after disappointing GDP report https://t.co/o5NFVueFqO https://t.co/mbpozd497w
2017-10-31,Black bear warning issued for Fish Creek Park https://t.co/CEJhUHtaUT #yyc https://t.co/4bIgjrMu9D
2017-10-31,Horror as Tokyo police find 9 dismembered bodies hidden in apartment https://t.co/jk7jquYcRg https://t.co/ZMmHBZoyNn
2017-10-31,'No joke': B.C. minister laughs off lawsuit claiming proof of Bigfoot https://t.co/1MFE48LIp5 https://t.co/DogQQl80BK
2017-10-31,Trump blasts former aide at centre of Russia probe as 'liar' https://t.co/ryu83JYiAs https://t.co/On0KyFXy7c
2017-10-31,U.K. police widen investigation into Harvey Weinstein: reports https://t.co/xGr5gPGUeJ https://t.co/MYqXxYUF31
2017-10-31,Alberta kills bill to get rid of daylight time https://t.co/KFx4H6HbB5 #yyc #yeg https://t.co/rQ6NsxOEBs
2017-10-31,"Thousands descend on Salem, Massachusetts for Halloween celebrations: https://t.co/m1oB3UE7En https://t.co/Jq9Ze5VF1O"
2017-10-31,"ICYMI: Attempted murder, assault charges laid in violent attacks at Macleod Trail businesses https://t.co/fGUJ5nhFhw https://t.co/Tp2PKHv7Kh"
2017-10-31,A local artist has created a masterpiece out of a tree on the banks of the Elbow River. @ctvkevingreen reports: https://t.co/cluEd55Zv4 #yyc https://t.co/4T4F98oFcq
2017-10-31,Heavy rescue team called to investigate damage to northeast Calgary business https://t.co/v1Rq0JiErt #yyc https://t.co/KzPkmY8Oo5
2017-10-31,Officials say wildfire near #Irricana was caused by cigarette butt https://t.co/SPssHM6CpN #yyc https://t.co/BFpLEKmH4J
2017-10-31,Nova Scotia Legion branch 'hurt' by Dollarama's rejection of poppy trays https://t.co/zVF955ZpUE https://t.co/igBYebTx7k
2017-10-31,Inconsistencies cast doubt on harrowing tale of women lost at sea for months https://t.co/rUjygV5EeV https://t.co/HrWv3jQ9Wg
2017-10-31,ICYMI: A #yyc martial artist is breaking through on the silver screen with some stunt work. @CTVShaunF reports: https://t.co/sKUWnavy7R https://t.co/b4sEUES0yf
2017-10-31,Emergency officials conduct Bow River search to solve missing person cases https://t.co/JbbDSLjoS5 #yyc https://t.co/Un114XhYNu
2017-10-31,Mueller sends warning to Trump and aides https://t.co/RwuxEymK4w https://t.co/g0Xf8yy5FO
2017-10-31,Fire department knocks down blaze at southeast mobile home park https://t.co/56Kq21xBX4 @CTVJKanygin #yyc https://t.co/kgh6oGSjYQ
2017-10-31,FREEZING RAIN WARNING from Environment Canada: https://t.co/7LojZuDAuO  #abstorm #yyc #Calgary https://t.co/cW1Lds7AED
2017-10-31,Southwest sounds + Mini marcher - Here's What's Trending tonight... https://t.co/gdTMKK144C #yyc https://t.co/7iUxH3v2t2
2017-10-31,"Calgary martial artist makes move to movies, @CTVShaunF catches up with the #Taekwondo champ…https://t.co/sKUWnaN8Zp #yyc https://t.co/UcaZCpLK8L"
2017-10-31,"Sculptors create animal carving out of old cottonwood, @ctvkevingreen has more on what inspired the creation:  https://t.co/cluEd5nAmC #yyc https://t.co/o8qljj7eu4"
2017-10-31,Veteran airman recalls missions over Mediterranean - @kevinfleming profiles the 97-year-old: https://t.co/EaKICTkHmV #remembranceday #yyc https://t.co/8A4DGhhVA4
2017-10-31,Business leaders gather to discuss state of economy -  @CTVBradMacLeod takes a look at what the future holds... https://t.co/hYXdug1LTF #yyc https://t.co/Ka2xIDu416
2017-10-31,"New legislation supports pay first, pump later systems - @CTVLWDoherty explains... https://t.co/2VQXqrRZhy #yyc https://t.co/YROiEdep4t"
2017-10-31,More details released on cost of pensions for Calgary’s city council: https://t.co/VkImSwr4cx #yyc @taxpayerDOTcom https://t.co/5wcpfFIT1u
2017-10-31,Crews clear glass that dropped from downtown building - @KamilKaramali has the latest on the investigation…https://t.co/wLL3xw9UGn #yyc https://t.co/CEtmJcmyci
2017-10-31,Happy Pug-o-Ween: #Edmonton dog owners throw costume party: https://t.co/YaCbUaAGAg #yeg https://t.co/0Wqy7QSjm6
2017-10-31,"See the full @CTVCalgary News at 6 w @CTVTaraNelson for Monday, October 30, 2017 here: https://t.co/f2boIOSle7 #yyc https://t.co/hx3LQrCpna"
2017-10-31,Drizzle drops in for #Halloween -  @CTVdavidspence has the full five-day forecast here …https://t.co/iFa2EO43Z7 #yyc #yycweather https://t.co/3GvdfiQDwO
2017-10-30,Push on for ‘pay before you pump’ legislation to protect Alberta workers: https://t.co/J5wbirw3LM #Bill19 #gas https://t.co/Ea6v7gfPZi
2017-10-30,Self-proclaimed Sasquatch hunter from Golden files civil lawsuit: https://t.co/mGcKxdvk1c https://t.co/SvqNF54jG6
2017-10-30,'Million Dollar Bus' sells square-inch spaces to fund community projects across Canada: https://t.co/xnMM6gjwTV https://t.co/oRK4ER20jl
2017-10-30,"Sears Canada creditor process biased toward sale, says former exec: https://t.co/OcIZxVXuou https://t.co/A8PxWIFFM7"
2017-10-30,"Coffee, por favor: Tim Hortons opens first cafe in Mexico: https://t.co/SentlWP1CE https://t.co/UuLMHBT5uQ"
2017-10-30,Canadian Forces colonel charged with sexual assault: https://t.co/oGE5zF7TS6 https://t.co/Ble3ERRxSK
2017-10-30,"Trump-Russia probe charges: 2 not guilty pleas, 1 guilty https://t.co/MMQqu7UG6N https://t.co/t9gkcifMp9"
2017-10-30,Woman found dead following fire at Blairmore apartment: https://t.co/YqzryrN24C @RCMPAlberta https://t.co/pMgoXSv25C
2017-10-30,UPDATE: Two female workers on Macleod Trail seriously hurt in 'horrific and violent' random attack https://t.co/nfO6GJRkte #yyc https://t.co/v4xHgdLEJq
2017-10-30,Group rescues deer with head stuck in plastic pumpkin bucket https://t.co/V0YpfgzQHO https://t.co/VvXwtAvItH
2017-10-30,UPDATE: Crews still don't know what broke 23rd floor window at Brookfield Place https://t.co/Wrec4ikwwk @KamilKaramali #yyc https://t.co/vHmRXz6aq6
2017-10-30,"Astros, Dodgers set Series HR record amid juiced ball buzz https://t.co/HNL7AEeyFd https://t.co/sEGoZp5lRl"
2017-10-30,.@CalgaryPolice very concerned about the random attack in the assault case. #yyc
2017-10-30,S/Sgt. Bruce Walker says Bogdan Radulescu is known in a number of different jurisdictions but can't get into further detail. #yyc
2017-10-30,LIVE NOW: @CalgaryPolice have details on charges against a man in connection with two violent attacks on women: https://t.co/tz80sNJptZ #yyc https://t.co/T8FWfiCRns
2017-10-30,Switch helps Nintendo half-year net profit soar 35 per cent https://t.co/0IqLJhF3T5 https://t.co/B8cQ9IO4LO
2017-10-30,LIVE NOW: Officials have an update on the situation on falling glass at Brookfield Place in downtown Calgary: https://t.co/tz80sNrOCr #yyc https://t.co/dXktW8apbn
2017-10-30,China is taking on unique strategy to combat terrorism that includes a ban on beards and Islamic materials. https://t.co/nxeM4bMmxb https://t.co/SyKUWWhCgp
2017-10-30,LIVE SOON: City officials have an update on the situation involving glass from a downtown office tower: https://t.co/tz80sNJptZ #yyc https://t.co/LcuZfxBocw
2017-10-30,"UPDATE: Police clear scene at warehouse in southeast Calgary -
 threat 'not credible' https://t.co/OcWw8IA7nS #yyc https://t.co/aX72iJiVK4"
2017-10-30,LIVE AT 11: @cityofcalgary updates situation in the core involving glass falling from Brookfield Place: https://t.co/tz80sNrOCr #yyc https://t.co/N1FooyMBoh
2017-10-30,Edmonton pug owners go all out for Pug-O-Ween https://t.co/v6MDekdER7 https://t.co/gPRRDhMoCc
2017-10-30,Man charged in connection with pair of attacks on Saturday https://t.co/nfO6GJRkte #yyc https://t.co/IeWUDHxzmr
2017-10-30,A drone user got some amazing footage of fall foliage in Newfoundland: https://t.co/NNaH8LLlTR https://t.co/X75DUw61kn
2017-10-30,BREAKING: Southeast Calgary warehouse evacuated because of threatening phone call https://t.co/qTN0SF0Zfl #yyc https://t.co/n9jdWlQhSn
2017-10-30,Google CEO vows to build a better burger emoji for cheesed-off users https://t.co/bLnBjB62Mr https://t.co/0UpaSs5yAB
2017-10-30,Alberta Legislature back in session on Monday https://t.co/XT5cirRrCW #yyc #ableg #abpoli https://t.co/tjIW5ZtjzC
2017-10-30,"One person was taken to hospital after a Corvette crashed onto some parked cars in Brampton, Ontario: https://t.co/Is05KPSM56 https://t.co/KExrhhCguo"
2017-10-30,"Kevin Spacey addresses harassment claims, comes out as gay https://t.co/396TsbSREc https://t.co/WMwPvAI8cQ"
2017-10-30,Former NDP MLA joins Alberta Party following stint as an independent https://t.co/4lUdwMZdFC https://t.co/Ct6qURxAw3
2017-10-30,ICYMI: Crews from Rocky View County battle grass fire west of Calgary https://t.co/smqUwSw6KF https://t.co/b1jQG6r2D6
2017-10-30,Police investigate possible home invasion in southwest Calgary https://t.co/OmuLqiazw0 #yyc https://t.co/idWdvHUa4L
2017-10-30,Major upgrade construction begins on Crowchild Trail https://t.co/7xun6S7gb2 #yyc https://t.co/yNLt9PZ27u
2017-10-30,"Trump's former campaign CEO Paul Manafort is expected to surrender to police, reports say: https://t.co/4rWuumSXOk https://t.co/bUu1rm6ANY"
2017-10-30,Police searching for parents after infant abandoned on Halifax street https://t.co/54t4A72V79 https://t.co/ktpLDwsI0S
2017-10-30,Downtown streets still closed due to fallen debris in Calgary https://t.co/8PGzTDi5pa @CTVJKanygin #yyc https://t.co/eqgReCJ7NG
2017-10-30,Rodney resigns so Kenney can run. @CTVInaSidhu reports on move designed to pave way for UCP leader to gain seat https://t.co/rNzHqJrFhQ #yyc https://t.co/rIDNbS1s6g
