created_at,text
2017-10-20,"Report recommends Alberta add urban ridings, cut three rural seats  https://t.co/WxQDlFQlcc"
2017-10-20,Renovating Banff’s Mount Royal Hotel after devastating fire. @CTVKevinFleming reports on plan to honour hotel's past https://t.co/eA9o2vXfwx https://t.co/DiIGiSp3cv
2017-10-20,Calgary courts Amazon ahead of HQ location decision. @CTVAlesia reports on effort to attract company to AB https://t.co/RxnUkcTsNx #yyc https://t.co/rl7sNTmhrc
2017-10-20,Officer fatally shoots motorist during traffic stop in Gleichen. @CTVJKanygin has the latest https://t.co/QsWRaoe4dS #yyc https://t.co/DWi3Kn9J2H
2017-10-20,"The @CTVCalgary News at 6 with @CTVTaraNelson for Thursday, Oct 19 is available in its entirety here: https://t.co/WdzPbD9T1V #yyc https://t.co/xbPVu6jAVi"
2017-10-20,Overwhelming support for badly burned father &amp; son from SK. @RecordStephanie speaks with  wives of injured men https://t.co/is1oZ7m1HR #yyc https://t.co/0vvdqxPeMM
2017-10-20,Cooler days ahead? @CTVdavidspence has Calgary's five-day forecast for Oct 19 here: https://t.co/4Z9LfXF1J1 #yyc https://t.co/6eiHJN2LEq
2017-10-20,"Sharp Hill fire sparked by cigarette. @CTVBradMacLeod reports from the scene of the fire, south of Airdrie https://t.co/d4aydhkx0O #yyc https://t.co/KdWMEFIJfc"
2017-10-20,"Family, friends &amp; politicians pay tribute to fallen volunteer firefighter. @CTVAlison reports #yql https://t.co/4guoyAk5lF https://t.co/lpalEV2jc6"
2017-10-20,"Dentist fixes domestic abuse survivor's tooth for free, see her reaction here: https://t.co/LumzbL9lQQ https://t.co/w7khWk9ADX"
2017-10-19,"A GoFundMe campaign to support the families of Ron and Evan Wedrick surpassed its $5,000 goal and has raised more than $58,000 in first day https://t.co/LQHJttQPpH"
2017-10-19,Father &amp; son airlifted to #yyc after suffering severe burns in Sask. wildfire. Family overwhelmed by support  https://t.co/MCK7xkZEiB https://t.co/NhXAcMnSKi
2017-10-19,"Call of the wild: B.C. man brings  pet wolf to school, take a look... https://t.co/joYkRl3DIy https://t.co/Eft282EfYv"
2017-10-19,Banff’s historic Mount Royal Hotel set to reopen in 2018 following devastating fire  https://t.co/slCz3FD0wL https://t.co/7mVbXnTk6R
2017-10-19,Costume accessory appears to make light of mental illness: https://t.co/aSupMTU6T0 https://t.co/F6H3cGgdbr
2017-10-19,".@ASIRT_AB investigates officer-involved shooting near Haynes, Alta: https://t.co/FGA07GkGv5 https://t.co/NsUCWU40uk"
2017-10-19,Updated Story | Officer charged after allegedly pointing firearm at driver during traffic stop - W/ Extended video: https://t.co/QRT5c5pn1X https://t.co/a5rPYiDjMI
2017-10-19,Supreme Court says conditional sentences don't count as jail time in immigration law: https://t.co/n1KR84KQUH https://t.co/P4BGG5CTsP
2017-10-19,Gimmick or game-changer: Is Virtual Reality the future of film? https://t.co/BcQA9DPOBE https://t.co/ncQ0g4SQV2
2017-10-19,"Winter forecast: More snow in Ontario and Quebec, 'dangerous' cold in Prairies: https://t.co/6h2Pk6qK82 https://t.co/9ORG6d6P9J"
2017-10-19,Police release description of man in suspected attack on junior high school student https://t.co/WQEnrNLC5l #yyc https://t.co/UZS6dizoUE
2017-10-19,Live Now - Professional Standards Section addresses charges against  officer for unlawfully pointing a firearm: https://t.co/VA4mhYhN5x #yyc https://t.co/oxSWb5NqV2
2017-10-19,Sears Canada liquidation sales underway across the country: https://t.co/c4XCJnJLgV https://t.co/FXaP1Ur6xc
2017-10-19,Watch Live at 1 PM - Officials provide update on charges against @CalgaryPolice officer: https://t.co/VA4mhYhN5x #yyc https://t.co/2cVG5isVyt
2017-10-19,UPDATE: Fatal ammonia leak at Fernie hockey arena still a mystery https://t.co/47sWqdtK42 #yyc #yvr https://t.co/sCoMUFlbc2
2017-10-19,Suspect identified in robbery of blind woman who trusted stranger: https://t.co/rYebmptgIW https://t.co/swf1zN7iR0
2017-10-19,Calgary police officer charged after pointing firearm at driver during traffic stop in 2016 - More to come... https://t.co/7YSQ2cJQgj https://t.co/bYA7TgZv8W
2017-10-19,UPDATE: Fire officials locate area where Sharp Hill grass fire likely started https://t.co/YAsRQwQ9Xm #yyc https://t.co/i8x0AFzmdh
2017-10-19,A wildfire in Portugal was whipped up into a unique fire tornado when it met with a duststorm. Check it out... https://t.co/CT17CW3LrP https://t.co/XfTK1F3vhz
2017-10-19,Sharp Hill fire caused by improper disposal of smoking material - more to come. #yyc https://t.co/pp1Mari5zS
2017-10-19,Airline apologizes to bed bug-bitten travellers https://t.co/P5LeBXenXh https://t.co/j6pYjkSrh2
2017-10-19,.@ASIRT_AB investigates police shooting in Gleichen - More to come... https://t.co/5tSZkCKz9v https://t.co/4FpoEu2sVD
2017-10-19,"A Winnipeg man is sharing the story of his wife, who died of the same form of cancer as @gorddownie: https://t.co/saVDH8EypM https://t.co/gWUhW0IWTj"
2017-10-19,Thrift store pulls wrist-cutting Halloween prop https://t.co/6tHOfG9s48 https://t.co/hz9qksuITc
2017-10-19,World class music school to open second location in Calgary https://t.co/UCHtwHKswO @CTVKevinFleming #yyc https://t.co/oYuCwrT7wX
2017-10-19,"UPDATE: Two men, one from Chestermere and one from Calgary, have died in a Hwy 1 crash https://t.co/rPnjom43BC @KamilKaramali #yyc https://t.co/ayVpd2Ow1q"
2017-10-19,Quebec has passed a controversial law that targets public service workers who wear face coverings: https://t.co/BhozFvfQu1 https://t.co/1xhNnJ49Hf
2017-10-19,New Amazon HQ would 'fundamentally alter' potential Canadian city candidates https://t.co/id4ValWInn https://t.co/MoEXdOYtQk
2017-10-19,Cenovus selling Palliser assets in Alberta to Torxen for $1.3 billion https://t.co/bnLD8vb3aB https://t.co/GxG6Us7apE
2017-10-19,8 students suspended after brawl near Ottawa high school caught on video  https://t.co/2DQo2IHtf5 https://t.co/BFGdcwjK86
2017-10-19,ICYMI: Firefighter dies during wildfire response in southeast Alberta https://t.co/22rfiVtigN #yyc #yql https://t.co/9rfbPeHstR
2017-10-19,Cochrane man charged with fraud sought by police after skipping court https://t.co/Icd0aiIfXy #yyc https://t.co/sMxb36ddOg
2017-10-19,Fernie residents still out of their homes following ammonia leak https://t.co/efIxxOWGUo @CTVInaSidhu #yyc #yvr https://t.co/PverpectwB
2017-10-19,State of emergency remains in place in Crowsnest Pass https://t.co/LrWOGGpImJ #yyc https://t.co/xLJPAoQof8
2017-10-19,Two people dead in crash on Highway 1 near Chestermere https://t.co/rPnjom43BC @KamilKaramali #yyc https://t.co/96ctWkBjfZ
2017-10-19,WIND WARNING from Environment Canada: https://t.co/7LojZuDAuO  #abstorm #yyc #Calgary https://t.co/4jbsDknVSm
2017-10-19,What's trending? Paddleboarding poultry + husky's fountain encounter   https://t.co/mRRqStVAir @CTVTaraNelson @CTVGCampbell #yyc https://t.co/j6Kk00MiB1
2017-10-19,WIND WARNING from Environment Canada: https://t.co/7LojZuDAuO  #abstorm #yyc #Calgary https://t.co/GquibJTcvc
2017-10-19,Learning to rock in Calgary. @CTVKevinFleming reports on the growth of School of Rock in #yyc https://t.co/9TvBcZysb4 https://t.co/EbYMYHIljy
2017-10-19,"Remembering Joe Carbury, the iconic voice of the Calgary Stampede's Rangeland Derby for decades. @CTVGCampbell  https://t.co/fJG0ZX1OP8 #yyc https://t.co/VT5BANCFXx"
2017-10-19,Calgary reacts to Gord Downie's passing. @CTVBMacfarlane reports following the death of @thehipdotcom frontman https://t.co/iJmv4cD8tR #yyc https://t.co/WEXVQILD9t
2017-10-19,Calls for improved lung cancer screening to improve chance of early detection. @ctvkevingreen reports.  https://t.co/Z2AMk0D1f9 #yyc https://t.co/lVl0bIcaHm
2017-10-19,Free Bentley? Only with purchase of $3.13 million Edmonton penthouse https://t.co/FYcd9vMJ0P https://t.co/IJvz8zmhXb
2017-10-19,"Deadly ammonia leak at rink in Fernie, BC claims three lives. @CTVInaSidhu reports. https://t.co/tZg6dMoFbK https://t.co/KkOtcckKpm"
2017-10-19,Fire threatens homes near Coleman as strong wind persists. @CTVJKanygin has the latest from Crowsnest Pass https://t.co/iGOnis7ivB https://t.co/TlM8McpEoS
2017-10-19,"Devastating fire on Siksika Nation destroys homes,  injures horses. @CTVLWDoherty surveys the damage https://t.co/aHzaMiwkXg #yyc https://t.co/99tTXnuTWS"
2017-10-19,"The @CTVCalgary News at 6 with @CTVTaraNelson for Wednesday, October 18 is available in its entirety here: https://t.co/uVWVaQsVED #yyc https://t.co/UMQY0ta4T6"
2017-10-19,A cooling trend? @CTVdavidspence has Calgary's five-day forecast for Oct 18 here: https://t.co/FeRLpNy8y4 #yyc https://t.co/YASrbytneY
2017-10-19,"Another warm, windy day tomorrow, with above average temperatures.  The @CTVCalgary 5 day forecast.  #yyc #Calgary https://t.co/vGPfphdsDn"
2017-10-19,Dozens of Sharp Hill residents displaced. @CTVBradMacLeod reports from scene of fire north of #yyc https://t.co/yenyDsvaiz https://t.co/xE5TxE7ppG
2017-10-18,"Palliser homicide victim identified, search for vehicle ends following police standoff in Revelstoke   https://t.co/7Z85nV0pDF  #yyc https://t.co/afMKUzz07D"
2017-10-18,Meet this week's Inspiring Albertan Marg Southern - Here's @CTVDarrelJanz ... https://t.co/16SJyANxjU #yyc https://t.co/wLwrQkGQZH
2017-10-18,"The mild temperature trend continues, with a chance to revisit summer next week. The @CTVCalgary 7 day trend. #yyc https://t.co/DLtqTnsZSr"
2017-10-18,PostScript: Tales from the Hip - @CTVdawnwalton remembers decades of covering – and following – Gord Downie... https://t.co/C9B9SyyfI0 #yyc https://t.co/ldxSeUR1Gx
2017-10-18,"Tragically Hip fans in Kingston, Ont., lay flowers for Gord Downie memorial https://t.co/y3GLv0fGOK https://t.co/tVWKkiqOpi"
2017-10-18,Wildfire evacuation orders lifted in several southern Alberta communities - Details here... https://t.co/8kiruHITFq https://t.co/tnktSyiFSo
2017-10-18,WIND WARNING from Environment Canada: https://t.co/7LojZuDAuO  #abstorm #yyc #Calgary https://t.co/TEoB6bcbjT
2017-10-18,Southwest school issues warning after student allegedly assaulted by man Wednesday morning  https://t.co/sf3sXjfCiI  #yyc https://t.co/veRs1geZSN
2017-10-18,"James Hargrave, volunteer firefighter stationed out of Walsh, AB, killed in crash during wildfire response in SK   https://t.co/XAnegBNJ84 https://t.co/euuWCEOqGV"
2017-10-18,"Student teams build unity at #Bocce competition, @CTVKevinFleming has more on the unified sports event: https://t.co/5dBuSIwbkX https://t.co/EgO4xyGjEm"
2017-10-18,Canadian researchers develop new model for early-stage lung cancer detection: https://t.co/yQSbz49Vtt https://t.co/NR1p03KJXh
2017-10-18,Crews work to contain #wildfire burning near community of Coleman: https://t.co/l1LsCurDvi https://t.co/0I7EzzwM7p
2017-10-18,UPDATE: Fernie officials continue investigation into ammonia leak that killed three workers https://t.co/fM8kAyO1fa @CTVInaSidhu #yyc https://t.co/4Jl3iwZgWe
2017-10-18,New information released in violent 2016 shooting in affluent #Calgary community: https://t.co/DTcKzQ822U #yyc https://t.co/2nQzmSq9ut
2017-10-18,Sears Canada extended warranties to run out today: https://t.co/QIM9ZTxi4H https://t.co/3BVhjijqSD
2017-10-18,LIVE NOW: Fernie officials have an update on three workers killed in an ammonia leak at a hockey arena: https://t.co/X7eNA6guNh #yyc #yvr https://t.co/xc0cBFD6tg
2017-10-18,COMING UP: Officials have further details about the death of three workers in Fernie: https://t.co/X7eNA6y6bR #yyc #yvr https://t.co/HGF3aKXilJ
2017-10-18,WIND WARNING from Environment Canada: https://t.co/7LojZuDAuO  #abstorm #yyc #Calgary https://t.co/Wn81vtrGrw
2017-10-18,An archaeological dig in Montreal has uncovered some treasures of Canada's old Parliament building: https://t.co/B0vB4znB0h https://t.co/oz51zN6go5
2017-10-18,LIVE at 11: Fernie officials have an update on the situation at a local hockey arena: https://t.co/X7eNA6y6bR #yyc #yvr https://t.co/14coLUwC0K
2017-10-18,The Rock gave the City of Surrey a shout-out while on a movie shoot: https://t.co/kuwTrxUAb8 https://t.co/VVgNE8jf23
2017-10-18,"Condolences pour in for Gord Downie, Tragically Hip frontman:https://t.co/xsc0rsNPF8 https://t.co/zz7Bt10iN7"
2017-10-18,"Nanaimo residents are calling for a goose cull, saying they are overrun with the birds: https://t.co/OrS0XLgTxa https://t.co/TZ3RDqaJBq"
2017-10-18,Residents north of Calgary still on edge after wildfire destroys one home https://t.co/69L07qudqr @KamilKaramali #yyc https://t.co/Te7vn1Djxi
2017-10-18,WITH EXTENDED VIDEO: Calgary emergency crews deal with dozens of wind storm-related incidents https://t.co/hOnJ45budQ #yyc #abstorm https://t.co/pkuttKPTrw
2017-10-18,Janes brand chicken products recalled over salmonella concerns https://t.co/QurquY7kKj https://t.co/gN3o2fyHzb
2017-10-18,"Joe Carbury, long-time voice of the @calgarystampede, dead at 91 https://t.co/pqwxmW0Ndv #yyc https://t.co/fn35BP6xdi"
2017-10-18,Fernie declares state of emergency because of ammonia leak https://t.co/0m2SAk4RvW @CTVInaSidhu #yyc https://t.co/X8XEYg6pMC
2017-10-18,B.C. RCMP locate vehicle possibly connected to Calgary murder https://t.co/Stn4LFMx9B #yyc https://t.co/hjR1t7QeDe
2017-10-18,ICYMI: B.C. Coroners Service investigates fatalities following ammonia leak at Fernie arena https://t.co/dR6jjIrH2T https://t.co/wYVh4vhG0p
2017-10-18,WIND WARNING from Environment Canada: https://t.co/7LojZuDAuO  #abstorm #yyc #Calgary https://t.co/KeYeyif3WW
2017-10-18,WIND WARNING from Environment Canada: https://t.co/7LojZuDAuO  #abstorm #yyc #Calgary https://t.co/DUtm5suPCU
2017-10-18,Cloudy proposal + Wiz kids - Here's What's Trending tonight... https://t.co/mhUfqICN4z #yyc https://t.co/qmnRkcbYU7
2017-10-18,Human remains found in burned out vehicle north of Drumheller: https://t.co/7AhbwApwp5 https://t.co/lj9OJMZQAh
2017-10-18,"Bra Day supports breast cancer awareness, @CTVBradMacLeod MacLeod has the details…https://t.co/M92AUwMp2N #yyc https://t.co/Q0HMjrXRhc"
2017-10-18,Will a new council consider a new arena? @CTVBMacfarlane has more on the challenges faced by the city and the team…https://t.co/YVn27Veiqa https://t.co/79eDTEwl8D
2017-10-18,Evacuation orders issued for several rural Alberta communities due to wildfires (Photo: Glenn Koester) -  More here: https://t.co/0EouZX6sPQ https://t.co/ECSTx11Xir
2017-10-18,Evacuation Order issued for the Town of Gleichen due to wildfires - Evac centres are at Strathmore Civic Centre &amp; Standard Community Hall
2017-10-18,B.C. Coroners Service investigates fatalities following ammonia leak at Fernie arena: https://t.co/GbcaLkF8vv https://t.co/gKxLqJ4m2j
2017-10-18,"See the full @CTVCalgary News at 6 w @CTVTaraNelson for Tuesday, October 17, 2017 here...https://t.co/plkne8NJL0 https://t.co/X4J4YBOK9s"
2017-10-18,Strong winds damage property across city - @CTVInaSidhu has an update on damages … https://t.co/6IMRck69x2 #yyc https://t.co/PxBcTi5pW4
2017-10-18,"Weather Update: Windy conditions continue on Wednesday, @CTVdavidspence has the full five-day forecast here… https://t.co/FXGSSMTay9 https://t.co/BGdl0LsrTB"
2017-10-18,Update: Officials say all residents of Sharp Hill have been evacuated safely &amp; fire is mostly under control: https://t.co/KH6JHhqJlT https://t.co/wH3eULAhBG
2017-10-18,BREAKING: @MunicipalityCNP declares State of Local Emergency  due to out-of-control wildfire: https://t.co/h520vTKWDq https://t.co/4E9kJHCmv8
2017-10-17,FBI nabs 2 women suspected of bank heist try dressed as nuns: https://t.co/HdBSBQjYEm https://t.co/gCcmLSwHUQ
2017-10-17,"BREAKING: Fire near Balzac forces evacuation of residents from Sharp Hill area, more to come (Photo:Ron Huffman) https://t.co/gl0ve8e4UQ https://t.co/St7IrcpW6l"
2017-10-17,WIND WARNING from Environment Canada: https://t.co/7LojZuDAuO  #abstorm #yyc #Calgary https://t.co/bQ1cumnXk3
2017-10-17,Residents evacuated as winds push wildfire closer to community of Coleman: https://t.co/h520vTKWDq @RCMPAlberta https://t.co/qFp7s9XgtO
2017-10-17,WIND WARNING from Environment Canada: https://t.co/7LojZuDAuO  #abstorm #yyc #Calgary https://t.co/m3q7Axeckq
2017-10-17,"A Montreal startup is sailing to a sustainable future, take a look... https://t.co/NOPlvQdGf8 https://t.co/r5p0nsZFy1"
2017-10-17,WIND WARNING from Environment Canada: https://t.co/7LojZuDAuO  #abstorm #yyc #Calgary https://t.co/9tOG7yBTTU
2017-10-17,WIND WARNING from Environment Canada: https://t.co/7LojZuDAuO  #abstorm #yyc #Calgary https://t.co/4re0GuQsVF
2017-10-17,New sports hijabs hit the hardwood at Winnipeg high school: https://t.co/kANqmEm1To https://t.co/BN7CXIIavc
2017-10-17,Wildfire alert for Cypress County - Residents N &amp; E of the fire &amp; N of Hilda should prepare 4 possible evacuation:  https://t.co/ad1ktw7Lrt
2017-10-17,"Strong winds forecast for southern Alberta - @environmentca issues warnings, more here...   https://t.co/g8OFJlANIv #yyc https://t.co/HkEO6ATOlg"
2017-10-17,Appeals court tosses US$72 million award in talcum powder case: https://t.co/dn4ceh3XZA https://t.co/zv4hpy5vD8
2017-10-17,WIND WARNING from Environment Canada: https://t.co/7LojZuDAuO  #abstorm #yyc #Calgary https://t.co/QCu6bQvgdk
2017-10-17,Missouri appeals court tosses US$72 million award in talcum powder case https://t.co/w9mzgewYjD https://t.co/sU5vmFvmIC
2017-10-17,Four charged in bizarre incident on Halifax's popular waterfront boardwalk https://t.co/17WVRZraSP https://t.co/89ml37FFv7
2017-10-17,Police search for suspects after home invasion in #Bowness https://t.co/ENm576GbJn #yyc https://t.co/ACGdC6x9TF
2017-10-17,"UPDATE: Laura Kennedy, RO for @cityofcalgary says a vote tabulator system would speed up the count: https://t.co/2TxVx8lbv8 #yyc #yycvotes https://t.co/OcwgbsZdWG"
2017-10-17,Victim identified in weekend shooting in Montgomery https://t.co/v7kG52KpYg #yyc https://t.co/IwINZLRZFs
2017-10-17,LIVE NOW: Elections Calgary has details on voter turnout for the municipal election: https://t.co/NK98gopeNY #yyc #yycvotes https://t.co/ohzw7F7kPH
2017-10-17,LIVE SOON: City officials answer questions about voting issues at many polls: https://t.co/NK98goGQcy #yyc #yycvotes https://t.co/6nucbA7Vgr
2017-10-17,LIVE AT 11:30: Voter turnout highest in 40 years in Calgary https://t.co/2TxVx8lbv8 #yyc #yycvotes
2017-10-17,Woman accused in Toronto hit-and-run that killed N.B. pedestrian granted bail https://t.co/2jbtvTwsAA https://t.co/HQ4gE2lDxm
2017-10-17,WIND WARNING from Environment Canada: https://t.co/7LojZuDAuO  #abstorm #yyc #Calgary https://t.co/xbwkmkt9je
2017-10-17,WIND WARNING from Environment Canada: https://t.co/7LojZuDAuO  #abstorm #yyc #Calgary https://t.co/8IryUu3loY
2017-10-17,A town in New Brunswick is relaxing the restrictions on a trick or treating bylaw: https://t.co/GQNEqefIDu https://t.co/iVaiWm0Oij
2017-10-17,UPDATE: @nenshi holds no grudges over negative social media posts following his win: https://t.co/6ILaUmDyQv #yyc #yycvote https://t.co/OalZtwq8c8
2017-10-17,"Atlanta toddler denied transplant because father violated probation, mom says https://t.co/tfPQFebhMR https://t.co/t8f1NXidN4"
2017-10-17,Diners at an Ontario restaurant were surprised when an SUV crashed through the restaurant window: https://t.co/gD12Sr1sSp https://t.co/ZHUjI45sUa
2017-10-17,Pollsters react on social media over Nenshi win https://t.co/FgpYtJYqCi #yyc #yycvotes https://t.co/BkoK55Eqes
2017-10-17,North Korea says 'a nuclear war may break out any moment' https://t.co/Fjc6f8uGkj https://t.co/XEnGdETLwn
2017-10-17,Four new faces join Calgary city council https://t.co/d6oT7VQylV #yyc #yycvotes https://t.co/e9T3bo8nAC
2017-10-17,ICYMI: Police investigate suspicious death in southwest Calgary https://t.co/q437CxCXOF #yyc https://t.co/Rm4q06QSIZ
2017-10-17,Ontario bill seeks to ban mandatory high heels https://t.co/X5KPa0Fv7r https://t.co/GhsHb0UcD3
2017-10-17,Naheed Nenshi returns to Calgary City Hall with his council https://t.co/7gxgMbZorZ @ctvkevingreen #yyc #yycvotes https://t.co/s22hKQ8ZpJ
2017-10-17,"ICYMI: Naheed Nenshi re-elected as Calgary Mayor, defeating Bill Smith by about 30,000 votes
 https://t.co/UFZnO1aIvR #yyc #yycvotes https://t.co/5D1uU1M8Ip"
2017-10-17,Election Update: @Ward4Ward1 elected in Ward 1: https://t.co/3SLv1aVhzP #yycvote #yyc https://t.co/7vwdIUOryJ
2017-10-17,Election Update: @RundleRay elected in Ward 10: https://t.co/3SLv1aVhzP #yycvote #yyc https://t.co/hTqpB9NCLh
2017-10-17,ICYMI: CTV Calgary News at 11 – Coverage of #Calgary Civic Election: https://t.co/dEgOW7RtwR #yyc https://t.co/aCpPf8D52E
2017-10-17,Election Update: @JeromyYYC elected in Ward 11: https://t.co/3SLv1aVhzP #yycvote #yyc https://t.co/ZXiK0QHdUd
2017-10-17,Election Update: @gccarra elected in Ward 9: https://t.co/3SLv1aVhzP #yycvote #yyc https://t.co/wcXqkTYZDd
2017-10-17,Election Update: @ChahalGeorge elected in Ward 5: https://t.co/3SLv1aVhzP #yycvote #yyc https://t.co/SoSWBdqesx
2017-10-17,Election Update: @seanchucalgary elected in Ward 4: https://t.co/3SLv1aVhzP #yycvote #yyc https://t.co/CXE0FVyKIQ
2017-10-17,Election Update: @BigRedyyc elected in Ward 13: https://t.co/3SLv1aVhzP #yycvote #yyc https://t.co/CJ4yZA9tbQ
2017-10-17,Election Update: @CouncillorKeats elected in Ward 12: https://t.co/3SLv1aVhzP #yycvote #yyc https://t.co/60Z15aNS6B
2017-10-17,Election Update: @DruhFarrell elected in Ward 7: https://t.co/3SLv1aVhzP #yycvote #yyc https://t.co/hcsKozGGSr
2017-10-17,Election Update: @JeffDavisonYYC elected in Ward 6: https://t.co/3SLv1aVhzP #yycvote #yyc https://t.co/yZV9iyAdy3
2017-10-17,That wraps our #Calgary election coverage - Thanks for joining us!
2017-10-17,Election Update: @peterdemong elected in Ward 14: https://t.co/3SLv1aVhzP #yycvote #yyc https://t.co/rrZIVozc5g
2017-10-17,Election Update: @EWoolleyWard8 elected in Ward 8: https://t.co/3SLv1aVhzP #yycvote #yyc https://t.co/kq6gPwOawm
2017-10-17,Election Update: @JyotiGondek elected in Ward 3: https://t.co/3SLv1bcSrn #yycvote #yyc https://t.co/bLYK64f4JK
2017-10-17,Election Update: @Joe_Magliocca elected in Ward 2... https://t.co/GRyevMuCng #yyccc #yycvote https://t.co/E6G1VqO4rw
2017-10-17,WATCH LIVE NOW – Coverage of #Calgary Civic Election 2017 w/ @CTVTaraNelson - On TV + livestream here… https://t.co/GRyevMuCng #yycvote #yyc https://t.co/0Xc95XM6mb
2017-10-17,BREAKING: CTV declares @nenshi  re-elected as Mayor of #Calgary: https://t.co/GRyevMuCng #yycvote #yc https://t.co/uMpJ5O0gRY
2017-10-17,"#Airdrie election results: Peter Brown re-elected as mayor. Council members include Chapman, Hegg, Jones, Kolson, Belyk &amp; Petrow"
2017-10-17,"UPDATE: Mayoral race- @nenshi 37,845 votes (51.7%), @TeamBillSmith 31,769 (43.4%), @chabot4calgary 2,222 (3.0%) - 73/266 polls #yycvote #yyc"
2017-10-17,@Thoneon https://t.co/GRyevMuCng
2017-10-17,"Our ongoing, online coverage of the 2017 Calgary Municipal Election is on a brief hiatus. We'll resume with updated results  #yyc #yycvote https://t.co/iiQ7MDtnTk"
2017-10-17,Ongoing election coverage is being livestreamed online. Televised coverage will resume at 11:00 https://t.co/GRyevMuCng #yyc #yycvote https://t.co/0aGoELgJ3T
2017-10-17,@Johewl Ongoing coverage (livestream) is available online now. Televised coverage will resume at 11:00 https://t.co/GRyevMuCng #yyc
2017-10-17,"Mayoral race update: @nenshi 5,718 (48.9%), @TeamBillSmith 5,115 (43.8%), @chabot4calgary 551 (4.7%) 27 of 266 polls reporting #yyc #yycvote"
2017-10-17,"High River election results: Craig Snodgrass re-elected as mayor. Council includes Couey, Nychyk, Masterman, Moore, MacMillan &amp; Klinghorn"
2017-10-17,"#Banff final vote results: Electorate vote: Is there ever a time that Banff should implement user pay parking? NO 54%, YES 46%  (2/2)"
2017-10-17,"#Banff final vote results: Karen Sorenson re-elected as mayor. Council includes Canning, Christensen, DiManno, Olver, Poole &amp;Standish (1/2)"
2017-10-17,@TigeProcyshyn @preddyk2 @GlobalCalgary @CBCCalgary Ongoing coverage (livestream) is available online now. Televised coverage will resume at 11:00 https://t.co/GRyevMuCng #yyc
2017-10-17,@HoulyP @jackshope @CBCCalgary @GlobalCalgary Ongoing coverage (livestream) is available online now. Televised coverage will resume at 11:00 https://t.co/GRyevMuCng #yyc
2017-10-17,@WMCSIMatters Ongoing coverage (livestream) is available online now. Televised coverage will resume at 11:00 https://t.co/GRyevMuCng #yyc
2017-10-17,"@evanbakeryyc Complete livestream coverage is available online, televised coverage resumes at 11:00 https://t.co/GRyevMuCng #yyc #yycvote"
2017-10-17,"Early results in mayoral race (6/266 polls): @nenshi 63.4%, @TeamBillSmith 30.9%, @chabot4calgary 2.1% #yyc #yycvote https://t.co/GRyevMuCng https://t.co/rnKLYdzWAD"
2017-10-17,"@Donnella_P @sprawlcalgary Available online now, TV coverage resumes at 11: https://t.co/GRyevMuCng"
2017-10-17,Our Coverage of the #Calgary Civic Election continues on our website HERE... https://t.co/GRyevMuCng https://t.co/vLRa0VPPHW
2017-10-17,@dylan_random https://t.co/GRyevMuCng
2017-10-17,@SanderSarioglu @dylan_random https://t.co/GRyevMuCng
2017-10-17,@meaganerd @bigbangtheory https://t.co/GRyevMuCng
2017-10-17,@Neil_Zee @GlobalCalgary https://t.co/GRyevMuCng
2017-10-17,@PhilipTurnbull @codihawkes @Crackmacs @juniper_gal @mckez_123 @sprawlcalgary @cityofcalgary @CBCCalgary @DuaneBratt Here's the url... https://t.co/GRyevMuCng
2017-10-17,"Newspaper stories ruined pimp's 'good reputation,' lawsuit claims https://t.co/d15HwUEcVR https://t.co/N6BX56qzmN"
2017-10-17,WATCH LIVE ONLINE &amp; ON AIR NOW – Complete coverage of #Calgary Civic Election 2017 –  Livestream here… https://t.co/GRyevMuCng #yycvote #yyc https://t.co/5dKJrWV0J6
2017-10-17,"Winds whip up for Tuesday, @CTVdavidspence has Calgary's five-day forecast for October 16 here:… https://t.co/2RwejYCBAu #yyc https://t.co/kQcQYFnNHu"
2017-10-17,Polls close in an hour! Join us at 8 for results &amp; analysis of #Calgary Civic Election 2017 – Watch Live here: https://t.co/GRyevMuCng #yyc https://t.co/iccZagXMVJ
