created_at,text
2017-12-02,Sliding below seasonal? @CTVdavidspence has Calgary's five-day forecast for December 1 here: https://t.co/7twzwbkCzs #yyc https://t.co/n0pqGRPJOd
2017-12-02,"It'll cool down a bit this weekend and Monday, before warmer weather returns next week.  The @CTVCalgary 5 day forecast. #yyc #Calgary https://t.co/rvcJfvGIVz"
2017-12-02,Strong wind exacerbates afternoon grass fire near Madden. The fire spread to cover nearly 10 acres and set hay bales ablaze.   https://t.co/MIPqvnmwnw  #yyc https://t.co/p3519BimhG
2017-12-02,Meet this week's Athlete of the Week LJ Hegwood - @CTVGCampbell has more... https://t.co/GACRgH5FjK #yyc @BigChiefBeef https://t.co/K4tSh74liY
2017-12-02,A downtown Lethbridge apartment overrun by squatters &amp; addicts has been shut down by Public Health. @CTVTerryVogt reports #YQL  https://t.co/GMIn5kYVah https://t.co/ShLGQ8NBuR
2017-12-02,"After a bit of a chill Sunday and Monday, it'll warm up again next week.  The @CTVCalgary 7 day trend.  #yyc #Calgary https://t.co/Fk9snxeodg"
2017-12-01,Company converts recycled sea cans to create modular housing for resort staff in #Banff: https://t.co/f66UTokW0H #yyc @CRMResorts https://t.co/2yqFzpdT8W
2017-12-01,SCC rules against Yukon government in watershed protection case: https://t.co/9sI5wz3DBR https://t.co/eB2GiAr7c1
2017-12-01,"Because of the cold start to the month, November in #Calgary goes into the books as both colder and wetter than average.  #yyc #Calgary https://t.co/YxOArcCe4N"
2017-12-01,Ex-Trump adviser Flynn pleads guilty to lying to FBI https://t.co/ve5SmYCPHb https://t.co/9RXraf5ATD
2017-12-01,Canada's top general says military not talking to U.S. about joining missile defence: https://t.co/8XFioO6v7O https://t.co/QnC03iATgQ
2017-12-01,Charges stayed against Calgary man who had been accused of abducting his six children. The man was arrested in October of 2016 in Ontario by a member of the Durham Regional Police Service during a traffic stop. https://t.co/5wUqK3XPi4 #yyc https://t.co/afXCGaTLtR
2017-12-01,Toronto father testifies in court fight to keep daughter on life support: https://t.co/EH91xTPkCY https://t.co/E92iEn31Ze
2017-12-01,Federal appeals court rules real estate agents must make data public: https://t.co/lMQbpDAEJl https://t.co/8fzieJS1YR
2017-12-01,City Hall hosts celebration for International Day of Persons with Disabilities: https://t.co/EFumPjKfvw @UN @modcanada #yyc #IDPD17 #IDPDCalgary2017 https://t.co/1ozcuKRKzo
2017-12-01,Loonie soars after strong job growth; Stocks in Toronto trade higher https://t.co/3dnaEglRiT https://t.co/oP7fngcbeZ
2017-12-01,Well above seasonal for the start of December. https://t.co/XeXJoC1B4T
2017-12-01,Montreal 'Weedmaps' ads removed after anti-marijuana complaints https://t.co/IDNx4NLnZg https://t.co/mD0h7xhAMi
2017-12-01,"Canadian's suit against Weinstein proceeds, though lawyers say they still can't find him https://t.co/jrAYq5TevC https://t.co/LSnwNjOEpc"
2017-12-01,"From hair dye to woodpeckers, new book shows da Vinci was curious about everything https://t.co/zsONLoGul1 https://t.co/4DdZz4bvQ8"
2017-12-01,Air Transat has been fined for its handling of a situation where customers were stranded on board an airplane on the tarmac for hours: https://t.co/2noJEZlacF https://t.co/kLZIXHeAx3
2017-12-01,Doc 'Dreaming of a Jewish Christmas' looks at composers behind holiday songs https://t.co/lGI7dQgtSS https://t.co/supIWjsJYk
2017-12-01,Elections Alberta demonstrates new voting technology for Calgary byelection https://t.co/AAlgvz6UJj #yyc #abpoli #abvote https://t.co/NGJC3YySQg
2017-12-01,Christmas shopping at a Winnipeg Toys R Us store got intense when a security guard pulled out what appeared to be a knife when trying to stop a suspected shoplifter: https://t.co/GvkYchbsBn https://t.co/BoqpNmVmP8
2017-12-01,Former national security adviser Michael Flynn to plead guilty to lying to FBI https://t.co/GiAm8kI63d https://t.co/xLmfFOkk09
2017-12-01,U.K. woman Trump accidentally tweeted awaits apology https://t.co/lij8Y4FLip https://t.co/NHhcdResFO
2017-12-01,A shortage of conifers in the United States could end up affecting the prices of Canadian trees this year: https://t.co/c7SHZgHehz https://t.co/20mc4JEb3o
2017-12-01,Attack siren brings back Cold War-era memories in Hawaii https://t.co/dS7Dmqa2bJ https://t.co/xdcmG0zXaf
2017-12-01,"Canada creates nearly 80,000 jobs last month as unemployment rate falls to 5.9 per cent https://t.co/cGCTBRekAz https://t.co/JcArErVo2Z"
2017-12-01,Calgary researchers investigate effect of second-hand pot smoke https://t.co/gySlFTKoyE @CTVKevinFleming #yyc https://t.co/8j4zcAX9KP
2017-12-01,'Historic agreement:' Canada signs High Arctic commercial fishing ban https://t.co/taWkI0k168 https://t.co/AZqc4s4RCH
2017-12-01,Trump outraged after jury acquits Mexican man in San Francisco pier killing  https://t.co/EYX8i8ZStT https://t.co/YQJ0KbuqWA
2017-12-01,ICYMI: Harry Hays Building evacuated due to suspicious package https://t.co/NkIL5AL3qV #yyc https://t.co/h7guwj9FC8
2017-12-01,Edmonton Oilers and Calgary Flames take a stand against online ticket scalpers https://t.co/3Tvz3ZoaUA #yyc #yeg https://t.co/NQGsgqs2uo
2017-12-01,Good start to December 1st! https://t.co/TCW9x3zN0Z
2017-12-01,"ICYMI: City council approves 2018 budget,  property tax to increase 3.8 per cent over 2017 rate https://t.co/bx2dFeEOpV @CTVJKanygin #yyc https://t.co/WKVStI7y9s"
2017-12-01,ICYMI: Displaced residents of uninhabitable apartment building in Hillhurst consider legal action https://t.co/eE412w7CCB #yyc https://t.co/BWTQBpx1I3
2017-12-01,Prince Harry and Meghan Markle make first official visit https://t.co/ahYkDAc0lO https://t.co/dxqQ6t3Ke3
2017-12-01,Displaced residents of the uninhabitable Kensington Manor apartment building in Hillhurst consider legal action against property management company  https://t.co/JnEGg5D5jv  #yyc https://t.co/NZgmTWpn0c
2017-12-01,"The @CTVCalgary News at 6 with @CTVTaraNelson for Thursday, November 30 is available in its entirety here: https://t.co/OvtbsEj2IS #yyc https://t.co/DWbkSSzI4i"
2017-12-01,Warm start to December. @CTVdavidspence has Calgary's five-day forecast for November 30 here: https://t.co/SflLSPSkah #yyc #yycwx #yycweather https://t.co/sdjJ8Oy9DV
2017-12-01,"City council approves 2018 budget, property tax to increase 3.8 per cent over 2017 rate. Average homeowner will pay $5.70 more per month  https://t.co/EXfl9CRvbx #yyc #yyccc"
2017-12-01,"Safety reminder from @lethpolice after officer rescues deer, dogs &amp; owners from Oldman River. #yql #lethbridge https://t.co/kJbH4CT7YB https://t.co/Xbd42JQTtM"
2017-12-01,Gregg Zaun fired from Sportsnet for 'inappropriate behaviour' https://t.co/KsOwTBmnjN https://t.co/1LQ1oxxtqa
2017-12-01,Have you seen Kurtis Cronk? Police are looking for the missing 39-year-old who was last heard from on November 6  https://t.co/8MC9pQfdd4  #yyc #missing #reddeer https://t.co/x3xQK1KeeX
2017-11-30,"Extended: CPS officials discuss ongoing investigation into a suspicious device, since determined to be non-explosive, that prompted the evacuation of the  Harry Hays Building  https://t.co/IWv8nkYPBk #yyc https://t.co/Zain1h2Bdj"
2017-11-30,Don't say 'hi': Quebec passes motion for French-only shop greeting https://t.co/cDhmzGo0sO https://t.co/7wtMN0DHWp
2017-11-30,Watch Live at 3:45 (approx.) - CPS officials to provide an update on the investigation into a suspicious device found in a washroom of the Harry Hays Building that prompted the evacuation of the building. https://t.co/4xCh80V3UY #yyc @CalgaryPolice https://t.co/XcEQWg8foL
2017-11-30,UPDATE: The suspicious device found in a women's washroom on the fifth floor of the Harry Hays Building Thursday morning has been contained and destroyed. CPS continue to investigate the incident.  https://t.co/k8pBu6wcJT #yyc https://t.co/HSOp3aRmqY
2017-11-30,Court awards $4K to jogger who appeared in ad without her consent: https://t.co/RKUtl5aeNo : https://t.co/vSMEwL26XU
2017-11-30,Lethbridge police officer helps dogs and owners to shore from the frigid waters of the Oldman River after the dogs attacked a deer in the water near the off-leash area in Peenaquim Park https://t.co/XJlP3ZwRh5  #yyc https://t.co/vMc4rQM8mI
2017-11-30,Swedish man convicted of 'online' rape; Canadian teen among victims: https://t.co/2rFu4nemRj https://t.co/oEHFY7hsZc
2017-11-30,UPDATE Investigation into suspicious package at Harry Hays building resolved. The building has reopened.  https://t.co/wcq1p5zQ7e #yyc https://t.co/6qo8cgRTeo
2017-11-30,Winnipeg police chief defends force after 3 officers arrested for drunk driving: https://t.co/KAW1vHzYOS https://t.co/TKSG4sEx1L
2017-11-30,"Jim Nabors, TV's homespun Gomer Pyle and singer, dies at 87: https://t.co/ASTT8m00UY https://t.co/d0UX2aYvwU"
2017-11-30,Taking ads sky high: Florida Man invents world's first drone billboard: https://t.co/tPlapbE5Qh https://t.co/M40cGdsdaW
2017-11-30,"BREAKING: Harry Hays Building evacuated due to suspicious package, more to come... https://t.co/cTD3qnmWCL https://t.co/Q8fvhd7Zes"
2017-11-30,Employee exposed to bear spray during robbery at #Okotoks store: https://t.co/J5yYDsFI6Y https://t.co/CSstEl1nu5
2017-11-30,"Police have released photos of two men who may have information about the death of Harsimran Singh Birdi, who was found in a northeast alley in April of 2016, more to come... https://t.co/nH42UcnFLm #yyc https://t.co/Khkqw7p7WQ"
2017-11-30,Man claims he caught eye-eating parasite at Pittsburgh amusement park: https://t.co/acs92jPo7k https://t.co/sDpFjXA6pd
2017-11-30,"We’re Hiring! @CTVCalgary is looking for a Reporter/Anchor to join our team! Find out more here… https://t.co/oyLMwjCCXF @caj
@RTDNA_Canada #JobListing #jobopening
#yyc #hiring #Opportunity #jobsearch https://t.co/KHBr1JPZtW"
2017-11-30,New long-acting drugs cut frequency of migraines: https://t.co/7lfMBmKgQx https://t.co/AhmSWgUpx3
2017-11-30,"Weather Update | Above seasonal for Thursday, @CTVStanfield has details…https://t.co/JHwUmrvIWC #yyc #yycweather https://t.co/Bvz65VXfEw"
2017-11-30,U.S. troops get freeze-dried plasma for battlefield blood loss: https://t.co/nR5QAPxvG6 https://t.co/bGkoGPImgj
2017-11-30,"Supreme Court says it will not hear Nicholas Rasberry manslaughter appeal, more to come... https://t.co/ARxtbf9rle #yyc https://t.co/1TTeOWacyT"
2017-11-30,"Avalanche danger considerable at alpine level in mountain parks, human triggered slides are possible in some zones (File Photo): https://t.co/uY5fKIDIWl https://t.co/L2FegjJfhg"
2017-11-30,North Korea releases photos of new ballistic missile: https://t.co/EOWruCuFff https://t.co/4CjnOLRIsf
2017-11-30,Service Alberta land titles registry website restored after outage: https://t.co/reiaIFf04K #yyc https://t.co/JCtQQsDxnH
2017-11-30,Calgary family looks for answers after glass table spontaneously explodes: https://t.co/WaP4XB5NzY https://t.co/A9XARVsJut
2017-11-30,.@NHLFlames Foundation and @NHL donate outdoor ice rink to  #Fernie for 2017-18 winter season: https://t.co/qTkTUSwrrJ #yyc https://t.co/JWqf52KFGC
2017-11-30,Pressure washers remove controversial art piece in downtown #Calgary underpass after artist apologizes: https://t.co/d98Jc1Yshw #yyc https://t.co/CPdC6IrKA1
2017-11-30,'Open banking' promising but cybersecurity fears linger for Canadian banks: https://t.co/97y6lDRi5P https://t.co/n1Ir5wmfbN
2017-11-30,Container UN war crimes convict drank from held deadly chemical: prosecutor: https://t.co/W8xGX88kq9
2017-11-30,Convicted B.C. killer Kelly Ellard asks for day parole: https://t.co/4DdLwvjmAf https://t.co/w5eeNQ6WLP
2017-11-30,Calgary family looks for answers after their glass table spontaneously exploded on Sunday afternoon as their children ate lunch and worked on homework   https://t.co/WaP4XBnoYy #yyc https://t.co/ASjyOUy4HT
2017-11-30,"UPDATE  Pressure washers remove 'Snapshots', a controversial art piece in a downtown underpass, after concerns regarding the consent of the subjects depicted surfaced. The artist apologized saying he thought the images were public domain.  https://t.co/d98Jc1Yshw @bishakali #yyc https://t.co/iV7FZbVs26"
2017-11-30,"The @CTVCalgary News at 6 with @CTVTaraNelson for Wednesday, November 29 is available in its entirety here: https://t.co/hmlN246uQ6 #yyc https://t.co/hNBaKdkQF7"
2017-11-30,Warm through the end of November (and into December!). @CTVwdean has Calgary's five-day forecast for November 29 here: https://t.co/DpiawYqj0F #yyc #yycwx #yycweather https://t.co/cLZI0xW5Af
2017-11-30,"Concerned locals build den and leave food for injured black bear 'Russell' ahead of winter. The bear has been living in a field along Highway 22, west of Calgary, since September    https://t.co/fsZFkmXI0f  #yyc https://t.co/Vw4Ep8nsqu"
2017-11-30,Meet this week's Inspiring Albertan Gordon Carter - Here's @CTVDarrelJanz ... https://t.co/mKOaNp5nbx #yyc https://t.co/9EPLVqoSVn
2017-11-30,“He’s watching over us” Family remembers Southern Alberta murder victim as kind &amp; caring grandpa. CTVTerryVogt reports #yql https://t.co/DSDc3TlWCi https://t.co/BIlNuvqZJo
2017-11-30,"Challenge accepted: Race between Ont. student, cop goes viral, take a look... https://t.co/w7xfQnhhj8 https://t.co/oacmTjemPf"
2017-11-30,"November ends on a great note, unlike me when I sing in the car! https://t.co/6vHC4PNjkI"
2017-11-30,Contestant with Down syndrome honoured at Miss Minnesota USA pageant: https://t.co/HzpufOGoAe https://t.co/IiVWuIUbaP
2017-11-29,Artist offers explanation for controversy created over snapshots used in public art piece: https://t.co/IoxdEJrokn #yyc #yyccc #Calgary #PublicArt https://t.co/sKfXUEyzby
2017-11-29,Couple mourns pet pigs slain in their yard by neighbour who mistook them for boars: https://t.co/nCpJme9vew https://t.co/6HUVAfsOkj
2017-11-29,Murder charge dropped in hot tub death overheard by Amazon Echo: https://t.co/fnPt1V5PnD https://t.co/U7gBwwdAsh
2017-11-29,Work-at-home trend stays static as daily commutes get longer across Canada: https://t.co/9v7JofSYXF https://t.co/K3hisx4RXa
2017-11-29,Gusty Wednesday in Southern Alberta https://t.co/1ft41gS64n
2017-11-29,Senior knocked unconscious following road rage attack on highway northeast of Airdrie  https://t.co/LUdQyqu9Zy #yyc https://t.co/98c6FpAcgO
2017-11-29,Producer for Vancouver-shot TV shows fired amid sexual harassment allegations: https://t.co/H9nIf7fGMR https://t.co/RTuOm8xOTH
2017-11-29,These were the most Instagrammed cities of 2017 https://t.co/sCWa1fHhDF https://t.co/p6hNCRH5yI
2017-11-29,UPDATE: Family of victim in May Long weekend double murder pleads for information https://t.co/5az1OOZviS @ctvkevingreen #yyc https://t.co/nblsMjnHva
2017-11-29,Disney chooses Chinese actress Liu Yifei to play Mulan https://t.co/Dp1QV48Fwx https://t.co/QIacxZ50Qo
2017-11-29,Apple's MacOS High Sierra has critical flaw 'every baby or child' can exploit https://t.co/n7leHUhjKF https://t.co/BHjaaKFGyi
2017-11-29,Alberta Health Services to blame for unauthorized access of Calgary patient’s records https://t.co/QH5wG7ngYP #yyc https://t.co/qppLPU44D9
2017-11-29,Viagra to be sold without prescription in Britain https://t.co/2eo6RH3nsT https://t.co/WMA6u6gEeB
2017-11-29,UN war crimes convict dies after taking poison in court: report https://t.co/cXgZWF9Lgn https://t.co/TjPwjFaRYC
2017-11-29,LIVE NOW: @CalgaryPolice want to speak to two drivers about a double murder case on the May Long weekend: https://t.co/X7GgGzmP24 #yyc https://t.co/V4JPIkTJci
2017-11-29,Some quick thinking neighbours were able to act fast and save a man from his burning home: https://t.co/vJPk4MAwhl https://t.co/DZwLg3P55B
2017-11-29,COMING UP: Police want to speak to two drivers who had contact with a suspected shooter charged in a double murder in May: https://t.co/X7GgGz5dDu #yyc https://t.co/rPQA7tHuUY
2017-11-29,"Price of bitcoin rises above US$10,000 as rally gains pace https://t.co/UdK1Fb0DHp https://t.co/hZwIjKfe1k"
2017-11-29,LIVE DETAILS at 11: Investigators are looking for some vehicles and drivers in connection with a double murder in May: https://t.co/X7GgGzmP24 #yyc https://t.co/2EJTcFFnUg
2017-11-29,LIVE at 11: @CalgaryPolice have details on a development in a double murder from the  May Long weekend: https://t.co/X7GgGzmP24 https://t.co/aVgqSW0Qye
2017-11-29,"Micro-transactions are causing frustration in the gaming community because of their hidden way to increase the cost of a popular game:
https://t.co/BK2AaRtLXV https://t.co/wJPA24UdpA"
2017-11-29,Bali airport reopens despite volcano still spewing ash https://t.co/rUhj0jBKCu https://t.co/5xxLYc44VC
2017-11-29,Calgary police work to identify more individuals and vehicles in May Long weekend murder case https://t.co/xi0BR8mqrt #yyc https://t.co/2lOCw2SziD
2017-11-29,A lobster has won a spot off the dinner plate thanks to its unique colour scheme: https://t.co/VOSZEVWmdY https://t.co/vhaO3KzHue
2017-11-29,"Education rates, commute times and time at work all growing, census shows https://t.co/kIFqWOPm76 https://t.co/SFZWpE3EiE"
2017-11-29,Victims of wire transfer service scams file claims to recoup funds https://t.co/i6EJhQ2DqG @CTVLWDoherty #yyc https://t.co/D8c2sjsJrL
2017-11-29,U.S. President Trump retweets videos purporting to show violence by Muslims https://t.co/eeAkfE9qqo https://t.co/Hg5PjW9X3G
2017-11-29,Trudeau names Sheilah L. Martin to Supreme Court https://t.co/R9UpEKXBWP https://t.co/ZqmlDKk7Hy
2017-11-29,Young drivers brush up on winter driving skills with special course https://t.co/VFerCdCpFb @CTVKevinFleming #yyc https://t.co/JLOeqtzPJV
2017-11-29,"North Korea launches ICBM, may be longest-range test yet https://t.co/9mkBrcJq29 https://t.co/EXR2M23lQ4"
2017-11-29,ICYMI: Public art installation in downtown Calgary underpass draws ire from across the pond https://t.co/3VwILo9bsY #yyc https://t.co/uFCqfHcQDK
2017-11-29,Alberta government says employment is on its way up thanks to boost in oil prices https://t.co/x5Vx11xVdR @ctvkevingreen #yyc #abpoli https://t.co/fs7FyqqgWB
2017-11-29,ICYMI: Fire destroys Sage Hill home and heavily damages two others https://t.co/cvRwOXWsfG #yyc https://t.co/5rOqZidUCx
2017-11-29,NBC fires Matt Lauer over 'inappropriate' workplace behaviour https://t.co/UjYh24gnno https://t.co/8g5s0yE4kM
2017-11-29,WIND WARNING from Environment Canada: https://t.co/7LojZuDAuO  #abstorm #yyc #Calgary https://t.co/EDa6rFcwcB
2017-11-29,WIND WARNING from Environment Canada: https://t.co/7LojZuDAuO  #abstorm #yyc #Calgary https://t.co/JPFjEelpI5
2017-11-29,"What's in store for the weekend weather wise? Get real-time, local forecasts from our experienced team of Weather Specialists w/ the Sky Watch Weather App -
FREE download here... https://t.co/LsVQkmBn3A #yyc #yycweather https://t.co/ECe6PeRXbF"
2017-11-29,"A course that helps young drivers navigate the roads in winter conditions was held at the University of Calgary, @CTVKevinFleming has a look at the Don’t Crash Course ... https://t.co/aBM4ugtw7I #yyc @UCalgary @FordCanada https://t.co/7bVpDwgmcW"
2017-11-29,Victims of Western Union wire transfer service scams can now file claims to recoup funds - More on this story here with a full report from @CTVLWDoherty ... https://t.co/lUzDdDVurS #yyc https://t.co/VYaejeBXwZ
2017-11-29,Sage Hill homes suffer heavy damage in fire - @CTVBradMacLeod has the latest on the investigation into a cause…https://t.co/EZY5wDVawt #yyc https://t.co/CikQcEM7iW
2017-11-29,Tsuut’ina school gets Giving Tuesday gift from Shell Canada - @ctvkevingreen has more... https://t.co/ClG4eiAxY8 #yyc https://t.co/nEziePB7ZI
2017-11-29,"See the full @CTVCalgary News at 6 w @CTVJLaidlaw for Tuesday, November 28, 2017 here:https://t.co/2foGZkMKXP #yyc https://t.co/dP9pdTbdGA"
2017-11-29,"Weather Update: Mild temps for rest of work week, @CTVdavidspence has details… https://t.co/ApiROG4xcj #yyc #yycweather https://t.co/QK9mgjuSmz"
2017-11-29,Several UK-based comedians say their faces are part of the 4th Street underpass art installation that is supposed to portray Calgarians. @KamilKaramali  reports… https://t.co/qUGcpYv3cG #yyc https://t.co/9t3IObDINe
2017-11-29,Victim identified in #Lethbridge suspicious death + two men charged with murder - @CTVAlison reports...https://t.co/UYDnjL3fAj #yql https://t.co/YATer1n3s2
2017-11-29,"Man pulled over for driving with huge Christmas tree on roof, take a look... https://t.co/KBfhnSNudt https://t.co/cbNzTG19Tz"
2017-11-29,Parole granted for 'evil twin' convicted in plot to kill identical twin sister: https://t.co/zhnlh0zbgu https://t.co/yRZw7sDyUt
2017-11-28,"Updated Story | Two men charged with second-degree murder in homicide at Lethbridge home - @lethpolice are looking for Simon Danny Scout, 19: https://t.co/XUNpbK3EB5 #yql https://t.co/9bISHBQ9RN"
2017-11-28,SNOWFALL WARNING from Environment Canada:  https://t.co/7LojZuDAuO  #abstorm #yyc #Calgary https://t.co/NH4YCsH2Pn
2017-11-28,"Bank of Canada flags steady climb of household debt &amp; still-hot housing markets as  financial system's top vulnerabilities, but says it's also seeing some early signs of improvement: https://t.co/nbSI3fQ1Tv https://t.co/F3Npd3BOl4"
2017-11-28,"Second-degree murder charges laid against two men in connection to death at #Lethbridge area home on Monday, more to come... https://t.co/x0ogVhIPD1 #yql https://t.co/MN8qYr1ohS"
2017-11-28,Alberta study shows fecal transplants in a capsule may be as effective as those delivered by colonoscopy: https://t.co/24mZ1yueqi https://t.co/DDbjy4Imxn
2017-11-28,SNOWFALL WARNING from Environment Canada:  https://t.co/7LojZuDAuO  #abstorm #yyc #Calgary https://t.co/nNiJgd4dIG
2017-11-28,SNOWFALL WARNING from Environment Canada:  https://t.co/7LojZuDAuO  #abstorm #yyc #Calgary https://t.co/lRTTohmF0A
2017-11-28,WIND WARNING from Environment Canada: https://t.co/7LojZuDAuO  #abstorm #yyc #Calgary https://t.co/ntQjbwpt2G
2017-11-28,Updated Story | Fire destroys Sage Hill home &amp; heavily damages two others: https://t.co/wNUQABt2yZ #yyc https://t.co/DM0DNKXttm
2017-11-28,"UPDATE: Fire in Sage Hill involves at least three homes -
 @CTVBradMacLeod is at the scene https://t.co/IkBaH1dFfQ #yyc https://t.co/sRzODWz1S2"
2017-11-28,Thieves recorded moving security cameras ahead of massive vodka heist from Los Angeles distillery https://t.co/9DwBCJbCrF https://t.co/X9Ucn7JwnM
2017-11-28,Public art installation in downtown Calgary underpass draws ire from across the pond https://t.co/3VwILnRA4o @KamilKaramali #yyc https://t.co/Ib8W8mvfSN
2017-11-28,BREAKING: Fire breaks out in northwest Calgary community of Sage Hill https://t.co/IkBaH1dFfQ #yyc https://t.co/s5CwffMiVT
2017-11-28,Air Miles raising daily redemption cap to $750 for the holiday season https://t.co/MaCmQ8ppuB https://t.co/371uRM4ya6
2017-11-28,"UPDATE: CFD calls third alarm for fire, now under control, at industrial building in northeast Calgary because of hazardous chemicals inside https://t.co/HOjb7WRgLV #yyc https://t.co/2Jqn4XBRob"
2017-11-28,'I was horrified': Outrage after gravesite decorations wind up 'in the dump' https://t.co/xWY9WzJVUc https://t.co/FZYRgdUCuW
2017-11-28,Tiger Woods getting strong reviews in return to golf https://t.co/gCOUxgVTyr https://t.co/oYW7W5HPYs
2017-11-28,Two-alarm fire leads to evacuation of northeast Calgary building https://t.co/uTMpnMjzd2 #yyc https://t.co/Hc9XtIjfHG
2017-11-28,SNOWFALL WARNING from Environment Canada:  https://t.co/7LojZuDAuO  #abstorm #yyc #Calgary https://t.co/oEODxXuAH7
2017-11-28,SNOWFALL WARNING from Environment Canada:  https://t.co/7LojZuDAuO  #abstorm #yyc #Calgary https://t.co/VYrJlXeuQS
2017-11-28,WIND WARNING from Environment Canada: https://t.co/7LojZuDAuO  #abstorm #yyc #Calgary https://t.co/KPpFcdssNk
2017-11-28,A Winnipeg woman is greatly concerned over a toy depicting an Indigenous person sold at a local store: https://t.co/qPBlTBYyWL https://t.co/ItG6BWb6Ou
2017-11-28,Charities urge people to donate on Giving Tuesday https://t.co/sSZIgLCLfJ https://t.co/w5kgbbFkIB
2017-11-28,Transport Canada has changed the rules on travelling with small knives in your luggage: https://t.co/O649bIQTXM https://t.co/J8TFsc2XOu
2017-11-28,BREAKING: Lethbridge police arrest man in connection with suspicious death https://t.co/s5clDJncmB #yyc #yql https://t.co/7lUwz2uXfg
2017-11-28,Japan on alert as boats thought to be from North Korea found https://t.co/jWS7Naiszn https://t.co/5b3n72FO3A
2017-11-28,Save the date: Royal wedding of Prince Harry and Meghan Markle set for May https://t.co/2chPswVAh9 https://t.co/vmLnqivyW8
2017-11-28,"Student leaders at Dalhousie University say Muslim students are being physically targeted, so they've begun to offer emergency hijab kits: https://t.co/Y0qmQn7j4w https://t.co/LvxGO1y6BS"
2017-11-28,"Man charged in connection with $50,000 drug bust in Brooks https://t.co/3q6eehKwD3 #yyc https://t.co/ePjPZ2lSns"
2017-11-28,Families of Navajo Code Talkers slam Trump's 'Pocahontas' jab https://t.co/LbLJN3JECw https://t.co/2j3xj52p9b
2017-11-28,ICYMI: Homeowner hit with bear spray during break and enter at rural residence east of Calgary https://t.co/MDbPXfi7sy https://t.co/WAQoUk7hoJ
2017-11-28,ICYMI: Appeal by couple convicted in Meika Jordan's death dismissed by Supreme Court https://t.co/gkxiZ27qqP #yyc https://t.co/3OurzRypMG
2017-11-28,B.C. fish processors spewing potentially dangerous bloodwater into key salmon migration corridor https://t.co/FwerPCi4mR https://t.co/KPJKIoObL6
2017-11-28,ICYMI: Carr painting discovered in Calgary exceeds estimate at art auction https://t.co/GkTtCjbDKY #yyc https://t.co/Mt6j9zLUnq
2017-11-28,Calgary Police Service seeks more funding to hire more officers and boost programs https://t.co/06KuEBZOiV @CTVJKanygin #yyc https://t.co/GbJKQWCUJx
2017-11-28,SNOWFALL WARNING from Environment Canada:  https://t.co/7LojZuDAuO  #abstorm #yyc #Calgary https://t.co/AzHI3oyqTs
2017-11-28,Calgary Mayor @nenshi makes good on Grey Cup bet by wearing Argos jersey https://t.co/kd1i792qqX #yyc https://t.co/HQmCP6xjor
