created_at,text
2017-03-24,Kate Middleton opens up about the stresses of motherhood https://t.co/D0zSASHlxd https://t.co/GWYdkGpMoV
2017-03-23,"Military has enough money to do its job, Morneau says https://t.co/817dNyVqUI https://t.co/0nRsuYDmpP"
2017-03-23,Trump's State Dept. to OK Keystone XL pipeline on Friday: sources https://t.co/a0DxNL1DX9 #KXL https://t.co/FPdAYksBG4
2017-03-23,NDP MP from B.C. planning cross-country tour to save electoral reform https://t.co/WgaiA3QNk5 https://t.co/0lIyZzuHw9
2017-03-23,B.C. Liberals' electoral finance reform package doesn't amount to much (blog) https://t.co/9gcjxxBcn9 https://t.co/kUer9gJDl9
2017-03-23,Liberals end Canada Savings Bonds program in federal budget https://t.co/ZulWFFzzmE https://t.co/H2cYRoVL3c
2017-03-23,"Federal budget means higher costs for transit riders, drinkers, smokers https://t.co/s3OAp1GK9n https://t.co/ILqZt4Gr4Q"
2017-03-23,"More daycare spaces, extended parental leave in federal budget https://t.co/5f74EnIXce https://t.co/Q3C9x59NTg"
2017-03-23,More than 140 First Nations still lack access to safe drinking water https://t.co/pj1EpIdYyl https://t.co/gyELP7xvxE
2017-03-23,This might be the priciest home ever listed in Canada https://t.co/o7U2Xpbi94 https://t.co/ViTiWXH0cm
2017-03-23,Indigenous women shouldn't have to live in fear. But they do. https://t.co/BXlMQSYehm https://t.co/VrgilanS4n
2017-03-23,Federal budget has good news for families across the country https://t.co/yZYs4tPV8l https://t.co/rj0Idu9FBw
2017-03-23,Addicts are not having fun. We are simply trying to survive. Blog by @rthexton https://t.co/m3uSPt5ZSI https://t.co/I0Q6VtFURL
2017-03-23,"Trudeau govt. pledges $101M to reduce violence against women
https://t.co/XOVrl3wBIu https://t.co/GKFJJWt9nh"
2017-03-23,"Sears has ""substantial doubt"" about its future survival https://t.co/47YVxK9sXb https://t.co/04eVQin4to"
2017-03-23,"More daycare spaces, extended parental leave in federal budget https://t.co/YWXJ7MQ41E https://t.co/Bh9A7zyGdr"
2017-03-22,Federal budget means bye-bye to public transit pass tax credit https://t.co/eG10JuC49Z https://t.co/Jjx8mMYUXg
2017-03-22,"Liberals dedicate billions to cities, provinces for affordable housing https://t.co/CJzyGfTXCj #cdnpoli https://t.co/hWRK1hIxo7"
2017-03-22,"Watch our livestream of #Budget2017: https://t.co/mZUdZ0lOQk
#CdnPoli"
2017-03-22,Ontario mansion may be the priciest home ever listed in Canada https://t.co/3ncGDFopDX https://t.co/MpIF3we296
2017-03-22,Liberals' 2nd federal budget has little room for new spending https://t.co/D7aWfVpSwM #cdnpoli https://t.co/rBMCjo8sWV
2017-03-22,More than 140 First Nations still lack access to safe drinking water https://t.co/ZKVCYx8lUI https://t.co/LMyxH1rPzy
2017-03-22,U.K. Parliament attacker has been shot by police: House leader https://t.co/kkgR1rIk90 https://t.co/OjlmafVzWp
2017-03-22,"You can soon buy Big Mac, McChicken, Filet-O-Fish sauce in stores https://t.co/wWtGsorD87 https://t.co/sZHg5Am1S2"
2017-03-22,"Federal budget expected to be heavy on policy, light on spending #cdnpoli https://t.co/lIeT9qums3 https://t.co/O6IwdiazSu"
2017-03-22,Tory leadership hopeful says he's running for the 'Canadian dream' https://t.co/fvuvIckTiB #cdnpoli https://t.co/3MluRVxT2Q
2017-03-21,"Refugees crossing over from the U.S. are breaking the law, writes @floracanada https://t.co/MtvhoXUKaO https://t.co/xvwWtro3e6"
2017-03-21,#Starbucks barista reportedly body shamed an 11-year-old girl https://t.co/YMaflISrfO https://t.co/xjvGV7i7V7
2017-03-21,"Trump says NAFTA is ""gonna be an easy one, folks"" https://t.co/369xEPnN7p https://t.co/UP3CXmRjhI"
2017-03-21,Canada slips to lowest ranking yet on the happiness scale https://t.co/mfXyWVBAJ5 https://t.co/2FyXoAzxqa
2017-03-21,Kids from war zones and safe countries share their biggest fears https://t.co/TPHpshATO4 https://t.co/9kviyQTnar
2017-03-21,Unwashed rice can leave alarming levels of arsenic https://t.co/Dx5EuJxT0x https://t.co/XgsyR68Xkt
2017-03-21,Hell hath no fury like hockey parents after team loses by coin toss https://t.co/MiLMRqHXI1 https://t.co/AzcCTwO8IW
2017-03-21,"Start questioning everything about how and why you bank, by @EmilyTheFirst https://t.co/f5xNHxQWvG https://t.co/v62t1bDmQw"
2017-03-21,Our politics podcast looks at federal NDP rumblings to shift party to the left https://t.co/l7f4W1BGHt https://t.co/FGe1i2cUbi
2017-03-21,B.C. will be a bit behind on warming up to spring: Environment Canada https://t.co/etUp4EPIdh https://t.co/yWdrbqUFZB
2017-03-21,Lawsuit claims B.C. Liberals spent millions on partisan ads #bcpoli https://t.co/ovm5H5vrvm https://t.co/DJmh9mXE2l
2017-03-21,Does Canada have an empty homes problem? by @benmyers29 https://t.co/3MaSJ1F9Wx #vanre https://t.co/lMKJwFdeiS
2017-03-20,Canada slips to its lowest ranking yet on the happiness scale https://t.co/aLDLGVa9v1 https://t.co/MaaVxRf9a3
2017-03-20,Cardboard cut-outs of Trudeau banned at Canadian government offices in U.S. https://t.co/zVeZGQlP5P https://t.co/ss76169LON
2017-03-20,"Don't write the obituary on winter quite yet, warns Environment Canada https://t.co/ozLPW1K3wL https://t.co/oHhKD0Zk4k"
2017-03-20,.@sesamestreet to debut new muppet who has autism https://t.co/BF4OFlskiP https://t.co/36ZTGGYO7d
2017-03-20,"Union veteran says NDP must go left, inches closer to leadership bid #cdnpoli https://t.co/i9eUAfbf84 https://t.co/GBE8RP3KM9"
2017-03-20,Outsider Tory leadership hopeful: 'I'm going to win a majority' https://t.co/o8LoqoZUlE #bcpoli https://t.co/0QVjjlCbAP
2017-03-20,"NDP needs a leader who supports workers. Peter Julian isn't it, by @DougOHalloran https://t.co/IQiFwvyDTG https://t.co/MbQlCfHHhS"
2017-03-19,Why TD Bank is losing me as a customer after 30 years (blog) https://t.co/tylui01OdO https://t.co/7882rzCWdI
2017-03-19,"Nelly Furtado, a child of immigrants, was told to 'go back to Portugal' https://t.co/0VfKUETaHE https://t.co/DjzJRLDGXa"
2017-03-19,"Ways to oppose Trump's agenda as a Canadian, by @kinsellawarren https://t.co/SOtdVELkGK https://t.co/zGzSQk3Kzr"
2017-03-19,End the unfounded paranoia around minors scoring marijuana: @danalarsen https://t.co/2ihA1y52kg https://t.co/GoGd1bNy3d
2017-03-19,Pretend to have your sh*t together with these simple cleaning tips https://t.co/Nfs8LsrQvj https://t.co/ylBbcdHTix
2017-03-19,Gillian Anderson wants to end the shame around menopause https://t.co/KmKf20e1TB https://t.co/IgRO1rZPeU
2017-03-19,Where rents are rising and falling in Canada https://t.co/ZwyAhZARTm https://t.co/sK0ssX9ZL7
2017-03-18,Gord Downie lends his voice in dreamy 'Anne Of Green Gables' opening https://t.co/raXTMv62lO https://t.co/0CKIys5MrQ
2017-03-18,Jason Kenney voted leader of Alberta PCs https://t.co/akxmlEn6t3 #pcldr https://t.co/5QLpA13cTK
2017-03-18,"Canadians have really good bullsh*t detectors, says @BaruchelNDG https://t.co/NGGNT6mGwW https://t.co/3juG0XaDdC"
2017-03-18,Things your Asian mom tells you every single damn day https://t.co/EWkeh92TE4 https://t.co/TEa3NsodTR
2017-03-18,40% of Canadian workers would take a pay cut for progress https://t.co/fN4jv4iyKm https://t.co/waHxw3QrTn
2017-03-18,The top-paying jobs that are hiring in Canada's major cities https://t.co/wmfGf5vngU https://t.co/rkYSB4xvWw
2017-03-18,"John Horgan is Christy Clark's polar opposite, by @waitinginBC https://t.co/HmvcsFxDpN #bcpoli https://t.co/XCk2Y8uJAl"
2017-03-17,"Wake the f*** up to what your teen's doing on their phone, by @ImLisaO https://t.co/pg5RydyUQS https://t.co/fzkjPdebxu"
2017-03-17,"Shut down B.C. lottery's annual taxpayer-funded spending binge, by @jordanbateman https://t.co/b46gmNIfPn https://t.co/E9HAjhh8M0"
2017-03-17,#Riverdale stars take advantage of shooting in #Vancouver https://t.co/VNe0zO8mBu https://t.co/OShTHjmnVw
2017-03-16,"Nelly Furtado, a child of immigrants, was told to 'go back to Portugal' https://t.co/piu279mbHa https://t.co/qHWTlaeOJM"
2017-03-16,Where rents are rising and falling in Canada https://t.co/8pOrxdrTNH https://t.co/hP4z3rAj1x
2017-03-16,"Together, First Nations defeated Enbridge. Kinder Morgan's next (blog) https://t.co/epanC2mgRd https://t.co/LUBKKw4akx"
2017-03-16,Former B.C. Conservative organizer now aims for federal Tory top job https://t.co/BYeqriyeGK #bcpoli https://t.co/EbgSBqtox3
2017-03-16,Cyberbully accused in Amanda Todd case gets 11 years in Dutch prison https://t.co/RzgLJV6pPK https://t.co/4Pjpcx3nSV
2017-03-16,"End the unfounded paranoia around minors scoring marijuana, by @danalarsen https://t.co/0ZA6w3fWzI https://t.co/r7Pl0uuFrP"
2017-03-16,#Vancouver remains the priciest city in Canada to rent an apartment https://t.co/jMVmOc1zwN https://t.co/sqoHio87Pu
2017-03-15,B.C. teen charged in child pornography case involving Texas boy https://t.co/X6XYxqoL1v https://t.co/PkuuMCHhf3
2017-03-15,2 American snowshoers presumed dead in Lake Louise avalanche https://t.co/fUcf7Bp43k https://t.co/tx4QX1eyVu
2017-03-15,"10 ways to oppose Trump's agenda as a Canadian, by @kinsellawarren https://t.co/qhTixZW5Wx https://t.co/0b40w0Enx5"
2017-03-15,Russian hacker charged in Yahoo breach detained in Canada https://t.co/yEqba9xu4x https://t.co/kbk0cxPVeT
2017-03-15,"'Yes, I was wearing pants,' dad from viral BBC interview confirms https://t.co/k2OaUQXdOW https://t.co/Y4EvHrMDiq"
2017-03-15,"Canada has among world's highest rates of ""severe"" rental rates https://t.co/YOT51JnFO3 https://t.co/zWqP8ILcze"
2017-03-15,"Shut down B.C. lottery's annual taxpayer-funded spending binge, by @jordanbateman https://t.co/V5oe3GUhVS #bcpoli https://t.co/9yeoysEfAd"
2017-03-15,"Blog: Please stop arresting marijuana activists, for Canada's sake https://t.co/nqVhswL36Q https://t.co/1bHdoaMm2w"
2017-03-15,#Vancouver businessman has 'radical' tax proposals in Tory leadership bid https://t.co/L0wUZoJf9s https://t.co/qYjO9OC2Xa
2017-03-15,"John Horgan is B.C. premier's polar opposite, by @waitinginBC https://t.co/gJIw6aiuWk #bcpoli https://t.co/BktaAPQ0S3"
2017-03-14,Canadian sex toy maker to pay millions over tracking of users https://t.co/2tEob4XzMv https://t.co/kAJ1sUMahv
2017-03-14,"Canada has among world's highest rates of ""severe"" rental costs https://t.co/vygz44dDHO https://t.co/N5OAcq1Bjx"
2017-03-14,These are the only vegetables you should buy frozen https://t.co/o9SDCIZSFz https://t.co/mbeRnAQv9L
2017-03-14,"If you like cruises, definitely don't watch this video of a cruise ship in a hurricane https://t.co/v7we8AwM9c https://t.co/GJzNdXS9OU"
2017-03-14,"'Save a dog, eat a Chinese' is disgusting display of racism https://t.co/mXRGe2jX2F https://t.co/s1ko1ijYo1"
2017-03-14,"Please stop arresting marijuana activists, for Canada's sake (blog) https://t.co/i7xdZELkKM https://t.co/EN1iZvWKFd"
2017-03-14,B.C. inmate says guards attacked him https://t.co/zpanaDDY2t https://t.co/pTdmZFAGy7
2017-03-14,B.C. premier supports bill to end forced high heels in workplaces https://t.co/C7OqWT8Ilz https://t.co/GzAWprNUgt
2017-03-14,Things your Asian mom tells you every single damn day https://t.co/zFB84Msync https://t.co/i8TBi28EV1
2017-03-14,The top-paying jobs that are hiring in Canada's major cities https://t.co/BtlUK9DkXX https://t.co/VHXJktLBy9
2017-03-14,B.C. inmate says guards attacked him as 'going away present' https://t.co/sdaNsnvZOb https://t.co/36YwQaJhTV
2017-03-14,Irish last names that make great first names https://t.co/67CgKxD62Z https://t.co/ZlrqpPHmPs
2017-03-14,"Dear #Toronto, please stop freaking out about the tiniest amount of snow, by @mmmbutters https://t.co/joZA63PT2k https://t.co/WLpYiGEliH"
2017-03-14,► Avalanche sweeps Whistler skier off a cliff https://t.co/4zoxmrLcbF https://t.co/zydmtSKJsS
2017-03-13,Bill to stop forced high heels in workplaces introduced in B.C. legislature https://t.co/2muw4PlU3E https://t.co/RFkt314M6U
2017-03-13,Air Canada now lets customers bid for a fancier seat https://t.co/17esf0fRXE https://t.co/h61osrKrsm
2017-03-13,18 healthy kids' snacks you can take on the go https://t.co/MjWT32d4Iq https://t.co/V4nxKWxkbN
2017-03-13,The #CdnScreenAwards were SO Canadian https://t.co/sxcEictK7F https://t.co/HlDsch9aNx
2017-03-13,"B.C. premier vows to end mandatory high heels in workplaces https://t.co/66Rp1xt4J2
 #bcpoli https://t.co/gD5oLqMIpw"
2017-03-13,CRA website back online after shutdown due to threat https://t.co/Lcl7viVZdN https://t.co/qasRcMmW2u
2017-03-13,Remember Bingogate? Blog by @kinsellawarren https://t.co/rW23PHS729 https://t.co/Z1h0x03J4r
2017-03-12,Researchers invent a sponge that could transform oil spill cleanup https://t.co/M19Q6kLJgG https://t.co/dI5Rc03yDY
2017-03-12,"Dear Minister Hussen, Len Van Heest deserves Canada's compassion: @ujjaldosanjh https://t.co/DvTfm6ZifB #bcpoli https://t.co/40RsR7DaG0"
2017-03-12,Award-winning Ojibway author Richard Wagamese dead at 61 https://t.co/haxeLSx4h4 https://t.co/owtViirX5X
2017-03-11,Elton John spends a day off in Vancouver shopping for records  https://t.co/Tlt3yhdtnZ https://t.co/7eoVORm2o2
2017-03-11,PM @JustinTrudeau reflects on his town hall tours https://t.co/WdzlnKqCoE #cdnpoli https://t.co/Gv2MbnE7cI
2017-03-11,3 expert tips for helping your kid adjust to daylight saving time https://t.co/A5RuAn9FRn https://t.co/TrJ5WoutD8
2017-03-11,Family travel hacks all parents need to know https://t.co/9z3HEZuqgA https://t.co/OLa1FSPc2A
2017-03-11,Canada's unemployment rate drops to lowest level in more than 2 years https://t.co/yB0cGX4azY https://t.co/aliqHYk7G4
2017-03-11,"Why mumps has made a comeback, by @JATetro https://t.co/nKoBYK9WFG https://t.co/UQ00ZCZrA9"
2017-03-11,"Parks Canada insults all indigenous actors with film's rejection, by @emma_prest https://t.co/kVvmdU7ZGS https://t.co/LIjdMIswrG"
2017-03-11,Acclaimed Ojibway author Richard Wagamese dead at 61 https://t.co/jhGVy6HLf9 https://t.co/JcY8pRMopO
2017-03-11,"Don't take any civics lesson from the BC NDP, writes @kinsellawarren https://t.co/hZcs1LlCBI https://t.co/QrjWhqZj60"
2017-03-11,"Canada's largest national park threatened by energy development, poor management: UNESCO https://t.co/GOTTuBScJC https://t.co/NOk8HOX8LG"
2017-03-11,"Dear Minister Hussen, Len Van Heest deserves Canada's compassion, by @ujjaldosanjh https://t.co/Em8wTaHGrq https://t.co/OPUmpVdkX6"
2017-03-11,Expert tips for helping your kid adjust to daylight saving time https://t.co/y1U6yct6Vw https://t.co/95FaOe1M2E
2017-03-11,"How does Elton John spend time in Vancouver? Shopping for vinyl, obviously  https://t.co/DU7cUPL46X https://t.co/dUGlIt5oas"
2017-03-10,"We won't always agree, but keep the tough questions coming, by @JustinTrudeau https://t.co/G8Y8X0sEsU #cdnpoli https://t.co/MX1x8w2lws"
2017-03-10,"'Prince of Pot,' wife charged with drug trafficking https://t.co/0Q4HvOv3r8 https://t.co/rBZG3yvGdN"
2017-03-10,"Canada added more jobs last month, and they're not all part-time https://t.co/d9I8toTzz3 https://t.co/w5tNLCgK9a"
2017-03-10,"Marc, Jodie Emery arrested as pot stores raided nationwide https://t.co/28mmkhXS3u https://t.co/3a8wjE7XuR"
2017-03-09,"Nelly Furtado: Women, we're not done yet #IWD https://t.co/hHEQt0w5Kx https://t.co/WvkjGmzI1r"
2017-03-09,Supreme Court of Canada allows lawsuit against Trump to go forward https://t.co/w4GG3M3s7V https://t.co/wrHStygy4K
2017-03-09,"Americans may ditch Wi-Fi for unlimited data. Your move, Canada https://t.co/ju4seSnojn https://t.co/9RbOOnD5DM"
2017-03-09,Prince and Princess of Pot arrested as stores raided nationwide https://t.co/QU4lyFmrRG https://t.co/RRlRuMjzfh
2017-03-09,People can't stop comparing this Dutch politician to Justin Trudeau https://t.co/BZq8TzjJ35 https://t.co/ohtypKS2uv
2017-03-09,Leitch's pepper spray policy won't protect women: @wavawrcc https://t.co/WeDkwbO3LD #Vancouver https://t.co/8AVNwp68Q2
2017-03-09,These 7 films made by indigenous women are 🔥 https://t.co/E1mN45hU9K #IWD2017 https://t.co/Bh5e617o9r
2017-03-09,Premier @christyclarkbc blogs on #IWD https://t.co/iYsDXC3pO2 #bcpoli https://t.co/ddbyd6G6sX
2017-03-09,338 young women took over Canada's Parliament and it was glorious #IWD2017 https://t.co/wvjcGKB3dk https://t.co/oVaPRPUwrc
2017-03-08,Renting vs. buying? Even average earners can do both https://t.co/OJS2ClhLmd https://t.co/xoKSBlpIx3
2017-03-08,Leitch's pepper spray policy won't protect women: #Vancouver rape crisis centre https://t.co/LhXy5NoHiP https://t.co/toTVMaaDgP
2017-03-08,Canadian weed stocks lose hundreds of millions after Liberal comment https://t.co/HeDHbOmMWt https://t.co/jpD3XVknta
2017-03-08,"Equality starts with giving women the confidence to compete – and win, by @christyclarkbc https://t.co/iWii45HQ56 https://t.co/k3RUUQ8v2C"
2017-03-08,"B.C. MP returns to House after stroke, and rips into Trudeau https://t.co/gPH3KkOqvd #cdnpoli https://t.co/1IbDJC6izC"
2017-03-08,Sophie Grégoire Trudeau says women should embrace men on International Women's Day https://t.co/ggh98PePai https://t.co/Ahq6biLiin
2017-03-08,Chinese searches for #Vancouver homes plunged 80% last summer https://t.co/Wmgw4zST5D https://t.co/Og8ptmBJlG
2017-03-08,'Robot lawyer' helps refugees apply for asylum in Canada https://t.co/uTonlizNYf https://t.co/fzxqAuWDrc
2017-03-08,Researchers invent a sponge that could transform oil spill cleanup https://t.co/XvEs3Miyyw https://t.co/ml5Nj800uF
2017-03-08,B.C. MP who suffered stroke receives rousing welcome back to House https://t.co/SEs9s6p0s8 #cdnpoli https://t.co/hxk4hxSGWI
2017-03-08,Researchers invent a sponge that could transform oil spill cleanup https://t.co/Itow7Eig4y https://t.co/c2jyKDyYiG
2017-03-08,#Chilliwack security cam has front-row seat to drivers in the snow https://t.co/nyy5r3xCOj https://t.co/RAS3jcrOp5
2017-03-08,Uber is coming to B.C. this year https://t.co/QQG8xqGLXP https://t.co/8oE4ZrzNQs
2017-03-07,Sophie Grégoire Trudeau says women should embrace men on #IWD https://t.co/ymuVOgMdvu https://t.co/49Ka2aixmP
2017-03-07,Chinese searches for Vancouver homes plunged 80% last summer https://t.co/MR7TgwgPIc https://t.co/kYfRFtHdBS
2017-03-07,"Rectal marijuana is more effective than smoking joints, says doctor https://t.co/tJimmnYOX9 https://t.co/PyE4LHDx88"
2017-03-07,Royal LePage report highlights striking inequality of Canadian house prices https://t.co/azUeiZNvfO https://t.co/hlt4FUIe1Q
2017-03-07,Security cam has front-row seat to B.C. drivers in the snow https://t.co/yPyTrKupnT https://t.co/IhJcXpfOz5
2017-03-07,"Nothing says ""get off my lawn"" like severed elk heads https://t.co/yCO8KTmRpM https://t.co/YpQpQF2Exx"
2017-03-07,"Here's the reason mumps has made a comeback, by @JATetro https://t.co/VEAH8zKhtE https://t.co/nFxCyR6yBm"
2017-03-07,#Vancouver engineer killed in #Whistler avalanche https://t.co/jTPg4RCNSQ https://t.co/CpLKZjLBuC
2017-03-07,RCMP commissioner to step down https://t.co/mbgP9R9mAo https://t.co/o7etaofqNG
2017-03-07,"Lawsuit filed against ""unconstitutional"" BC foreign buyer tax https://t.co/qUK756UxhW https://t.co/7Co3oynbHU"
2017-03-06,Feds to extend Ukraine mission until 2019 https://t.co/6WtnkLhqAi https://t.co/cdlCK37bTF
2017-03-06,5 foods you shouldn't avoid if you want to lose weight https://t.co/gzlxmfNSK5 https://t.co/gH7C4s0t8z
2017-03-06,"Refugees denied by U.S. ""regularly"" accepted by Canada: lawyer  https://t.co/jFfJ2qwRRP https://t.co/uGazggsrPd"
2017-03-06,Fundraiser set up for #Whistler avalanche victim's young son https://t.co/7F3B79U2Q5 https://t.co/4wL6kLh1Nk
2017-03-06,"$1 million can score 4-bdrm, waterfront Halifax home, but in #Vancouver... https://t.co/rb1Sjd9BgN https://t.co/TPyF01ZOiD"
2017-03-06,Rectal marijuana is more effective than smoking joints: doctor https://t.co/Q2PdAYLLNd https://t.co/67SaxHZXom
2017-03-05,"Avalanche near Whistler leaves 32-year-old dead 
https://t.co/XvU5jV52Oa https://t.co/SLWX4OVDd1"
2017-03-05,Repaying government loans is a burden on refugees: B.C. MP #cdnpoli https://t.co/PEfA9f1DNU https://t.co/dO5lNI8tTY
2017-03-05,Canada's 100 best restaurants https://t.co/wOQU3MxIH7 https://t.co/wJ960vxkFU
2017-03-05,Want to stop Canada's #Fentanyl overdose crisis? End drug prohibition https://t.co/W3x6b1fzKi https://t.co/Zqu6WvL522
2017-03-05,You're (not) hired: The top 10 scams targeting Canadians https://t.co/f31f3DwIhd https://t.co/TSFHMeDYN8
2017-03-05,The surprising cities Canadians are leaving https://t.co/ivn99MIT2k https://t.co/Bj8dSQXM1s
2017-03-04,"Halifax sex assault victim couldn't give consent. A judge gave it for her, by @GlenfordCanning https://t.co/TiqkrF5GxU https://t.co/gCzGLLKHBI"
2017-03-04,Gross new study confirms what you thought about pee in public pools https://t.co/7VPtWmzzvx https://t.co/fEPPj6HZK0
2017-03-04,Podcast: What's going on with the Tory party? https://t.co/5NdzuBP0wa #cdnpoli #followup https://t.co/4sOAVEby6a
2017-03-04,#Canada has the world's fastest-growing population of super-rich https://t.co/xEqT8uvLzd https://t.co/RiOaAWJGJg
2017-03-04,Canada's millennials getting shut out of homeownership https://t.co/jYtQg1N2IH https://t.co/j172fhVqMn
2017-03-04,"Government loans ""handicap"" refugees trying to start over in Canada: advocate #cdnpoli https://t.co/NzleRGjnzS https://t.co/vvAvTS2Xka"
2017-03-04,Should landlords be able to deny tenants the right to grow pot? by @jennav5 https://t.co/u59SaGhreB https://t.co/UrC8hMHZgo
2017-03-04,Trudeau: Opioid crisis is devastating families across Canada https://t.co/29IVxcDdvV https://t.co/TetdvrKr5S
2017-03-04,Want to leave a comment? This news site wants you to answer a quiz first https://t.co/57wuHrEbmD https://t.co/vgXuLzf7IH
2017-03-04,"Direct action against pipelines is more important than ever, writes @ArezaNaraghi https://t.co/38v3fablPR https://t.co/9IuXyjokOG"
2017-03-03,Family travel hacks all parents need to know https://t.co/ysgHiYMyr1 https://t.co/TrszPCy8GP
2017-03-03,Kellie Leitch suggests her video went viral because it was so good https://t.co/9Q26mWVHmn #cdnpoli https://t.co/a6ht8lliEx
2017-03-03,European politician shuts down sexist jerk she has to work with https://t.co/1petGwq55H https://t.co/UzOdzC2gYR
2017-03-03,More than 130K Canadians demand Liberals keep electoral reform pledge https://t.co/4O4lihgBzQ https://t.co/52iCkb9Dk2
2017-03-03,Marijuana is the only illicit drug gov't will legalize: Trudeau https://t.co/Db2H04xc1q https://t.co/ucjD9ZJ7Yp
2017-03-03,Boy gets the same haircut as his friend so you can't tell them apart https://t.co/S3JXOWiv73 https://t.co/0AZW0vmI4A
2017-03-03,Here's how you can stop body shaming https://t.co/g2uG5jDI7T https://t.co/6rXKBEefdW
2017-03-03,"Clark's '5 conditions' concealed support for B.C. oil projects, by @raincoast https://t.co/tdbSCcDn4x https://t.co/Mo9Szjis1B"
2017-03-03,Canada's 100 best restaurants are worth the wait https://t.co/qfoyhyfAnT https://t.co/Q26lAeVqHM
2017-03-03,"Canada ranks 1st on Internet affordability, says new index https://t.co/QxOr59seyc https://t.co/sLQ2p8jzRl"
2017-03-03,Zamboni driver who tried to plow snowy street recognized in B.C. legislature https://t.co/HyakpElkGI https://t.co/gxJxnTIPiQ
2017-03-03,Marijuana is the only illicit drug gov't will legalize: Trudeau #cdnpoli  https://t.co/TQCHCVlE2q https://t.co/5RCJmAzHPK
2017-03-03,Gross new study reveals the truth about how much pee is in public pools  https://t.co/CDkhOhnOBr https://t.co/M4xIVMlBn8
2017-03-03,Canada's economy finished 2016 with a bang https://t.co/JeXEEy4pnK https://t.co/PFkuwYNluM
2017-03-03,You're (not) hired: The top 10 scams targeting Canadians https://t.co/0PKYaS9USn https://t.co/XQWuXfTCdc
2017-03-02,"Refugees rely on welfare, odd jobs to repay debt to federal gov't #cdnpoli https://t.co/Ht27Y810e7 https://t.co/xbeRFR58Qg"
2017-03-02,Missing Alberta sisters found alive and well 30 years later https://t.co/T1nTQRSpik https://t.co/vrhqpyzi97
2017-03-02,"Canada ranks 1st on Internet affordability, according to new index https://t.co/VzOprr3ne6 https://t.co/7pSiXhRasD"
2017-03-02,Want to stop the #Fentanyl overdose crisis? End drug prohibition https://t.co/bpjGgXhPFb https://t.co/JCkuJSvtCE
2017-03-02,Photos show accountant distracted on phone moments before Oscar fiasco https://t.co/7bezVqgSsK https://t.co/jLI9yhEeiW
2017-03-02,Tinder issues lifetime ban to man who hurled racist slurs at Asian woman https://t.co/yhqXOcLvBZ https://t.co/BJ2jyCn643
2017-03-02,Only in Canada would a Zamboni driver be recognized in a legislature https://t.co/cVgmRyryDF https://t.co/diKB4Utgh6
2017-03-02,Poll on measurement in Canada shocks no one https://t.co/mTNpPBVqi2 https://t.co/xKfi03x4kx
2017-03-02,Justin Trudeau took a break to dab with school kids https://t.co/NxfCCVGN4v https://t.co/J3rOmtmCEk
2017-03-02,The surprising cities Canadians are leaving https://t.co/otdFXNUXcq https://t.co/E5cyIWTwPW
2017-03-01,Canada's banks resist proposal for them to carry more of the risk of mortgage lending https://t.co/ChwsSG7Duw https://t.co/XWzJKALenn
2017-03-01,Canada's millennials getting shut out of homeownership https://t.co/Nyxyggd8x9 https://t.co/uSasDJvd2Y
2017-03-01,5 ways federal NDP leadership hopefuls can spark some dang excitement https://t.co/PiKJ1utgwr https://t.co/6RzqQEg6Gi
2017-03-01,"When #Vancouver residents move, they prefer #Toronto https://t.co/7bO1Oxa6uS https://t.co/jfaCAUzmx7"
2017-03-01,Trump gives Trudeau a shout-out in 1st Congress speech #cdnpoli https://t.co/VBbVkg94XB https://t.co/0cBMzu3gin
2017-03-01,Video emerges of Uber CEO lashing out at driver about fares  https://t.co/3YJibPxeAf https://t.co/OL78hLbBek
2017-03-01,Read the full apology for the #Oscars Best Picture mixup https://t.co/cscOwNa5H6 https://t.co/tguvH7l76P
2017-03-01,"Clark's '5 conditions' concealed support for B.C. oil projects, by @raincoast https://t.co/1CDSEytJ1S #bcpoli https://t.co/EZkFEBRmFV"
2017-03-01,"Scotiabank CEO predicts housing correction for Toronto, Vancouver #TorontoRE #VanRE https://t.co/AifSUQbdq8 https://t.co/ICg9YmZ2CE"
2017-03-01,Nearly half of Canadians say they'd boycott Trump products https://t.co/DOxZWYWkkw https://t.co/QKJU78F8Od
