created_at,text
2017-08-31,Why are we so obsessed with the placenta anyway? https://t.co/0bNHDslkU7 https://t.co/lFDUnMzcN2
2017-08-31,Meet the Vancouverite who gives 'triage' to white supremacists and neo-Nazis https://t.co/RiYOFm0wXT https://t.co/PbXL8WTUj9
2017-08-31,CMHC mortgage insurance plunges 33% after new rules https://t.co/Ii5fKAV0Rd https://t.co/UfLdtpIhpi
2017-08-31,Kellie Leitch shut out of Conservative shadow cabinet https://t.co/ojsov2lLGV https://t.co/d7iS3LS6Jw
2017-08-31,CIBC report calls for overhaul of Canadian education https://t.co/EcVFdaBOIt https://t.co/xF4AiR8tMn
2017-08-30,This is what Prince Charles really wanted to name William and Harry https://t.co/Q9ST4IUw4b https://t.co/PTD30NNYRJ
2017-08-30,"It's no sure thing for Jagmeet Singh, NDP membership numbers show https://t.co/z8IUTPGbEO https://t.co/Py8oMqcTqd"
2017-08-30,I am grateful that my son is gay (blog) https://t.co/3bbtRRxUNu https://t.co/u37mCcJVFx
2017-08-30,These are the industries doing the most hiring in Canada https://t.co/FBLwWaEHKX https://t.co/5ZGvdJOfPS
2017-08-30,'Dancing With The Stars' is getting a dose of 'Property Brothers' this season with @MrDrewScott https://t.co/ClNTRDRfA3 https://t.co/DgAZDuIruH
2017-08-30,Trudeau appoints acclaimed writer to Senate https://t.co/FxhA7FgKQd https://t.co/p1Qpz24Yd7
2017-08-30,"HBC scrapped a Confederate plaque, but that wasn't their only option (blog) https://t.co/hkOGqZx8xj https://t.co/zQHa1phOTZ"
2017-08-30,Indigenous affairs split ‘doubled the colonial structures’: Pam Palmater https://t.co/3bS7YBwCmC https://t.co/cT4tmlB3Xl
2017-08-29,Everybody needs to chill about Trump's NAFTA threats: Trade minister https://t.co/TfYSPKoHrM https://t.co/3YejAYlRbc
2017-08-29,How to talk to your kids about drugs without sounding like a PSA https://t.co/JfOQ2zl63n https://t.co/wNkEtaguxV
2017-08-29,Honour Indigenous heroes instead of debating John A. Macdonald: Senator https://t.co/Wu5VXPL2wZ https://t.co/pfBlegqdvw
2017-08-29,Beards and moustaches can protect you from the sun's UV rays https://t.co/IqtJAlG67e https://t.co/v8RU7emyiO
2017-08-29,These are the top-paying jobs you can get without a university degree https://t.co/KLk5tz2n4m https://t.co/qjVGiJRoAb
2017-08-29,Pension fund dumps stocks because ‘there is no president in the U.S.’ https://t.co/5jFXynVjcC https://t.co/D3bKDMG2Ei
2017-08-29,"Kindergarten teacher reads book about trans girl, parents flip out https://t.co/IyPbCIEwZS https://t.co/LsI6XhsOLU"
2017-08-29,Priority boarding could be bad for your health https://t.co/5GDPNt30aO https://t.co/QwBFcbKuOI
2017-08-29,"Hate is hate is hate. That's why we're stronger fighting it together, by @ShimonFogel https://t.co/s7jUbqhL0Y https://t.co/wz9KQjCCWM"
2017-08-29,"Canada's health-care system has an expiration date, by @TimPaziuk https://t.co/ezJX8iNUKe https://t.co/B5D9gmmajh"
2017-08-29,"5 tips to help you learn Japanese, from @lingosteve https://t.co/vFQkqLjRLu https://t.co/Z4Hg6Y4gps"
2017-08-29,Bruce Springsteen signs on to help close Prince Harry's Invictus Games https://t.co/lMAACNxO8V https://t.co/y8aNzSRApn
2017-08-29,"Harvey could slam the U.S. economy, and not just the oil business https://t.co/jVCTPXW7sw https://t.co/Ix7PPwpUXA"
2017-08-29,"'I will not lose,' Jagmeet Singh tells rival at Montreal debate https://t.co/C8g1SxFufF https://t.co/BK0T3f6T9C"
2017-08-29,"He came to Canada as a refugee with nothing. Now 97, he's still creating. https://t.co/eyvV720GUT https://t.co/1sRFFxlJGc"
2017-08-28,.@TheRock invites kid who saved brother to visit him in Vancouver https://t.co/eMQRPlypie https://t.co/2dcoi1UX5s
2017-08-28,UN panel says Site C Dam will 'irreversibly damage' Indigenous lands https://t.co/oqNPswEQVe https://t.co/FYbIMLAGCj
2017-08-28,Canadians shouldn't read into Trump's NAFTA threats too much: U.S. Governor https://t.co/HOjgUt9PkW https://t.co/LK5w6wgMyc
2017-08-28,Feds seeking 'substantive' rehaul of Indigenous Affairs department #cdnpoli https://t.co/wdWAy7fzn0 https://t.co/bC0IChFMPV
2017-08-28,Vancouver teen hit in 'serial' egging suffers major eye injury https://t.co/K423yB2zKo https://t.co/wYBakB43cl
2017-08-28,Canadian gas prices expected to rise in Harvey's wake https://t.co/5b4r4y6GUA https://t.co/P5Nw1hKLru
2017-08-27,Three-generation homes aren't easy for millennials caught between cultures https://t.co/w6cjDW68PI https://t.co/BGo9TQXX3L
2017-08-27,Jagmeet Singh opposes Quebec’s religious neutrality bill https://t.co/Wb234Luv2C #cdnpoli https://t.co/386NYVG5q3
2017-08-26,Tories aren't saying if all ties to Rebel Media are cut https://t.co/QrTHjK9c0W https://t.co/T4OVHkdv5n
2017-08-26,Liberals are lying to would-be asylum seekers: refugees group https://t.co/1o8xitpinl https://t.co/ocAZaJYaQQ
2017-08-26,The least visited country in the world is a hidden gem https://t.co/HUVtGUwWKT https://t.co/n5nuKT0Y7K
2017-08-26,"Hey runners, reduce your risk of injury with these 3 moves #TheQuickFix  https://t.co/c2s8uHJxhl https://t.co/tl5CdrP6Xr"
2017-08-26,Feds must face 'true history' of Canada's key figures: Indigenous activists https://t.co/DvE2SBqBT6 https://t.co/JNEs216SYj
2017-08-25,Senator says personal attacks about dead husband cross the line https://t.co/4kr39g5Xoj https://t.co/NmECwYBO7L
2017-08-25,Teen sent a letter on mental health to every MP. Only 40 replied. #cdnpoli https://t.co/KNU3u50lVU https://t.co/K63WBFg5a4
2017-08-25,"Indigenous millennials like me feel torn between two worlds, by @dariandoblej https://t.co/l4tnje4eQg https://t.co/B2sbMPYUtx"
2017-08-25,Wildfire near Kelowna likely caused by humans https://t.co/iuKrvYVKdr https://t.co/iYFeH0w500
2017-08-25,Canada will soon allow gender-neutral passports https://t.co/9Ugu5PRy0c https://t.co/xunEGc84es
2017-08-25,"Who let the dogs out? @yvrairport now has therapy dogs

https://t.co/DK6c4sLFIL https://t.co/qS2vDQPGQC"
2017-08-25,Canada has plenty of colonial memorials we could remove (blog) https://t.co/VmsiLRVyf8 https://t.co/jnxYAZXdTS
2017-08-25,The least visited country in the world is a hidden gem https://t.co/RWOAfnx6wi https://t.co/BY2C4pFUYi
2017-08-25,Canadian tourist on a pizza run gets caught in deadly shooting https://t.co/LPSc4GEqyP https://t.co/R88FNBcz7b
2017-08-24,"Ruff flight? @yvrairport now has therapy dogs

https://t.co/OuxckXWlaH https://t.co/C1wpECCK4A"
2017-08-24,Globe and Mail's Beijing correspondent briefly detained In China https://t.co/cENcfq1dEQ https://t.co/Oox9meGnUg
2017-08-24,Teen defends elderly Filipino couple against 'disgusting' racist rant https://t.co/XgLFjxghRO https://t.co/51cdS5Pq1H
2017-08-24,Religious rights debate may polarize NDP leadership race https://t.co/JfsIYaXgOb https://t.co/fYTbrAnHmQ
2017-08-24,Trudeau couldn’t resist cracking a new joke about him being shirtless https://t.co/A4KLmO7dIo https://t.co/nfOJgf2iiW
2017-08-24,Angry Air Canada CEO refuses to talk about passenger bumping https://t.co/sZ0MLNAZhu https://t.co/ZU1kYgZR2H
2017-08-24,"B.C. tech companies lure employees with ""vacation bonuses"" and 5-hour workdays https://t.co/Tgav3Kb7Hk https://t.co/zd6ZIm7QnP"
2017-08-24,The city Canadians think is safest actually has a rising crime rate https://t.co/Svj3zw07yi https://t.co/mfzWediyFk
2017-08-24,"There’s only one thing a Confederate flag can mean in Canada, by @nicholasmizera https://t.co/T7vBu9Oq6B https://t.co/YhmaeXOwwX"
2017-08-24,See the awful toll wildfire took on Kootenay National Park https://t.co/VNvJsQLooP https://t.co/40pKbXLnaU
2017-08-24,You can spot a 2017 wedding from miles away https://t.co/fIWByesC0I https://t.co/XfYLcgJ8bm
2017-08-24,It's disturbing who the B.C. government is giving tax breaks to (blog) https://t.co/MBRLSjP7Wd https://t.co/AXmTW5WuGd
2017-08-23,ESPN removes broadcaster from Virginia game because his name is Robert Lee https://t.co/PcHQRI1SMK https://t.co/a5rTxC0nGq
2017-08-23,B.C. police ask public for videos of slain teen Marrisa Shen's funeral https://t.co/lm8pzirqCA https://t.co/fOrYiqgwcN
2017-08-23,The best time to take a nap is when you're already feeling unmotivated https://t.co/sbxnhMQWuw https://t.co/8slyGkR02T
2017-08-23,"B.C. tech companies lure employees with 5-hour workdays, luxury cars https://t.co/CeYZYZgOCb https://t.co/VAOSuiVlry"
2017-08-23,Canadians' credit card debt could be trouble in the next recession https://t.co/ZZnmSZY6om https://t.co/evwjhZVW6C
2017-08-23,Millions of Americans cross fingers for $700-million Powerball prize https://t.co/4m3mNL923f https://t.co/33kB1SZT7o
2017-08-23,"Liberals misleading asylum seekers, NDP MP says https://t.co/Hs707RaJGk https://t.co/6QOSBITDDw"
2017-08-23,"Canada, Mexico basically yawn at Trump's NAFTA threat #cdnpoli https://t.co/MBqdG6jOAw https://t.co/ga8OrAdNgE"
2017-08-22,Young entrepreneurs are finding meaningful work in a dismal job market (blog) https://t.co/4UcWW7yExU https://t.co/Y5XdjmuGra
2017-08-22,"No big deal, just two Vancouverites hanging out https://t.co/IY2FvOLjRn https://t.co/LiRpRY0IBo"
2017-08-22,You've gone to the protest. Now go make equality happen (blog) https://t.co/3jJZKRfqsL https://t.co/NNFgCuhZGw
2017-08-22,"Don't lie, you looked at the eclipse just like Donald Trump did https://t.co/iCkKLI8mAM https://t.co/Z22Vk67eNC"
2017-08-22,'Great Deal' of negotiations needed after round one of NAFTA talks ends https://t.co/jXcJjid2Np https://t.co/BMz8JnrY4d
2017-08-22,B.C. police punched black bear after it broke into a family's home https://t.co/UQXrrF2fjN https://t.co/FHZg9BHS1k
2017-08-22,"5 common bad resume writing tips to avoid, from @Workopolis https://t.co/641aCDyGw1 https://t.co/cSusIlJspq"
2017-08-21,Guerrilla 'social experiment' forces Canadians to confront #MMIW crisis https://t.co/9BfMa6s2jL https://t.co/xyc3JFm3iF
2017-08-21,Canadians may be spending too much of their income on housing https://t.co/3yhZDmJDFO https://t.co/fiY5EYVFAq
2017-08-21,Thrill-seekers head south for 'Great American Eclipse' https://t.co/BWSNAHFFnT https://t.co/BCZB0grgXz
2017-08-21,"Meet the invasive plants threatening to destroy Canadian habitats, by @NCC_CNC https://t.co/gp9ujZf3Pt https://t.co/JGbymwAh4n"
2017-08-20,Teachers too insecure to actually talk about residential schools: study https://t.co/z4XIVbaO8q https://t.co/VaQk0ozpGa
2017-08-20,Eclipse-chasers head south for the sight of a lifetime https://t.co/0RuXgyfd55 https://t.co/RtJL6vch6r
2017-08-20,Trudeau has an 8-person team to take on Trump's wildest NAFTA twists https://t.co/mOzH11Y2CK https://t.co/XDxkr9EaAy
2017-08-20,"Banks and sellers are protected. B.C. homebuyers? Not nearly enough, by @atrina_ https://t.co/6hYbIRTpQ9 https://t.co/MNXsANx2lm"
2017-08-20,14% of Canadians admit to getting it on while driving: survey https://t.co/J05rvXUrH0 https://t.co/9M6W1jfezQ
2017-08-20,Calgary's @dinnerwithjulie wants to fight hate with #ProjectPotluck #yyc https://t.co/KflQHyVgoE https://t.co/lhztLi15Qu
2017-08-20,"Thousands #StandUpToRacism, stand up for love in Vancouver #yvr https://t.co/xQE2XG4tuz https://t.co/kalLoPozNU"
2017-08-20,"$500,000 hardship fund approved for laid-off Sears Canada employees https://t.co/8j5V7SjL2s https://t.co/eB5d67XqSX"
2017-08-20,How to encourage girls to get interested in STEM https://t.co/nEA796Unip https://t.co/NClbio5jhE
2017-08-19,Prince William always breaks royal protocol for his kids https://t.co/Zz6c6G5Z1t https://t.co/WtWPCCkqkP
2017-08-19,"#ProjectPotluck wants to bring people together to fight hate (and eat pie) 
https://t.co/AYLSV8h89j https://t.co/ByQeRpaoUY"
2017-08-19,Simply great books to dedicate the rest of your summer to https://t.co/ZWT2zhniKW https://t.co/kImnfOLHXb
2017-08-19,"Talk to your kids about Charlottesville, ex neo-Nazi urges parents https://t.co/lsOCrvn3v2 https://t.co/Pr67DE5msx"
2017-08-19,"Banks and sellers are protected. B.C. homebuyers? Not nearly enough, by @atrina_ https://t.co/CWPSUpgxqr https://t.co/Hyd6b8V7VN"
2017-08-19,"Steve Bannon out at White House, back at Breitbart https://t.co/d8rvxg9ex8 https://t.co/Cmn6hQ8Ibk"
2017-08-19,Canadian killed in Barcelona attack identified https://t.co/gcx5rmdPZG https://t.co/OuCCdtchOh
2017-08-19,Air Canada near miss at SFO prompts 'significant' changes https://t.co/sKTlyBBoKe https://t.co/ketqs5tIAB
2017-08-18,Amusement park decides ride with Indigenous man's severed head isn't OK https://t.co/ococlBQwZd https://t.co/wsPWQtwAJU
2017-08-18,Initial details released of 'Deadpool 2' stuntwoman's death https://t.co/HVpTzxNNSq https://t.co/ZoJhp1Va8A
2017-08-18,"According to an analyst, Donald Trump is worth $2 billion to Twitter https://t.co/FohbdSdlQr https://t.co/NuzYLlMb8v"
2017-08-18,Why the solar eclipse is causing so many daycares to close on Monday https://t.co/KVw9irDtgD https://t.co/tsklSBFxZh
2017-08-18,"Liberals jump on Rebel Media fallout to jab at Tories, grow mailing list #cdnpoli https://t.co/X3RQKNr9mo https://t.co/RrXZOKef1g"
2017-08-18,Easier ways you can reduce waste today https://t.co/ryADOK9zyq https://t.co/P0VGH7Y3g2
2017-08-18,Daycare owner uses MMA moves to fight off alleged child abductor https://t.co/IkIx58g8GB https://t.co/VvAMzL6Hl7
2017-08-18,"White nationalism needs Canadians to think we're over racism, says @janaya_khan https://t.co/zQ2F66RiVk https://t.co/gaS1kkZYy2"
2017-08-18,Paris Hilton apologizes for comments defending Donald Trump https://t.co/E5mJM42EbN https://t.co/zX1WIkPl4c
2017-08-18,Men who eat healthy are more likely to attract romantic partners https://t.co/hoxKmpgA6X https://t.co/P0ehnf6ls9
2017-08-18,Canadian meteorologist responds to pregnancy body-shaming on live TV https://t.co/qCDQ9wqji7 https://t.co/0uWNVdG0jK
2017-08-18,The cosmos aligns! Bonnie Tyler is singing 'Total Eclipse Of The Heart' during the eclipse https://t.co/tgpH5uE892 https://t.co/10tUmoQpHo
2017-08-17,B.C. woman uses MMA moves to fight off alleged child abductor https://t.co/euzbvyvcP6 https://t.co/1MxHy3Nu6M
2017-08-17,Bell Canada's ‘Alt-TV’ doesn’t sit well after #Charlottesville violence https://t.co/VEQqiFxdFv https://t.co/bkxVUVPo0K
2017-08-17,Anti-NAFTA protests hit Mexico as government fights to keep trade deal https://t.co/GEUehGUhj1 https://t.co/Uhg1D8JPsv
2017-08-17,'March On Google' cancelled over alleged threats from 'terrorist groups' https://t.co/PpZehjBb9V https://t.co/EoI52leyrZ
2017-08-17,Blog: Are we seriously negotiating a free trade deal with Donald Trump? #cdnpoli https://t.co/qrjjSdS30N https://t.co/nVHeBz6Guq
2017-08-17,Sears Canada chairman steps away so he can try to buy the retailer https://t.co/1ZfDOhXOUH https://t.co/5S3YV1KPte
2017-08-17,Canadian meteorologist @KelseyMcEwen responds to pregnancy body-shaming on live TV  https://t.co/iR0PKb7CiP @YourMorning https://t.co/j494mkvKUB
2017-08-17,"Toronto and Vancouver housing is going to get even pricier, says @benmyers29 https://t.co/0zzsWc0S6g https://t.co/McIWgwxGsM"
2017-08-17,Blog: Canadian Muslims abused by their government have to rely on the law https://t.co/cmDLhLsb7B https://t.co/yeha5ayPf7
2017-08-16,The Royals don't give autographs for a pretty outdated reason https://t.co/PjJmnZIkPB https://t.co/030TzN3zFT
2017-08-16,"Ryan Reynolds, 'Deadpool 2' director lead moment of silence for stuntwoman https://t.co/ep1qhhZNQM https://t.co/Y9IAQCuuHG"
2017-08-16,CIBC launches a new direct banking banking brand called 'Simplii' https://t.co/jUIiQ49ppA https://t.co/1UVRuyUb60
2017-08-16,NAFTA energy clause draws criticism from Canadian voices on the right and left https://t.co/EWOvFsJ5Um https://t.co/ku1mSoV92B
2017-08-16,McDonald's offering 67-cent burgers for one day only (that day is today) https://t.co/RbP9rBxnTg https://t.co/layVJGBnYe
2017-08-16,Woman gives birth to first baby conceived using 'FitBit fertility tracker' https://t.co/fuIEZlvyIh https://t.co/XI7kAeV29N
2017-08-16,B.C. moves towards $15 minimum wage under new NDP government https://t.co/hxZkmTksxc https://t.co/a99McnUVdC
2017-08-16,"This is how much sex people have, according to their age https://t.co/YYZ8zveAWk https://t.co/8h9q5x0gXl"
2017-08-16,Elon Musk's mom is a stunning Canadian-born model https://t.co/mOwaH4caXQ https://t.co/YWV96MFofe
2017-08-15,"Rock legend shuts down ""a**hole"" Ted Nugent in just 7 words https://t.co/eoExL1iV61 via @HuffPostEnt https://t.co/Wgc5wSxsF0"
2017-08-15,U.S. trade vets skeptical about Canada's NAFTA demands #cdnpoli https://t.co/S3prXDiec6 https://t.co/QfDAvTqYpI
2017-08-15,New Yorker Joi 'SJ' Harris identified as stuntwoman killed on 'Deadpool 2' set https://t.co/Zo5yqqE2l1 https://t.co/zRxDMTuNpy
2017-08-15,"In rare double euthanasia, 91-year-old Dutch couple died ""confidently holding hands"" https://t.co/3sxSc32eVf via @HuffPost https://t.co/zzUDwVKhIW"
2017-08-15,14% of Canadians admit to 'romantic activities' while driving: survey https://t.co/mz2fFm1f2v https://t.co/NCkKp4FGub
2017-08-15,Watch: Johnny Depp surprises kids at BC Children's Hospital https://t.co/ZQisEyCoWW #Vancouver https://t.co/NuoM3VZ7Tb
2017-08-15,B.C. bans trophy hunting grizzly bears https://t.co/ac3j2WpPsy https://t.co/6uYEH8awB8
2017-08-15,Ryan Reynolds 'heartbroken' after stuntwoman's death on #Vancouver set https://t.co/INT1UhBwuD https://t.co/UR43nJqBU7
2017-08-15,Photos: Johnny Depp delights kids at #Vancouver hospital https://t.co/aa2WaABAla https://t.co/zphNeS4N3S
2017-08-15,Stuntwoman dies after accident on 'Deadpool 2' set in #Vancouver https://t.co/jhX5VZm2x5 https://t.co/MEGloUlLq0
2017-08-15,B.C. bans trophy hunting grizzly bears #bcpoli https://t.co/pxQLb8v6yr https://t.co/vnN11jm5Zw
2017-08-14,"Home sales falling ""in most large Canadian cities west of Ottawa"" https://t.co/GiiDPYasMF https://t.co/C9lCtKoDPO"
2017-08-14,Stunt driver dies on 'Deadpool 2' set in #Vancouver https://t.co/eUaAziERuy https://t.co/XE23Ll0WCY
2017-08-14,Just a little reminder of how much the U.S. depends on Canadahttp://huffp.st/n7AOyMZ
2017-08-14,Tourist dies after charter bus crash in #Vancouver https://t.co/DRBIdgCKot https://t.co/BFSRF7lkiW
2017-08-14,You might want to think twice about that office birthday cake https://t.co/56dpNxJERl https://t.co/tzA5R50tqx
2017-08-14,'Canada isn't immune' Trudeau says after white supremacist rally in #Charlottesville https://t.co/5sRKGEjnJZ https://t.co/HdFK3LOXTi
2017-08-14,"UPDATE: 1 dead, 2 injured after tour bus crashes in downtown #Vancouver https://t.co/JvV3QsJx5P https://t.co/XhiEe8nv2h"
2017-08-13,4 seriously injured after tour bus crashes in Vancouver https://t.co/ZEqWEyelQS https://t.co/c5Mf5mMfb3
2017-08-12,RCMP apologizes for telling women to wear backpacks to avoid rape https://t.co/xotvqlbtla https://t.co/trvU914wxi
2017-08-12,Reminder that Canada's tech sector isn't immune to Silicon Valley-style sexism https://t.co/9S5Wy4GXuk https://t.co/wDEwBPvQVJ
2017-08-12,A coffee nap could make you much more productive https://t.co/9gQH0fGqHw https://t.co/sTQmtE3oWN
2017-08-12,Access to B.C.'s Cariboo region banned due to wildfire risk https://t.co/dGglr5I6GX https://t.co/jHzJMO7FQE
2017-08-12,Here’s how 'good debt' can go wild https://t.co/hWQeqMRSIv https://t.co/5ywAizCS7r
2017-08-12,"Nighttime leg cramps suck. Here's how to make them go away, by @lifetimedaily https://t.co/bkIzZFHCTn https://t.co/Pa8P4ibJlk"
2017-08-12,'The Rock' loves #Vancouver and its role in his career change https://t.co/VZPjKG5yiF https://t.co/4Xx6bDE2WM
2017-08-12,"Helicopter parents need to let teachers do their jobs, by @marciasirota https://t.co/KqWqXKuGxA https://t.co/4wLjUOu7Ki"
2017-08-12,Canada the top choice by far for tech workers fleeing Trump https://t.co/cBKiQriQvD https://t.co/2b2kahtggu
2017-08-12,'He won't make it': 22-year-old hit with fatal punch at a Metro Vancouver B.C. Starbucks https://t.co/syhmKLctCn https://t.co/ZfNtxSnimG
2017-08-12,Key evidence mistakenly deleted related to investigation into Air Canada flight’s close call https://t.co/foCG4jDFTm https://t.co/cCkHTeU0mf
2017-08-11,Rafael Nadal got crushed by Canadian teen Denis Shapovalov #RogersCup https://t.co/2qtK0fddNk https://t.co/PnIloFYH9y
2017-08-11,Former husband and wife sentenced to jail in polygamous child-bride case https://t.co/E5MNag7pZ8 https://t.co/KmtCxoJrBN
2017-08-11,North Korea's nuclear program a 'grave threat' to the world: Freeland https://t.co/34VTHJVMvV https://t.co/OTSwcpb5SA
2017-08-11,Young orca puts on a heck of a show for lucky whale watchers https://t.co/H1V5f6l6tQ https://t.co/n0fCQDiEVC
2017-08-11,'The Rock' reveals #Vancouver led to career-changing twist https://t.co/2Bd1PGtEpO https://t.co/VYN0Yt3W4W
2017-08-11,"Forget car-free buildings. Bike-only condos are coming, by @NextHome https://t.co/jxmgOAmv7y https://t.co/cRKXcyMODP"
2017-08-11,Loblaw hits back after petition calls CEO comments 'sabotage of minimum wage' https://t.co/9iMWXDSFf4 https://t.co/E9QYxHkKEy
2017-08-11,RCMP apologizes for telling women to wear backpacks to avoid rape https://t.co/ZnboqUdKSh https://t.co/Y65QMONCRX
2017-08-11,'Selfless' WestJet employee pulls strings to help get Calgary man to dying sister https://t.co/lbeHHPZ1In https://t.co/0X2G0KGYeS
2017-08-10,"Diet hashtags are where healthy eating and science go to die, by @lisarutledgeRD https://t.co/neNfwxdKI4 https://t.co/XAv1iAlcMC"
2017-08-10,'No baloney' in immigration minister's claim about Quebec asylum seekers https://t.co/TyvTSZntmV https://t.co/Uz5eHMIWUc
2017-08-10,Netflix Canada is hiking its subscription prices https://t.co/ZOUUSuqGqC https://t.co/69qrE1Bj1M
2017-08-10,"Canadians go on ""spending binge"" borrowing against their homes https://t.co/twTGOI2vZY https://t.co/5kvU9ylyhB"
2017-08-10,Canadians have worse impression of U.S. government than China: poll https://t.co/nCpemndsSc https://t.co/atSM2IqXZE
2017-08-10,"Canada's expected new food guide has meat, dairy lobbies up in arms https://t.co/P1Geq8s3nk https://t.co/siEhT2s7Of"
2017-08-09,No one wants to name their kid 'Michael' anymore https://t.co/tjIV2N8YAu https://t.co/miYTIT3puE
2017-08-09,"The day we took more from the Earth than it could give, by @DavidSuzukiFDN https://t.co/WHLJ4fVIUv https://t.co/EJZVlkogXv"
2017-08-09,Canadians have worse impression of U.S. government than China: poll https://t.co/rO0Cp7jKll https://t.co/14mSf0uoi5
2017-08-09,B.C. needs to show leadership in 3 key areas to tackle climate change (blog) https://t.co/15Ffb8XhgA https://t.co/Koa6Rh17CT
2017-08-09,Ryan Reynolds is not keeping a low profile in Vancouver https://t.co/XTVAya6pbq https://t.co/wcOEemtkvc
2017-08-09,New North Korean missile capable of reaching majority of B.C.: experts https://t.co/MKQ8HJcVzV https://t.co/bUaRk6b1ID
2017-08-09,"Genetically modified salmon now sold in Canada, but you may not even know it https://t.co/p5TRV49diE https://t.co/NGnI4Yb5sC"
2017-08-09,Marijuana laced with deadly opioid discovered in Ontario https://t.co/EMc7nJv915 https://t.co/weNGW9DZAe
2017-08-08,Feds mull lowering legal alcohol limit for drivers https://t.co/VBqERqguMz https://t.co/mfrguIPlC5
2017-08-08,Americans keep bringing guns to Canada and lying about it: prosecutor https://t.co/XQdF3cZ8Mr https://t.co/kxnWUdStI4
2017-08-08,►Keep this in mind if you're ever asked to leave a store https://t.co/CBKOyp2DJI
2017-08-08,"Funeral homes need to be prepared for pandemics, health officials say https://t.co/aGOiBLUhQW https://t.co/sCaIH2CtyM"
2017-08-07,Softwood lumber dispute might not be fixed before NAFTA talks: Freeland https://t.co/6J63Tll6yx https://t.co/70HQFzZzHq
2017-08-07,Trump admin wants changes to the way Canada sells wine https://t.co/5uDkQrgErh https://t.co/tMjjVQCuBA
2017-08-07,Legal pot could be an economic boost to Canada's small towns https://t.co/HRRhvNxftA https://t.co/2AmoH1qKgH
2017-08-07,Holocaust denier deported from Canada dies at 78 https://t.co/1N5ksvzTlc https://t.co/HvlcDrEk10
2017-08-06,Family who lost home in Fort McMurray wildfire loses another in B.C. blaze  https://t.co/SvBVRyq3Ov https://t.co/b1JKDzPkIT
2017-08-06,►Cool trampoline tricks to impress your friends https://t.co/5Mh0LvjcjH #LAT
2017-08-06,Legal pot could revive Canada's small towns https://t.co/ftzgcLixWE https://t.co/R4i1Jpecom
2017-08-06,Stolen equipment another headache for crews fighting B.C. wildfires https://t.co/qeGETI0W3R https://t.co/p3EJPhqQdf
2017-08-06,►Here are your rights as a store customer https://t.co/FzbdPRqPf9
2017-08-05,►Where to find some of Saskatoon's hidden gems https://t.co/ipFIabh5Qx #LAT
2017-08-05,Stolen equipment another worry for crews fighting B.C. wildfires https://t.co/DvDZRCEfIc https://t.co/MG0k8GzgZi
2017-08-04,Time to add these cool trampoline tricks to your repertoire https://t.co/oKGrJBF9W3 #LAT
2017-08-04,"3 years after Mount Polley, it's still business as usual for B.C. mining, by @ClayoquotAction https://t.co/IGomjtXZmq https://t.co/a7VwaW12Jk"
2017-08-04,Kamloops records worst air quality in its history https://t.co/C5gKQYYjTE https://t.co/DbHb5cfhO9
2017-08-04,B.C. man charged for having sex without disclosing HIV status to partners https://t.co/R8Ms6AFxzQ https://t.co/Ka8SUARzQW
2017-08-04,"►Try not to fall in love with the ""Paris of the Prairies"" after watching this https://t.co/fWVe7KKDGZ https://t.co/Po9MMLm9Z6"
2017-08-04,5 common exercise myths debunked https://t.co/Rcu0STCZJ7 https://t.co/m8cm0eEvw0
2017-08-04,WATCH: 'Giant' seagull photobombs Vancouver morning show https://t.co/3pQ2xykz2J https://t.co/njUpB5S0oq
2017-08-04,Politicians accused of violating Canadians' rights by blocking them online https://t.co/n61Pz1o5sh #cdnpoli https://t.co/rPmfVKZtWe
2017-08-04,Trump says 'Canada is no problem' in leaked phone call about trade https://t.co/E2oQ3ZqKTX https://t.co/Nb9IPsCZHV
2017-08-04,19-year-old kidney transplant survivor Bhavkiran Dhesi killed in B.C. https://t.co/DGIzl2JEcS https://t.co/j87iPy4dDq
2017-08-03,A Muslim superhero is coming to “Legends Of Tomorrow” https://t.co/jWejgOMS8f https://t.co/dc90llYUgp
2017-08-03,NDP leadership hopefuls squared off in Victoria https://t.co/5l8ZGUtAnZ #cdnpoli #ndpldr #yyj https://t.co/tlhL7x4wse
