created_at,text
2017-11-08,Mayor Watson on Ottawa's 2018 city budget: 'People will be very pleased' https://t.co/cyuGDFgprj https://t.co/HjCqf8V02i
2017-11-08,Ottawa-born combat cameraman filmed D-Day invasion https://t.co/NC1o636pO1 https://t.co/UuHtJvZ3eZ
2017-11-08,International students face special challenges as college strike drags on https://t.co/T55fSbXJzF https://t.co/ka5j2E5iL4
2017-11-08,Ottawa Public Library launches musical instrument lending programhttp://ow.ly/zvIj30gqCVQ
2017-11-08,Earn your drink at these incredibly hard-to-reach bars https://t.co/eAHjgzMTRb #travel https://t.co/X00cDfKcMX
2017-11-08,Ottawa Fire Services budget could go up by as much as $13.3 million without any additional services https://t.co/QRJB567eLz https://t.co/Ymyqj7kJ5m
2017-11-08,Could young blood cure Alzheimer’s? First study shows 'hints' that plasma revives old brains https://t.co/q7KexNn1Er #health https://t.co/wiztTdBjsJ
2017-11-08,Cook this: Coconut and chocolate cake just so happens to be gluten-free https://t.co/rKLP5woAzK #life #EatSweet https://t.co/DizL1s9dHW
2017-11-08,New Health Canada guidelines mean accessing abortion pill will be easier https://t.co/a5507nNheP https://t.co/KcTEPnQJcU
2017-11-08,Gordon Ramsay says chefs who ban photos at restaurants are pompous 'old farts who've forgotten to move on' https://t.co/Db1tR7TDYO #life https://t.co/q3LbTnBvQT
2017-11-08,Mayor Watson on Ottawa's 2018 city budget: 'People will be very pleased' https://t.co/cyuGDFgprj https://t.co/pGjEqXWq8X
2017-11-08,Eichel says frustrations setting in over Sabres' slow start https://t.co/PF04xHd3Ss https://t.co/QZt5USPQQg
2017-11-08,Raptors hang on after Bulls nearly erase 23-point lead https://t.co/4e7dzGjoh6 https://t.co/91GOE00OYJ
2017-11-08,Charlie Lindgren stays perfect as Canadiens edge the Golden Knights https://t.co/Ujltgome8e https://t.co/e2OvsrONxu
2017-11-08,"This is a preview of the front page of your Ottawa Citizen for Wednesday, Nov. 8, 2017. https://t.co/A6HdHh7nlM"
2017-11-08,"Review: An edgeless satire in George Clooney's 'Suburbicon'
https://t.co/fb7tGb0lT2 https://t.co/SIeiz5n1dG"
2017-11-08,A homecoming for Senators' Oduya https://t.co/7dEa3cWAbE https://t.co/rYDaVM66OX
2017-11-08,Senators' Erik Karlsson happy his teammates will get to see Sweden https://t.co/iAiC6dV3XZ
2017-11-08,Redblacks nominee for Tom Pate Memorial Award is offensive lineman Alex Mateas. Presentation is Nov. 23 in Ottawa. https://t.co/kBmSmtppkW
2017-11-08,Ottawa Senators hit the ground running in Sweden https://t.co/zF4CZCwJ62
2017-11-08,Man seriously injured in Lowertown stabbing https://t.co/vlCV42qmcw
2017-11-08,"Former Cold Lake man charged with murder after Abbotsford, B.C., police killing
 Jonny Wakefield https://t.co/6Pc7nmASMJ"
2017-11-08,Liberal government concedes to Senate on sex-based discrimination in Indian Act https://t.co/td0vH9GFyy
2017-11-08,"The F-word is not vulgar — but only when aired on a French broadcast, watchdog rules https://t.co/JDKUGNOCfb https://t.co/vcsb0BpIDS"
2017-11-08,"Godspeed to Roy Halladay, a throwback starter, beloved star and unforgettable Blue Jay https://t.co/ggMlKRAyKI https://t.co/qNllHdpywN"
2017-11-08,"Christie Blatchford: Deleting 'political' emails not wrong, defence lawyer tells gas plants trial https://t.co/lYi4MLnnaF"
2017-11-08,Ottawa-born combat cameraman filmed D-Day invasion https://t.co/I3oCAURnva https://t.co/KVuhFLyJ2d
2017-11-08,International students face special challenges as college strike drags on https://t.co/T55fSbXJzF https://t.co/j0v18PU9FE
2017-11-08,Lowertown pop-up injection site to close https://t.co/kulSHeXHEx https://t.co/E1qdac9PY9
2017-11-08,Ottawa Public Library launches musical instrument lending program https://t.co/YaUpP9nTrs https://t.co/vMhkNqed6y
2017-11-08,Ottawa Fire Services budget could go up by as much as $13.3 million without any additional services https://t.co/gPYjAcBaSZ https://t.co/ij9qgliF1s
2017-11-08,Paparazzi tried to sell nude photos of Sia — so she posted them on Twitter herself https://t.co/jWTKxKK1Ws https://t.co/FHraZW5FbB
2017-11-08,"Watch: Dacre Montgomery's bizarre, shirtless audition tape for Stranger Things 2 https://t.co/1Wvgt7plaY https://t.co/fghiB2TENm"
2017-11-08,Apple iPhone X final review: One week later and the home button is still dead https://t.co/O7kbDkP9gN https://t.co/J0449xr790
2017-11-08,New Health Canada guidelines mean accessing abortion pill will be easier https://t.co/a5507nNheP https://t.co/lnhZz9wD5z
2017-11-08,Analysts watch for ’catalysts for correction’ as market hit levels not seen since before two historic crashes https://t.co/hhU8MkGFvA https://t.co/oYAQBhxsF7
2017-11-08,Mayor Watson on Ottawa's 2018 city budget: 'People will be very pleased' https://t.co/cyuGDFgprj https://t.co/uZINa4x26Q
2017-11-08,"Man who killed Ontario tot, set body on fire, now ""free and clear"" https://t.co/uWaEhCqT5r https://t.co/UROfXKTLLF"
2017-11-08,Trump claims 'hundreds more' would have died in Texas massacre after being asked about gun control https://t.co/r3iP3PsyoY https://t.co/HIevcw9oEC
2017-11-08,Amazon in talks for a new Lord of the Rings television series https://t.co/Mvj7N1ZVgX https://t.co/ppb2l25MGS
2017-11-08,Five people found naked after Edmonton crash arrested. Police call it 'quite an investigation' https://t.co/UxQ8TYxjYN https://t.co/m1bnWH6pTX
2017-11-08,Woman impulsively flips off Donald Trump while riding her bike and ends up fired for it https://t.co/0hUFbixhCV https://t.co/lU288Kyw07
2017-11-07,Sean 'Diddy' Combs says he didn't actually change his name to Brother Love https://t.co/BYGSySB3B8 https://t.co/blC8FdsNgZ
2017-11-07,"Ontario to invest $115 million in new long-term care beds, staffing https://t.co/xPcf98UHvN https://t.co/gIBMTZtGIh"
2017-11-07,"Mayor, city manager to negotiate on LeBreton Flats — without local councillor https://t.co/cAMmZPvX4k https://t.co/Rkz60OLVXI"
2017-11-07,"Trying to slip a casino through the committee of adjustment is a betrayal, writes @davidreevely https://t.co/6QQjqHQMsW https://t.co/6KqFkNJizh"
2017-11-07,Roy Halladay killed in plane crash: Longtime Toronto Blue Jays pitcher dead at 40 https://t.co/UlMzUSw2l0 https://t.co/ymlo8BmcGF
2017-11-07,Officials in Italy are wondering if 26 teenage girls found dead at sea were purposely killed https://t.co/QaiEOnBTYZ https://t.co/mkypLjdGVK
2017-11-07,Erik Karlsson couldn’t be happier than to share this experience with his teammates. https://t.co/WtI4f81Ndf https://t.co/vO6o900K2Y
2017-11-07,"Today's letters: FINE! Make the GG a robot, then! https://t.co/iss0UhQgV1"
2017-11-07,Here's why Payette was right to speak out: Cohen https://t.co/Z25B4hhzq2 https://t.co/8zNjDi0tCW
2017-11-07,Where ancient rocks and the world's highest tides meet the Atlantic https://t.co/LyReb1HhpJ https://t.co/p3fblZoBDy
2017-11-07,The Senators won’t have Mark Borowiecki as they take on the Colorado Avalanche in back-to-back games this weekend. https://t.co/aaka5NMrYM https://t.co/wJMyyFT2v4
2017-11-07,"These will be the top food trends for 2018, according to Whole Foods https://t.co/hPoLn6AYh1 https://t.co/4rldgHUHT0"
2017-11-07,Fox News pulls ad calling for Trump's impeachment https://t.co/Povf2Q9haM https://t.co/PJQvQmZQaQ
2017-11-07,Farooqi and Elghawaby: Nothing honourable about violence against women https://t.co/DZXMiBG5rA https://t.co/2ia5R4mL83
2017-11-07,"More missile interceptors to be bought to counter North Korea, protect U.S. and allies https://t.co/hYEQ4U0WAq https://t.co/mBIxeBrbiq"
2017-11-07,"28,000 people signed a petition to replace Kevin Spacey with Kevin James on House of Cards https://t.co/tUICANilUs https://t.co/Y7Ieo4nHGz"
2017-11-07,Senators game in Stockholm  is a homecoming for Johnny Oduya https://t.co/nCRyD5vtHQ https://t.co/MrRs86pXmC
2017-11-07,'Jihadi Jack' could end up in Canadian hands after months in the custody of Kurdish militias https://t.co/TaN3H0QvnC https://t.co/p0MYXRhivu
2017-11-07,Trudeau-appointed Mi'kmaq Sen. Daniel Christmas calls for Cape Breton independence discussion https://t.co/StVjfAZXQv https://t.co/FxCvEyUmc7
2017-11-07,Ottawa Senators get ready to take on the Avalanche in Sweden https://t.co/bJTzm2fJjC https://t.co/YQnM8Tkexe
2017-11-07,'Hero' Abbotsford police officer dead after strip-mall shootout https://t.co/uQ7rlIPgw4 https://t.co/ipy7mwhyzy
2017-11-07,"Japan's 'black widow' sentenced to hang for killing husbands, lovers with cyanide https://t.co/HkOE5Y9qYA https://t.co/KckUvdhDLc"
2017-11-07,"Just follow the signs, OPP sighs after transport wedged at border crossing https://t.co/hzcRnwmcSe"
2017-11-07,Analysts watch for ’catalysts for correction’ as market hit levels not seen since before two historic crashes https://t.co/hhU8MkGFvA https://t.co/hA2YhVommt
2017-11-07,"Man who killed Ontario tot, set body on fire, now ""free and clear"" https://t.co/uWaEhCqT5r https://t.co/gai6WcnEmG"
2017-11-07,Man in his 60s injured by exploding chlorine container https://t.co/tx4jO3lBDG https://t.co/eYIvkjZUY1
2017-11-07,These Ottawa intersections had the most collisions in 2016 https://t.co/rZ8YQBD9Ny https://t.co/HptLH06Ytj
2017-11-07,"Stars shine in fast-paced, touching Leonard Cohen tribute, Trudeau makes surprise appearance https://t.co/6F6Rlwl5An https://t.co/0eZW3tyLak"
2017-11-07,Trump claims 'hundreds more' would have died in Texas massacre after being asked about gun control https://t.co/r3iP3PsyoY https://t.co/THSZNnlY8K
2017-11-07,'Jihadi Jack' could end up in Canadian hands after months in the custody of Kurdish militias https://t.co/TaN3H0QvnC https://t.co/qsHsmAfQd6
2017-11-07,"Watch: Dacre Montgomery's bizarre, shirtless audition tape for Stranger Things 2 https://t.co/1Wvgt7plaY https://t.co/OVndJIIwnK"
2017-11-07,Gordon Ramsay says chefs who ban photos at their restaurants are pompous 'old farts who've forgotten to move on' https://t.co/AFmdiS6x5U https://t.co/Tfa9x8a5wL
2017-11-07,Amazon in talks for a new Lord of the Rings television series https://t.co/Mvj7N1ZVgX https://t.co/QHgG3JlsvU
2017-11-07,"These will be the top food trends for 2018, according to Whole Foods https://t.co/lM7PzM2P34 #life https://t.co/nHVjOZm05J"
2017-11-07,Here's why Payette was right to speak out: Cohen https://t.co/Z25B4hhzq2 https://t.co/lWhIG0DUFN
2017-11-07,Redblacks hoist team flag at city hall as playoff encounter looms https://t.co/XQcTPDozhC https://t.co/c8NQi0H58B
2017-11-07,Sean 'Diddy' Combs says he didn't actually change his name to Brother Love https://t.co/BYGSySB3B8 https://t.co/BnVfySq9Sp
2017-11-07,"Sean 'Diddy' Combs enters a new phase of life, and changes his name accordingly (again) https://t.co/9EJvAw83TN https://t.co/NQF0RmJVdw"
2017-11-07,Bill 62: Face-covering ban will be challenged in court https://t.co/2Hf0hvyh16 https://t.co/ZSSbCToEPA
2017-11-07,Paparazzi tried to sell nude photos of Sia — so she posted them on Twitter herself https://t.co/jWTKxKK1Ws https://t.co/ushw4OlVTv
2017-11-07,Apple iPhone X final review: One week later and the home button is still dead https://t.co/O7kbDkP9gN https://t.co/QrEloYQNSk
2017-11-07,Woman impulsively flips off Donald Trump while riding her bike and ends up fired for it https://t.co/0hUFbixhCV https://t.co/xDwtI0QnjH
2017-11-07,Trump claims 'hundreds more' would have died in Texas massacre after being asked about gun control https://t.co/r3iP3PsyoY https://t.co/tdq4u1DF2I
2017-11-07,Five people found naked after Edmonton crash arrested. Police call it 'quite an investigation' https://t.co/UxQ8TYxjYN https://t.co/De4yrDNRwi
2017-11-07,"Man who killed Ontario tot, set body on fire, now ""free and clear"" https://t.co/uWaEhCqT5r https://t.co/sfadoT2qeo"
2017-11-07,Was Governor General Julie Payette out of line with her remarks last week? https://t.co/4ADo9TUbiM
2017-11-07,Analysts watch for ’catalysts for correction’ as market hit levels not seen since before two historic crashes https://t.co/hhU8MkGFvA https://t.co/6vGpFZdKnU
2017-11-07,"More missile interceptors to be bought to counter North Korea, protect U.S. and allies https://t.co/hYEQ4U0WAq https://t.co/el3BZejsOd"
2017-11-07,'Hero' Abbotsford police officer dead after strip-mall shootout https://t.co/uQ7rlIPgw4 https://t.co/cdcv6VJb1K
2017-11-07,Dig out those mitts – frigid temperatures are on the way https://t.co/B3clzT21Zj https://t.co/fUCg5JTV5k
2017-11-07,"Just follow the signs, OPP sighs after transport wedged at border crossing https://t.co/hzcRnwmcSe"
2017-11-07,A gene test could detect oesophagus cancer eight years early https://t.co/HzGhyczNg5 https://t.co/ncuVZV2ib7
2017-11-07,"Stars shine in fast-paced, touching Leonard Cohen tribute, Trudeau makes surprise appearance https://t.co/6F6Rlwl5An https://t.co/B9zP6j9CqI"
2017-11-07,These Ottawa intersections had the most collisions in 2016 https://t.co/rZ8YQBD9Ny https://t.co/MkgyBQRT5p
2017-11-07,Five people found naked after Edmonton crash arrested. Police call it 'quite an investigation' https://t.co/UxQ8TYxjYN https://t.co/kqJF3N9Q4D
2017-11-07,Dorion can't hide delight with Duchene acquisition as team heads to Stockholm https://t.co/8pNTxJgUgP https://t.co/4Fe8ua1dwP
2017-11-07,Could young blood cure Alzheimer’s? First study shows 'hints' that plasma revives old brains https://t.co/zGArEQUqem https://t.co/H1UQo0mgK9
2017-11-07,Dig out those mitts – frigid temperatures are on the way https://t.co/B3clzT21Zj https://t.co/vmUFcTSR2M
2017-11-07,Ottawa murder witness sentenced to jail for perjury https://t.co/6VIF9G5Br8
2017-11-07,Woman impulsively flips off Donald Trump while riding her bike and ends up fired for it https://t.co/0hUFbixhCV https://t.co/nJzcE9dUNW
2017-11-07,Bargaining breaks down between Ontario colleges and striking faculty https://t.co/kOCzSAuImZ https://t.co/40YUXe73Sj
2017-11-07,"City didn't receive a call from province for tent assistance, Mayor Watson says https://t.co/lbzvtjEpwh https://t.co/33CET59zTi"
2017-11-07,Isra Levy to leave post as city's Medical Officer of Health https://t.co/ViBVCu1Vfo https://t.co/S51G8aJfNH
2017-11-07,'It was not a good trip': Alex Trebek once ate a mountain of hash brownies https://t.co/WVZQKB2nqp https://t.co/GQJnZ6f5OY
2017-11-07,Managing pain by proper opioid prescribing is now in danger: Thompson https://t.co/DhMH4foO7N https://t.co/5T8RsjSmVN
2017-11-07,"Attempted missile strike on Riyadh could be considered 'an act of war,' Saudi Arabia tells Iran https://t.co/iGqR7ePFrD https://t.co/ETmnJCJtDF"
2017-11-07,"Stephen Bronfman, lead fundraiser for Trudeau in 2015, linked to offshore tax haven: Paradise Papers https://t.co/UoNNSqUvy7 https://t.co/uVMASP7nSy"
2017-11-07,'The pain is considerable': Senator Rand Paul recovering after alleged attack by neighbour https://t.co/5wX2ptl7d8 https://t.co/ZWObbdvVrl
2017-11-07,A new twist: Trump a victim of hackers years before election https://t.co/GQLtn3jxZ0 https://t.co/t4fTsGdjAj
2017-11-07,A gene test could detect esophagus cancer eight years early https://t.co/B9R5Gqd9iF #health https://t.co/2U9wNVmr1e
2017-11-07,Ottawa transplant physician honoured for contribution to global stem cell research https://t.co/1FBKqe45yS https://t.co/qJi1AhTgXL
2017-11-07,Dorion can't hide delight with Duchene acquisition as team heads to Stockholm https://t.co/2Q0hdZZ8pU https://t.co/lC9koOeP2M
2017-11-07,"The government is buying luxury cars for legitimate reasons, argues @drivingdotca's Lorraine Sommerfeld: https://t.co/R08qRznStk #autos https://t.co/wdQ6HK3XxR"
2017-11-07,How to eat more of the foods that are good for you and less of the foods that are bad for you https://t.co/xmwhTJ9MKM #life https://t.co/EQb7jbXGkP
2017-11-07,"Cook this: Soft and fudgy chocolate, banana and pecan cookies https://t.co/9Ms7UmSN66 #life #EatSweet https://t.co/mC88aIuLJh"
2017-11-07,Stylish globetrotter gets dramatic refit https://t.co/nEvBLtxDyY #travel https://t.co/LmsOzDf81t
2017-11-07,These Ottawa intersections had the most collisions in 2016 https://t.co/zWqCeya7iC
2017-11-07,Redblacks hoist team flag at city hall as playoff encounter looms https://t.co/XQcTPDozhC https://t.co/eEwuLZVg1l
2017-11-07,What to watch on Netflix and CraveTV this week https://t.co/PR6c1ygQcq https://t.co/VHx1WHgc0r
2017-11-07,"Here's a preview of the Ottawa Citizen's A1 front page for Tuesday, Nov. 7, 2017. https://t.co/rGjmUCyqpY"
2017-11-07,Turris on the list of Senators leaders who left a void in community https://t.co/ODXOlRdkdY https://t.co/hqRmb4cDPf
2017-11-07,Disciplinary committee calls for removal of Quebec judge over cocaine use https://t.co/hX9P9wewjI https://t.co/hXWcH5yJ04
2017-11-07,"Trump Jr. hinted at review of anti-Russia law, sought records to harm Clinton: Moscow lawyer https://t.co/pzcRBLlppI"
2017-11-07,"Lawyers for Toronto actress can't find Harvey Weinstein, but sexual assault lawsuit will proceed regardless https://t.co/PTqLGiyztV"
2017-11-07,Trudeau again faces accusations of tax hypocrisy following Paradise Papers revelations https://t.co/ks0XlosXZH https://t.co/ec5b6UKEGb
2017-11-07,Ottawa Champions announce 2018 season will start at home on May 18. https://t.co/OtoaMWt9FP
2017-11-07,Trade for elite player like Duchene is part of push to win Cup while Karlsson still here https://t.co/y5i4XmZGf8 https://t.co/vB3E1ylHTx
2017-11-07,Immigration hiccup keeps Kyle Turris from joining Predators immediately https://t.co/s52TjI3lRX https://t.co/o6A5gIcvBF
2017-11-07,Kyle Turris ready to take on new NHL challenge in Nashville https://t.co/GMdMLNkrgM https://t.co/gzljUsHlPQ
2017-11-07,Completing Duchene-Turris deal wasn't easy for Senators GM Pierre Dorion https://t.co/veokRjV5Bt https://t.co/vU89ZLIjnV
2017-11-07,Anderson expects smooth transition for former Avalanche teammate https://t.co/ejeJ1EfMlv https://t.co/p3CJNUxLXO
2017-11-07,Senators add two more players to roster before heading overseas https://t.co/LY04lQ9A7r https://t.co/Am42gUGwgp
2017-11-07,Ottawa transplant physician honoured for contribution to global stem cell research https://t.co/vk5e9pYibi https://t.co/bdB7Ft0CeX
2017-11-07,'It was not a good trip': Alex Trebek once ate a mountain of hash brownies https://t.co/WVZQKB2nqp https://t.co/ZbGEeSG4N1
2017-11-07,Dorion can't hide delight with Duchene acquisition as team heads to Stockholm https://t.co/2Q0hdZZ8pU https://t.co/a5AtxDEnrl
2017-11-07,Bargaining breaks down between Ontario colleges and striking faculty https://t.co/kOCzSAuImZ https://t.co/q6WbcvVBzw
2017-11-07,Richard Dreyfuss' son says Kevin Spacey groped him while his father was in the room: 'My mind went blank' https://t.co/wpaAd8uOx9 https://t.co/tq4eTZ2ztS
2017-11-07,A gene test could detect oesophagus cancer eight years early https://t.co/HzGhyczNg5 https://t.co/T0DMGNuhL5
2017-11-07,Could young blood cure Alzheimer’s? First study shows 'hints' that plasma revives old brains https://t.co/zGArEQUqem https://t.co/QcZyrF19iS
2017-11-07,"'Act now, ask questions later': The civilian who chased the Texas shooting suspect at 150 km/h https://t.co/mcasjFvdJ6 https://t.co/kCoZcelxRs"
2017-11-07,Ex-Guantanamo captive plans to sue Canada for $50 million for alleged complicity in his torture https://t.co/HShCQCzH8a https://t.co/Gh7CI8Wju7
2017-11-07,The anti-Maple Leafs and Oilers: Nashville Predators GM David Poile fleeces way to another trade win https://t.co/CMwhP5ezAL https://t.co/P3L1Ilmm3D
2017-11-07,"Senators introduce Matt Duchene - ready to be ""part of a long playoff run"" https://t.co/VUl9z3jSPS https://t.co/jiYrKRTHfY"
2017-11-07,"Stephen Bronfman, lead fundraiser for Trudeau in 2015, linked to offshore tax haven: Paradise Papers https://t.co/UoNNSqUvy7 https://t.co/gsfLhNtDuH"
2017-11-07,"Families losing patience for no-fly kid woes, taking their case to the feds https://t.co/C4x5zunsdw https://t.co/hF91WUeJ2x"
2017-11-07,Paradise Papers reveal new links between Russia and Team Trump https://t.co/7t2rB9YXBY https://t.co/Ggd865i97D
2017-11-06,Leonard Cohen to be honoured with memorial concert in Montreal tonight https://t.co/g7NGoaJx3Q https://t.co/9wVtd4749J
2017-11-06,Gordon Ramsay says chefs who ban photos at their restaurants are pompous 'old farts who've forgotten to move on' https://t.co/AFmdiS6x5U https://t.co/uDspgcg0hY
2017-11-06,Redblacks hoist team flag at city hall as playoff encounter looms https://t.co/XQcTPDGa9a https://t.co/IuriWqGyA7
2017-11-06,Ottawa murder witness sentenced to jail for perjury https://t.co/cbKi699wCz https://t.co/Od7Bxtek5Y
2017-11-06,The number game with Matt Duchene https://t.co/J5m3yIzsg3 https://t.co/7KQhIg5Kjx
2017-11-06,"Sweeping purge orchestrated by Saudi prince may push kingdom to political crisis, analysts fear https://t.co/uy3ilcSIhg https://t.co/TapttclhFS"
2017-11-06,Trailer park with perennial water woes gets new treatment plant https://t.co/ZSTC4lh2jk https://t.co/Tak7mnj3ru
2017-11-06,Results posted after Outaouais election outcomes slow to roll in https://t.co/UNLfGLMvDK
2017-11-06,"Reevely: U of O gets grant to fight discrimination in schools, though not the most obvious kind https://t.co/xO2KJ0Ai9P https://t.co/5Ig0xHE09q"
2017-11-06,Isra Levy to leave post as city's Medical Officer of Health https://t.co/ViBVCu1Vfo https://t.co/3VePRF3CxM
2017-11-06,Whirlwind trade has Duchene trying to catch his breath https://t.co/IaNN4gzYhV https://t.co/nE5huXeROO
2017-11-06,The anti-Maple Leafs and Oilers: Nashville Predators GM David Poile fleeces way to another trade win https://t.co/CMwhP5ezAL https://t.co/nORygzv3Mc
2017-11-06,"Senators introduce Matt Duchene - ready to be ""part of a long playoff run"" https://t.co/VUl9z3jSPS https://t.co/RJEWpCHi1x"
2017-11-06,Editorial: Julie Payette and the Golden Rule https://t.co/drgUDNSqOf https://t.co/mm9WpojDTL
2017-11-06,"Today's letters: The Governor General, the feminist T-shirt, modern schooling https://t.co/hB84TrkJFl https://t.co/Z9HxsQ4xcc"
2017-11-06,"SirVincent, Stangby could be back at Redblacks' Wednesday practice https://t.co/5OP6iCGvyt https://t.co/8gAvfJXduX"
2017-11-06,Ottawa police searching for man facing child pornography charges https://t.co/3iomtSbEHR https://t.co/PYdovrSOWl
2017-11-06,"U.S. Commerce Secretary has stake in firm with ties to Putin, leaked documents show https://t.co/eOhbnSNzGl https://t.co/dOdrUHAKlB"
2017-11-06,"Sean 'Diddy' Combs enters a new phase of life, and changes his name accordingly (again) https://t.co/9EJvAw83TN https://t.co/aHr0g73ddI"
2017-11-06,A new twist: Trump a victim of hackers years before election https://t.co/GQLtn3jxZ0 https://t.co/tc14pBZ5BU
2017-11-06,'The pain is considerable': Senator Rand Paul recovering after alleged attack by neighbour https://t.co/5wX2ptl7d8 https://t.co/s02pFfbKMw
2017-11-06,"Attempted missile strike on Riyadh could be considered 'an act of war,' Saudi Arabia tells Iran https://t.co/iGqR7ePFrD https://t.co/Nu4sdTTQrU"
2017-11-06,Ex-Guantanamo captive plans to sue Canada for $50 million for alleged complicity in his torture https://t.co/HShCQCzH8a https://t.co/9psWtr91d4
2017-11-06,Bargaining breaks down between Ontario colleges and striking faculty https://t.co/kOCzSAuImZ https://t.co/YHrWwQ0kkQ
2017-11-06,"Families losing patience for no-fly kid woes, taking their case to the feds https://t.co/C4x5zunsdw https://t.co/i4ycH8GGKS"
2017-11-06,"Sweeping purge orchestrated by Saudi prince may push kingdom to political crisis, analysts fear https://t.co/uy3ilcSIhg https://t.co/R5S90yMoHR"
2017-11-06,"City didn't receive a call from province for tent assistance, Mayor Watson says https://t.co/lbzvtjEpwh https://t.co/wFr0co01gz"
2017-11-06,"Valerie Plante defeats Denis Coderre, becomes Montreal's first female mayor https://t.co/RKZMkFUKIi https://t.co/PC1I5td26I"
2017-11-06,Isra Levy to leave post as city's Medical Officer of Health https://t.co/ViBVCu1Vfo https://t.co/EvkSDsqfPD
2017-11-06,Managing pain by proper opioid prescribing is now in danger: Thompson https://t.co/DhMH4foO7N https://t.co/KLgksgCh5a
2017-11-06,Paradise Papers reveal new links between Russia and Team Trump https://t.co/7t2rB9YXBY https://t.co/RUnaNn2qt0
2017-11-06,"'Act now, ask questions later': The civilian who chased the Texas shooting suspect at 150 km/h https://t.co/mcasjFMP7G https://t.co/sgewyMzRLK"
2017-11-06,Leonard Cohen to be honoured with memorial concert in Montreal tonight https://t.co/g7NGoaJx3Q https://t.co/xcbpi682WR
2017-11-06,Richard Dreyfuss' son says Kevin Spacey groped him while his father was in the room: 'My mind went blank' https://t.co/wpaAd8uOx9 https://t.co/H0RFxSN8p7
2017-11-06,How to live forever: Here are the ways Silicon Valley plans to conquer death https://t.co/QRAC35VFNe #health https://t.co/2fODLheWcx
2017-11-06,'It was not a good trip': Alex Trebek once ate a mountain of hash brownies https://t.co/WVZQKB2nqp https://t.co/1NIFbDi5VO
2017-11-06,Sunday's trade nothing like the original speculation involving Duchene https://t.co/6ffCH684tQ https://t.co/hKGwUxB3CY
2017-11-06,CRA says it won't hesitate to investigate Canadian tax cheats exposed in Paradise Papers https://t.co/XOvEQbNVcL https://t.co/Nhunf25Fz5
2017-11-06,The best ramen in Japan is coming to Canada https://t.co/xMN7uSGG8U #life https://t.co/R9NbVUxKC5
2017-11-06,Gatineau re-elects Maxime Pedneaud-Jobin as mayor https://t.co/jTbMxU5c2z
2017-11-06,"U.S. Commerce Secretary has stake in firm with ties to Putin, leaked documents show https://t.co/eOhbnSNzGl https://t.co/r3HHkNHOi1"
2017-11-06,"Senators introduce Matt Duchene - ready to be ""part of a long playoff run"" https://t.co/VUl9z3jSPS https://t.co/u3IEDGBcwC"
2017-11-06,How to eat more of the foods that are good for you and less of the foods that are bad for you https://t.co/TlluDAiakV https://t.co/qV3d7Pf8pH
2017-11-06,Ottawa police searching for man facing child pornography charges https://t.co/3iomtSbEHR https://t.co/0yCR5ozHoT
2017-11-06,"Families losing patience for no-fly kid woes, taking their case to the feds https://t.co/C4x5zunsdw https://t.co/xGENkgKkM1"
