id,created_at,text
2014-11-26,Metro London is closing. Today will be the last day of our digital coverage. We’re grateful for your support and readership. Thank you.
2014-11-21,Ontario taxpayers foot bill for disciplined justices' legal fees http://t.co/0DPvuV9SIc http://t.co/AsopbAm3Oq
2014-11-20,"Bill Cosby concert should be cancelled, London, Ont., councillor says http://t.co/97NCES8sNu http://t.co/KM5mLs0pvl"
2014-11-17,Several families will be in a London court today in an effort to stop wind farm construction http://t.co/DNex6EQ1Sb
2014-11-17,Has a criminal conviction &amp; house arrest changed Joe Fontana? We sat down for a chat w/ him: http://t.co/m7SHwpbGnc http://t.co/omF5HE3ch4
2014-11-17,Joe Fontana gave Metro an exclusive interview as he came off house arrest. Here's what he said: http://t.co/CJpgRMTf0d #ldnont
2014-11-16,Joe Fontana had a difficult time during his house arrest. He told us all about it. http://t.co/vKaQOwhY4O  #ldnont http://t.co/HXOdCHrx4s
2014-11-16,"Joe Fontana's message for the new #ldnont council: 
 http://t.co/J6zA7dfW8i"
2014-11-16,Here’s your chance to learn about — and experience— a talented #ldnont family from days gone by: http://t.co/qQSA2IIN8P @MuseumLondon
2014-11-16,Joe Fontana decided not to seek 2nd term as mayor long before being found guilty of fraud. Here he tells all: http://t.co/pD2Z0ofcuI #ldnont
2014-11-16,How about some Sunday afternoon Jazzercise? You got it: http://t.co/UpsihWp57T #ldnont
2014-11-16,What's the first thing Joe Fontana did when his house arrest ended? Find out here: http://t.co/GK0fq0rWHP  #ldnont http://t.co/I4QlpwLpA5
2014-11-16,Joe Fontana is allowed to leave his house again. He gave just one interview. This one: http://t.co/3RzDxr6bjV #ldnont http://t.co/trAebHKOmN
2014-11-16,"Coming tomorrow: Metro's exclusive interview w/ former #ldnont mayor Joe Fontana, fresh off house arrest. http://t.co/YWGrNH35Qb"
2014-11-15,Still making your Saturday night plans? Plenty of our best bets left to enjoy: http://t.co/WSNqv9dZGG #ldnont
2014-11-15,ICYMI: Meet the man who's out to make the #ldnont holiday season wickedly awesome: http://t.co/8m48fYs5N8 http://t.co/C1o2XhRkgO
2014-11-15,Want to celebrate your #LdnOnt neighbourhood? These toque-an show you how. http://t.co/TF1aAYPM1a http://t.co/lEPY6lnWX9
2014-11-15,"Need something fancy, shiny or just different? The wknd best bet billed as 'out of this Earth:' http://t.co/vl26FAlSeE #ldnont @WesternFair"
2014-11-15,"Let your imagination run wild, then head out to this event today and create what you dreamed: http://t.co/toSYaTXo1k @unlondon #ldnont"
2014-11-15,We can think of a great way to show pride in #ldnont ... off the tops of our heads: http://t.co/AIdJ6XAr3h http://t.co/Q5LY4H52Bf
2014-11-15,"Robots, hackers, theatre, gems...what’s not to love about our best bets for your #ldnont wknd: http://t.co/3ra5LXq7bq http://t.co/e3IJEwODnN"
2014-11-15,Hat’s the way to do it! Meet the new #LdnOnt product that’s going to save you from the winter. http://t.co/RplCWO8Ven @itsdpms
2014-11-15,Coming tomorrow: A #ldnont company has just the answer to fighting off winter's sudden chill. Sneak peek: http://t.co/8YFtJr7rjd
2014-11-15,"#ldnont group talking w/ local police, urging changes in wake of 'weak' sentence in #youknowhername child porn case: http://t.co/6Zyk04aDvF"
2014-11-15,ICYMI: Mountie taken to hospital after shooting self (accidentally) at #ldnont police firearms range. http://t.co/YaVZSeIS0c
2014-11-14,He's tiny and evil. Meet the man who's out to make the #ldnont holiday season wickedly awesome: http://t.co/KzA8ql5mv6 @thegrandlondon
2014-11-14,#ldnont 12yo giving piano concert @AeolianHall to help kids who love music http://t.co/hEi409TDFr
2014-11-14,#ldnont man identified as victim in fatal Bruce County crash: http://t.co/VOKcaFVMSO
2014-11-14,What's w/ the purple today in #ldnont? It's all about these sad stories: http://t.co/KEwcR9fFcz #shinethelight #wearpurpleday @endwomanabuse
2014-11-14,Mountie accidentally shots self w/ own gun at #ldnont police station: http://t.co/5Kz4L95GSb http://t.co/Ix3EmYA5fd
2014-11-14,Sentence doesn’t go ‘far enough’ in #youknowhername case @LdnABC says/calls for action http://t.co/RuXNut8zro #ldnont http://t.co/lKg9395Fix
2014-11-14,"There's something new in #OEVldn &amp; it's been described as 'great fun:' 
http://t.co/le6sT8tSnq @OEVCASec #ldnont"
2014-11-14,It is coming. There's no stopping the snow: http://t.co/l3Sk2xxxr9 #LdnOnt
2014-11-14,All this buzz about bee deaths has led one #ldnont group straight to city hall w/ an interesting proposal: http://t.co/yYIL6KGzar
2014-11-14,"Ontario threatens to take away Beer Store monopoly unless it pays ""franchise fee"" to the province http://t.co/iDk2uibxWM"
2014-11-14,"If you're passing through #OEVLdn anytime soon, you may want to keep an eye out for these unusual offerings: http://t.co/OBsNhsNW3P #ldnont"
2014-11-14,Are you 'pollinator friendly?' It's becoming all the buzz these days in #ldnont: http://t.co/QrVh3tRYe5
2014-11-14,What's #ldnont's future? @Mike_Donachie gazes into his crystal ball &amp; tells all (in city council terms at least): http://t.co/yIvK3H9tf9
2014-11-14,ICYMI: LCBO closing in on a deal to open express kiosk in a #ldnont grocery store: http://t.co/BdGsItPzr7 http://t.co/cSpT9wPWcF
2014-11-13,Bees are in decline &amp; city hall is mulling the idea of making #ldnont a ‘pollinator sanctuary’ http://t.co/vz9wioq6WW http://t.co/sFi6YJX4kD
2014-11-13,.@FanshaweCollege has launched a 'reputation campaign' in its bid to woo new students: http://t.co/OhyqsLXS3M #ldnont #fanshawe
2014-11-13,#ldnont's next 4 years in a nutshell: Here's what the fresh-faced council will mean for your pocketbook ... &amp; stomach http://t.co/yEAc7CVuq0
2014-11-13,Need a chance to simply blow off some steam and play? Here you go: http://t.co/bAIj41keIE #ldnont
2014-11-13,Where will the new #ldnont council land on transit/taxes/development/respect &amp; ... food trucks? Our predictions: http://t.co/qdkxdesMtg
2014-11-13,"Londoner charged after Million Mask March clashes with police, city hall vandalized: http://t.co/qoAh360gHg  #ldnont http://t.co/aG7ibdMjYA"
2014-11-13,"A big piece of #ldnont history has made a big move. But that's only half the battle toward saving it, some say: http://t.co/iH2yp9MoU8"
2014-11-13,"He interviewed all the fresh faces, now @Mike_Donachie is out with predictions for #ldnont's new city council: http://t.co/xcfdAfGVlK"
2014-11-13,"We've e-introduced your new councillors. http://t.co/AhyeZIASU3 Tomorrow, @Mike_Donachie weighs in on what it all means for #ldnont's future"
2014-11-13,"Warning, this message from city workers might send shivers down your spine: http://t.co/Hzrp9X3wYd #ldnont"
2014-11-13,Have people's views on war changed so much that we need to change Remembrance Day? Our panel weighs in: http://t.co/Vbbh0pjNHs #ldnont
2014-11-12,"#ldnont's Fugitive Slave Chapel has arrived in SoHo, &amp; supporters say it's just the first part of a big undertaking: http://t.co/oyMWT8cYqK"
2014-11-12,It's snow joke (sorry). #ldnont crews have put 65 pieces of road-plowing equipment (and more) on standby: http://t.co/linEY1WAPC
2014-11-12,Sign of the times? The new face of @CoventMarket is beginning to take shape: http://t.co/i79ZLqQs51 #ldnont
2014-11-12,Remembrance Day — are we doing it right? http://t.co/srzE2vFEQG  #ldnont http://t.co/gAyKjrFkRQ
2014-11-12,.@AeolianHall having big 2014 finale w/ best of best on display from #ldnont artists: http://t.co/NE4RKX4kqI #OEVLdn http://t.co/cmcLYKcutU
2014-11-12,Metro panel time! @ShawnaLewk @adamfearnall @Canucklehead_ca talk: Remembrance Day — are we doing it right? http://t.co/uoXIiO0bqx #ldnont
2014-11-12,.@SWUNSIGNED putting on a big indie music show in #ldnont w/ proceeds staying local. Here's what you can expect: http://t.co/UKll84fkKw
2014-11-12,Beef Baron stabbing: Man charged with four offences. http://t.co/7BusRCdRMD #LdnOnt
2014-11-12,Sometimes the best way to build the future is by looking at the past. A group in #OEVLdn is doing just that; http://t.co/iAZXplaoSq
2014-11-12,ICYMI: Highlights from #RemembranceDay in #ldnont: http://t.co/Oe9kyMH4xe http://t.co/eWzFxvQEFR
2014-11-12,@Hollingsworth49 Sorry about that. It's @Vibrafusion Lab (355 Clarence St.)
2014-11-12,Staff at @HealthCentre are turning back the clock 20yrs for a new look at #OEVldn: http://t.co/Cpgr3u4o13 #ldnont http://t.co/fQaKoN7oMS
2014-11-12,"Expected to be a #RemembranceDay like no other in Canada, it didn't disappoint in #ldnont: http://t.co/MRW86k3OMc http://t.co/W2TsIGCcFP"
2014-11-12,"The new #ldnont city councillor who's been trying to ""get ideas out there"" for at least a two decades: http://t.co/fLt0FpXpA3"
2014-11-11,"4 bands, 1 night &amp; a giantreminder that indie punk is still alive — &amp; thriving — in #ldnont: http://t.co/IShsR6Nf2b @SWUNSIGNED #swunsigned"
2014-11-11,"Missed today's #RemembranceDay ceremony on #ldnont. No worries, this is what is sounded and looked like: http://t.co/qosigPRJvn"
2014-11-11,Big name coming to #ldnont @kingsatwestern this week to remind students about the importance of a chill pill: http://t.co/zOq1Q6Tgw6
2014-11-11,The sights and sounds of #ldnont's #RemembranceDay tribute:  http://t.co/LwoSYFgi6M http://t.co/RNoPmzt0vf
2014-11-11,This new #ldnont city councillor spent years as the saxophone player in the clown band at Canada's Wonderland. http://t.co/xivwQ6pPch
2014-11-11,#ldnont @3M_Canada plant to benefit from $3M gas mask contract. http://t.co/UcwhIQJrKY http://t.co/COZlpdWFIw
2014-11-11,#ldnont #RemembranceDay events will start in about 40 minutes. Details:  http://t.co/ihNEtGq37m http://t.co/BP8Cu9eq9z
2014-11-11,Take a moment to remember. Details of some Remembrance Day events in #LdnOnt: http://t.co/LXJQJm33Ok http://t.co/Y44UpjapVd
2014-11-11,"Meet @mikevanholst, the #LdnOnt man who unseated a council veteran and has big ideas: http://t.co/W7B6E0SNxj http://t.co/tx7yKpoFq0"
2014-11-11,Treading the boards in an angry way. With humour. http://t.co/9UiTSki0Ex  #LdnOnt http://t.co/dLosVh2dSn
2014-11-11,Splash! Want to find out more about the improvements to #LdnOnt's aquatics centre? Dive in here: http://t.co/IKOiskqkeR
2014-11-10,Remembrance Day is here again. Details of some #LdnOnt events here: http://t.co/aFhHtIg4rL http://t.co/DbI9ZKMlKz
2014-11-10,Anger and comedy? This one's a minefield. A new stage show in #LdnOnt next week: http://t.co/TNQK0e3xpU http://t.co/3sf2AIUcSF
2014-11-10,Big money's been spent on the Canada Games Aquatic Centre. Here are the results: http://t.co/I78kNyLrfP #LdnOnt
2014-11-10,"Meet @tanneramma, the new #ldnont councillor who's a champion for the core and SoHo: http://t.co/UeN05aWcdx http://t.co/GwirdnCMSG"
2014-11-10,"Being as good as other cities isn't enough for new #ldnont councillor Tanya Park. We have to ""pass them,"" she says:  http://t.co/uy88raxR2U"
2014-11-10,Think you know the new faces on #ldnont council? Not until you check out this series: http://t.co/nP8HFzARG8 http://t.co/dceLFQyJIk
2014-11-09,"The new #ldnont councillor who's passions include city, history &amp;, gotta love it, beer. Meet the real @JaredZaifman: http://t.co/FtsjoTcld7"
2014-11-09,Historian unlocking secrets of #ldnont's past today @Eldon_House — one of our best bets for your wknd: http://t.co/IreUPinqGF
2014-11-09,The Lambeth legion is marking #RemembranceDay today. Details here: http://t.co/ZRBIRdJeIN  #ldnont http://t.co/xvj7BgdFDy
2014-11-09,Think new #ldnont councillor @JaredZaifman is inexperienced? His background speaks otherwise — even if he is shy: http://t.co/xnRXK5OTKx
2014-11-09,Looking for something to fill the day? Still a couple of our best bets for the wknd coming up. Have a look: http://t.co/lJeio0vL4L #ldnont
2014-11-09,He's the youngest on our new #ldnont city council.But there's much more to say about this guy: http://t.co/DOrzrQuFC2 http://t.co/px3bi6WZsr
2014-11-09,What's new #ldnont city councillor @SquirePhil's biggest pet peeve? This: http://t.co/OoEKCqIG9V http://t.co/YZWCtSudfS
2014-11-08,T-minus 30 mins til Santa starts his trek into #ldnont. All the deets on the big procession: http://t.co/0eRZFCNvUM http://t.co/cmC9as7aOF
2014-11-08,Do you know your new city councillor? Here's your chance to get up to speed (or learn some new things): http://t.co/GUgzleRFAb #ldnont
2014-11-08,Video: HR officer issues serious challenge to #ldnont workers ... while wearing a chicken hat. http://t.co/23naS8Aw5S
2014-11-08,"Santa, Remembrance Day ceremonies, history: Still plenty of our bets for the wknd to enjoy: http://t.co/0Flbv7i4H7 #ldnont"
2014-11-08,#RemembranceDay is a few days away but some #ldnont groups are having ceremonies this wknd: http://t.co/RzEaLZ5MP3 http://t.co/m0rX0P8Vo6
2014-11-08,You may know @SquirePhil as a lawyer/face on school board. But do you know his marathon time? We do: http://t.co/1GXYPVPqhi #ldnont
2014-11-08,"Did you know @Eldon_House has secret areas w/ hidden #ldnont history? If you act fast, you might get a look today: http://t.co/HIgMnDJDw5"
2014-11-08,What makes #ldnont's new Ward 6 city councillor hot under the collar (and we mean really hot)? This: http://t.co/YJdMG7Ihqv
2014-11-08,#ldnont police are urging ppl who live in this area to take extra safety precautions after a spike in home break-ins: http://t.co/jxNIyQuuUx
2014-11-07,#ldnont's @rtraction dedicates $25K to recording the oral histories of cities/towns across Canada: http://t.co/2SqRhiVRJw @taleofatown
2014-11-07,Apathy in #ldnont? Not according to this new face at city hall: http://t.co/uhvpDQCoTb http://t.co/v8qzXbjLze
2014-11-07,"@JSaundersOnline FYI: you're tweeting a news organization in London, Ontario, Canada"
2014-11-07,#ldnont bar/restaurant patios could soon be a little less smoky: http://t.co/UstgLnLsiH http://t.co/mCCD86lbCK
2014-11-07,'Our hearts are here and it shows:' #OEVldn gets national nod for doing what it does best — being great. http://t.co/zsG3Vg9PV1 #ldnont
2014-11-07,Do you live in this area? #ldnont police have issued a crime alert after a spike in home break-ins here: http://t.co/hdoueju5b2
2014-11-07,It's official. #OEVldn is one of the best neighbourhoods in Canada: http://t.co/srKf3A18gk @GreatPlacesCA #ldnont
2014-11-07,"Unemployment inches up, labour force inches down in #ldnont area. Latest numbers from Stats Can out today: http://t.co/9W45rK14J0"
2014-11-07,"You might know about @AnnaHopkins11's Reservoir Hill fight, but there's more to the new #ldnont councillor than that: http://t.co/rW6LcjzIdK"
2014-11-07,Ever wonder what magic is? An event in #ldnont today is promising to tell all: http://t.co/LC4TDR2YO9
2014-11-07,"Community, community, community.Oh,did we mention community?Meet the new #ldnont city councillor who truly ""gets it:"" http://t.co/3RWG7GRZFQ"
2014-11-07,This paramedic is used to dealing w/ crisis. But can he handle the drama @ #ldnont city hall? @st3v3turn3r says yes: http://t.co/4JMoSMz6hJ
2014-11-07,ICYMI: #ldnont street work has sent Santa Claus packing http://t.co/1Qrn5pisME http://t.co/UCSm4IbGFQ
2014-11-07,"Survey: 72% of teens say science is fun,but they still don't want a job in it— &amp; that's a problem #ldnont group says: http://t.co/B0hxGDhLrd"
2014-11-07,Video: HR officer issues challenge to #ldnont workers ... while wearing a chicken hat: http://t.co/Io14ZCykMI http://t.co/u1fJ5HLv1N
2014-11-06,What's the difference between magic &amp; magick? A lot says this guy who's about to give #ldnont a lesson in the occult: http://t.co/m7qu3gYQeR
2014-11-06,"@DavidWinterPW Hey, it's better than ..... sun? A blizzard maybe?"
2014-11-06,'Shifting from remission to recovery:' A new exhibit @theartsproject is about more than just creativty: http://t.co/vZwWHv5EuB #ldnont
2014-11-06,"Yes, Virgina, even Santa Claus can't avoid #ldnont road work. Construction snarls his arrival: http://t.co/4nhR95bjxb http://t.co/LoGs2JcGK9"
2014-11-06,"@Sadie_Liz Thx! That @Mike_Donachie's a superstar, no? http://t.co/ZmHCRcOUFw #ldnont"
2014-11-06,@DeannaRonson Yes. Temporary cafe up and running!
2014-11-06,How chicken hats helped a #ldnont company become 1 of the best places to work in Canada: http://t.co/0UIW4YzF9T @STARTECHdotCOM
2014-11-06,"Teens know science is impt, still not interested. New report from #ldnont's @LetsTalkScience highlights challenges http://t.co/H6Icghupxs"
2014-11-06,A big comeback tour has announced a stop @BudGardens in 2015: http://t.co/JEliobst4y #ldnont
2014-11-06,Which new #ldnont city councillor caught his love for public service during a first-aid class? This guy: http://t.co/yiLSE0DHkG
2014-11-06,Coffee on the brain? There's a new #ldnont brew w/ names like Super F’n Dark &amp; Velvet Hammer: http://t.co/hSZlTtEQzi @patricksbeans
2014-11-06,"He's literally been saving lives for years. Now, @st3v3turn3r wants to help more ppl via a role @ #ldnont city hall . http://t.co/BAIz04TBCG"
2014-11-06,ICYMI: Call for changes made after death following fire at east #ldnont “group home” operating outside city bylaws. http://t.co/WEnu4LFWxo
2014-11-06,"Calling all poets! Er, we mean city councillors. The #ldnont event w/ a whole new twist on political introductions: http://t.co/fNEDKcclwT"
2014-11-06,"Will the next 4 yrs @ #ldnont city hall be all rainbows &amp; kittens? We hope so, but that's not likely to be the case: http://t.co/0vs9qnszBL"
2014-11-05,#ldnont's @BudGardens announced as stop on @Nickelback 2015 #NoFixedAddress tour: http://t.co/T1ZqWUCuBq http://t.co/nA0MgH7VJI
2014-11-05,Patrick’s Beans: #ldnont’s new coffee option with a feel-good mission. http://t.co/392NRRjDL1  @patricksbeans http://t.co/hEPKlw6TlO
2014-11-05,#ldnont mental health advocate calls for changes after fire @ “group home” operating outside city bylaws: http://t.co/puqYGBErmF
2014-11-05,#ldnont politicians are about to grab centre stage &amp; say something a little different. Poetry anyone? http://t.co/MksVSF714Y
2014-11-05,"Was this the biggest #LdnOnt election shock? Meet @virginia_ridley, who's so different from her predecessor: http://t.co/Z9I7Rs83XN"
2014-11-05,"New #ldnont council been unfairly painted w/ a broad, progressive brush? Some say we don't know what we're in for: http://t.co/aOdu4sbCDH"
2014-11-05,#ldnont police major crimes unit probing Oxford Street fire after man taken to hospital dies: http://t.co/OsFxD7zqK1 http://t.co/xdLwDCITNH
2014-11-05,It's that time of year again. @PillarNN is getting ready to honour the 'quiet giants' of #ldnont: http://t.co/ZthKClHrmY
2014-11-05,".@virginia_ridley 'grew up very poor,' working jobs before &amp; after school. Now, she's ready to work for #ldnont: http://t.co/g9pIabuapK"
2014-11-05,"Homecoming street parties need to end &amp; #ldnont needs to invest in transit, #westernu student leader @MattHelfand: http://t.co/lkLiSdjocc"
2014-11-05,Meet the new #ldnont councillor who grew up in community programs &amp; says they are critical to transforming cities: http://t.co/K3O99mewtA
2014-11-05,The story behind the man who's seemingly stolen the hearts of #ldnont's Ward 3 and &amp; what he plans to do next: http://t.co/66Y5JnGXRH
2014-11-05,"Young? Jobless? Work for free, Bank of Canada governor says: http://t.co/79moV0nucj  #ldnont http://t.co/jQo3NxFx7u"
2014-11-05,'Brutal repression &amp; violence:' A powerful exhibit that's been around the world is landing @kingsatwestern http://t.co/QGELCRCIkW #ldnont
2014-11-04,City is about to own Lorne Ave. school. Should it be torn down for housing? Big discussion brewing in east #ldnont: http://t.co/lCYDbjHoya
2014-11-04,#westernu student leader says state of #ldnont transit 'unacceptable' in annual state of @WesternUSC address: http://t.co/eZzjwMKLmu
2014-11-04,A council committee gave the go-ahead today to razing 2 heritage properties: http://t.co/Mn5RFnib3z  #ldnont http://t.co/AR6i2gGaLN
2014-11-04,.@TVDSB selling Lorne Ave. school to @CityofLdnOnt. But first there needs to be a big discussion in #OEVldn: http://t.co/74IPC82AGp #ldnont
2014-11-04,@endwomanabuse Our pleasure! http://t.co/HuISNQBjD3
2014-11-04,Do you know Mo? Meet the new #ldnont Ward 3 councillor who's something like a force of nature. http://t.co/frpu9Oe0W7 http://t.co/yeGJETUmSc
2014-11-04,Real ppl w/ stories of 'brutal repression &amp; violence:' @kingsatwestern exhibit tells human cost of Holocaust http://t.co/o2imUjHK5I #ldnont
2014-11-04,"ICYMI: Emotional night, powerful messages as #ldnont marks start of #ShineTheLight @endwomanabuse campaign: http://t.co/Tqox5Kj0Xc"
2014-11-04,Why are arts &amp; culture valuable to the #ldnont economy? Because of stories like this: http://t.co/r4ApPSfVmi @thegrandlondon
2014-11-04,Q executive producer taking time off amid #JianGhomeshi allegations: http://t.co/6rcBAlvvBP http://t.co/xw7f9bp3MA
2014-11-04,1 of the first things on @MohamedMOSalih's council agenda: Working w/ minorities &amp; ppl who get overlooked. http://t.co/AvU2pJqTsf #ldnont
2014-11-04,Which new #ldnont city councillor wore out four pairs of shoes on the campaign trail? This guy: http://t.co/FM0JzCyNUx
2014-11-04,Long day? Looking for some help to tackle Tuesday? It's time for a Metro motivational moment w/ @PaulaMorand: http://t.co/ocAXpvwyNq #ldnont
2014-11-04,Daughter of murdered #ldnont woman makes emotional plea to community: http://t.co/ST3tMl7hki  #ShineTheLight http://t.co/uoyO5rFlbN
2014-11-04,"A lot of ppl have heard @mrjoshmorgan talk politics. But, did you know he has an artsy side too? Have a look: http://t.co/vxCl7YfYuK #ldnont"
2014-11-03,#Fanshawe is moving closer to have thousands more students roaming the core. http://t.co/5oyvmb9Qes
2014-11-03,"In a matter of weeks, @FanshaweCollege will own it's newest building in downtown #ldnont. Here's the latest: http://t.co/i4N409LjHX"
2014-11-03,There's been a major accolade for Mitch Marner of @GoLondonKnights: http://t.co/Xee9L73hgp #OHL #LdnOnt
2014-11-03,Everyone's invited to tonight's big launch of @endwomanabuse #ShineTheLight campaign. Details: http://t.co/CYBxE8723c #ldnont
2014-11-03,"'… Whoa, this is kind of a bit much:' #westernu grad talks about encounter w/ #JianGhomeshi during Q internship. http://t.co/Udr64e7NZP"
2014-11-03,Achy joints? #ldnont researchers may soon have the remedy w/ @westernu spending millions on new initiative: http://t.co/VMdpqFqUGJ #westernu
2014-11-03,@VictoriaLCraig TY!! @PaulaMorand is great! http://t.co/OYhzHfbEji
2014-11-03,You learned a lot about @mrjoshmorgan during the election. These are some of the things you don't know: http://t.co/sOpoq3lCKi #ldnont
2014-11-03,"Need inspiration? @PaulaMorand has it, and some advice. http://t.co/pZgwEaq4jA #LdnOnt"
2014-11-03,Western University students were warned against Q internships after reports of Jian Ghomeshi's behaviour http://t.co/Dtp5uNbCnR
2014-11-03,"'I want to be there, talking to people:' Meet the new #ldnont councillor who seems to enjoy being held accountable: http://t.co/uCvnxCAQa9"
2014-11-03,A new Joni Baechler? Councillor-elect @MaureenPCassidy would proudly claim the title: http://t.co/0vT56JmOWZ  #ldnont http://t.co/ES2QY6uIdW
2014-11-02,.@PalaceTheatre hosting Robin Williams double-bill tonight. It's all about men's health &amp; building awareness: http://t.co/PU9yGlER4f #ldnont
2014-11-02,"Wknd coming to an end, but still plenty to do today in #ldnont. Our best bets for good times: http://t.co/uvs90kouEq"
2014-11-02,Look more puzzle than intersection? City is worried it'll cause problems for #ldnont drivers: http://t.co/aLcu48SHIS http://t.co/pMqoxWuuvM
2014-11-02,What's new #ldnont Ward 5 councillor Maureen Cassidy all about &amp; how did she leave 7 other candidates in the dust? http://t.co/3n3X1l2Aqy
2014-11-02,"If Saturday's party wasn’t enough, there’s always Sunday afternoon. Cool event today @apklondon: http://t.co/VUz6iDuaYW #ldnont"
2014-11-02,Could @MaureenPCassidy be #ldnont city council’s new Joni Baechler? http://t.co/Umkcw40skX
2014-11-02,2 #ldnont heritage properties may be razed if city councillors give the go ahead next week: http://t.co/N6QWJ3BjHs http://t.co/to7U1nd95s
2014-11-01,#ldnont police release descriptions of two men wanted in downtown stabbing: http://t.co/CLRxcK0SvD
2014-11-01,#ldnont police have laid charges after a hit-and-run involving a pedestrian: http://t.co/c7laKMMDCE
2014-11-01,Looking for something to do tonight? Consider heading to @BudGardens for this 7 p.m. event: http://t.co/vGpabXRBhO #ldnont
2014-11-01,You won't find twerking in this video. #ldnont musician @missmtomlinson is out to make a different kind of statement: http://t.co/T6oIZHwkKQ
2014-11-01,"Which new #ldnont councillor thinks ""government can be a real force for good in the world?"" This guy: http://t.co/svITGmEVeU..."
2014-11-01,ICYMI: #ldnont company expecting to hit global stage after takeover http://t.co/Hs5ZKG7SoI
2014-11-01,"Tired of waiting for permission, guerrilla gardeners are planting an attack on #ldnont: http://t.co/RxVq38cqRQ http://t.co/q3g4EBt8DL"
2014-11-01,#ldnont group promising a huge fireworks show tonight. One of our best bets for your wknd: http://t.co/zkXGJXsol4 http://t.co/vKjVchx4Ht
2014-11-01,He ran for #ldnont council b/c he was frustrated &amp; he was inspired by @nenshi. Meet @jesse_helmer: http://t.co/qbNYHts9Py
2014-11-01,"Fireworks,music,@LondonLightning,Robin Williams — plenty of fun to be had this wknd in #ldnont. Our best bets: http://t.co/JNuLJa9k9z"
2014-11-01,"You know the names, but who are they? Start of a series getting down &amp; dirty w/ the 11 new faces on #ldnont council. http://t.co/66MwEnVCI3"
2014-11-01,Good news on the #ldnont economy front as local company taken over by a digital elections powerhouse: http://t.co/cYWd18EPID
2014-10-31,#ldnont's @akirasystems has been bought by digital elections giant @Scytl_SA &amp; that means growth Akira says: http://t.co/eLKWZBmJto
