id,created_at,text
2014-10-02,#ldnont animal shelter vet facing disciplinary action: http://t.co/NaJnzdyV2Q
2014-10-02,Are scrunchies making a comeback? These 3 #ldnont entrepreneurs are betting their bottom dollar on it: http://t.co/Shgc5Y5vm0 @ezzylynn
2014-10-02,"We know where we’ve come from, right? Think again. The #ldnont history you hear isn’t the full story. http://t.co/a6DMy8u20x #LdnLost"
2014-10-02,Falling leaves leafing you in a bind? There’s a new place to unload them in #ldnont: http://t.co/9V2kEgZRUv http://t.co/Mwa6DjuLQv
2014-10-02,This might make your skin crawl: Important alert issued by UTRCA  http://t.co/gcWf1vmduk #ldnont @UTRCAmarketing
2014-10-02,A #ldnont man has been fingered as a peeping Tom preying on houses around @westernu. http://t.co/AKnbs6o9Ig #westernu
2014-10-02,Is #LdnLost? There's 2 histories of #ldnont — the one you read in books &amp; the one that's often overlooked: http://t.co/8B5a7qL2AL
2014-10-02,"Coming at noon, Part 2 of Is #LdnLost? series: @Mike_Donachie takes you back in time, exploring the #ldnont history we don't hear about."
2014-10-02,'I will not promise jobs' @RCaranci says as he announces job-creation plan for #ldnont: http://t.co/5IW2XyVRcp #LdnVotes
2014-10-02,"This cool #ldnont project started with an idea, a hat and a song: http://t.co/jQBBmbAh0Q @ShawnTronPhoton @enterwolfsaga @itsdpms"
2014-10-02,"11 years after being raped, #ldnont woman tells her story in hopes of starting conversation:  http://t.co/TxokJXPa8T http://t.co/2heVGzJvNZ"
2014-10-02,A trio of talent: Londoners team up for music project w/ a message about the power of partnerships http://t.co/biKShPtq3z #ldnont
2014-10-02,Are we having an identity crisis as a city? Share your thoughts here: http://t.co/RwPKJt41Ha  #LdnLost http://t.co/ghmhFGJ55k
2014-10-02,"Goodbye @MLHealthUnit,hello high rise:#ldnont planners support developing key dwtwn corner. http://t.co/wViTkdHvyr http://t.co/U4Tc4yG0J8"
2014-10-02,Inmate’s death at London jail under investigation http://t.co/p9CAkPDinD
2014-10-02,ICYMI: A #ldnont mayoral hopeful under fire for promising to support local business but having website made in U.S. http://t.co/y13ZeYL31t
2014-10-01,That London. This #ldnont. What London? Is London Lost? Part 1 of a one-week series: http://t.co/k6HEVvmYUi #LdnLost
2014-10-01,"There's a rape ""epidemic,"" says #LdnOnt victim Jane Piper. Now she's speaking out: http://t.co/u7FBdE0wAh http://t.co/lGhP8vNuON"
2014-10-01,"Get it right, say the planners. Details of a new high-rise in downtown #LdnOnt: http://t.co/EMeLa1Wby3"
2014-10-01,Is #LdnOnt having an identity crisis so severe that we should change its name? Some people think so: http://t.co/5BvJuL7kTk #LdnLost
2014-10-01,"Yes sir, Captain Tightpants: A big name has pulled out of @ForestCtComicon http://t.co/qJLpn6bGeI http://t.co/aGTLteNyTw"
2014-10-01,"Does #LdnOnt know what it is &amp; where it's going, or is #LdnLost? Start of a Metro series exploring the question: http://t.co/RFXj9Q0tht"
2014-10-01,Starting a noon today: A weeklong series exploring a simple question: Is London lost? #ldnont #LdnLost http://t.co/TX8yVSpPGv
2014-10-01,Matt Brown has promised to help #ldnont companies if elected mayor. So why was his campaign website made in Calif.? http://t.co/Fxgu6z4lsi
2014-10-01,The jobs candidate? #ldnont @Matt_Brown_ under fire for having U.S.-made campaign website: http://t.co/BgHemHwspD http://t.co/e3ly1pG6MB
2014-10-01,Trying to break into the job market? @EmergingLondon wants to help: http://t.co/tnyR8gh5sH  #ldnont http://t.co/WiFt4HNtlW
2014-10-01,This new #ldnont campaign is all about giving and receiving the best things you can imagine (w/ link this time): http://t.co/LrIJfeRiPu
2014-10-01,@_BradMcKay_ @OchoRiosGurl Apologies. Here you go: http://t.co/GNu1I5OGDS
2014-10-01,Need a little love? This new #ldnont campaign is all about giving and receiving the best things you can imagine: http://t.co/xy6UuWr8be
2014-09-30,"If you want to #BuyLocal &amp; fresh, two new ways to make it happen are coming to #ldnont: http://t.co/SMP4TlKcpC"
2014-09-30,How did @MikePMoffatt @PeggySattlerNDP @dbillson find success? Ask them yourself says @EmergingLondon: http://t.co/k04wX8SBWT #ldnont
2014-09-30,#ldnont @JeffYurekMPP has turned online to find support for bill inspired by a 12yo's death: http://t.co/fhj4vpqS66 http://t.co/1nMPtlH17Q
2014-09-30,"What's the best way to fight #haters? A 'kindness revolution,' of course http://t.co/uiY0Xi5LWB @luso_london #ldnont"
2014-09-30,Nearly 200 jobs coming to #ldnont as @FarmBoy announces two new stores: http://t.co/D01Hipkee9
2014-09-30,Farm Boy to open two new #ldnont stores: Masonville and Beaverbrook. Full story follows.
2014-09-30,Getting technical: The spotlight is being turned on growing new crop of #ldnont specialists http://t.co/71tUfn9lE8 @TechAlliance
2014-09-30,Expect to see hundreds of extra young faces in #ldnont. @westernu is gearing up to host a big event: http://t.co/mYTIppXhmt @AIESECcanada
2014-09-30,"There's a worrying trend taking shape, and you could be 1 of 100 Londoners who helps nip it in the bud: http://t.co/eV8pJXbL6C #ldnont"
2014-09-30,"A Canadian organization is trying to stop a worrying trend, and it's calling on #ldnont to help nip it in the bud: http://t.co/wzbWKtrNnb"
2014-09-30,"There’s a problem, and 100 Londoners per week are being asked to help: http://t.co/f8M833fQeV @itsinyoutogive #ldnont"
2014-09-30,"Meet Youn S. Lee: Ontario’s newest multi-millionaire. And, oh yeah, he lives in #ldnont: http://t.co/zwM6Iqkp9c http://t.co/jPohWkaCjk"
2014-09-30,"ICYMI: Two people have been charged in #ldnont w/ stealing a family's mementos of a dead infant 
 http://t.co/WIfWPEVY0N"
2014-09-30,"""Crazy"" and ""humbling"": #ldnont startup @pulpandpress sees big success, gaining firm squeeze on juice market. http://t.co/91ZBeFCMAA"
2014-09-29,.@MayorofLdnOnt @irenemathyssen are just 2 of the big names donating to this #LdnVotes council campaign: http://t.co/kXlE8bUwPk #ldnont
2014-09-29,"#fanshawe starts fund to help international students, showing 'how great Canadians can be' recipient says: http://t.co/hMuGwDuvGt #ldnont"
2014-09-29,Remember that $14M #LottoMax ticket sold in the #ldnont area? The winner has stepped forward:  http://t.co/cTFI3xjoD6 http://t.co/onnKFr79EH
2014-09-29,Proposal would take secondary students off school buses and load them onto LTC. http://t.co/tbeiP8S8yi Good idea or bad? #ldnont
2014-09-29,Who's paying for @mrjoshmorgan bid for #ldnont city hall? These people: http://t.co/AbDip9vxgQ  #LdnVotes http://t.co/CPAw8xRGch
2014-09-29,"Some, not all, items found in baby memory box case. Two charged: http://t.co/z5nv8APlW7 #LdnOnt"
2014-09-29,"A #ldnont success story: Juicers @pulpandpress seeing big growth, teaming up with @Balzacs to press into GTA market. http://t.co/C7QQBXZJL9"
2014-09-29,ICYMI: The #LdnOnt man giving away his million-dollar idea to help ALS sufferers: http://t.co/afHe9lN5Nz
2014-09-29,"Free @themetrolondon coffee now gone. Thx to those who emptied the pot. If you missed out, stay tuned on Twitter. It will be back. #ldnont"
2014-09-29,@BritownMusic C'mon … coffee break!
2014-09-29,Clarification: That free coffee from @themetrolondon is at DOWNTOWN @fireroastedcafe. It's not a joke. The pot is waiting. #ldnont
2014-09-29,Free coffee from @themetrolondon on offer at @fireroastedcafe. Come get it while it lasts  #ldnont http://t.co/XuklRIWZ7C
2014-09-29,Search underway in Norwich area for missing two-year-old who wandered from her family's farm last night http://t.co/6NHvQu2e5p
2014-09-29,"The newest cultural event to hit #ldnont is all about, you guessed it, words: http://t.co/Pl7aYvGTlC http://t.co/Bk5GaxiABV"
2014-09-28,This @westernu grad is part of an effort that’s giving a voice to ppl who were trapped in their own bodies. http://t.co/erIX2QrrT1 #ldnont
2014-09-28,Need a free bike? Have one you want to get rid of? A #ldnont biz is working on a project that can help both camps: http://t.co/NhbBUDf7CS
2014-09-28,Still plenty of time left to do some poking around in your own back yard at Doors Open/Culture Days: http://t.co/885b7qitqA #ldnont
2014-09-28,Want a look inside the former #ldnont Asylum for the Insane? Today's the day. One of our best bets for you wknd: http://t.co/cT7DsoNq4c
2014-09-28,Meet the #LdnOnt man who’s changing lives with code he’s writing in his basement. http://t.co/m9I7EfEOeh http://t.co/7g7sB5rlMw
2014-09-28,You’ve got a million-dollar idea. You can’t just give away. Or can you? http://t.co/uTwL6uDxb5 #ldnont @SYMfound
2014-09-28,Prepare for trouble. Make it double. The women whose lives are one big coincidence: http://t.co/w1SbqWWPHh  #ldnont http://t.co/opsQsnF1YP
2014-09-27,No Sat. night plans? This will be a scream (we promise). One of our best bets for your wknd: http://t.co/95rXjtguN0 #ldnont
2014-09-27,What do you love most about #ldnont? Some of Twitter’s well-known faces open up about their fav things: http://t.co/6yzsXHc391
2014-09-27,#Ldnont gallery that ‘reflected the origins of Canada through art’ closing up shop: http://t.co/1cqNQbdm42
2014-09-27,How about an afternoon text trade? Neat project launched at downtown #ldnont art gallery: http://t.co/BQ404g6snU http://t.co/ZOmhArTwIK
2014-09-27,Another downtown #ldnont business is closing as its owners move on to retirement: http://t.co/4lms30lFI5
2014-09-27,"History, culture, art — lots to do this wknd in #ldnont. These are our best bets for whiling away the next two days: http://t.co/lpBrtFmKLH"
2014-09-27,One #ldnont mayoral hopeful is claiming he has record support — and the numbers to prove it: http://t.co/bO2VpNFKLt
2014-09-27,A business built around sharing Canada’s rich cultural diversity is leaving downtown #ldnont: http://t.co/0PsS998guU
2014-09-27,The @Matt_Brown_ campaign has released details about donors/volunteers — and made a big claim:  http://t.co/qrv76iOY70 #ldnont
2014-09-27,"This #ldnont kitten was more than cuddly, he was an inspiration: http://t.co/BP7wPAVaBZ http://t.co/Y4Aduk7BGe"
2014-09-27,ICYMI: #ldnont police lay new charge against driver in tragic Costco crash. http://t.co/dqt9ZrF6tt
2014-09-26,"Speaking of the mayor’s race, here’s what happens when @PaulChengLdn answers ‘unscripted’ questions: http://t.co/8iH7CEWhpI #ldnont"
2014-09-26,Is @Matt_Brown_ making history w/ his election campaign? That's the claim he made today: http://t.co/87uHpBZydO #ldnont #ldnvotes
2014-09-26,A doctor's appointment you don't want to miss: Whovians unite this wknd in #ldnont. http://t.co/rBNZoNS1wc
2014-09-26,"From hand-painted signs on down, this #ldnont 'politician' wins the title for being as green as they come: http://t.co/6XYvIQtTqv"
2014-09-26,#ldnont Police lay new charge against driver in Costco crash case: http://t.co/TLSDdPZArq
2014-09-26,Video: Pre-approved questions? Not these. @PaulChengLdn says to ask him anything. http://t.co/lxfe5Owhir #LdnOnt
2014-09-26,Updated: The search for a stolen memory box now involves a $500 reward. http://t.co/CFifjebRtU #LdnOnt
2014-09-26,"Here's what happened when a #ldnont 8yo decided she'd rather “help the kitties"" than get presents for her birthday: http://t.co/v5c9PuqqWJ"
2014-09-26,Peek inside local history at the former London Asylum for the Insane: http://t.co/gv1TYRlYGF #ldnont @stjosephslondon http://t.co/maqlYLMLbq
2014-09-26,"Meet Finn, the #ldnont kitten who inspired a movement http://t.co/9jKpr0UzWh @HollysHopeLee http://t.co/0HkkwWbQAf"
2014-09-26,A big piece of #ldnont medical history is about to go on display. Deets: http://t.co/4XdK6pqZan @stjosephslondon
2014-09-26,ICYMI: 3 Londoners among 60 ppl facing charges after massive online child exploitation sweep. http://t.co/wTTZsIZoWh
2014-09-26,"How gold-plated rabbit ears could revolutionize your smartphone: 
 http://t.co/gku2W2QXYO #ldnont #westernu http://t.co/sGDcbBiloy"
2014-09-25,A box of delights: @sherylwillwrite opens city's tiniest library — in her front yard http://t.co/skKkOaMyLG  #ldnont
2014-09-25,What was it like inside the old #ldnont Asylum for the Insane? Here's your chance to find out: http://t.co/TkAZ5ovAN8 http://t.co/zkPGfjIq6Z
2014-09-25,Up for a challenge? Try planting 800 trees in 5 hours. These folks doing it to make #ldnont better: http://t.co/ZGZaGw6Jof
2014-09-25,"ICYMI: Parents of cyclist killed in #ldnont crash question Ont. road laws, working w/ lawyers to pursue 'remedies' http://t.co/ols0ybdNfo"
2014-09-25,Tired of your cellphone dying? A golden discovery @westernu could fix the problem once and for all: http://t.co/C6yyp6zqQ5 #ldnont
2014-09-25,"Lazy, but want to look professional? Try The Suitsy, a onesie business suit for men. http://t.co/qmyp5BdDt8  #ldnont http://t.co/byJKZIcKqG"
2014-09-25,"There’s a new attraction in east #ldnont &amp; it’s the littlest, cutest thing you’ve ever seen. http://t.co/hex98dJYhx http://t.co/IzTB0kCYni"
2014-09-25,3 people from #ldnont charged in massive online child pornography sweep: http://t.co/SZlBjna0eU http://t.co/x5U5t3RCNW
2014-09-25,The Holly Painters: Digital 'doppelgangers' who share much more than an email address http://t.co/4g0BxLVqz7  #ldnont http://t.co/GRGHtpKKxt
2014-09-25,You're mayor of #LdnOnt. You can achieve just one thing. What'll it be? This is what 13 candidates said: http://t.co/0BCLunuvq6 #Ldnvotes
2014-09-25,Curtis Glencross scores OT winner for Flames in pre-season win http://t.co/hKmSWp9HLq
2014-09-25,Highlight's of tonight's big mayoral debate in #LdnOnt: http://t.co/7IrPxoPkdo
2014-09-25,"There's a lot to love about #ldont, but is it lacking a clear 'destiny.' Metro panelist @philipmcleod thinks so: http://t.co/hqLy9WF3UN"
2014-09-24,"Family of #ldnont 19yo killed @ Riverside/Wharncliffe says laws don't 'protect cyclists,'issues statement via lawyer: http://t.co/1d0u2NS1wp"
2014-09-24,"Same name, age, creative passion &amp; more. Amazing story of digital 'doppelgangers': http://t.co/AxnWCQDuO0  #ldnont http://t.co/RFyDqVVQry"
2014-09-24,We're ready to go at the #ldnont mayoral debate. Up to 13 candidates expected. Story later tonight. #ldnvotes
2014-09-24,'She had no safe route:' Advocate takes aim at city as police say no charges laid in teen cyclist's death http://t.co/fWWnLXJ18t #ldnont
2014-09-24,Ever get someone else’s email? For @Hey_MissP and @HolyPainter it's gotten downright spooky: http://t.co/T7aLtZ3q6T #ldnont
2014-09-24,Updated: Now you can donate to help the family whose baby keepsakes were stolen in #LdnOnt: http://t.co/W87Gksnmdb
2014-09-24,@PulseSpinStudio Incredible! Here's what we're talking about for everyone not yet in the loop: http://t.co/9Im8DaEVXD #ldnont
2014-09-24,Police name victim of this morning's fatal crash in #ldnont. They have charged one man. http://t.co/VZXtVVTk14
2014-09-24,"Why do you love #ldnont? @Canucklehead_ca, @ShawnaLewk, @MikePMoffatt, @adamfearnall have ideas for making it better: http://t.co/bSsEeKkruZ"
2014-09-24,#ldnont police release results of investigation into road death of cyclist Alexandra Foto. http://t.co/z14XQeYgzY http://t.co/b4i11wV1De
2014-09-24,Where's the worst cluster of election signs you've seen in #ldnont? Best tweets/pictures published. #ldnvotes
2014-09-24,How many election signs have you seen today? Too many says #ldnont mayoral hopeful @RCaranci http://t.co/IDzJaeagu2 http://t.co/d0mdvwrbwC
2014-09-24,They stood with Salih. The 25 people who fought back against racism in #LdnOnt: http://t.co/OXSUkohRjx http://t.co/uhQYUGv79M
2014-09-24,Happy National Tree Day! Big arboreal affair today in #ldnont w/ hundreds of free trees on offer. Deets: http://t.co/HXJyFWwAus @rfldn
2014-09-24,Need a bike? This #ldnont biz owner has been fixing some up to give away — free of charge: http://t.co/KTy4tQcaSZ http://t.co/GBFIrf6aOJ
2014-09-24,#ldnont police looking for thief who stole family's mementos of a newborn killed in a crash: http://t.co/m6wqwK9VME
2014-09-24,Remember the rowdy #westernu Homecoming party? It led to these charges: http://t.co/JJp50iEjvi  #ldnont #westernuhoco http://t.co/6UxWeFvSKJ
2014-09-23,"This crowd just said no to racism, and stood with @MohamedMOSalih: http://t.co/leyjLtYm3A  #LdnOnt http://t.co/3rnjy5TZbO"
2014-09-23,New Brunswick election problems: #ldnont city clerk pledges it won't happen here and here's why: http://t.co/97GeN4nhvW #ldnvotes #nbvotes
2014-09-23,Long day? The new @FanshaweCollege massage clinic could be your (affordable) ticket to tranquil http://t.co/9UMB8zM5eG #fanshawe
2014-09-23,The man they call 'the future of blues' is coming to #ldnont w/ fresh material: http://t.co/nNlKNmMS4Q  @JBONAMASSA http://t.co/KxHaUzvbZI
2014-09-23,"Autons, Cybermen and sonic screwdrivers: Whovians are uniting this wknd in downtown #ldnont http://t.co/en9tXlryc6 @LAMoodcomics"
2014-09-23,Mementos of newborn killed in crash stolen from #ldnont parking lot: http://t.co/TgLYqluuDg
2014-09-23,#ldnont biz about to give away hundreds of bikes in a literal read on the term 'upcycling:' http://t.co/M57abxmJu3 @PulseSpinStudio
2014-09-23,@BriscoeClass Nice!
2014-09-23,ICYMI: Hitler moustaches and knife attacks: #ldnont election battle turns into all out war http://t.co/uMYySlr53x #ldnvotes
2014-09-23,"#westernu Homecoming leads to just 2 criminal charges – but 1 ‘major incident,' #ldnont police say: http://t.co/mIgzh5g3nL #westernuhoco"
2014-09-23,When should councillors stop spending our money? Close to an election is a pretty good time says @Wodanis: http://t.co/UmaZKDh4Bm #ldnont
2014-09-23,UK expense scandal veteran says more spending safeguards needed at #ldnont city hall: http://t.co/CHlaIf4Nqf @Wodanis http://t.co/faMqFlRipc
2014-09-23,'Cowards who lurk in the dark?' Sign wars have broken out on the #ldnont campaign trail http://t.co/wpuCupZFZV http://t.co/yWP48bjaDh
2014-09-22,There's an app for that: Tool launched today to make voting easier in #ldnont: http://t.co/xn680zydXV @mrjoshmorgan #ldnvotes
2014-09-22,"Hitler moustaches and knife attacks: Yep, it's come to that on the #ldnont campaign trail. http://t.co/XgSa3NX9nI #ldnvotes"
2014-09-22,"Tardis, Gallifrey and timey-wimey. Know what those words mean? Then this is the #LdnOnt event for you: http://t.co/DKPXCexJn7"
2014-09-22,"Are you doin’ it? (Yes, IT). If so, you need to read this: http://t.co/u6ae5pGGRZ #ldnont @_RHAC"
2014-09-22,A new tech tool has been launched to make voting easier in #ldnont: http://t.co/14gjit13Uz #ldnontvotes @mrjoshmorgan
2014-09-22,Free trees on offer in #ldnont: @rfldn &amp; partners giving away saplings to mark #NTD2014 http://t.co/rfdSpdGNte http://t.co/87LDxX1t9q
2014-09-22,@JoyBringingHope Our pleasure! http://t.co/UZMaY66YpE
2014-09-22,"It's called Stay Safe Fanshawe, and it's about to give your cellphone super powers: http://t.co/e5opHQQREg #fanshawe @FanshaweCollege"
2014-09-22,"Suspect in shooting death of construction executive Don Frigo arrested at Pearson airport, police say http://t.co/GbkfvOpCO1"
2014-09-22,The new @FanshaweCollege app that's designed to keep students safe: http://t.co/QvdeyCssKk #fanshawe #ldnont http://t.co/TiYkFfhQGL
2014-09-21,Building 'momentum' for safer cycling: That's what one #ldnont woman hopes to do by sharing a personal story http://t.co/zwk4lgFeYu
2014-09-21,We asked 5 active Londoners if the outgoing council will leave a legacy or was a fail. Do you agree w/ them? http://t.co/KLoHsjcPgG #ldnont
2014-09-21,Mo support: @MohamedMOSalih met with solidarity after racism on #ldnont campaign trail: http://t.co/vHAdV1a9QR #ldnvotes
2014-09-21,"You can help build a forest today. No, seriously, you can. A best bet for your wknd: http://t.co/nEyJP0pYdV #ldnont http://t.co/AK8za9pbge"
2014-09-21,"A year after she was hit by a car, cyclist @JoyBringingHope is sharing her story to keep others safe: http://t.co/2yjDmVuinj #ldnont"
2014-09-21,Bikes n’ Brains: Cyclist telling her story to build ‘momentum’ for safer #ldnont streets http://t.co/Lp5XpJcNZa http://t.co/DHk0RE0rhp
2014-09-21,What's #westernhoco really all about? Let’s go inside and have a look: http://t.co/4QBQJ17hfw #ldnont http://t.co/yAY04bbxKA
2014-09-20,Time's running out (but there's still time to cash in):A best bet for the wknd happening tonight @BudGardens. http://t.co/VgkZ6wnL9G #ldnont
2014-09-20,What's #westernu Homecoming all about? This link will take you deep inside the big purple party: http://t.co/j8lnSJHn8J #westernhoco #ldnont
2014-09-20,Candidate's racism claim proves a call to action for #ldnont: http://t.co/uUwnzjVYQT  @jesse_helmer #ldnvotes http://t.co/LdWzQJxDHu
2014-09-20,Know a #ldnont street that needs a bike lane? It may be getting one as city maps the future: http://t.co/MVe3jPKFOK http://t.co/xXQd45HEIS
2014-09-20,Read this before you unzip anything: 7 dos and don’ts for #westernhoco http://t.co/aquQajJzr6 #ldnont
2014-09-20,Happy weekend! These are our best bets for ways to spend it in #ldnont: http://t.co/Tfi49miTwp http://t.co/fKaRohfnwE
2014-09-20,"Mo money, Mo signs, Mo helpers. That's the reaction to racism against @MohamedMOSalih http://t.co/fzMVLWaIRM #ldnont #ldnvotes"
2014-09-20,.@MohamedMOSalih was subjected to racism. But look at the public reaction: http://t.co/BOG3o5JVVE #ldnont #ldnvotes http://t.co/Ljzw2qSrJ6
2014-09-20,ICYMI: Ombudsman released ruling today on latest accusation of 'secret meetings' at #ldnont city hall: http://t.co/YkKkBG2MJ6
2014-09-20,It's like a fitness challenge only w/o all that pesky exercise: http://t.co/gdGpDhuOZe #30Days2Vote
2014-09-20,"Everyone should be able to play hockey, right? A #ldnont 10yo is answering the question in a whole new way: http://t.co/21C5SzF2qh"
2014-09-19,Should #ldnont city hall tell you more about what's happening outside public view? Challenge issued: http://t.co/l24hN9Ff3r #opendata
2014-09-19,It's almost party time! Here's 7 dos and don’ts for the big #westernu Homecoming weekend: http://t.co/SHAvNZ1WTE #westernhoco #ldnont
2014-09-19,Report from @Ont_Ombudsman in on latest investigation into alleged wrongdoing by #ldnont politicians. The ruling: http://t.co/BiLtC7S0CP
2014-09-19,Up for a challenge? Scottish referendum turnout fuels #30Days2Vote effort in #ldnont: http://t.co/CjztCHL6Nc @FemPoliLDN
2014-09-19,#ldnont is gearing up to host a big #nhl game and a big ol' party to go along with it: http://t.co/ZVflXIxH3S
2014-09-19,Salary freezes across the board at #ldnont city hall: @SwanforMayor announces plan to avoid big tax increases http://t.co/Q1YJGfKrk5
2014-09-19,Where do nonprofits/charities fall on priority list for #ldnont candidates? Here's the answer: http://t.co/OW2ghzS3az @PillarNN #ldnvotes
2014-09-19,Push on for more data about what's really happening @ #ldnont city hall. Here's what the means for you: http://t.co/CzKHMOd6is #opendata
2014-09-19,ICYMI: Irish dinners &amp; Colombian lunches: #ldnont is in the midst of an accidental ambassadorial ambush. http://t.co/mbpLyfic4o
2014-09-19,Data debate: How much should the city tell you about what's happening behind the scenes? http://t.co/5KFs1c9V0K #ldnont #OpenData
2014-09-19,"10 promises from @PaulChengLdn if elected #ldnont mayor (24/7 construction, taxpayer $$ for PhD studies included) http://t.co/jMNjdSNR8k"
2014-09-19,Lots of feedback from ppl using our interactive map of #ldnont bike lanes planned to 2016. Did city get it right? http://t.co/XItd1Xg7ut
2014-09-18,"Votes are in &amp; answer’s on the way. But, what is Scotland really deciding? Metro’s @Mike_Donachie explains: http://t.co/Nnsq5Kyn1u #ldnont"
2014-09-18,Has #ldnont become a centre for diplomacy? Forest City in midst of ambassadorial ambush: http://t.co/QwoIw1rRMX http://t.co/kZiF5lnT7S
2014-09-18,Could be a while before #sttont police know identity of woman found dead Sunday in park. Here's the latest: http://t.co/VMU7r6Uj7X #ldnont
2014-09-18,Do you know @garybarwin? You should. He's trying to give #ldnont arts a big boost: http://t.co/oGAzhpF8sO @londonlibrary @westernu
2014-09-18,Expect some loud voices during a big event tonight in Victoria Park: http://t.co/XiLpe76xIU #ldnont
2014-09-18,"Could pudding &amp; soup decide who wins a seat at #ldnont city hall? The idea's been dished up (sorry, couldn't resist): http://t.co/70OE0yc9T6"
2014-09-18,Have you seen this man? #ldnont police looking for an alleged serial gas thief http://t.co/15e1LuKBOx http://t.co/L72AU3UYzj
2014-09-18,"You've heard his name, but what does he stand for? 10 things @PaulChengLdn wants to do if elected mayor of #ldnont: http://t.co/3A8TkzY2Q6"
2014-09-18,@MrJDCoco We're happy to have you!
2014-09-18,Police identify #ldnont man killed in Hwy 401 crash just after midnight: http://t.co/MUzfYBLR16 http://t.co/Uh9TVmFBuL
2014-09-18,"@MrJDCoco I was wrong there before, just to clarify. Seniors can't be on sidewalks either. Here's a guide: http://t.co/ZzwVLrenIg"
2014-09-18,It's decision day in Scotland &amp; it's not just a simple yes/no. The take from Metro #ldnont's @Mike_Donachie: http://t.co/cXnS6HZnxG #indyref
2014-09-18,@MrJDCoco Only for kids under a certain age and (I believe) seniors. Everyone else has to be on the street.
2014-09-18,Is the city planning a bike lane on your route? Interactive guide to new cycling lanes through 2016: http://t.co/V3YcmlMOKH #ldnont
2014-09-18,Like the idea of preserving #ldnont history? Campaign on to save this piece of our heritage: http://t.co/CkleJsQ2Mu http://t.co/A2vIRmmSPZ
2014-09-18,Interactive: Your guide to the next 40 km of bike lanes planned for #ldnont http://t.co/vuYqYIPECU http://t.co/JhK12ansgO
2014-09-18,ICYMI: This store is pulling out of downtown #ldnont. http://t.co/R97hTen2Uu http://t.co/p2pk86uOka
2014-09-18,"Not “a lot of big wins:"" @ShawnaLewk as our community panel talks about legacy of this #ldnont city council. Agree? http://t.co/KMCMmK1RBG"
2014-09-18,How much did all that rain hurt #WesternFair? This much: http://t.co/zs86Jq7XsA  #ldnont http://t.co/TT447TplAB
