id,created_at,text
2014-06-10,On civic works: extra $500K cost for a city engineering project at Fox Hollow. Council told it's due to unexpected soil conditions. #LdnOnt
2014-06-10,The PC camp has responded to allegations of incorrect polling information sent to #ldnont North Centre voters: http://t.co/48NdWHfijj
2014-06-10,"And animal welfare changes are sent back to staff. Baechler, Orser and Matt Brown voted against delay; 11 in favour of deferral. #LdnOnt"
2014-06-10,Opposition to referral is vocal. Orser and Baechler calling for action on this now. Council's reputation is it can't act decisively. #LdnOnt
2014-06-10,Councillors are now disagreeing with each other's opinions of the law. City solicitor is shifting in his seat. Referral is likely. #LdnOnt
2014-06-10,"Some councillors calling for the new pet rules to be sent back to committee, so staff can give legal advice. #LdnOnt"
2014-06-10,"Now the new measures for animal welfare/control. They include increased limits on pet numbers, encouraging spay/neutering. #LdnOnt"
2014-06-10,"In the end, every council member present agreed to postpone any crossing guard cuts for at least a year. #LdnOnt"
2014-06-10,Matt Brown's saying that consultation means flexibility. We've had raised voice across the chamber already. They're feisty tonight. #LdnOnt
2014-06-10,"We're getting a flurry of activity here. Councillors, led by Orser and Polhill, demanding that crossing guard cuts be rejected now. #LdnOnt"
2014-06-10,Cuts to school crossing guards are the first big issue at council tonight. Proposal is to suspend any changes and consult public. #LdnOnt
2014-06-10,"Elections Canada complaint filed after letters sent to #ldnont North Centre voters w/ wrong poll info, Liberals say: http://t.co/7Lo5fWRcwP"
2014-06-09,"With a big political fight days away, Kathleen Wynne found some solid friends today at a #ldnont high school. http://t.co/LIY5zUe5jK #onpoli"
2014-06-09,Thames River: #ldnont politicians support pitch for shoreline design contest. http://t.co/NKopffG8Xu
2014-06-09,People worldwide want to use this #ldnont factory. Welcome to the #westernu tornado dome. http://t.co/58OA3O4WqE http://t.co/7COQaPtoAz
2014-06-09,Thames River time at city hall. London Community Foundation pitching the design contest we wrote about here: http://t.co/2AnA9ZlIoi #LdnOnt
2014-06-09,Visa problems creating pitching woes for #ldnont Majors. http://t.co/0e3BLIHNqA
2014-06-09,Chief city planner John Fleming gives an impressive presentation. He outlines the process of offering SoHo hospital lands to market. #ldnont
2014-06-09,The SoHo hospital lands start this meeting at city hall. It's the investment and economic prosperity committee. #LdnOnt
2014-06-09,Charges laid after Sunday's Hwy 401 crash near Dorchester Road. http://t.co/ZLXpeJcoJP #ldnont
2014-06-09,You've heard of Bitcoins. What about GOODCoins? They've hit #ldnont and it's all about paying you to be healthy. http://t.co/qxjljLiGPV
2014-06-09,"Nearly 10 years later, #ldnont sexual assault victim to face abuser in court. http://t.co/nV6PEnWCRy"
2014-06-09,Police are looking for suspects in the robbery of a pharmacy. http://t.co/0lN5CRV15y #ldnont #stton #stthomas
2014-06-09,"Are people less friendly, more cynical these days? Or is it just @UrbanCompassLdn ? http://t.co/LrLAn1DBSE"
2014-06-09,"On the other hand, few speed limits will be broken on Richmond St this summer. Construction will see to that. #LdnOnt http://t.co/Csj5KEy8P2"
2014-06-09,Young lives saved thanks to tougher penalties on stunt driving: Western U study #LdnOnt http://t.co/u5iozc3b36
2014-06-08,Tall tree order will take some deep pockets. #LdnOnt http://t.co/8HIQ4LH5n8
2014-06-08,London will miss Micheal Ray on the Lightning bench http://t.co/iOWaEwLlW1
2014-06-08,Truck crash at 401 and Dorchester Road snarls traffic early Sunday afternoon. http://t.co/80OURqNAJB #LdnOnt
2014-06-06,Want to watch an app happen? Join the experts from @simalaminc next week to see the magic: http://t.co/nXlN6DIjRy #LdnOnt
2014-06-06,Two London men have been arrested by the OPP following a stolen car chase: http://t.co/La1lgee8f6 #LdnOnt
2014-06-06,Coun. Paul Van Meerbergen was the last of the 15 city councillors to reveal his plans for the election: http://t.co/YEPqnu8Hyg #LdnOnt
2014-06-06,"Keep those kids safe if you have a pool, the city is telling Londoners: http://t.co/PSK2CptjhE #LdnOnt"
2014-06-05,"End of an era: Coach, teacher Darwin Semotiuk leaving #westernu http://t.co/b7RgtSdJj9 #ldnont"
2014-06-05,St. Joseph’s Health Care #ldnont fined after nurse injured. http://t.co/OOjTbvAaST
2014-06-05,"It's ""shovel-ready"". So it's time to offer SoHo's hospital lands for sale: http://t.co/4xd6MJKhNF #LdnOnt"
2014-06-05,Deficit triggers layoff plans at #ldnont Catholic school board. http://t.co/0qVz2oCWko
2014-06-05,Father of child rescued from #ldnont bedroom to launch legal fight. http://t.co/Isf137ZX89
2014-06-05,Here's our chat with Micheal Ray Richardson on his decision to leave the @LondonLightning: http://t.co/1FM8avwczn #ldnont
2014-06-05,Details on @LondonLightning decision regarding coach Michael Ray: http://t.co/dy8eRN4G8D #ldnont http://t.co/11a4s0J4PO
2014-06-05,Micheal Ray not coming back as coach of @LondonLightning story to come #ldnont
2014-06-05,Friends mourning loss of #ldnont crash victim Danielle Schmoll.  http://t.co/wIJdeCmnxM http://t.co/zUuV6NFIJb
2014-06-05,#ldnont police have identified the woman killed in a Wednesday crash on Oxford Street West. http://t.co/wVZKNYuvIQ
2014-06-05,Anyone from #ldnont with family in #Moncton? Email angela.mullins@metronews.ca
2014-06-04,Human Rights Tribunal rules in favour of transgender worker booted from #ldnont Trails End market. http://t.co/Px4K00Qflc
2014-06-04,Grey Days Preferable: Play about London painter Paul Peel comes to @LondonFringe Festival #ldnont http://t.co/z9X5HA2P6E
2014-06-04,"#ldnont non-profit pitching big plan to reconnect with the Thames, but one city councillor is already concerned. http://t.co/OiqVlfeOFJ"
2014-06-04,"New legislation to protect sex workers hailed by London police chief, women's rights advocate. http://t.co/jzUztogmpd http://t.co/KsCQuWHJTI"
2014-06-04,"Advocates, academic disagree on new prostitution legislation. #LdnOnt http://t.co/JM2TOIU234"
2014-06-04,@IlluminateLDN can you shoot me an email please. Angela.Mullins@metronews.ca
2014-06-04,"The victim in this morning's west #ldnont crash has died, Oxford Street still closed: http://t.co/8rrgf6eQFU"
2014-06-04,@MOWLondon No problem. That's what we're here for.
2014-06-04,@MOWLondon Police at the scene say it might be an hour or two more.
2014-06-04,"Driver seriously injured, part of Oxford St closed after bad crash this morning: http://t.co/QsPmyUa7W9 #ldnont"
2014-06-03,Higher tree targets to be set for #ldnont after new forestry strategy meets opposition: http://t.co/2ynclPTP2T
2014-06-03,Need an excuse to get your kid to the gym? Here's one: http://t.co/meFBnaoD5J #ldnont
2014-06-03,"Hated all those extreme temps this winter? Then, you're going to love what's on the #ldnont summer horizon: http://t.co/J1kcEqgi4x"
2014-06-03,They're talking trees at the planning and environment committee. It's all about the urban forest strategy: http://t.co/0gXBypk6Ow #LdnOnt
2014-06-03,Expos to make Montreal return? Former voice of team dishes with Metro on the chances as he prepares to visit #ldnont http://t.co/lxDAeFCKE9
2014-06-03,#ldnont police back on scene of unsolved Jonathan Zak murder. http://t.co/YFN4tvrmZg http://t.co/8DRUgtKkXi
2014-06-03,"Bouchard’s success helping rebuild no. of women playing tennis, #ldnont pro says. http://t.co/GWKatdqY45 http://t.co/v71phiexHp"
2014-06-03,#ldnont man killed in rollover crash: http://t.co/O77dxMFJBg
2014-06-02,#fanshawe planning expansion at #ldnont airport's former Jazz hangar. http://t.co/aqmftkU45S
2014-06-02,A little red tent has put #ldnont in the spirit of pitching in. http://t.co/maqGe50TD1
2014-06-02,"Like books, beer or maybe both? This new #ldnont creation is for you: http://t.co/AgTWgGbyaG"
2014-06-02,A trust fund has been established for the #ldnont boy rescued from a locked bedroom. Details here: http://t.co/2NzeX7WUQA
2014-06-02,Couple charged with locking boy in #ldnont bedroom released from custody: http://t.co/s7B96wKOrd
2014-06-01,Too many golf courses in #ldnont area? Question has been brought up by one mgr as links recover from a slow start: http://t.co/ksogBmAc2S
2014-06-01,#ldnont Humane Society marks biggest Bark in the Park yet  http://t.co/aUcUaPRNGQ http://t.co/44vEP0NLqd
2014-06-01,Cheese please: #ldnont area cheese maker planning big expansion (but he needs your help).  http://t.co/ogyZqASnU4 http://t.co/g6iYF5lELG
2014-06-01,10yo boy hurt in an Oct. hit and run has been released from hospital. Big benefit planned in his honour: http://t.co/J9NCkdYs0l #ldnont
2014-06-01,Child abandonment charge laid after toddler rescued from hot vehicle. http://t.co/Metf7czvje #ldnont
2014-05-30,Update: Latest details on investigation into 10-year-old #ldnont boy found in bedroom: http://t.co/13wLOb9AXe
2014-05-30,Update: By found locked in #ldnont bedroom in hospital. Neighbours react: http://t.co/b8Kk5yLqXj
2014-05-30,Police found a 10-year-old boy who'd been locked in a filthy London room for nearly 2 years http://t.co/Ni9VPblKJc
2014-05-30,"Most election polls unreliable, pollsters say http://t.co/JFMJLvABiJ"
2014-05-29,"Union claims Hudak cost will cost #ldnont 7,000 jobs http://t.co/zoVYaMQoLr #onpoli"
2014-05-29,Stupid or criminal? #Fontana case boils down to simple question in closing statements. http://t.co/zc7LRFvL87 #ldnont
2014-05-29,Leading #ldnont figures were on trial today for a good cause. http://t.co/ys264ACoEv
2014-05-29,Brace yourselves for inter-dimensional travel without ever leaving downtown #ldnont.  http://t.co/giBDafQJlu http://t.co/GX0jrL2Et8
2014-05-28,Learning about learning: #ldnont program helping immigrants navigate school http://t.co/jjIbMXmySo
2014-05-28,"The Forest City is losing its forest. Now, there's a plan to turn back the clock: http://t.co/LbpAaaiI7q #ldnont"
2014-05-28,"#ldnont police renew appeal for tips in child abduction, sexual assault: http://t.co/uYh50wOElL"
2014-05-28,"Fontana's defence: it was ""stupid"", but not criminal: http://t.co/upa5mnKmJG #LdnOnt"
2014-05-28,New faces join the @GoLondonKnights: http://t.co/8ocdoPbAJT #ldnont
2014-05-28,here's what happened this a.m. as #fontana went toe to toe with the Crown:  http://t.co/V1XKt2D1h8 #ldnont http://t.co/oXm1rpttxg
2014-05-28,It's official. #Fontana has taken the stand at this trial. Answering questions now. @TaylorInLondon will keep you posted. #ldnont
2014-05-28,Defence starts at #Fontana trial. Will he testify? Follow Metro's @TaylorInLondon to find out. Day 2 recap: http://t.co/kR5vxjP4TO  #ldnont
2014-05-27,Can rugby bring peace to post-conflict communities? One #ldnont woman says so: http://t.co/wZjMwAigxF
2014-05-27,Meet the #ldnont man who wants to hear a million voices (and change their lives): http://t.co/agNTfeL2Sb
2014-05-27,Tomorrow may be the biggest day in the #fontana trial. Will he testify or not?: http://t.co/L7PsCA8y7A  #ldnont
2014-05-27,"#Fontana hashtag draws rebuke far, far from #ldnont: http://t.co/Y5vsT6rAoV"
2014-05-27,#Fontana defence says gov't expense claim for event to honour former MP Goodale. Tuesday trial recap so far: http://t.co/jk7Talr9PQ #ldnont
2014-05-27,"Two children abducted, one sexually assaulted in #ldnont: http://t.co/ecIMQcQvBJ"
2014-05-27,@Mkwright82Katie Hmmm. Not that I can remember.
2014-05-27,Reminder: Metro's @TaylorInLondon is tweeting live from Day 2 of Fontana's trial. Here's a recap so far:  http://t.co/HEWqBtlCy8 #ldnont
2014-05-26,Will #LdnOnt cut nine crossing guards? These councillors were out to block the idea: http://t.co/9XwGrWhQn7
2014-05-26,"As expected, committee agrees to send the crossing guards proposal back to staff. More consultation will happen. #LdnOnt"
2014-05-26,"Coun. Stephen Orser also wants the crossing guard cuts nixed; says it could be ""the most stupid thing we could do"". #LdnOnt"
2014-05-26,"Coun. Bud Polhill, not a member of the committee, is here to call for the crossing guard cuts to be cancelled outright. #LdnOnt"
2014-05-26,Coun. Denise Brown also agrees. That's all three committee members in favour of sending this back to staff. #LdnOnt
2014-05-26,"Coun. Bill Armstrong agrees. With only three committee members here, that shows what will happen. No crossing guard cuts for now. #LdnOnt"
2014-05-26,"Coun. Matt Brown wants more consultation on crossing guard changes. Speaks of a ""huge communication gap"" on the issue. #LdnOnt"
2014-05-26,Community and protective services s about to begin at city hall. School crossing guards are early on the agenda. #LdnOnt
2014-05-26,A recap of the first day in #ldnont mayor's criminal trial: http://t.co/3Q9Nl0PzzD
2014-05-26,"#MCMemorialCup: Tournament will turn a profit, organizer says #ldnont http://t.co/YHcO8DBc1K"
2014-05-26,"Were you born between 1980 and 2000? If so, you're just what London wants. Here's why: http://t.co/6XHAhIYBzn #LdnOnt"
2014-05-26,"@CharlesMetcalf4 Just an FYI. We're in London, Ontario, Canada, not the UK"
2014-05-26,"Before Cirque Du Soleil takes over @BudGardens this week, check out this behind-the-scenes look at Varekai: http://t.co/u4g5sR4WEF #ldnont"
2014-05-26,Memorial to honour #ldnont murder victim Jonathan Zak. http://t.co/epBfYt0aUD
2014-05-26,Wanna tickle the ivories in public? Pretty soon you'll be able to do that in #ldnont: http://t.co/KSm0T5HPeE
2014-05-26,Altered invoice early issue at #ldnont Fontana trial. This morning's highlights: http://t.co/TKVQ1cbRgx http://t.co/msELDKVdqL
2014-05-26,Man charged with cruelty to muskrat on outskirts of #ldnont http://t.co/S72HOg5Lbf
2014-05-26,Get up-to-the-minute courtroom coverage from Joe Fontana's trial by following Metro reporter @TaylorInLondon #ldnont
2014-05-26,London man charged with child porn offences http://t.co/I8Jn3Ie8W3
2014-05-26,#ldnont Mayor Joe Fontana's criminal trial on fraud charges starts today. Here's what to expect: http://t.co/xGjP1MFAlu
2014-05-25,The City of London wants to reach out to students in a new way: http://t.co/L4oLRf6Sgs #LdnOnt
2014-05-25,What's a tea sommelier? It's a job that #Fanshawe College will train you for: http://t.co/zEfNu8qR55 #LdnOnt
2014-05-25,"Update: Murder charge laid in SoHo stabbing; victim, suspect identified: http://t.co/XjWstZVW3i #ldnont"
2014-05-25,"""We all feel it:"" SoHo community reacts to fatal stabbing. http://t.co/EUcrigiILp #ldnont"
2014-05-25,This time with the link. London Police investigating suspicious death on Clarence St. last night. #LdnOnt http://t.co/HnYDc5pAJI
2014-05-25,London Police investigating death on Clarence St. last night. #LdnOnt
2014-05-24,#ldnont is now home to the longest game in  Memorial Cup history. Here's what happened last night: http://t.co/8QQ7XymECk #MCMemorialCup
2014-05-23,London-Middlesex survivors get chance to thank their saviours http://t.co/AY5YaLMyU3
2014-05-23,The city's removing crossing guards at nine intersections. Here's what one of them thinks about it: http://t.co/VtSbj4bdLK #ldnont
2014-05-22,Horwath quizzed on #ldnont job losses as NDP releases elex platform. http://t.co/fkfzZBnYVn
2014-05-22,"#MCMemorialCup party must go on despite no @GoLondonKnights, chief organizer said today: http://t.co/N2cB0Xiseu #ldnont"
2014-05-22,Update: more details on the big plan for shaping #ldnont future unveiled today at city hall. http://t.co/CTBl4oINdJ
2014-05-22,Council members formally accept the London Plan. Now the public can comment on it. It still has a ways to go before it's accepted. #LdnOnt
2014-05-22,"Londoners could be allowed to own more cats and dogs, with new rules to be considered at city hall: http://t.co/Yv3S5Ltvjf #LdnOnt"
2014-05-22,"Fleming's presentation on the London Plan (and yes, we are writing a story about it) ends with a standing ovation and handshakes. #LdnOnt"
2014-05-22,"Fleming speaking of London's future. He has this crowded room in the palm of his hand. Quite a speech, especially for a planner. #LdnOnt"
2014-05-22,"London Plan's a different approach. City planner John Fleming says the city rejects planning by land use; instead, a mosaic of uses. #LdnOnt"
2014-05-22,London 2035: Mega plan for the future unveiled at city hall. http://t.co/zeh917t8A0 #ldnont
2014-05-22,Huge crowd here in the public gallery to see this big moment for #LdnOnt. We're recognizing many faces. Hello everyone!
2014-05-22,"It's called the London Plan. Here at city hall, staff are unveiling the city's official development plan for the next 20 years. #LdnOnt"
2014-05-22,Tired of a political attack ads? A look at 4 ads with bite and a #westernu expert opinion on if  they worked: http://t.co/KUdeRI15r8 #ldnont
2014-05-22,Guelph Storm oust host @GoLondonKnights from #MemorialCup http://t.co/UbImXoQmub
2014-05-22,"#MCMemorialCup: @GoLondonKnights lose to Guelph Storm, season over. http://t.co/47ztS6VXwK"
2014-05-22,#MCMemorialCup: Guelph Storm still top @GoLondonKnights. Highlights of the first two periods: http://t.co/0ExYIRCnUq #ldnont
2014-05-22,#MCMemorialCup: Guelph takes first-period lead over @GoLondonKnights. Here's the action so far: http://t.co/IoU9euitYI #ldnont
2014-05-21,#ldnont musicians are chomping at the bit to rock patios thanks to new rules at city hall. http://t.co/1xBqiuMXYc
2014-05-21,.@ATMOSmarketing has broken the #ldnont Bitcoin barrier. http://t.co/5g7Gd0kPfp
2014-05-21,#ldnont rallying to help flood victims in Balkans. Here's how to help: http://t.co/sJCdV2njFS
2014-05-21,"The key to ending the fight over wind turbines? It's all about caring and sharing, #westernu says http://t.co/qHabCT8nAF #ldnont"
2014-05-21,Guelph Storm player suspended for rest of #MCMemorialCup tourney: http://t.co/cgmbXFZV7c #ldnont
2014-05-21,Folks @lawsonresearch are on the cusp of a life-saving diabetes breakthrough. http://t.co/4NaUOG6S6f #ldnont
2014-05-21,There's a new @OntarioGreens candidate in #ldnont West: http://t.co/HD7iy9Zsms
2014-05-21,"The bacteria that gives you a sore throat could help beat colon cancer, #westernu researchers say. http://t.co/175oohEO5I #ldnont"
2014-05-21,In case you missed last night's #MCMemorialCup marathon between Val-d'Or and Edmonton. http://t.co/8nSslTSWS1 #ldnont
2014-05-21,#MCMemorialCup Game 5 turned into a marathon tonight. Here's the result between Foreurs and Oil Kings: http://t.co/oVBLg8Rop7 #ldnont
2014-05-21,Guelph's capt said what about the @GoLondonKnights? war of words officially launched: http://t.co/HGB1mgBrb5 #ldnont #MCMemorialCup
2014-05-20,"Based on visits from party leaders, #ldnont is a key battleground in the Ontario election. Here's why: http://t.co/9wliptzsTN #onpoli"
2014-05-20,Sing out if you want music on patios. These councillors do: http://t.co/dZFS9AVGJL #LdnOnt
2014-05-20,"Jobs, transit, you name it. Our one-on-one chat with Kathleen Wynne about #ldnont issues: http://t.co/Z6z9JybfY0 #onpoli"
2014-05-20,And that patio music is approved. #Ldnont
2014-05-20,Several councillors have spoken in favour of getting a decision on patio music tonight. Vote is now. #Ldnont
2014-05-20,City hall update: some councillors want acoustic music on patios item to be sent back to staff for more consideration. #ldnont
2014-05-20,Londoners in on $1M Lotto Max prize. http://t.co/d1qfK8Ygcw  #ldnont http://t.co/f2AnoQ06Fl
2014-05-20,"Council's fully under way here, and it's looking like we're about to get some discussion about outdoor music on patios. #LdnOnt"
2014-05-20,Full council is under way here at city hall. Many members are wearing @GoLondonKnights jerseys. Go council go! #LdnOnt
2014-05-20,"Ontario PCs attack Wynne’s tractor stunt as setting “a very bad example”, forget that Hudak did same thing last year http://t.co/Pgon5vc83c"
2014-05-20,Ontario NDP pledges to cut ER wait times in half http://t.co/W34UHfYTYh
2014-05-20,Storm maintains #MCMemorialCup momentum. http://t.co/03GYy2fb7M  #OHL #ldnont http://t.co/fCdZdJ7XNa
2014-05-19,"The Greens' provincial candidate has dropped out of the race in London West, but is he a Liberal now? http://t.co/ENra11Zmg1 #LdnOnt #onpoli"
2014-05-19,"Ontario party leaders are facing ghosts of premiers past one the campaign trail, #WesternU prof says. http://t.co/UvlwwY28FU #onpoli #ldnont"
2014-05-19,"As @GoLondonKnights sit 0-2, #ldnont in danger of losing #MCMemorialCup buzz.  http://t.co/87WatunhM5 http://t.co/oCOti2jWOb"
2014-05-19,Hungry? Hockey fan? Brace yourself for this: http://t.co/P0kjWsURdT #LdnOnt #MCMemorialCup
2014-05-19,A right royal encounter: what happened when St. Thomas campaigner @HomelessMcJason met Prince Charles: http://t.co/VOQH90sNq7 #StThomas
2014-05-19,"Feeling blue? Tired? Must be Monday, but these entrepreneurs have a solution for you: http://t.co/OPbFWErTi9 #LdnOnt"
2014-05-19,@reacher411 Apologies. We replaced it with a tweet that did the job properly. But thanks!
2014-05-19,Man in hospital after London stabbing: http://t.co/fet84AhPZM #LdnOnt
2014-05-19,Two London men charged with armed robbery: http://t.co/xaHsdUVqWA #LdnOnt
2014-05-19,The @GoLondonKnights are one step closer to the end of their #MCMemorialCup season. http://t.co/NS2lWs436b #ldnont
2014-05-17,The Guelp Storm proved their strength today in #MCMemorialCup action in #ldnont. http://t.co/GcCkKupT9b
2014-05-17,One @GoLondonKnights player is overcoming person adversity to excel on the #MCMemorialCup ice. http://t.co/22iojO92OP #ldnont
2014-05-17,"From box hockey to the Stanley Cup, there's lots going on downtown for the #MemorialCup: http://t.co/5cr6UJIBNB #LdnOnt"
2014-05-17,What could have been a beautiful night for the @GoLondonKnights turned sour fast. #MCMemorialCup http://t.co/01F2FwBGce
2014-05-16,NDP leader Andrea Horwath puts breaks on high-speed rail for London http://t.co/7WG4JSmpGs
2014-05-16,It's almost time to see the results of ReThink London: http://t.co/jqwwKiIzlO #LdnOnt
2014-05-15,It's official. Here's who's getting the start in net tomorrow in the @GoLondonKnights #MemorialCup debut. http://t.co/yOeoLCXQNq #ldnont
2014-05-15,"Photos: It was all about the cup (and hockey, of course) as the #MemorialCup festivities got a start in #ldnont. http://t.co/Ymb5Bz6DZj"
2014-05-15,Is high-speed rail a good idea for #LdnOnt? Progressive Conservative leader Tim Hudak wouldn't say: http://t.co/WtL5DOy0bZ
2014-05-15,"For the first time, the London Multicultural Club has endorsed candidates in the municipal election: http://t.co/gip8rY1IDU #LdnOnt"
2014-05-15,"London's police are asking the city for $339,000 to buy 176 Tasers: http://t.co/IHWpTNkkyo #LdnOnt"
2014-05-15,The city's about to lift the ban on overnight street parking: http://t.co/NlzMU1JYM3 #LdnOnt
2014-05-14,Kathleen Wynne was on the attack as her election campaign rolled into #ldnont. http://t.co/IQPFTqJge6 #onpoli
2014-05-14,Call them the mighty 500: The volunteers who make the #ldnont #MemorialCup tick. http://t.co/XONzvxxAAG http://t.co/V9UfTPoujB
2014-05-14,"Former London Knight Rob Schremp is back in North America, and London: http://t.co/cLDlsiSTSb #LdnOnt"
2014-05-14,Doubts hanging over redevelopment of #ldnont Hydro lands: http://t.co/FOuGXFlJAb
2014-05-14,"Performing arts centre proposal is all about its new business plan, but the core project hasn't changed. City to examine details. #LdnOnt"
2014-05-14,This arts centre update includes some new details about the $164m project. Its owners would be a new non-profit foundation. #LdnOnt
2014-05-14,"Councillors formally noting the update on the Kilmer Browfield/London Hydro plans. Next, an update on the performing arts centre. #LdnOnt"
2014-05-14,"Fontana's talking about development as ""an incredible opportunity"". Somehow that included comments about patio music and the moon. #LdnOnt"
2014-05-14,"Ah. Chair Joe Swan stresses the relocation of London Hydro won't cost $40m. That's an ""inaccurate"" figure. Costs much lower. #LdnOnt"
2014-05-14,"Coun. Matt Brown says it's a ""complicated piece of real estate"". Asks when the city will know if the project is viable. #LdnOnt"
2014-05-14,"Mayor Fontana's comments now. There will always be ""question marks"", he says, but city needs a ""vision"". #LdnOnt"
2014-05-14,"""The bottom line is, do we have a project?"" Hayward adds. The answer is: They don't know yet. It depends on costs, useable land. #LdnOnt"
2014-05-14,"By the way, Hayward is presenting this to councillors due to the departure, last week, of staffer Harvey Filger, whose bag it was. #LdnOnt"
2014-05-14,"One problem, Hayward says, is the relocation costs for London Hydro. Estimate of $40m is not ""doable"", he adds, but could come down. #LdnOnt"
2014-05-14,"The Kilmer Brownfield development on Hydro lands could mean 900 jobs, Hayward says. But it depends on how much land can be used. #LdnOnt"
2014-05-14,"City treasurer Martin Hayward presents plans for the Hydro site, beginning as thunder rolls in dramatically. More fun than usual. #LdnOnt"
2014-05-14,Now at city hall: the investment and economic prosperity committee. It's the London Hydro lands sale and the performing arts centre. #LdnOnt
2014-05-14,Ontario teachers call Hudak’s education plans ‘dangerous’ http://t.co/jwFFwAH5O6
2014-05-14,"Tim Hudak’s budget cuts target schools, keep LCBO status quo http://t.co/EMeyiyi22u"
2014-05-14,LHSC expects to finalize a deal to buy the Bethesda Centre in #LdnOnt by the end of the week: http://t.co/xfWGZaeK7x
2014-05-13,"As opioid overdoses spike in #ldnont, a new program has launched to help stop the trend. http://t.co/PEwxs7AxKA"
2014-05-13,Charges pending after Westmount Mall stabbing. http://t.co/1AOdY5eKbr #ldnont
2014-05-13,The @GoLondonKnights have called in a special coach to scrape off the rust before #MemorialCup debut. http://t.co/wQHNwLVjmU #ldnont
